{
  "HOUSE_OVERSIGHT_010477": {
    "date": "2004-09-08",
    "time": null,
    "source": "content_parsed",
    "raw_date": "MA, September 8, 2004",
    "confidence": "low"
  },
  "HOUSE_OVERSIGHT_010486": {
    "date": "2004-09-08",
    "time": null,
    "source": "content_parsed",
    "raw_date": "MA, September 8, 2004",
    "confidence": "low"
  },
  "HOUSE_OVERSIGHT_010560": {
    "date": "2019-06-19",
    "time": null,
    "source": "content_parsed",
    "raw_date": "Link, \nJune 19, 2019",
    "confidence": "low"
  },
  "HOUSE_OVERSIGHT_010566": {
    "date": "2009-09-24",
    "time": null,
    "source": "content_parsed",
    "raw_date": "Doe, September 24, 2009",
    "confidence": "low"
  },
  "HOUSE_OVERSIGHT_010609": {
    "date": "2012-06-20",
    "time": null,
    "source": "content_parsed",
    "raw_date": "6/20/2012",
    "confidence": "low"
  },
  "HOUSE_OVERSIGHT_010617": {
    "date": "2017-01-19",
    "time": null,
    "source": "content_parsed",
    "raw_date": "1/19/2017",
    "confidence": "low"
  },
  "HOUSE_OVERSIGHT_010715": {
    "date": "2014-03-20",
    "time": null,
    "source": "metadata",
    "raw_date": "03/20/2014",
    "confidence": "medium"
  },
  "HOUSE_OVERSIGHT_010723": {
    "date": null,
    "time": null,
    "source": "unknown",
    "raw_date": null,
    "confidence": "none"
  },
  "HOUSE_OVERSIGHT_010732": {
    "date": "2008-05-19",
    "time": null,
    "source": "content_parsed",
    "raw_date": "Monday, May 19, 2008",
    "confidence": "low"
  },
  "HOUSE_OVERSIGHT_010735": {
    "date": "2015-02-02",
    "time": null,
    "source": "content_parsed",
    "raw_date": "02/02/2015",
    "confidence": "low"
  },
  "HOUSE_OVERSIGHT_010754": {
    "date": "2015-11-05",
    "time": null,
    "source": "content_parsed",
    "raw_date": "11/5/2015",
    "confidence": "low"
  },
  "HOUSE_OVERSIGHT_010757": {
    "date": "2015-11-23",
    "time": null,
    "source": "content_parsed",
    "raw_date": "11/23/2015",
    "confidence": "low"
  },
  "HOUSE_OVERSIGHT_010887": {
    "date": "2016-01-29",
    "time": null,
    "source": "content_parsed",
    "raw_date": "01/29/2016",
    "confidence": "low"
  },
  "HOUSE_OVERSIGHT_010912": {
    "date": "2016-05-10",
    "time": null,
    "source": "metadata",
    "raw_date": "05/10/2016",
    "confidence": "medium"
  },
  "HOUSE_OVERSIGHT_011170": {
    "date": "2016-06-27",
    "time": null,
    "source": "metadata",
    "raw_date": "06/27/2016",
    "confidence": "medium"
  },
  "HOUSE_OVERSIGHT_011277": {
    "date": "2016-12-09",
    "time": "15:46:19",
    "source": "email_header",
    "raw_date": "12/9/2016 3:46:19 PM",
    "confidence": "high"
  },
  "HOUSE_OVERSIGHT_011280": {
    "date": "2016-12-09",
    "time": "16:03:45",
    "source": "email_header",
    "raw_date": "12/9/2016 4:03:45 PM",
    "confidence": "high"
  },
  "HOUSE_OVERSIGHT_011284": {
    "date": null,
    "time": null,
    "source": "unknown",
    "raw_date": null,
    "confidence": "none"
  },
  "HOUSE_OVERSIGHT_011304": {
    "date": "2017-05-25",
    "time": null,
    "source": "metadata",
    "raw_date": "05/25/2017",
    "confidence": "medium"
  },
  "HOUSE_OVERSIGHT_011463": {
    "date": null,
    "time": null,
    "source": "unknown",
    "raw_date": null,
    "confidence": "none"
  },
  "HOUSE_OVERSIGHT_011472": {
    "date": null,
    "time": null,
    "source": "unknown",
    "raw_date": null,
    "confidence": "none"
  },
  "HOUSE_OVERSIGHT_011904": {
    "date": "2018-04-05",
    "time": "22:16:55",
    "source": "email_header",
    "raw_date": "4/5/2018 10:16:55 PM",
    "confidence": "high"
  },
  "HOUSE_OVERSIGHT_011907": {
    "date": "2019-05-07",
    "time": "13:53:22",
    "source": "email_header",
    "raw_date": "5/7/2019 1:53:22 PM",
    "confidence": "high"
  },
  "HOUSE_OVERSIGHT_011908": {
    "date": null,
    "time": null,
    "source": "unknown",
    "raw_date": null,
    "confidence": "none"
  },
  "HOUSE_OVERSIGHT_012037": {
    "date": "2016-08-15",
    "time": "12:09:58",
    "source": "email_header",
    "raw_date": "8/15/2016 12:09:58 PM",
    "confidence": "high"
  },
  "HOUSE_OVERSIGHT_012044": {
    "date": "2016-12-09",
    "time": "15:56:27",
    "source": "email_header",
    "raw_date": "12/9/2016 3:56:27 PM",
    "confidence": "high"
  },
  "HOUSE_OVERSIGHT_012048": {
    "date": "2017-11-14",
    "time": null,
    "source": "content_parsed",
    "raw_date": "11/14/2017",
    "confidence": "low"
  },
  "HOUSE_OVERSIGHT_012102": {
    "date": "2019-05-07",
    "time": "04:29:00",
    "source": "email_header",
    "raw_date": "5/7/2019 4:29:00 AM",
    "confidence": "high"
  },
  "HOUSE_OVERSIGHT_012103": {
    "date": "2011-05-17",
    "time": null,
    "source": "metadata",
    "raw_date": "05/17/2011",
    "confidence": "medium"
  },
  "HOUSE_OVERSIGHT_012130": {
    "date": "2038-05-15",
    "time": null,
    "source": "content_parsed",
    "raw_date": "38, May 15, 2008",
    "confidence": "low"
  },
  "HOUSE_OVERSIGHT_012135": {
    "date": "2038-05-15",
    "time": null,
    "source": "content_parsed",
    "raw_date": "38, May 15, 2008",
    "confidence": "low"
  },
  "HOUSE_OVERSIGHT_012197": {
    "date": "2008-06-02",
    "time": null,
    "source": "content_parsed",
    "raw_date": "Monday, June 2, 2008",
    "confidence": "low"
  },
  "HOUSE_OVERSIGHT_012684": {
    "date": "2011-02-17",
    "time": "18:19:01",
    "source": "email_header",
    "raw_date": "2/17/2011 6:19:01 PM",
    "confidence": "high"
  },
  "HOUSE_OVERSIGHT_012685": {
    "date": "2011-03-04",
    "time": null,
    "source": "content_parsed",
    "raw_date": "3/4/2011",
    "confidence": "low"
  },
  "HOUSE_OVERSIGHT_012690": {
    "date": "2011-03-04",
    "time": null,
    "source": "metadata",
    "raw_date": "03/04/2011",
    "confidence": "medium"
  },
  "HOUSE_OVERSIGHT_012700": {
    "date": "2011-03-11",
    "time": null,
    "source": "metadata",
    "raw_date": "03/11/2011",
    "confidence": "medium"
  },
  "HOUSE_OVERSIGHT_012704": {
    "date": "2011-04-21",
    "time": null,
    "source": "content_parsed",
    "raw_date": "2011-04-21",
    "confidence": "low"
  },
  "HOUSE_OVERSIGHT_012707": {
    "date": null,
    "time": null,
    "source": "unknown",
    "raw_date": null,
    "confidence": "none"
  },
  "HOUSE_OVERSIGHT_012711": {
    "date": "2011-06-14",
    "time": "16:54:35",
    "source": "email_header",
    "raw_date": "6/14/2011 4:54:35 PM",
    "confidence": "high"
  },
  "HOUSE_OVERSIGHT_012718": {
    "date": "2011-06-17",
    "time": null,
    "source": "content_parsed",
    "raw_date": "06/17/2011",
    "confidence": "low"
  },
  "HOUSE_OVERSIGHT_012722": {
    "date": "2011-08-03",
    "time": "14:11:03",
    "source": "email_header",
    "raw_date": "8/3/2011 2:11:03 PM",
    "confidence": "high"
  },
  "HOUSE_OVERSIGHT_012740": {
    "date": "2011-09-21",
    "time": null,
    "source": "metadata",
    "raw_date": "09/21/2011",
    "confidence": "medium"
  },
  "HOUSE_OVERSIGHT_012747": {
    "date": null,
    "time": null,
    "source": "unknown",
    "raw_date": null,
    "confidence": "none"
  },
  "HOUSE_OVERSIGHT_012898": {
    "date": "2013-05-13",
    "time": "22:28:30",
    "source": "email_header",
    "raw_date": "5/13/2013 10:28:30 PM",
    "confidence": "high"
  },
  "HOUSE_OVERSIGHT_012899": {
    "date": "2013-09-19",
    "time": null,
    "source": "metadata",
    "raw_date": "09/19/2013",
    "confidence": "medium"
  },
  "HOUSE_OVERSIGHT_013268": {
    "date": "2013-11-13",
    "time": null,
    "source": "metadata",
    "raw_date": "11/13/2013",
    "confidence": "medium"
  },
  "HOUSE_OVERSIGHT_013275": {
    "date": "2013-12-26",
    "time": null,
    "source": "content_parsed",
    "raw_date": "2013-12-26",
    "confidence": "low"
  },
  "HOUSE_OVERSIGHT_013304": {
    "date": "2014-01-17",
    "time": null,
    "source": "metadata",
    "raw_date": "01/17/2014",
    "confidence": "medium"
  },
  "HOUSE_OVERSIGHT_013403": {
    "date": "2011-10-19",
    "time": null,
    "source": "metadata",
    "raw_date": "10/19/2011",
    "confidence": "medium"
  },
  "HOUSE_OVERSIGHT_013405": {
    "date": "2011-04-07",
    "time": null,
    "source": "content_parsed",
    "raw_date": "THURSDAY, APRIL 07, 2011",
    "confidence": "low"
  },
  "HOUSE_OVERSIGHT_013415": {
    "date": "2009-09-18",
    "time": null,
    "source": "content_parsed",
    "raw_date": "Friday, September 18, 2009",
    "confidence": "low"
  },
  "HOUSE_OVERSIGHT_013435": {
    "date": "2011-03-11",
    "time": null,
    "source": "content_parsed",
    "raw_date": "Friday, March 11, 2011",
    "confidence": "low"
  },
  "HOUSE_OVERSIGHT_013437": {
    "date": "2011-07-29",
    "time": null,
    "source": "metadata",
    "raw_date": "07/29/2011",
    "confidence": "medium"
  },
  "HOUSE_OVERSIGHT_013440": {
    "date": "2011-07-13",
    "time": null,
    "source": "content_parsed",
    "raw_date": "Wednesday, July 13, 2011",
    "confidence": "low"
  },
  "HOUSE_OVERSIGHT_013442": {
    "date": "2012-03-13",
    "time": null,
    "source": "metadata",
    "raw_date": "03/13/2012",
    "confidence": "medium"
  },
  "HOUSE_OVERSIGHT_013450": {
    "date": "2012-03-21",
    "time": null,
    "source": "metadata",
    "raw_date": "03/21/2012",
    "confidence": "medium"
  },
  "HOUSE_OVERSIGHT_013460": {
    "date": "2012-03-23",
    "time": "19:10:58",
    "source": "email_header",
    "raw_date": "3/23/2012 7:10:58 PM",
    "confidence": "high"
  },
  "HOUSE_OVERSIGHT_013463": {
    "date": null,
    "time": null,
    "source": "unknown",
    "raw_date": null,
    "confidence": "none"
  },
  "HOUSE_OVERSIGHT_013482": {
    "date": "2012-11-23",
    "time": "13:06:38",
    "source": "email_header",
    "raw_date": "11/23/2012 1:06:38 PM",
    "confidence": "high"
  },
  "HOUSE_OVERSIGHT_013484": {
    "date": "2012-11-28",
    "time": "17:55:14",
    "source": "email_header",
    "raw_date": "11/28/2012 5:55:14 PM",
    "confidence": "high"
  },
  "HOUSE_OVERSIGHT_013489": {
    "date": null,
    "time": null,
    "source": "unknown",
    "raw_date": null,
    "confidence": "none"
  },
  "HOUSE_OVERSIGHT_013501": {
    "date": "2005-03-22",
    "time": null,
    "source": "metadata",
    "raw_date": "03/22/2005",
    "confidence": "medium"
  },
  "HOUSE_OVERSIGHT_013796": {
    "date": null,
    "time": null,
    "source": "unknown",
    "raw_date": null,
    "confidence": "none"
  },
  "HOUSE_OVERSIGHT_014037": {
    "date": "2014-02-05",
    "time": null,
    "source": "metadata",
    "raw_date": "02/05/2014",
    "confidence": "medium"
  },
  "HOUSE_OVERSIGHT_014084": {
    "date": "2015-03-24",
    "time": null,
    "source": "content_parsed",
    "raw_date": "03/24/2015",
    "confidence": "low"
  },
  "HOUSE_OVERSIGHT_014118": {
    "date": "2005-09-03",
    "time": null,
    "source": "content_parsed",
    "raw_date": "9/3/2005",
    "confidence": "low"
  },
  "HOUSE_OVERSIGHT_014310": {
    "date": "2016-11-15",
    "time": "14:44:06",
    "source": "email_header",
    "raw_date": "11/15/2016 2:44:06 PM",
    "confidence": "high"
  },
  "HOUSE_OVERSIGHT_014312": {
    "date": "2016-11-14",
    "time": null,
    "source": "content_parsed",
    "raw_date": "Monday, November 14, 2016",
    "confidence": "low"
  },
  "HOUSE_OVERSIGHT_014315": {
    "date": "2016-11-17",
    "time": null,
    "source": "metadata",
    "raw_date": "11/17/2016",
    "confidence": "medium"
  },
  "HOUSE_OVERSIGHT_014397": {
    "date": "2016-11-17",
    "time": "20:55:12",
    "source": "email_header",
    "raw_date": "11/17/2016 8:55:12 PM",
    "confidence": "high"
  },
  "HOUSE_OVERSIGHT_014404": {
    "date": "2016-11-17",
    "time": null,
    "source": "metadata",
    "raw_date": "11/17/2016",
    "confidence": "medium"
  },
  "HOUSE_OVERSIGHT_014410": {
    "date": "2016-11-17",
    "time": null,
    "source": "metadata",
    "raw_date": "11/17/2016",
    "confidence": "medium"
  },
  "HOUSE_OVERSIGHT_014424": {
    "date": "2016-11-13",
    "time": null,
    "source": "metadata",
    "raw_date": "11/13/2016",
    "confidence": "medium"
  },
  "HOUSE_OVERSIGHT_014432": {
    "date": "2016-12-02",
    "time": null,
    "source": "metadata",
    "raw_date": "12/02/2016",
    "confidence": "medium"
  },
  "HOUSE_OVERSIGHT_014460": {
    "date": "2016-11-30",
    "time": null,
    "source": "metadata",
    "raw_date": "11/30/2016",
    "confidence": "medium"
  },
  "HOUSE_OVERSIGHT_014498": {
    "date": "2016-12-13",
    "time": null,
    "source": "content_parsed",
    "raw_date": "TUESDAY, DECEMBER 13, 2016",
    "confidence": "low"
  },
  "HOUSE_OVERSIGHT_014516": {
    "date": "2016-12-15",
    "time": "17:40:04",
    "source": "email_header",
    "raw_date": "12/15/2016 5:40:04 PM",
    "confidence": "high"
  },
  "HOUSE_OVERSIGHT_014518": {
    "date": "2016-12-14",
    "time": null,
    "source": "metadata",
    "raw_date": "12/14/2016",
    "confidence": "medium"
  },
  "HOUSE_OVERSIGHT_014523": {
    "date": "2016-12-15",
    "time": null,
    "source": "content_parsed",
    "raw_date": "12/15/2016",
    "confidence": "low"
  },
  "HOUSE_OVERSIGHT_014525": {
    "date": "2017-01-05",
    "time": "15:31:54",
    "source": "email_header",
    "raw_date": "1/5/2017 3:31:54 PM",
    "confidence": "high"
  },
  "HOUSE_OVERSIGHT_014532": {
    "date": "2017-01-05",
    "time": null,
    "source": "metadata",
    "raw_date": "01/05/2017",
    "confidence": "medium"
  },
  "HOUSE_OVERSIGHT_014622": {
    "date": "2017-01-06",
    "time": null,
    "source": "metadata",
    "raw_date": "01/06/2017",
    "confidence": "medium"
  },
  "HOUSE_OVERSIGHT_014652": {
    "date": "2017-01-10",
    "time": null,
    "source": "metadata",
    "raw_date": "01/10/2017",
    "confidence": "medium"
  },
  "HOUSE_OVERSIGHT_014695": {
    "date": "2017-01-27",
    "time": "20:03:49",
    "source": "email_header",
    "raw_date": "1/27/2017 8:03:49 PM",
    "confidence": "high"
  },
  "HOUSE_OVERSIGHT_014697": {
    "date": null,
    "time": null,
    "source": "unknown",
    "raw_date": null,
    "confidence": "none"
  },
  "HOUSE_OVERSIGHT_014717": {
    "date": "2017-03-16",
    "time": "18:27:30",
    "source": "email_header",
    "raw_date": "3/16/2017 6:27:30 PM",
    "confidence": "high"
  },
  "HOUSE_OVERSIGHT_014721": {
    "date": "2016-10-01",
    "time": null,
    "source": "content_parsed",
    "raw_date": "10/1/2016",
    "confidence": "low"
  },
  "HOUSE_OVERSIGHT_014731": {
    "date": "2016-11-21",
    "time": null,
    "source": "metadata",
    "raw_date": "11/21/2016",
    "confidence": "medium"
  },
  "HOUSE_OVERSIGHT_014788": {
    "date": "2017-03-18",
    "time": null,
    "source": "metadata",
    "raw_date": "03/18/2017",
    "confidence": "medium"
  },
  "HOUSE_OVERSIGHT_014797": {
    "date": "2017-03-20",
    "time": null,
    "source": "metadata",
    "raw_date": "03/20/2017",
    "confidence": "medium"
  },
  "HOUSE_OVERSIGHT_014857": {
    "date": "2017-04-04",
    "time": "17:28:21",
    "source": "email_header",
    "raw_date": "4/4/2017 5:28:21 PM",
    "confidence": "high"
  },
  "HOUSE_OVERSIGHT_014860": {
    "date": "2017-04-07",
    "time": "12:24:59",
    "source": "email_header",
    "raw_date": "4/7/2017 12:24:59 PM",
    "confidence": "high"
  },
  "HOUSE_OVERSIGHT_014865": {
    "date": "2017-04-07",
    "time": null,
    "source": "content_parsed",
    "raw_date": "4/7/2017",
    "confidence": "low"
  },
  "HOUSE_OVERSIGHT_014873": {
    "date": "2017-04-11",
    "time": null,
    "source": "metadata",
    "raw_date": "04/11/2017",
    "confidence": "medium"
  },
  "HOUSE_OVERSIGHT_014887": {
    "date": "2017-04-06",
    "time": null,
    "source": "metadata",
    "raw_date": "04/06/2017",
    "confidence": "medium"
  },
  "HOUSE_OVERSIGHT_014951": {
    "date": null,
    "time": null,
    "source": "unknown",
    "raw_date": null,
    "confidence": "none"
  },
  "HOUSE_OVERSIGHT_014972": {
    "date": "2017-06-20",
    "time": null,
    "source": "metadata",
    "raw_date": "06/20/2017",
    "confidence": "medium"
  },
  "HOUSE_OVERSIGHT_015002": {
    "date": "2017-07-04",
    "time": "16:46:06",
    "source": "email_header",
    "raw_date": "7/4/2017 4:46:06 PM",
    "confidence": "high"
  },
  "HOUSE_OVERSIGHT_015015": {
    "date": "2017-07-04",
    "time": null,
    "source": "content_parsed",
    "raw_date": "Tuesday, July 4, 2017",
    "confidence": "low"
  },
  "HOUSE_OVERSIGHT_015028": {
    "date": "2017-08-26",
    "time": null,
    "source": "content_parsed",
    "raw_date": "Saturday, August 26, 2017",
    "confidence": "low"
  },
  "HOUSE_OVERSIGHT_015032": {
    "date": "2013-09-27",
    "time": null,
    "source": "metadata",
    "raw_date": "09/27/2013",
    "confidence": "medium"
  },
  "HOUSE_OVERSIGHT_015462": {
    "date": "2017-06-16",
    "time": null,
    "source": "metadata",
    "raw_date": "06/16/2017",
    "confidence": "medium"
  },
  "HOUSE_OVERSIGHT_015501": {
    "date": "2015-08-03",
    "time": null,
    "source": "metadata",
    "raw_date": "08/03/2015",
    "confidence": "medium"
  },
  "HOUSE_OVERSIGHT_015529": {
    "date": "2015-10-05",
    "time": null,
    "source": "content_parsed",
    "raw_date": "10/5/2015",
    "confidence": "low"
  },
  "HOUSE_OVERSIGHT_015590": {
    "date": "2015-11-23",
    "time": null,
    "source": "content_parsed",
    "raw_date": "Confidentiality, November 23, 2015",
    "confidence": "low"
  },
  "HOUSE_OVERSIGHT_015650": {
    "date": "2015-11-12",
    "time": null,
    "source": "content_parsed",
    "raw_date": "A, November 12, 2015",
    "confidence": "low"
  },
  "HOUSE_OVERSIGHT_015671": {
    "date": "2015-05-26",
    "time": null,
    "source": "metadata",
    "raw_date": "05/26/2015",
    "confidence": "medium"
  },
  "HOUSE_OVERSIGHT_015672": {
    "date": null,
    "time": null,
    "source": "unknown",
    "raw_date": null,
    "confidence": "none"
  },
  "HOUSE_OVERSIGHT_015675": {
    "date": "2015-04-28",
    "time": null,
    "source": "metadata",
    "raw_date": "04/28/2015",
    "confidence": "medium"
  },
  "HOUSE_OVERSIGHT_016111": {
    "date": "2016-06-30",
    "time": null,
    "source": "metadata",
    "raw_date": "06/30/2016",
    "confidence": "medium"
  },
  "HOUSE_OVERSIGHT_016197": {
    "date": "2019-07-02",
    "time": null,
    "source": "metadata",
    "raw_date": "07/02/2019",
    "confidence": "medium"
  },
  "HOUSE_OVERSIGHT_016203": {
    "date": "2019-07-13",
    "time": "21:06:05",
    "source": "email_header",
    "raw_date": "7/13/2019 9:06:05 PM",
    "confidence": "high"
  },
  "HOUSE_OVERSIGHT_016218": {
    "date": "2018-05-09",
    "time": "01:51:01",
    "source": "email_header",
    "raw_date": "5/9/2018 1:51:01 AM",
    "confidence": "high"
  },
  "HOUSE_OVERSIGHT_016221": {
    "date": null,
    "time": null,
    "source": "unknown",
    "raw_date": null,
    "confidence": "none"
  },
  "HOUSE_OVERSIGHT_016413": {
    "date": "2019-01-15",
    "time": null,
    "source": "content_parsed",
    "raw_date": "1/15/2019",
    "confidence": "low"
  },
  "HOUSE_OVERSIGHT_016420": {
    "date": "2019-01-14",
    "time": null,
    "source": "metadata",
    "raw_date": "01/14/2019",
    "confidence": "medium"
  },
  "HOUSE_OVERSIGHT_016506": {
    "date": "2019-02-28",
    "time": null,
    "source": "content_parsed",
    "raw_date": "THURSDAY, FEBRUARY 28, 2019",
    "confidence": "low"
  },
  "HOUSE_OVERSIGHT_016507": {
    "date": "2019-02-28",
    "time": null,
    "source": "content_parsed",
    "raw_date": "Thursday, February 28, 2019",
    "confidence": "low"
  },
  "HOUSE_OVERSIGHT_016508": {
    "date": "2019-02-28",
    "time": null,
    "source": "content_parsed",
    "raw_date": "Thursday, February 28, 2019",
    "confidence": "low"
  },
  "HOUSE_OVERSIGHT_016509": {
    "date": "2019-02-28",
    "time": null,
    "source": "content_parsed",
    "raw_date": "Thursday, February 28, 2019",
    "confidence": "low"
  },
  "HOUSE_OVERSIGHT_016552": {
    "date": null,
    "time": null,
    "source": "unknown",
    "raw_date": null,
    "confidence": "none"
  },
  "HOUSE_OVERSIGHT_016553": {
    "date": "2008-07-24",
    "time": null,
    "source": "content_parsed",
    "raw_date": "Thursday, July 24, 2008",
    "confidence": "low"
  },
  "HOUSE_OVERSIGHT_016554": {
    "date": "2008-07-17",
    "time": null,
    "source": "content_parsed",
    "raw_date": "THURSDAY, JULY 17, 2008",
    "confidence": "low"
  },
  "HOUSE_OVERSIGHT_016574": {
    "date": "2008-07-17",
    "time": null,
    "source": "content_parsed",
    "raw_date": "THURSDAY, JULY 17, 2008",
    "confidence": "low"
  },
  "HOUSE_OVERSIGHT_016595": {
    "date": "2008-06-26",
    "time": null,
    "source": "content_parsed",
    "raw_date": "Thursday, June 26, 2008",
    "confidence": "low"
  },
  "HOUSE_OVERSIGHT_016597": {
    "date": "2008-07-07",
    "time": null,
    "source": "metadata",
    "raw_date": "07/07/2008",
    "confidence": "medium"
  },
  "HOUSE_OVERSIGHT_016599": {
    "date": null,
    "time": null,
    "source": "unknown",
    "raw_date": null,
    "confidence": "none"
  },
  "HOUSE_OVERSIGHT_016600": {
    "date": null,
    "time": null,
    "source": "unknown",
    "raw_date": null,
    "confidence": "none"
  },
  "HOUSE_OVERSIGHT_016601": {
    "date": null,
    "time": null,
    "source": "unknown",
    "raw_date": null,
    "confidence": "none"
  },
  "HOUSE_OVERSIGHT_016602": {
    "date": "2008-04-17",
    "time": null,
    "source": "content_parsed",
    "raw_date": "THURSDAY, April 17, 2008",
    "confidence": "low"
  },
  "HOUSE_OVERSIGHT_016616": {
    "date": "2008-07-17",
    "time": null,
    "source": "content_parsed",
    "raw_date": "THURSDAY, JULY 17, 2008",
    "confidence": "low"
  },
  "HOUSE_OVERSIGHT_016636": {
    "date": "2009-01-23",
    "time": null,
    "source": "metadata",
    "raw_date": "01/23/2009",
    "confidence": "medium"
  },
  "HOUSE_OVERSIGHT_016690": {
    "date": "2008-06-26",
    "time": null,
    "source": "content_parsed",
    "raw_date": "Thursday, June 26, 2008",
    "confidence": "low"
  },
  "HOUSE_OVERSIGHT_016692": {
    "date": "2009-05-04",
    "time": null,
    "source": "content_parsed",
    "raw_date": "Monday, May 04, 2009",
    "confidence": "low"
  },
  "HOUSE_OVERSIGHT_016693": {
    "date": "2008-11-19",
    "time": null,
    "source": "content_parsed",
    "raw_date": "Wednesday, November 19, 2008",
    "confidence": "low"
  },
  "HOUSE_OVERSIGHT_016694": {
    "date": null,
    "time": null,
    "source": "unknown",
    "raw_date": null,
    "confidence": "none"
  },
  "HOUSE_OVERSIGHT_016695": {
    "date": null,
    "time": null,
    "source": "unknown",
    "raw_date": null,
    "confidence": "none"
  },
  "HOUSE_OVERSIGHT_016696": {
    "date": null,
    "time": null,
    "source": "unknown",
    "raw_date": null,
    "confidence": "none"
  },
  "HOUSE_OVERSIGHT_016697": {
    "date": null,
    "time": null,
    "source": "unknown",
    "raw_date": null,
    "confidence": "none"
  },
  "HOUSE_OVERSIGHT_016698": {
    "date": null,
    "time": null,
    "source": "unknown",
    "raw_date": null,
    "confidence": "none"
  },
  "HOUSE_OVERSIGHT_016699": {
    "date": "2019-05-16",
    "time": null,
    "source": "metadata",
    "raw_date": "05/16/2019",
    "confidence": "medium"
  },
  "HOUSE_OVERSIGHT_016787": {
    "date": "2019-06-29",
    "time": "12:03:59",
    "source": "email_header",
    "raw_date": "6/29/2019 12:03:59 PM",
    "confidence": "high"
  },
  "HOUSE_OVERSIGHT_016801": {
    "date": "2019-07-02",
    "time": null,
    "source": "content_parsed",
    "raw_date": "7/2/2019",
    "confidence": "low"
  },
  "HOUSE_OVERSIGHT_016804": {
    "date": null,
    "time": null,
    "source": "unknown",
    "raw_date": null,
    "confidence": "none"
  },
  "HOUSE_OVERSIGHT_016996": {
    "date": "2010-12-17",
    "time": null,
    "source": "metadata",
    "raw_date": "12/17/2010",
    "confidence": "medium"
  },
  "HOUSE_OVERSIGHT_017060": {
    "date": "2011-01-18",
    "time": null,
    "source": "metadata",
    "raw_date": "01/18/2011",
    "confidence": "medium"
  },
  "HOUSE_OVERSIGHT_017088": {
    "date": "2012-04-02",
    "time": null,
    "source": "metadata",
    "raw_date": "04/02/2012",
    "confidence": "medium"
  },
  "HOUSE_OVERSIGHT_017488": {
    "date": "2012-06-14",
    "time": null,
    "source": "content_parsed",
    "raw_date": "Thursday, June 14, 2012",
    "confidence": "low"
  },
  "HOUSE_OVERSIGHT_017523": {
    "date": "2012-08-18",
    "time": "16:11:07",
    "source": "email_header",
    "raw_date": "8/18/2012 4:11:07 PM",
    "confidence": "high"
  },
  "HOUSE_OVERSIGHT_017524": {
    "date": "2012-08-17",
    "time": null,
    "source": "metadata",
    "raw_date": "08/17/2012",
    "confidence": "medium"
  },
  "HOUSE_OVERSIGHT_017526": {
    "date": "2012-09-05",
    "time": null,
    "source": "metadata",
    "raw_date": "09/05/2012",
    "confidence": "medium"
  },
  "HOUSE_OVERSIGHT_017574": {
    "date": "2012-11-28",
    "time": "16:17:19",
    "source": "email_header",
    "raw_date": "11/28/2012 4:17:19 PM",
    "confidence": "high"
  },
  "HOUSE_OVERSIGHT_017581": {
    "date": "2012-11-28",
    "time": "11:28:51",
    "source": "email_header",
    "raw_date": "Wed, 28 Nov 2012 11:28:51 -0500",
    "confidence": "high"
  },
  "HOUSE_OVERSIGHT_017590": {
    "date": "2017-07-04",
    "time": "16:53:13",
    "source": "email_header",
    "raw_date": "7/4/2017 4:53:13 PM",
    "confidence": "high"
  },
  "HOUSE_OVERSIGHT_017603": {
    "date": "2019-02-28",
    "time": null,
    "source": "content_parsed",
    "raw_date": "Thursday, February 28, 2019",
    "confidence": "low"
  },
  "HOUSE_OVERSIGHT_017635": {
    "date": "2019-02-28",
    "time": null,
    "source": "content_parsed",
    "raw_date": "Thursday, February 28, 2019",
    "confidence": "low"
  },
  "HOUSE_OVERSIGHT_017714": {
    "date": "2019-02-28",
    "time": null,
    "source": "content_parsed",
    "raw_date": "Thursday, February 28, 2019",
    "confidence": "low"
  },
  "HOUSE_OVERSIGHT_017767": {
    "date": "2019-04-15",
    "time": null,
    "source": "content_parsed",
    "raw_date": "4/15/2019",
    "confidence": "low"
  },
  "HOUSE_OVERSIGHT_017771": {
    "date": "2019-04-09",
    "time": null,
    "source": "metadata",
    "raw_date": "04/09/2019",
    "confidence": "medium"
  },
  "HOUSE_OVERSIGHT_017787": {
    "date": "2019-04-09",
    "time": null,
    "source": "metadata",
    "raw_date": "04/09/2019",
    "confidence": "medium"
  },
  "HOUSE_OVERSIGHT_017789": {
    "date": "2019-04-09",
    "time": null,
    "source": "metadata",
    "raw_date": "04/09/2019",
    "confidence": "medium"
  },
  "HOUSE_OVERSIGHT_017792": {
    "date": "2019-04-03",
    "time": null,
    "source": "content_parsed",
    "raw_date": "4/3/2019",
    "confidence": "low"
  },
  "HOUSE_OVERSIGHT_017796": {
    "date": "2019-04-09",
    "time": null,
    "source": "metadata",
    "raw_date": "04/09/2019",
    "confidence": "medium"
  },
  "HOUSE_OVERSIGHT_017800": {
    "date": "2019-04-03",
    "time": null,
    "source": "content_parsed",
    "raw_date": "4/3/2019",
    "confidence": "low"
  },
  "HOUSE_OVERSIGHT_017818": {
    "date": "2019-04-15",
    "time": null,
    "source": "metadata",
    "raw_date": "04/15/2019",
    "confidence": "medium"
  },
  "HOUSE_OVERSIGHT_017824": {
    "date": "2019-04-09",
    "time": null,
    "source": "metadata",
    "raw_date": "04/09/2019",
    "confidence": "medium"
  },
  "HOUSE_OVERSIGHT_017827": {
    "date": "2019-04-23",
    "time": "09:55:44",
    "source": "email_header",
    "raw_date": "4/23/2019 9:55:44 AM",
    "confidence": "high"
  },
  "HOUSE_OVERSIGHT_017830": {
    "date": "2005-03-21",
    "time": null,
    "source": "metadata",
    "raw_date": "03/21/2005",
    "confidence": "medium"
  },
  "HOUSE_OVERSIGHT_017904": {
    "date": null,
    "time": null,
    "source": "unknown",
    "raw_date": null,
    "confidence": "none"
  },
  "HOUSE_OVERSIGHT_017935": {
    "date": "2019-04-17",
    "time": null,
    "source": "metadata",
    "raw_date": "04/17/2019",
    "confidence": "medium"
  },
  "HOUSE_OVERSIGHT_018045": {
    "date": "2010-09-10",
    "time": "16:01:03",
    "source": "email_header",
    "raw_date": "9/10/2010 4:01:03 PM",
    "confidence": "high"
  },
  "HOUSE_OVERSIGHT_018084": {
    "date": "2010-10-28",
    "time": "16:16:11",
    "source": "email_header",
    "raw_date": "10/28/2010 4:16:11 PM",
    "confidence": "high"
  },
  "HOUSE_OVERSIGHT_018085": {
    "date": "2011-06-17",
    "time": null,
    "source": "metadata",
    "raw_date": "06/17/2011",
    "confidence": "medium"
  },
  "HOUSE_OVERSIGHT_018119": {
    "date": "2011-09-22",
    "time": "04:48:35",
    "source": "email_header",
    "raw_date": "9/22/2011 4:48:35 AM",
    "confidence": "high"
  },
  "HOUSE_OVERSIGHT_018158": {
    "date": "2011-09-22",
    "time": "10:19:51",
    "source": "email_header",
    "raw_date": "9/22/2011 10:19:51 AM",
    "confidence": "high"
  },
  "HOUSE_OVERSIGHT_018197": {
    "date": "2013-02-15",
    "time": "16:52:58",
    "source": "email_header",
    "raw_date": "2/15/2013 4:52:58 PM",
    "confidence": "high"
  },
  "HOUSE_OVERSIGHT_018224": {
    "date": "2019-04-05",
    "time": null,
    "source": "content_parsed",
    "raw_date": "2019-04-05",
    "confidence": "low"
  },
  "HOUSE_OVERSIGHT_018232": {
    "date": null,
    "time": null,
    "source": "unknown",
    "raw_date": null,
    "confidence": "none"
  },
  "HOUSE_OVERSIGHT_018438": {
    "date": null,
    "time": null,
    "source": "unknown",
    "raw_date": null,
    "confidence": "none"
  },
  "HOUSE_OVERSIGHT_018703": {
    "date": "2004-02-01",
    "time": null,
    "source": "content_parsed",
    "raw_date": "Sunday, February 1, 2004",
    "confidence": "low"
  },
  "HOUSE_OVERSIGHT_018726": {
    "date": null,
    "time": null,
    "source": "unknown",
    "raw_date": null,
    "confidence": "none"
  },
  "HOUSE_OVERSIGHT_018727": {
    "date": "2014-11-04",
    "time": null,
    "source": "metadata",
    "raw_date": "11/04/2014",
    "confidence": "medium"
  },
  "HOUSE_OVERSIGHT_018743": {
    "date": "2015-09-04",
    "time": null,
    "source": "metadata",
    "raw_date": "09/04/2015",
    "confidence": "medium"
  },
  "HOUSE_OVERSIGHT_018804": {
    "date": "2017-05-22",
    "time": null,
    "source": "metadata",
    "raw_date": "05/22/2017",
    "confidence": "medium"
  },
  "HOUSE_OVERSIGHT_018862": {
    "date": "2012-11-09",
    "time": null,
    "source": "content_parsed",
    "raw_date": "FRIDAY, NOVEMBER 9, 2012",
    "confidence": "low"
  },
  "HOUSE_OVERSIGHT_018872": {
    "date": null,
    "time": null,
    "source": "unknown",
    "raw_date": null,
    "confidence": "none"
  },
  "HOUSE_OVERSIGHT_019086": {
    "date": null,
    "time": null,
    "source": "unknown",
    "raw_date": null,
    "confidence": "none"
  },
  "HOUSE_OVERSIGHT_019088": {
    "date": "2015-07-27",
    "time": null,
    "source": "metadata",
    "raw_date": "07/27/2015",
    "confidence": "medium"
  },
  "HOUSE_OVERSIGHT_019105": {
    "date": "2016-08-17",
    "time": "15:27:07",
    "source": "email_header",
    "raw_date": "8/17/2016 3:27:07 PM",
    "confidence": "high"
  },
  "HOUSE_OVERSIGHT_019109": {
    "date": null,
    "time": null,
    "source": "unknown",
    "raw_date": null,
    "confidence": "none"
  },
  "HOUSE_OVERSIGHT_019111": {
    "date": "2016-09-28",
    "time": null,
    "source": "metadata",
    "raw_date": "09/28/2016",
    "confidence": "medium"
  },
  "HOUSE_OVERSIGHT_019203": {
    "date": "2016-12-19",
    "time": "04:36:41",
    "source": "email_header",
    "raw_date": "12/19/2016 4:36:41 AM",
    "confidence": "high"
  },
  "HOUSE_OVERSIGHT_019206": {
    "date": "2016-12-30",
    "time": null,
    "source": "content_parsed",
    "raw_date": "Journal, December 30, 2016",
    "confidence": "low"
  },
  "HOUSE_OVERSIGHT_019211": {
    "date": "2016-12-31",
    "time": "23:57:08",
    "source": "email_header",
    "raw_date": "12/31/2016 11:57:08 PM",
    "confidence": "high"
  },
  "HOUSE_OVERSIGHT_019212": {
    "date": "2016-12-28",
    "time": null,
    "source": "metadata",
    "raw_date": "12/28/2016",
    "confidence": "medium"
  },
  "HOUSE_OVERSIGHT_019218": {
    "date": "2017-01-25",
    "time": "16:15:19",
    "source": "email_header",
    "raw_date": "1/25/2017 4:15:19 PM",
    "confidence": "high"
  },
  "HOUSE_OVERSIGHT_019219": {
    "date": "2017-02-11",
    "time": "13:37:47",
    "source": "email_header",
    "raw_date": "2/11/2017 1:37:47 PM",
    "confidence": "high"
  },
  "HOUSE_OVERSIGHT_019221": {
    "date": "2008-05-19",
    "time": null,
    "source": "content_parsed",
    "raw_date": "Monday, May 19, 2008",
    "confidence": "low"
  },
  "HOUSE_OVERSIGHT_019224": {
    "date": null,
    "time": null,
    "source": "unknown",
    "raw_date": null,
    "confidence": "none"
  },
  "HOUSE_OVERSIGHT_019233": {
    "date": "2017-05-20",
    "time": null,
    "source": "metadata",
    "raw_date": "05/20/2017",
    "confidence": "medium"
  },
  "HOUSE_OVERSIGHT_019297": {
    "date": "2016-10-23",
    "time": null,
    "source": "content_parsed",
    "raw_date": "Sunday, October 23, 2016",
    "confidence": "low"
  },
  "HOUSE_OVERSIGHT_019300": {
    "date": "2018-02-19",
    "time": null,
    "source": "metadata",
    "raw_date": "02/19/2018",
    "confidence": "medium"
  },
  "HOUSE_OVERSIGHT_019302": {
    "date": "2018-07-22",
    "time": "23:27:26",
    "source": "email_header",
    "raw_date": "7/22/2018 11:27:26 PM",
    "confidence": "high"
  },
  "HOUSE_OVERSIGHT_019305": {
    "date": "2018-07-22",
    "time": "23:58:18",
    "source": "email_header",
    "raw_date": "7/22/2018 11:58:18 PM",
    "confidence": "high"
  },
  "HOUSE_OVERSIGHT_019308": {
    "date": "2018-07-23",
    "time": "00:18:57",
    "source": "email_header",
    "raw_date": "7/23/2018 12:18:57 AM",
    "confidence": "high"
  },
  "HOUSE_OVERSIGHT_019312": {
    "date": "2018-07-23",
    "time": "00:19:09",
    "source": "email_header",
    "raw_date": "7/23/2018 12:19:09 AM",
    "confidence": "high"
  },
  "HOUSE_OVERSIGHT_019316": {
    "date": "2018-07-23",
    "time": "11:07:34",
    "source": "email_header",
    "raw_date": "7/23/2018 11:07:34 AM",
    "confidence": "high"
  },
  "HOUSE_OVERSIGHT_019321": {
    "date": "2018-07-23",
    "time": "13:50:16",
    "source": "email_header",
    "raw_date": "7/23/2018 1:50:16 PM",
    "confidence": "high"
  },
  "HOUSE_OVERSIGHT_019326": {
    "date": "2016-12-19",
    "time": "10:39:57",
    "source": "email_header",
    "raw_date": "12/19/2016 10:39:57 AM",
    "confidence": "high"
  },
  "HOUSE_OVERSIGHT_019330": {
    "date": "2016-12-19",
    "time": "15:01:54",
    "source": "email_header",
    "raw_date": "12/19/2016 3:01:54 PM",
    "confidence": "high"
  },
  "HOUSE_OVERSIGHT_019334": {
    "date": "2018-07-23",
    "time": "01:51:58",
    "source": "email_header",
    "raw_date": "Mon, 23 Jul 2018 01:51:58 +0200",
    "confidence": "high"
  },
  "HOUSE_OVERSIGHT_019338": {
    "date": "2018-07-23",
    "time": "13:58:04",
    "source": "email_header",
    "raw_date": "7/23/2018 1:58:04 PM",
    "confidence": "high"
  },
  "HOUSE_OVERSIGHT_019343": {
    "date": "2018-07-23",
    "time": "15:32:23",
    "source": "email_header",
    "raw_date": "7/23/2018 3:32:23 PM",
    "confidence": "high"
  },
  "HOUSE_OVERSIGHT_019348": {
    "date": "2018-07-23",
    "time": "15:58:02",
    "source": "email_header",
    "raw_date": "7/23/2018 3:58:02 PM",
    "confidence": "high"
  },
  "HOUSE_OVERSIGHT_019352": {
    "date": null,
    "time": null,
    "source": "unknown",
    "raw_date": null,
    "confidence": "none"
  },
  "HOUSE_OVERSIGHT_019396": {
    "date": null,
    "time": null,
    "source": "unknown",
    "raw_date": null,
    "confidence": "none"
  },
  "HOUSE_OVERSIGHT_019406": {
    "date": "2011-03-04",
    "time": "19:03:00",
    "source": "email_header",
    "raw_date": "Friday, March 4 2011 07:03 PM",
    "confidence": "high"
  },
  "HOUSE_OVERSIGHT_019407": {
    "date": "2011-03-08",
    "time": "16:40:35",
    "source": "email_header",
    "raw_date": "3/8/2011 4:40:35 PM",
    "confidence": "high"
  },
  "HOUSE_OVERSIGHT_019409": {
    "date": "2011-03-08",
    "time": "16:41:04",
    "source": "email_header",
    "raw_date": "3/8/2011 4:41:04 PM",
    "confidence": "high"
  },
  "HOUSE_OVERSIGHT_019412": {
    "date": "2013-08-26",
    "time": "14:46:00",
    "source": "email_header",
    "raw_date": "Monday, August 26 2013 02:46 PM",
    "confidence": "high"
  },
  "HOUSE_OVERSIGHT_019439": {
    "date": null,
    "time": null,
    "source": "unknown",
    "raw_date": null,
    "confidence": "none"
  },
  "HOUSE_OVERSIGHT_019440": {
    "date": "2014-01-29",
    "time": null,
    "source": "metadata",
    "raw_date": "01/29/2014",
    "confidence": "medium"
  },
  "HOUSE_OVERSIGHT_019444": {
    "date": "2009-10-15",
    "time": null,
    "source": "metadata",
    "raw_date": "10/15/2009",
    "confidence": "medium"
  },
  "HOUSE_OVERSIGHT_019446": {
    "date": "2012-06-22",
    "time": "23:08:00",
    "source": "email_header",
    "raw_date": "Friday, June 22 2012 11:08 PM",
    "confidence": "high"
  },
  "HOUSE_OVERSIGHT_019448": {
    "date": "2011-05-17",
    "time": null,
    "source": "metadata",
    "raw_date": "05/17/2011",
    "confidence": "medium"
  },
  "HOUSE_OVERSIGHT_019465": {
    "date": "2013-03-07",
    "time": "14:03:11",
    "source": "email_header",
    "raw_date": "3/7/2013 2:03:11 PM",
    "confidence": "high"
  },
  "HOUSE_OVERSIGHT_019467": {
    "date": "2015-01-14",
    "time": null,
    "source": "content_parsed",
    "raw_date": "1/14/2015",
    "confidence": "low"
  },
  "HOUSE_OVERSIGHT_019468": {
    "date": null,
    "time": null,
    "source": "unknown",
    "raw_date": null,
    "confidence": "none"
  },
  "HOUSE_OVERSIGHT_019474": {
    "date": null,
    "time": null,
    "source": "unknown",
    "raw_date": null,
    "confidence": "none"
  },
  "HOUSE_OVERSIGHT_019476": {
    "date": null,
    "time": null,
    "source": "unknown",
    "raw_date": null,
    "confidence": "none"
  },
  "HOUSE_OVERSIGHT_019477": {
    "date": null,
    "time": null,
    "source": "unknown",
    "raw_date": null,
    "confidence": "none"
  },
  "HOUSE_OVERSIGHT_019845": {
    "date": "2017-03-13",
    "time": "14:45:19",
    "source": "email_header",
    "raw_date": "3/13/2017 2:45:19 PM",
    "confidence": "high"
  },
  "HOUSE_OVERSIGHT_019849": {
    "date": "2017-03-13",
    "time": null,
    "source": "metadata",
    "raw_date": "03/13/2017",
    "confidence": "medium"
  },
  "HOUSE_OVERSIGHT_019856": {
    "date": "2017-03-20",
    "time": null,
    "source": "metadata",
    "raw_date": "03/20/2017",
    "confidence": "medium"
  },
  "HOUSE_OVERSIGHT_019864": {
    "date": "2017-03-30",
    "time": null,
    "source": "metadata",
    "raw_date": "03/30/2017",
    "confidence": "medium"
  },
  "HOUSE_OVERSIGHT_019871": {
    "date": "2018-01-08",
    "time": "19:47:20",
    "source": "email_header",
    "raw_date": "1/8/2018 7:47:20 PM",
    "confidence": "high"
  },
  "HOUSE_OVERSIGHT_019873": {
    "date": "2018-01-08",
    "time": null,
    "source": "content_parsed",
    "raw_date": "Mon, Jan 8, 2018",
    "confidence": "low"
  },
  "HOUSE_OVERSIGHT_019874": {
    "date": "2018-01-05",
    "time": null,
    "source": "metadata",
    "raw_date": "01/05/2018",
    "confidence": "medium"
  },
  "HOUSE_OVERSIGHT_020143": {
    "date": "2018-02-21",
    "time": null,
    "source": "content_parsed",
    "raw_date": "2/21/2018",
    "confidence": "low"
  },
  "HOUSE_OVERSIGHT_020153": {
    "date": "2015-11-16",
    "time": null,
    "source": "metadata",
    "raw_date": "11/16/2015",
    "confidence": "medium"
  },
  "HOUSE_OVERSIGHT_020437": {
    "date": "2018-04-27",
    "time": "20:25:30",
    "source": "email_header",
    "raw_date": "4/27/2018 8:25:30 PM",
    "confidence": "high"
  },
  "HOUSE_OVERSIGHT_020440": {
    "date": "2018-07-22",
    "time": null,
    "source": "content_parsed",
    "raw_date": "7/22/2018",
    "confidence": "low"
  },
  "HOUSE_OVERSIGHT_020443": {
    "date": "2018-08-27",
    "time": "10:37:29",
    "source": "email_header",
    "raw_date": "Mon, 27 Aug 2018 10:37:29 -0400",
    "confidence": "high"
  },
  "HOUSE_OVERSIGHT_020446": {
    "date": "2018-10-11",
    "time": null,
    "source": "content_parsed",
    "raw_date": "10/11/2018",
    "confidence": "low"
  },
  "HOUSE_OVERSIGHT_020447": {
    "date": "2018-11-17",
    "time": null,
    "source": "metadata",
    "raw_date": "11/17/2018",
    "confidence": "medium"
  },
  "HOUSE_OVERSIGHT_020660": {
    "date": "2018-12-22",
    "time": null,
    "source": "content_parsed",
    "raw_date": "12/22/2018",
    "confidence": "low"
  },
  "HOUSE_OVERSIGHT_020662": {
    "date": null,
    "time": null,
    "source": "unknown",
    "raw_date": null,
    "confidence": "none"
  },
  "HOUSE_OVERSIGHT_020666": {
    "date": "2019-03-07",
    "time": "16:21:42",
    "source": "email_header",
    "raw_date": "3/7/2019 4:21:42 PM",
    "confidence": "high"
  },
  "HOUSE_OVERSIGHT_020815": {
    "date": "2018-05-13",
    "time": "11:02:26",
    "source": "email_header",
    "raw_date": "5/13/2018 11:02:26 AM",
    "confidence": "high"
  },
  "HOUSE_OVERSIGHT_020822": {
    "date": "2011-03-07",
    "time": "19:11:08",
    "source": "email_header",
    "raw_date": "3/7/2011 7:11:08 PM",
    "confidence": "high"
  },
  "HOUSE_OVERSIGHT_020824": {
    "date": "2011-02-24",
    "time": null,
    "source": "metadata",
    "raw_date": "02/24/2011",
    "confidence": "medium"
  },
  "HOUSE_OVERSIGHT_021090": {
    "date": null,
    "time": null,
    "source": "unknown",
    "raw_date": null,
    "confidence": "none"
  },
  "HOUSE_OVERSIGHT_021092": {
    "date": null,
    "time": null,
    "source": "unknown",
    "raw_date": null,
    "confidence": "none"
  },
  "HOUSE_OVERSIGHT_021093": {
    "date": null,
    "time": null,
    "source": "unknown",
    "raw_date": null,
    "confidence": "none"
  },
  "HOUSE_OVERSIGHT_021094": {
    "date": "2007-06-12",
    "time": null,
    "source": "metadata",
    "raw_date": "06/12/2007",
    "confidence": "medium"
  },
  "HOUSE_OVERSIGHT_021096": {
    "date": "2018-02-21",
    "time": null,
    "source": "content_parsed",
    "raw_date": "Wed, Feb 21, 2018",
    "confidence": "low"
  },
  "HOUSE_OVERSIGHT_021106": {
    "date": "2018-05-13",
    "time": "11:03:18",
    "source": "email_header",
    "raw_date": "5/13/2018 11:03:18 AM",
    "confidence": "high"
  },
  "HOUSE_OVERSIGHT_021113": {
    "date": "2019-04-23",
    "time": "12:58:06",
    "source": "email_header",
    "raw_date": "4/23/2019 12:58:06 PM",
    "confidence": "high"
  },
  "HOUSE_OVERSIGHT_021120": {
    "date": "2019-05-28",
    "time": null,
    "source": "metadata",
    "raw_date": "05/28/2019",
    "confidence": "medium"
  },
  "HOUSE_OVERSIGHT_021145": {
    "date": "2016-08-18",
    "time": null,
    "source": "metadata",
    "raw_date": "08/18/2016",
    "confidence": "medium"
  },
  "HOUSE_OVERSIGHT_021216": {
    "date": "2019-04-23",
    "time": "12:57:52",
    "source": "email_header",
    "raw_date": "4/23/2019 12:57:52 PM",
    "confidence": "high"
  },
  "HOUSE_OVERSIGHT_021223": {
    "date": "2019-04-23",
    "time": "16:06:36",
    "source": "email_header",
    "raw_date": "4/23/2019 4:06:36 PM",
    "confidence": "high"
  },
  "HOUSE_OVERSIGHT_021230": {
    "date": "2009-06-27",
    "time": "11:22:50",
    "source": "email_header",
    "raw_date": "6/27/2009 11:22:50 AM",
    "confidence": "high"
  },
  "HOUSE_OVERSIGHT_021231": {
    "date": "2009-07-12",
    "time": "11:37:00",
    "source": "email_header",
    "raw_date": "7/12/2009 11:37:00 AM",
    "confidence": "high"
  },
  "HOUSE_OVERSIGHT_021235": {
    "date": "2010-01-12",
    "time": "00:28:25",
    "source": "email_header",
    "raw_date": "1/12/2010 12:28:25 AM",
    "confidence": "high"
  },
  "HOUSE_OVERSIGHT_021241": {
    "date": "2010-01-12",
    "time": "11:18:58",
    "source": "email_header",
    "raw_date": "1/12/2010 11:18:58 AM",
    "confidence": "high"
  },
  "HOUSE_OVERSIGHT_021247": {
    "date": null,
    "time": null,
    "source": "unknown",
    "raw_date": null,
    "confidence": "none"
  },
  "HOUSE_OVERSIGHT_021399": {
    "date": "2011-03-03",
    "time": "17:54:10",
    "source": "email_header",
    "raw_date": "3/3/2011 5:54:10 PM",
    "confidence": "high"
  },
  "HOUSE_OVERSIGHT_021400": {
    "date": "2011-03-07",
    "time": "19:12:54",
    "source": "email_header",
    "raw_date": "3/7/2011 7:12:54 PM",
    "confidence": "high"
  },
  "HOUSE_OVERSIGHT_021403": {
    "date": "2011-03-08",
    "time": "01:10:38",
    "source": "email_header",
    "raw_date": "3/8/2011 1:10:38 AM",
    "confidence": "high"
  },
  "HOUSE_OVERSIGHT_021406": {
    "date": "2011-04-04",
    "time": "12:21:13",
    "source": "email_header",
    "raw_date": "4/4/2011 12:21:13 PM",
    "confidence": "high"
  },
  "HOUSE_OVERSIGHT_021408": {
    "date": "2017-12-11",
    "time": "06:53:37",
    "source": "email_header",
    "raw_date": "12/11/2017 6:53:37 AM",
    "confidence": "high"
  },
  "HOUSE_OVERSIGHT_021416": {
    "date": "2017-12-11",
    "time": "15:22:48",
    "source": "email_header",
    "raw_date": "12/11/2017 3:22:48 PM",
    "confidence": "high"
  },
  "HOUSE_OVERSIGHT_021425": {
    "date": "2017-12-11",
    "time": null,
    "source": "content_parsed",
    "raw_date": "Mon, Dec 11, 2017",
    "confidence": "low"
  },
  "HOUSE_OVERSIGHT_021434": {
    "date": "2007-03-07",
    "time": null,
    "source": "content_parsed",
    "raw_date": "03/07/2007",
    "confidence": "low"
  },
  "HOUSE_OVERSIGHT_021569": {
    "date": null,
    "time": null,
    "source": "unknown",
    "raw_date": null,
    "confidence": "none"
  },
  "HOUSE_OVERSIGHT_021718": {
    "date": "2013-07-29",
    "time": null,
    "source": "content_parsed",
    "raw_date": "MONDAV, JULY 29, 2013",
    "confidence": "low"
  },
  "HOUSE_OVERSIGHT_021729": {
    "date": "2019-03-14",
    "time": "16:48:11",
    "source": "email_header",
    "raw_date": "3/14/2019 4:48:11 PM",
    "confidence": "high"
  },
  "HOUSE_OVERSIGHT_021740": {
    "date": "2019-03-14",
    "time": "16:30:53",
    "source": "email_header",
    "raw_date": "3/14/2019 4:30:53 PM",
    "confidence": "high"
  },
  "HOUSE_OVERSIGHT_021749": {
    "date": "2019-03-14",
    "time": "17:28:39",
    "source": "email_header",
    "raw_date": "3/14/2019 5:28:39 PM",
    "confidence": "high"
  },
  "HOUSE_OVERSIGHT_021758": {
    "date": "2009-06-19",
    "time": "23:01:00",
    "source": "email_header",
    "raw_date": "Friday, June 19 2009 11:01 PM",
    "confidence": "high"
  },
  "HOUSE_OVERSIGHT_021759": {
    "date": "2009-06-23",
    "time": "22:49:00",
    "source": "email_header",
    "raw_date": "Tuesday, June 23 2009 10:49 PM",
    "confidence": "high"
  },
  "HOUSE_OVERSIGHT_021761": {
    "date": "2010-02-26",
    "time": "14:59:54",
    "source": "email_header",
    "raw_date": "2/26/2010 2:59:54 PM",
    "confidence": "high"
  },
  "HOUSE_OVERSIGHT_021764": {
    "date": "2010-02-24",
    "time": null,
    "source": "content_parsed",
    "raw_date": "Wed, Feb 24, 2010",
    "confidence": "low"
  },
  "HOUSE_OVERSIGHT_021775": {
    "date": "2006-08-04",
    "time": null,
    "source": "content_parsed",
    "raw_date": "Friday, August 04, 2006",
    "confidence": "low"
  },
  "HOUSE_OVERSIGHT_021790": {
    "date": "2010-02-26",
    "time": "18:37:49",
    "source": "email_header",
    "raw_date": "2/26/2010 6:37:49 PM",
    "confidence": "high"
  },
  "HOUSE_OVERSIGHT_021794": {
    "date": "2010-02-26",
    "time": null,
    "source": "content_parsed",
    "raw_date": "Fri, Feb 26, 2010",
    "confidence": "low"
  },
  "HOUSE_OVERSIGHT_021806": {
    "date": "2015-01-03",
    "time": null,
    "source": "content_parsed",
    "raw_date": "Saturday, January 3, 2015",
    "confidence": "low"
  },
  "HOUSE_OVERSIGHT_021808": {
    "date": "2015-01-09",
    "time": null,
    "source": "content_parsed",
    "raw_date": "Friday, January 9, 2015",
    "confidence": "low"
  },
  "HOUSE_OVERSIGHT_021811": {
    "date": "2015-01-09",
    "time": null,
    "source": "content_parsed",
    "raw_date": "Friday, January 9, 2015",
    "confidence": "low"
  },
  "HOUSE_OVERSIGHT_021814": {
    "date": "2015-01-09",
    "time": null,
    "source": "content_parsed",
    "raw_date": "Friday, January 9, 2015",
    "confidence": "low"
  },
  "HOUSE_OVERSIGHT_021818": {
    "date": "2015-01-09",
    "time": null,
    "source": "content_parsed",
    "raw_date": "Friday, January 9, 2015",
    "confidence": "low"
  },
  "HOUSE_OVERSIGHT_021823": {
    "date": "2015-01-20",
    "time": null,
    "source": "content_parsed",
    "raw_date": "Tuesday, January 20, 2015",
    "confidence": "low"
  },
  "HOUSE_OVERSIGHT_021824": {
    "date": "2015-10-17",
    "time": null,
    "source": "metadata",
    "raw_date": "10/17/2015",
    "confidence": "medium"
  },
  "HOUSE_OVERSIGHT_021956": {
    "date": "2016-01-20",
    "time": null,
    "source": "content_parsed",
    "raw_date": "Wednesday, January 20, 2016",
    "confidence": "low"
  },
  "HOUSE_OVERSIGHT_021958": {
    "date": "2016-09-28",
    "time": null,
    "source": "metadata",
    "raw_date": "09/28/2016",
    "confidence": "medium"
  },
  "HOUSE_OVERSIGHT_022058": {
    "date": "2016-09-28",
    "time": null,
    "source": "metadata",
    "raw_date": "09/28/2016",
    "confidence": "medium"
  },
  "HOUSE_OVERSIGHT_022118": {
    "date": "2016-09-28",
    "time": null,
    "source": "metadata",
    "raw_date": "09/28/2016",
    "confidence": "medium"
  },
  "HOUSE_OVERSIGHT_022187": {
    "date": "2016-10-13",
    "time": null,
    "source": "content_parsed",
    "raw_date": "Thursday, October 13, 2016",
    "confidence": "low"
  },
  "HOUSE_OVERSIGHT_022189": {
    "date": "2016-11-11",
    "time": null,
    "source": "content_parsed",
    "raw_date": "Friday, November 11, 2016",
    "confidence": "low"
  },
  "HOUSE_OVERSIGHT_022190": {
    "date": "2015-01-09",
    "time": null,
    "source": "content_parsed",
    "raw_date": "Friday, January 9, 2015",
    "confidence": "low"
  },
  "HOUSE_OVERSIGHT_022193": {
    "date": "2015-01-09",
    "time": null,
    "source": "content_parsed",
    "raw_date": "Friday, January 9, 2015",
    "confidence": "low"
  },
  "HOUSE_OVERSIGHT_022197": {
    "date": "2015-01-09",
    "time": null,
    "source": "content_parsed",
    "raw_date": "Friday,  January 9, 2015",
    "confidence": "low"
  },
  "HOUSE_OVERSIGHT_022202": {
    "date": "2015-01-20",
    "time": null,
    "source": "content_parsed",
    "raw_date": "Tuesday, January 20, 2015",
    "confidence": "low"
  },
  "HOUSE_OVERSIGHT_022203": {
    "date": "2010-12-11",
    "time": "21:01:17",
    "source": "email_header",
    "raw_date": "12/11/2010 9:01:17 PM",
    "confidence": "high"
  },
  "HOUSE_OVERSIGHT_022207": {
    "date": "2010-12-16",
    "time": "21:28:38",
    "source": "email_header",
    "raw_date": "12/16/2010 9:28:38 PM",
    "confidence": "high"
  },
  "HOUSE_OVERSIGHT_022210": {
    "date": "2019-03-01",
    "time": null,
    "source": "content_parsed",
    "raw_date": "Friday, March 1, 2019",
    "confidence": "low"
  },
  "HOUSE_OVERSIGHT_022211": {
    "date": "2019-03-02",
    "time": null,
    "source": "content_parsed",
    "raw_date": "Saturday, March 2, 2019",
    "confidence": "low"
  },
  "HOUSE_OVERSIGHT_022212": {
    "date": "2019-03-02",
    "time": null,
    "source": "content_parsed",
    "raw_date": "Saturday, March 2, 2019",
    "confidence": "low"
  },
  "HOUSE_OVERSIGHT_022213": {
    "date": null,
    "time": null,
    "source": "unknown",
    "raw_date": null,
    "confidence": "none"
  },
  "HOUSE_OVERSIGHT_022214": {
    "date": "2013-01-31",
    "time": null,
    "source": "content_parsed",
    "raw_date": "Thursday, January 31, 2013",
    "confidence": "low"
  },
  "HOUSE_OVERSIGHT_022216": {
    "date": "2010-12-15",
    "time": null,
    "source": "content_parsed",
    "raw_date": "12/15/2010",
    "confidence": "low"
  },
  "HOUSE_OVERSIGHT_022219": {
    "date": "2010-12-16",
    "time": "13:15:29",
    "source": "email_header",
    "raw_date": "12/16/2010 1:15:29 PM",
    "confidence": "high"
  },
  "HOUSE_OVERSIGHT_022223": {
    "date": "2010-12-16",
    "time": "13:20:06",
    "source": "email_header",
    "raw_date": "12/16/2010 1:20:06 PM",
    "confidence": "high"
  },
  "HOUSE_OVERSIGHT_022226": {
    "date": "2010-12-16",
    "time": "13:27:48",
    "source": "email_header",
    "raw_date": "12/16/2010 1:27:48 PM",
    "confidence": "high"
  },
  "HOUSE_OVERSIGHT_022230": {
    "date": "2010-12-16",
    "time": "13:31:21",
    "source": "email_header",
    "raw_date": "12/16/2010 1:31:21 PM",
    "confidence": "high"
  },
  "HOUSE_OVERSIGHT_022234": {
    "date": "2011-03-08",
    "time": null,
    "source": "content_parsed",
    "raw_date": "Tuesday, March 8, 2011",
    "confidence": "low"
  },
  "HOUSE_OVERSIGHT_022237": {
    "date": null,
    "time": null,
    "source": "unknown",
    "raw_date": null,
    "confidence": "none"
  },
  "HOUSE_OVERSIGHT_022245": {
    "date": "2009-09-28",
    "time": "23:34:06",
    "source": "email_header",
    "raw_date": "9/28/2009 11:34:06 PM",
    "confidence": "high"
  },
  "HOUSE_OVERSIGHT_022247": {
    "date": "2011-03-04",
    "time": "11:14:35",
    "source": "email_header",
    "raw_date": "Fri, 4 Mar 2011 11:14:35 -0500",
    "confidence": "high"
  },
  "HOUSE_OVERSIGHT_022250": {
    "date": "2011-04-03",
    "time": "19:15:00",
    "source": "email_header",
    "raw_date": "Sunday, April 3 2011 07:15 PM",
    "confidence": "high"
  },
  "HOUSE_OVERSIGHT_022258": {
    "date": "2013-01-31",
    "time": null,
    "source": "content_parsed",
    "raw_date": "Thursday, January 31, 2013",
    "confidence": "low"
  },
  "HOUSE_OVERSIGHT_022260": {
    "date": "2014-03-14",
    "time": "02:24:19",
    "source": "email_header",
    "raw_date": "3/14/2014 2:24:19 AM",
    "confidence": "high"
  },
  "HOUSE_OVERSIGHT_022262": {
    "date": "2014-03-14",
    "time": "04:41:47",
    "source": "email_header",
    "raw_date": "3/14/2014 4:41:47 AM",
    "confidence": "high"
  },
  "HOUSE_OVERSIGHT_022265": {
    "date": "2017-03-15",
    "time": "12:14:18",
    "source": "email_header",
    "raw_date": "3/15/2017 12:14:18 PM",
    "confidence": "high"
  },
  "HOUSE_OVERSIGHT_022267": {
    "date": "2018-07-21",
    "time": null,
    "source": "metadata",
    "raw_date": "07/21/2018",
    "confidence": "medium"
  },
  "HOUSE_OVERSIGHT_022272": {
    "date": "2014-03-13",
    "time": null,
    "source": "content_parsed",
    "raw_date": "Thu, Mar 13, 2014",
    "confidence": "low"
  },
  "HOUSE_OVERSIGHT_022275": {
    "date": "2018-08-23",
    "time": "16:01:11",
    "source": "email_header",
    "raw_date": "8/23/2018 4:01:11 PM",
    "confidence": "high"
  },
  "HOUSE_OVERSIGHT_022277": {
    "date": "2011-08-30",
    "time": null,
    "source": "content_parsed",
    "raw_date": "Tuesday, August 30, 2011",
    "confidence": "low"
  },
  "HOUSE_OVERSIGHT_022322": {
    "date": "2013-10-21",
    "time": null,
    "source": "content_parsed",
    "raw_date": "10/21/2013",
    "confidence": "low"
  },
  "HOUSE_OVERSIGHT_022325": {
    "date": "2013-12-20",
    "time": null,
    "source": "metadata",
    "raw_date": "12/20/2013",
    "confidence": "medium"
  },
  "HOUSE_OVERSIGHT_022330": {
    "date": "2013-12-20",
    "time": null,
    "source": "metadata",
    "raw_date": "12/20/2013",
    "confidence": "medium"
  },
  "HOUSE_OVERSIGHT_022344": {
    "date": "2014-01-13",
    "time": "20:14:00",
    "source": "email_header",
    "raw_date": "Monday, January 13 2014 08:14 PM",
    "confidence": "high"
  },
  "HOUSE_OVERSIGHT_022346": {
    "date": "2014-03-14",
    "time": null,
    "source": "content_parsed",
    "raw_date": "3/14/2014",
    "confidence": "low"
  },
  "HOUSE_OVERSIGHT_022348": {
    "date": "2012-03-01",
    "time": "03:54:12",
    "source": "email_header",
    "raw_date": "3/1/2012 3:54:12 AM",
    "confidence": "high"
  },
  "HOUSE_OVERSIGHT_022350": {
    "date": "2012-05-15",
    "time": null,
    "source": "metadata",
    "raw_date": "05/15/2012",
    "confidence": "medium"
  },
  "HOUSE_OVERSIGHT_022359": {
    "date": "2013-04-30",
    "time": "18:57:28",
    "source": "email_header",
    "raw_date": "4/30/2013 6:57:28 PM",
    "confidence": "high"
  },
  "HOUSE_OVERSIGHT_022361": {
    "date": "2013-04-29",
    "time": null,
    "source": "metadata",
    "raw_date": "04/29/2013",
    "confidence": "medium"
  },
  "HOUSE_OVERSIGHT_022367": {
    "date": null,
    "time": null,
    "source": "unknown",
    "raw_date": null,
    "confidence": "none"
  },
  "HOUSE_OVERSIGHT_022372": {
    "date": "2016-11-09",
    "time": null,
    "source": "metadata",
    "raw_date": "11/09/2016",
    "confidence": "medium"
  },
  "HOUSE_OVERSIGHT_022396": {
    "date": "2016-11-22",
    "time": null,
    "source": "content_parsed",
    "raw_date": "11/22/2016",
    "confidence": "low"
  },
  "HOUSE_OVERSIGHT_022397": {
    "date": "2017-03-22",
    "time": null,
    "source": "content_parsed",
    "raw_date": "3/22/2017",
    "confidence": "low"
  },
  "HOUSE_OVERSIGHT_022405": {
    "date": "2017-12-19",
    "time": null,
    "source": "metadata",
    "raw_date": "12/19/2017",
    "confidence": "medium"
  },
  "HOUSE_OVERSIGHT_022407": {
    "date": "2017-12-15",
    "time": null,
    "source": "metadata",
    "raw_date": "12/15/2017",
    "confidence": "medium"
  },
  "HOUSE_OVERSIGHT_022417": {
    "date": "2015-11-18",
    "time": null,
    "source": "content_parsed",
    "raw_date": "2015-11-18",
    "confidence": "low"
  },
  "HOUSE_OVERSIGHT_022443": {
    "date": "2016-01-21",
    "time": "14:28:39",
    "source": "email_header",
    "raw_date": "1/21/2016 2:28:39 PM",
    "confidence": "high"
  },
  "HOUSE_OVERSIGHT_022444": {
    "date": "2016-04-25",
    "time": "14:04:49",
    "source": "email_header",
    "raw_date": "4/25/2016 2:04:49 PM",
    "confidence": "high"
  },
  "HOUSE_OVERSIGHT_022445": {
    "date": null,
    "time": null,
    "source": "unknown",
    "raw_date": null,
    "confidence": "none"
  },
  "HOUSE_OVERSIGHT_022463": {
    "date": "2018-12-08",
    "time": null,
    "source": "content_parsed",
    "raw_date": "Saturday, December 8, 2018",
    "confidence": "low"
  },
  "HOUSE_OVERSIGHT_022464": {
    "date": "2019-06-19",
    "time": "19:57:01",
    "source": "email_header",
    "raw_date": "6/19/2019 7:57:01 PM",
    "confidence": "high"
  },
  "HOUSE_OVERSIGHT_022479": {
    "date": "2019-06-30",
    "time": "18:28:36",
    "source": "email_header",
    "raw_date": "6/30/2019 6:28:36 PM",
    "confidence": "high"
  },
  "HOUSE_OVERSIGHT_022494": {
    "date": "2012-11-09",
    "time": null,
    "source": "metadata",
    "raw_date": "11/09/2012",
    "confidence": "medium"
  },
  "HOUSE_OVERSIGHT_022624": {
    "date": "2014-12-31",
    "time": "23:43:48",
    "source": "email_header",
    "raw_date": "12/31/2014 11:43:48 PM",
    "confidence": "high"
  },
  "HOUSE_OVERSIGHT_022656": {
    "date": "2015-01-09",
    "time": "18:17:14",
    "source": "email_header",
    "raw_date": "1/9/2015 6:17:14 PM",
    "confidence": "high"
  },
  "HOUSE_OVERSIGHT_022658": {
    "date": "2015-01-09",
    "time": "18:24:30",
    "source": "email_header",
    "raw_date": "1/9/2015 6:24:30 PM",
    "confidence": "high"
  },
  "HOUSE_OVERSIGHT_022660": {
    "date": "2015-01-09",
    "time": "18:33:09",
    "source": "email_header",
    "raw_date": "1/9/2015 6:33:09 PM",
    "confidence": "high"
  },
  "HOUSE_OVERSIGHT_022661": {
    "date": "2015-01-09",
    "time": "18:57:01",
    "source": "email_header",
    "raw_date": "1/9/2015 6:57:01 PM",
    "confidence": "high"
  },
  "HOUSE_OVERSIGHT_022663": {
    "date": "2015-01-10",
    "time": "14:22:04",
    "source": "email_header",
    "raw_date": "1/10/2015 2:22:04 PM",
    "confidence": "high"
  },
  "HOUSE_OVERSIGHT_022665": {
    "date": "2015-01-10",
    "time": "16:43:39",
    "source": "email_header",
    "raw_date": "1/10/2015 4:43:39 PM",
    "confidence": "high"
  },
  "HOUSE_OVERSIGHT_022667": {
    "date": "2015-01-16",
    "time": null,
    "source": "content_parsed",
    "raw_date": "Friday, January 16, 2015",
    "confidence": "low"
  },
  "HOUSE_OVERSIGHT_022668": {
    "date": "2015-01-16",
    "time": null,
    "source": "content_parsed",
    "raw_date": "Friday, January 16, 2015",
    "confidence": "low"
  },
  "HOUSE_OVERSIGHT_022670": {
    "date": "2015-01-16",
    "time": null,
    "source": "content_parsed",
    "raw_date": "Friday, January 16, 2015",
    "confidence": "low"
  },
  "HOUSE_OVERSIGHT_022673": {
    "date": "2015-01-30",
    "time": null,
    "source": "content_parsed",
    "raw_date": "1/30/2015",
    "confidence": "low"
  },
  "HOUSE_OVERSIGHT_022684": {
    "date": "2015-01-30",
    "time": null,
    "source": "content_parsed",
    "raw_date": "Fri, Jan 30, 2015",
    "confidence": "low"
  },
  "HOUSE_OVERSIGHT_022695": {
    "date": "2015-01-31",
    "time": "02:46:14",
    "source": "email_header",
    "raw_date": "1/31/2015 2:46:14 AM",
    "confidence": "high"
  },
  "HOUSE_OVERSIGHT_022707": {
    "date": null,
    "time": null,
    "source": "unknown",
    "raw_date": null,
    "confidence": "none"
  },
  "HOUSE_OVERSIGHT_022727": {
    "date": null,
    "time": null,
    "source": "unknown",
    "raw_date": null,
    "confidence": "none"
  },
  "HOUSE_OVERSIGHT_022746": {
    "date": null,
    "time": null,
    "source": "unknown",
    "raw_date": null,
    "confidence": "none"
  },
  "HOUSE_OVERSIGHT_022766": {
    "date": "2015-04-22",
    "time": "19:03:52",
    "source": "email_header",
    "raw_date": "4/22/2015 7:03:52 PM",
    "confidence": "high"
  },
  "HOUSE_OVERSIGHT_022770": {
    "date": "2016-01-19",
    "time": null,
    "source": "content_parsed",
    "raw_date": "Tuesday, January 19, 2016",
    "confidence": "low"
  },
  "HOUSE_OVERSIGHT_022771": {
    "date": "2016-01-20",
    "time": null,
    "source": "content_parsed",
    "raw_date": "Wednesday, January 20, 2016",
    "confidence": "low"
  },
  "HOUSE_OVERSIGHT_022773": {
    "date": "2016-01-21",
    "time": null,
    "source": "content_parsed",
    "raw_date": "Thursday, January 21, 2016",
    "confidence": "low"
  },
  "HOUSE_OVERSIGHT_022776": {
    "date": "2016-01-22",
    "time": null,
    "source": "content_parsed",
    "raw_date": "Friday, January 22, 2016",
    "confidence": "low"
  },
  "HOUSE_OVERSIGHT_022780": {
    "date": null,
    "time": null,
    "source": "unknown",
    "raw_date": null,
    "confidence": "none"
  },
  "HOUSE_OVERSIGHT_022801": {
    "date": "2016-02-15",
    "time": null,
    "source": "content_parsed",
    "raw_date": "Monday, February 15, 2016",
    "confidence": "low"
  },
  "HOUSE_OVERSIGHT_022805": {
    "date": "2017-11-07",
    "time": null,
    "source": "content_parsed",
    "raw_date": "Tue, Nov 7, 2017",
    "confidence": "low"
  },
  "HOUSE_OVERSIGHT_022806": {
    "date": "2017-11-07",
    "time": "15:00:15",
    "source": "email_header",
    "raw_date": "11/7/2017 3:00:15 PM",
    "confidence": "high"
  },
  "HOUSE_OVERSIGHT_022808": {
    "date": "2017-11-08",
    "time": "13:48:26",
    "source": "email_header",
    "raw_date": "11/8/2017 1:48:26 PM",
    "confidence": "high"
  },
  "HOUSE_OVERSIGHT_022811": {
    "date": "2018-01-09",
    "time": "08:51:12",
    "source": "email_header",
    "raw_date": "Tue, 9 Jan 2018 08:51:12 -0500",
    "confidence": "high"
  },
  "HOUSE_OVERSIGHT_022815": {
    "date": "2018-04-06",
    "time": "15:49:11",
    "source": "email_header",
    "raw_date": "4/6/2018 3:49:11 PM",
    "confidence": "high"
  },
  "HOUSE_OVERSIGHT_022816": {
    "date": null,
    "time": null,
    "source": "unknown",
    "raw_date": null,
    "confidence": "none"
  },
  "HOUSE_OVERSIGHT_022817": {
    "date": "2018-08-13",
    "time": "19:30:44",
    "source": "email_header",
    "raw_date": "8/13/2018 7:30:44 PM",
    "confidence": "high"
  },
  "HOUSE_OVERSIGHT_022819": {
    "date": "2018-08-14",
    "time": "14:09:34",
    "source": "email_header",
    "raw_date": "8/14/2018 2:09:34 PM",
    "confidence": "high"
  },
  "HOUSE_OVERSIGHT_022822": {
    "date": "2018-08-17",
    "time": "14:48:49",
    "source": "email_header",
    "raw_date": "8/17/2018 2:48:49 PM",
    "confidence": "high"
  },
  "HOUSE_OVERSIGHT_022824": {
    "date": "2015-01-09",
    "time": null,
    "source": "content_parsed",
    "raw_date": "Friday, January 9, 2015",
    "confidence": "low"
  },
  "HOUSE_OVERSIGHT_022825": {
    "date": "2015-01-09",
    "time": "18:20:08",
    "source": "email_header",
    "raw_date": "1/9/2015 6:20:08 PM",
    "confidence": "high"
  },
  "HOUSE_OVERSIGHT_022827": {
    "date": "2015-01-10",
    "time": "14:57:45",
    "source": "email_header",
    "raw_date": "1/10/2015 2:57:45 PM",
    "confidence": "high"
  },
  "HOUSE_OVERSIGHT_022829": {
    "date": "2015-01-10",
    "time": "16:42:43",
    "source": "email_header",
    "raw_date": "1/10/2015 4:42:43 PM",
    "confidence": "high"
  },
  "HOUSE_OVERSIGHT_022831": {
    "date": "2015-01-10",
    "time": "17:58:11",
    "source": "email_header",
    "raw_date": "1/10/2015 5:58:11 PM",
    "confidence": "high"
  },
  "HOUSE_OVERSIGHT_022834": {
    "date": "2015-01-16",
    "time": null,
    "source": "content_parsed",
    "raw_date": "Friday, January 16, 2015",
    "confidence": "low"
  },
  "HOUSE_OVERSIGHT_022835": {
    "date": "2015-01-16",
    "time": "18:23:52",
    "source": "email_header",
    "raw_date": "1/16/2015 6:23:52 PM",
    "confidence": "high"
  },
  "HOUSE_OVERSIGHT_022837": {
    "date": "2015-01-16",
    "time": null,
    "source": "content_parsed",
    "raw_date": "Friday, January 16, 2015",
    "confidence": "low"
  },
  "HOUSE_OVERSIGHT_022839": {
    "date": "2015-01-16",
    "time": "19:52:31",
    "source": "email_header",
    "raw_date": "1/16/2015 7:52:31 PM",
    "confidence": "high"
  },
  "HOUSE_OVERSIGHT_022841": {
    "date": "2015-01-16",
    "time": "20:12:46",
    "source": "email_header",
    "raw_date": "1/16/2015 8:12:46 PM",
    "confidence": "high"
  },
  "HOUSE_OVERSIGHT_022844": {
    "date": null,
    "time": null,
    "source": "unknown",
    "raw_date": null,
    "confidence": "none"
  },
  "HOUSE_OVERSIGHT_022863": {
    "date": null,
    "time": null,
    "source": "unknown",
    "raw_date": null,
    "confidence": "none"
  },
  "HOUSE_OVERSIGHT_022894": {
    "date": null,
    "time": null,
    "source": "unknown",
    "raw_date": null,
    "confidence": "none"
  },
  "HOUSE_OVERSIGHT_022926": {
    "date": "2015-04-22",
    "time": "19:16:34",
    "source": "email_header",
    "raw_date": "4/22/2015 7:16:34 PM",
    "confidence": "high"
  },
  "HOUSE_OVERSIGHT_022931": {
    "date": "2015-04-22",
    "time": "19:34:00",
    "source": "email_header",
    "raw_date": "Wednesday, April 22 2015 07:34 PM",
    "confidence": "high"
  },
  "HOUSE_OVERSIGHT_022936": {
    "date": "2016-01-20",
    "time": null,
    "source": "content_parsed",
    "raw_date": "Wednesday, January 20, 2016",
    "confidence": "low"
  },
  "HOUSE_OVERSIGHT_022938": {
    "date": "2016-01-21",
    "time": null,
    "source": "content_parsed",
    "raw_date": "Thursday, January 21, 2016",
    "confidence": "low"
  },
  "HOUSE_OVERSIGHT_022941": {
    "date": "2017-05-24",
    "time": "23:04:43",
    "source": "email_header",
    "raw_date": "5/24/2017 11:04:43 PM",
    "confidence": "high"
  },
  "HOUSE_OVERSIGHT_022943": {
    "date": "2017-11-07",
    "time": "10:35:08",
    "source": "email_header",
    "raw_date": "11/7/2017 10:35:08 AM",
    "confidence": "high"
  },
  "HOUSE_OVERSIGHT_022944": {
    "date": "2017-11-07",
    "time": "10:42:23",
    "source": "email_header",
    "raw_date": "11/7/2017 10:42:23 AM",
    "confidence": "high"
  },
  "HOUSE_OVERSIGHT_022945": {
    "date": "2017-11-07",
    "time": "14:55:20",
    "source": "email_header",
    "raw_date": "11/7/2017 2:55:20 PM",
    "confidence": "high"
  },
  "HOUSE_OVERSIGHT_022947": {
    "date": "2017-11-07",
    "time": "15:10:06",
    "source": "email_header",
    "raw_date": "11/7/2017 3:10:06 PM",
    "confidence": "high"
  },
  "HOUSE_OVERSIGHT_022949": {
    "date": "2017-11-08",
    "time": null,
    "source": "content_parsed",
    "raw_date": "Wed, Nov 8, 2017",
    "confidence": "low"
  },
  "HOUSE_OVERSIGHT_022952": {
    "date": null,
    "time": null,
    "source": "unknown",
    "raw_date": null,
    "confidence": "none"
  },
  "HOUSE_OVERSIGHT_022970": {
    "date": null,
    "time": null,
    "source": "unknown",
    "raw_date": null,
    "confidence": "none"
  },
  "HOUSE_OVERSIGHT_022977": {
    "date": "2017-05-04",
    "time": null,
    "source": "content_parsed",
    "raw_date": "2017-05-04",
    "confidence": "low"
  },
  "HOUSE_OVERSIGHT_022986": {
    "date": null,
    "time": null,
    "source": "unknown",
    "raw_date": null,
    "confidence": "none"
  },
  "HOUSE_OVERSIGHT_022987": {
    "date": "2017-05-12",
    "time": null,
    "source": "content_parsed",
    "raw_date": "Friday, May 12, 2017",
    "confidence": "low"
  },
  "HOUSE_OVERSIGHT_022988": {
    "date": null,
    "time": null,
    "source": "unknown",
    "raw_date": null,
    "confidence": "none"
  },
  "HOUSE_OVERSIGHT_022989": {
    "date": "2017-05-10",
    "time": null,
    "source": "content_parsed",
    "raw_date": "Wednesday, May 10, 2017",
    "confidence": "low"
  },
  "HOUSE_OVERSIGHT_022990": {
    "date": "2017-05-12",
    "time": null,
    "source": "content_parsed",
    "raw_date": "Friday, May 12, 2017",
    "confidence": "low"
  },
  "HOUSE_OVERSIGHT_022994": {
    "date": "2016-05-18",
    "time": null,
    "source": "content_parsed",
    "raw_date": "2016-05-18",
    "confidence": "low"
  },
  "HOUSE_OVERSIGHT_022998": {
    "date": "2018-11-28",
    "time": "23:50:16",
    "source": "email_header",
    "raw_date": "11/28/2018 11:50:16 PM",
    "confidence": "high"
  },
  "HOUSE_OVERSIGHT_023000": {
    "date": null,
    "time": null,
    "source": "unknown",
    "raw_date": null,
    "confidence": "none"
  },
  "HOUSE_OVERSIGHT_023001": {
    "date": "2019-05-10",
    "time": "23:06:29",
    "source": "email_header",
    "raw_date": "5/10/2019 11:06:29 PM",
    "confidence": "high"
  },
  "HOUSE_OVERSIGHT_023018": {
    "date": "2013-10-18",
    "time": "22:38:16",
    "source": "email_header",
    "raw_date": "10/18/2013 10:38:16 PM",
    "confidence": "high"
  },
  "HOUSE_OVERSIGHT_023020": {
    "date": "2013-10-18",
    "time": "23:24:22",
    "source": "email_header",
    "raw_date": "10/18/2013 11:24:22 PM",
    "confidence": "high"
  },
  "HOUSE_OVERSIGHT_023022": {
    "date": "2013-10-18",
    "time": "23:25:53",
    "source": "email_header",
    "raw_date": "10/18/2013 11:25:53 PM",
    "confidence": "high"
  },
  "HOUSE_OVERSIGHT_023024": {
    "date": "2013-10-19",
    "time": "00:10:27",
    "source": "email_header",
    "raw_date": "10/19/2013 12:10:27 AM",
    "confidence": "high"
  },
  "HOUSE_OVERSIGHT_023026": {
    "date": "2013-10-19",
    "time": "00:27:41",
    "source": "email_header",
    "raw_date": "10/19/2013 12:27:41 AM",
    "confidence": "high"
  },
  "HOUSE_OVERSIGHT_023028": {
    "date": "2013-10-19",
    "time": "01:36:44",
    "source": "email_header",
    "raw_date": "10/19/2013 1:36:44 AM",
    "confidence": "high"
  },
  "HOUSE_OVERSIGHT_023030": {
    "date": "2011-03-04",
    "time": "16:28:00",
    "source": "email_header",
    "raw_date": "Friday, March 4 2011 04:28 PM",
    "confidence": "high"
  },
  "HOUSE_OVERSIGHT_023032": {
    "date": "2011-03-04",
    "time": "16:40:00",
    "source": "email_header",
    "raw_date": "Friday, March 4 2011 04:40 PM",
    "confidence": "high"
  },
  "HOUSE_OVERSIGHT_023035": {
    "date": "2011-03-04",
    "time": "16:48:00",
    "source": "email_header",
    "raw_date": "Friday, March 4 2011 04:48 PM",
    "confidence": "high"
  },
  "HOUSE_OVERSIGHT_023038": {
    "date": "2011-03-04",
    "time": "16:56:00",
    "source": "email_header",
    "raw_date": "Friday, March 4 2011 04:56 PM",
    "confidence": "high"
  },
  "HOUSE_OVERSIGHT_023041": {
    "date": "2011-03-04",
    "time": "17:20:00",
    "source": "email_header",
    "raw_date": "Friday, March 4 2011 05:20 PM",
    "confidence": "high"
  },
  "HOUSE_OVERSIGHT_023044": {
    "date": "2019-02-01",
    "time": "10:18:49",
    "source": "email_header",
    "raw_date": "2/1/2019 10:18:49 AM",
    "confidence": "high"
  },
  "HOUSE_OVERSIGHT_023046": {
    "date": "2019-02-27",
    "time": null,
    "source": "content_parsed",
    "raw_date": "WEDNESDAY, FEBRUARY 27, 2019",
    "confidence": "low"
  },
  "HOUSE_OVERSIGHT_023047": {
    "date": "2019-02-27",
    "time": null,
    "source": "content_parsed",
    "raw_date": "Wednesday, February 27, 2019",
    "confidence": "low"
  },
  "HOUSE_OVERSIGHT_023048": {
    "date": null,
    "time": null,
    "source": "unknown",
    "raw_date": null,
    "confidence": "none"
  },
  "HOUSE_OVERSIGHT_023049": {
    "date": "2019-02-27",
    "time": null,
    "source": "content_parsed",
    "raw_date": "Wednesday, February 27, 2019",
    "confidence": "low"
  },
  "HOUSE_OVERSIGHT_023050": {
    "date": null,
    "time": null,
    "source": "unknown",
    "raw_date": null,
    "confidence": "none"
  },
  "HOUSE_OVERSIGHT_023051": {
    "date": "2019-04-17",
    "time": "11:43:00",
    "source": "email_header",
    "raw_date": "Wednesday, April 17 2019 11:43 AM",
    "confidence": "high"
  },
  "HOUSE_OVERSIGHT_023054": {
    "date": "2019-02-01",
    "time": "10:18:27",
    "source": "email_header",
    "raw_date": "2/1/2019 10:18:27 AM",
    "confidence": "high"
  },
  "HOUSE_OVERSIGHT_023056": {
    "date": "2011-03-04",
    "time": "16:45:00",
    "source": "email_header",
    "raw_date": "Friday, March 4 2011 04:45 PM",
    "confidence": "high"
  },
  "HOUSE_OVERSIGHT_023059": {
    "date": "2011-03-04",
    "time": "17:17:00",
    "source": "email_header",
    "raw_date": "Friday, March 4 2011 05:17 PM",
    "confidence": "high"
  },
  "HOUSE_OVERSIGHT_023062": {
    "date": "2011-03-04",
    "time": "17:21:00",
    "source": "email_header",
    "raw_date": "Friday, March 4 2011 05:21 PM",
    "confidence": "high"
  },
  "HOUSE_OVERSIGHT_023065": {
    "date": "2011-07-01",
    "time": "22:38:00",
    "source": "email_header",
    "raw_date": "Friday, July 1 2011 10:38 PM",
    "confidence": "high"
  },
  "HOUSE_OVERSIGHT_023067": {
    "date": "2013-10-19",
    "time": "00:30:10",
    "source": "email_header",
    "raw_date": "10/19/2013 12:30:10 AM",
    "confidence": "high"
  },
  "HOUSE_OVERSIGHT_023069": {
    "date": "2017-01-31",
    "time": null,
    "source": "metadata",
    "raw_date": "01/31/2017",
    "confidence": "medium"
  },
  "HOUSE_OVERSIGHT_023096": {
    "date": "2012-11-25",
    "time": null,
    "source": "metadata",
    "raw_date": "11/25/2012",
    "confidence": "medium"
  },
  "HOUSE_OVERSIGHT_023097": {
    "date": "2015-05-20",
    "time": null,
    "source": "metadata",
    "raw_date": "05/20/2015",
    "confidence": "medium"
  },
  "HOUSE_OVERSIGHT_023101": {
    "date": "2016-10-16",
    "time": "22:34:07",
    "source": "email_header",
    "raw_date": "10/16/2016 10:34:07 PM",
    "confidence": "high"
  },
  "HOUSE_OVERSIGHT_023102": {
    "date": "2015-09-08",
    "time": null,
    "source": "content_parsed",
    "raw_date": "9/8/2015",
    "confidence": "low"
  },
  "HOUSE_OVERSIGHT_023107": {
    "date": "2019-07-16",
    "time": "20:00:39",
    "source": "email_header",
    "raw_date": "7/16/2019 8:00:39 PM",
    "confidence": "high"
  },
  "HOUSE_OVERSIGHT_023120": {
    "date": "2018-04-21",
    "time": null,
    "source": "metadata",
    "raw_date": "04/21/2018",
    "confidence": "medium"
  },
  "HOUSE_OVERSIGHT_023121": {
    "date": "2018-04-21",
    "time": null,
    "source": "metadata",
    "raw_date": "04/21/2018",
    "confidence": "medium"
  },
  "HOUSE_OVERSIGHT_023123": {
    "date": "2018-04-21",
    "time": null,
    "source": "metadata",
    "raw_date": "04/21/2018",
    "confidence": "medium"
  },
  "HOUSE_OVERSIGHT_023125": {
    "date": "2019-02-16",
    "time": null,
    "source": "content_parsed",
    "raw_date": "Saturday, February 16, 2019",
    "confidence": "low"
  },
  "HOUSE_OVERSIGHT_023126": {
    "date": "2019-05-10",
    "time": "23:01:49",
    "source": "email_header",
    "raw_date": "5/10/2019 11:01:49 PM",
    "confidence": "high"
  },
  "HOUSE_OVERSIGHT_023133": {
    "date": "2014-12-09",
    "time": null,
    "source": "content_parsed",
    "raw_date": "12/9/2014",
    "confidence": "low"
  },
  "HOUSE_OVERSIGHT_023198": {
    "date": "2015-12-07",
    "time": "19:23:18",
    "source": "email_header",
    "raw_date": "12/7/2015 7:23:18 PM",
    "confidence": "high"
  },
  "HOUSE_OVERSIGHT_023201": {
    "date": "2017-07-29",
    "time": "22:28:10",
    "source": "email_header",
    "raw_date": "7/29/2017 10:28:10 PM",
    "confidence": "high"
  },
  "HOUSE_OVERSIGHT_023202": {
    "date": "2015-12-07",
    "time": "19:35:13",
    "source": "email_header",
    "raw_date": "12/7/2015 7:35:13 PM",
    "confidence": "high"
  },
  "HOUSE_OVERSIGHT_023205": {
    "date": "2015-12-07",
    "time": "19:36:12",
    "source": "email_header",
    "raw_date": "12/7/2015 7:36:12 PM",
    "confidence": "high"
  },
  "HOUSE_OVERSIGHT_023208": {
    "date": "2015-10-26",
    "time": null,
    "source": "content_parsed",
    "raw_date": "Mon, Oct 26, 2015",
    "confidence": "low"
  },
  "HOUSE_OVERSIGHT_023287": {
    "date": "2017-09-15",
    "time": null,
    "source": "metadata",
    "raw_date": "09/15/2017",
    "confidence": "medium"
  },
  "HOUSE_OVERSIGHT_023291": {
    "date": "2018-04-08",
    "time": "16:20:18",
    "source": "email_header",
    "raw_date": "4/8/2018 4:20:18 PM",
    "confidence": "high"
  },
  "HOUSE_OVERSIGHT_023361": {
    "date": null,
    "time": null,
    "source": "unknown",
    "raw_date": null,
    "confidence": "none"
  },
  "HOUSE_OVERSIGHT_023416": {
    "date": "2014-09-13",
    "time": null,
    "source": "metadata",
    "raw_date": "09/13/2014",
    "confidence": "medium"
  },
  "HOUSE_OVERSIGHT_023418": {
    "date": "2014-09-20",
    "time": "02:37:36",
    "source": "email_header",
    "raw_date": "9/20/2014 2:37:36 AM",
    "confidence": "high"
  },
  "HOUSE_OVERSIGHT_023426": {
    "date": "2014-09-23",
    "time": "22:17:55",
    "source": "email_header",
    "raw_date": "9/23/2014 10:17:55 PM",
    "confidence": "high"
  },
  "HOUSE_OVERSIGHT_023427": {
    "date": "2014-09-24",
    "time": "00:06:54",
    "source": "email_header",
    "raw_date": "9/24/2014 12:06:54 AM",
    "confidence": "high"
  },
  "HOUSE_OVERSIGHT_023429": {
    "date": "2014-09-24",
    "time": "00:25:39",
    "source": "email_header",
    "raw_date": "9/24/2014 12:25:39 AM",
    "confidence": "high"
  },
  "HOUSE_OVERSIGHT_023431": {
    "date": "2014-09-24",
    "time": "00:48:31",
    "source": "email_header",
    "raw_date": "9/24/2014 12:48:31 AM",
    "confidence": "high"
  },
  "HOUSE_OVERSIGHT_023433": {
    "date": "2014-09-25",
    "time": "13:47:51",
    "source": "email_header",
    "raw_date": "9/25/2014 1:47:51 PM",
    "confidence": "high"
  },
  "HOUSE_OVERSIGHT_023435": {
    "date": null,
    "time": null,
    "source": "unknown",
    "raw_date": null,
    "confidence": "none"
  },
  "HOUSE_OVERSIGHT_023438": {
    "date": "2018-03-20",
    "time": null,
    "source": "content_parsed",
    "raw_date": "Tuesday, March 20, 2018",
    "confidence": "low"
  },
  "HOUSE_OVERSIGHT_023440": {
    "date": "2014-09-20",
    "time": "05:29:55",
    "source": "email_header",
    "raw_date": "9/20/2014 5:29:55 AM",
    "confidence": "high"
  },
  "HOUSE_OVERSIGHT_023448": {
    "date": "2014-09-24",
    "time": "00:07:26",
    "source": "email_header",
    "raw_date": "9/24/2014 12:07:26 AM",
    "confidence": "high"
  },
  "HOUSE_OVERSIGHT_023450": {
    "date": "2014-09-23",
    "time": null,
    "source": "metadata",
    "raw_date": "09/23/2014",
    "confidence": "medium"
  },
  "HOUSE_OVERSIGHT_023452": {
    "date": "2014-09-23",
    "time": null,
    "source": "metadata",
    "raw_date": "09/23/2014",
    "confidence": "medium"
  },
  "HOUSE_OVERSIGHT_023454": {
    "date": "2011-12-15",
    "time": "02:57:00",
    "source": "email_header",
    "raw_date": "Thursday, December 15 2011 02:57 AM",
    "confidence": "high"
  },
  "HOUSE_OVERSIGHT_023458": {
    "date": "2011-04-16",
    "time": null,
    "source": "metadata",
    "raw_date": "04/16/2011",
    "confidence": "medium"
  },
  "HOUSE_OVERSIGHT_023487": {
    "date": "2011-04-18",
    "time": null,
    "source": "metadata",
    "raw_date": "04/18/2011",
    "confidence": "medium"
  },
  "HOUSE_OVERSIGHT_023517": {
    "date": "2011-05-25",
    "time": null,
    "source": "metadata",
    "raw_date": "05/25/2011",
    "confidence": "medium"
  },
  "HOUSE_OVERSIGHT_023545": {
    "date": "2013-02-28",
    "time": null,
    "source": "content_parsed",
    "raw_date": "2/28/2013",
    "confidence": "low"
  },
  "HOUSE_OVERSIGHT_023548": {
    "date": "2013-03-07",
    "time": "17:32:30",
    "source": "email_header",
    "raw_date": "3/7/2013 5:32:30 PM",
    "confidence": "high"
  },
  "HOUSE_OVERSIGHT_023550": {
    "date": "2015-05-09",
    "time": "19:17:32",
    "source": "email_header",
    "raw_date": "5/9/2015 7:17:32 PM",
    "confidence": "high"
  },
  "HOUSE_OVERSIGHT_023564": {
    "date": "2017-12-27",
    "time": "17:02:00",
    "source": "email_header",
    "raw_date": "Wednesday, December 27 2017 05:02 PM",
    "confidence": "high"
  },
  "HOUSE_OVERSIGHT_023567": {
    "date": "2016-07-22",
    "time": null,
    "source": "content_parsed",
    "raw_date": "7/22/2016",
    "confidence": "low"
  },
  "HOUSE_OVERSIGHT_023570": {
    "date": "2017-05-14",
    "time": null,
    "source": "metadata",
    "raw_date": "05/14/2017",
    "confidence": "medium"
  },
  "HOUSE_OVERSIGHT_023571": {
    "date": "2016-09-28",
    "time": null,
    "source": "content_parsed",
    "raw_date": "Wednesday, September 28, 2016",
    "confidence": "low"
  },
  "HOUSE_OVERSIGHT_023572": {
    "date": "2017-05-13",
    "time": null,
    "source": "content_parsed",
    "raw_date": "2017-05-13",
    "confidence": "low"
  },
  "HOUSE_OVERSIGHT_023575": {
    "date": "2017-06-06",
    "time": null,
    "source": "metadata",
    "raw_date": "06/06/2017",
    "confidence": "medium"
  },
  "HOUSE_OVERSIGHT_023612": {
    "date": "2014-01-06",
    "time": "02:40:00",
    "source": "email_header",
    "raw_date": "Monday, January 6 2014 02:40 AM",
    "confidence": "high"
  },
  "HOUSE_OVERSIGHT_023616": {
    "date": "2014-01-06",
    "time": "12:29:00",
    "source": "email_header",
    "raw_date": "Monday, January 6 2014 12:29 PM",
    "confidence": "high"
  },
  "HOUSE_OVERSIGHT_023621": {
    "date": "2014-01-06",
    "time": "12:40:00",
    "source": "email_header",
    "raw_date": "Monday, January 6 2014 12:40 PM",
    "confidence": "high"
  },
  "HOUSE_OVERSIGHT_023627": {
    "date": "2016-10-08",
    "time": "20:05:08",
    "source": "email_header",
    "raw_date": "10/8/2016 8:05:08 PM",
    "confidence": "high"
  },
  "HOUSE_OVERSIGHT_023635": {
    "date": "2016-11-14",
    "time": "15:32:12",
    "source": "email_header",
    "raw_date": "11/14/2016 3:32:12 PM",
    "confidence": "high"
  },
  "HOUSE_OVERSIGHT_023638": {
    "date": "2017-03-03",
    "time": null,
    "source": "metadata",
    "raw_date": "03/03/2017",
    "confidence": "medium"
  },
  "HOUSE_OVERSIGHT_023644": {
    "date": "2017-05-03",
    "time": null,
    "source": "metadata",
    "raw_date": "05/03/2017",
    "confidence": "medium"
  },
  "HOUSE_OVERSIGHT_023661": {
    "date": "2017-09-13",
    "time": null,
    "source": "content_parsed",
    "raw_date": "Wed, Sep 13, 2017",
    "confidence": "low"
  },
  "HOUSE_OVERSIGHT_023666": {
    "date": "2018-08-27",
    "time": null,
    "source": "content_parsed",
    "raw_date": "Kuhn, August 27, 2018",
    "confidence": "low"
  },
  "HOUSE_OVERSIGHT_023707": {
    "date": "2018-12-03",
    "time": null,
    "source": "content_parsed",
    "raw_date": "Kuhn, December 3, 2018",
    "confidence": "low"
  },
  "HOUSE_OVERSIGHT_023717": {
    "date": "2016-11-14",
    "time": "15:34:18",
    "source": "email_header",
    "raw_date": "11/14/2016 3:34:18 PM",
    "confidence": "high"
  },
  "HOUSE_OVERSIGHT_023720": {
    "date": null,
    "time": null,
    "source": "unknown",
    "raw_date": null,
    "confidence": "none"
  },
  "HOUSE_OVERSIGHT_023731": {
    "date": "2011-06-14",
    "time": null,
    "source": "metadata",
    "raw_date": "06/14/2011",
    "confidence": "medium"
  },
  "HOUSE_OVERSIGHT_023971": {
    "date": "2011-07-27",
    "time": "14:09:40",
    "source": "email_header",
    "raw_date": "7/27/2011 2:09:40 PM",
    "confidence": "high"
  },
  "HOUSE_OVERSIGHT_024003": {
    "date": "2014-04-21",
    "time": null,
    "source": "metadata",
    "raw_date": "04/21/2014",
    "confidence": "medium"
  },
  "HOUSE_OVERSIGHT_024117": {
    "date": "2014-05-14",
    "time": null,
    "source": "metadata",
    "raw_date": "05/14/2014",
    "confidence": "medium"
  },
  "HOUSE_OVERSIGHT_024132": {
    "date": "2012-03-15",
    "time": null,
    "source": "metadata",
    "raw_date": "03/15/2012",
    "confidence": "medium"
  },
  "HOUSE_OVERSIGHT_024135": {
    "date": "2012-06-29",
    "time": null,
    "source": "metadata",
    "raw_date": "06/29/2012",
    "confidence": "medium"
  },
  "HOUSE_OVERSIGHT_024179": {
    "date": "2012-09-19",
    "time": null,
    "source": "metadata",
    "raw_date": "09/19/2012",
    "confidence": "medium"
  },
  "HOUSE_OVERSIGHT_024185": {
    "date": "2012-06-19",
    "time": null,
    "source": "metadata",
    "raw_date": "06/19/2012",
    "confidence": "medium"
  },
  "HOUSE_OVERSIGHT_024194": {
    "date": "2012-10-22",
    "time": null,
    "source": "metadata",
    "raw_date": "10/22/2012",
    "confidence": "medium"
  },
  "HOUSE_OVERSIGHT_024202": {
    "date": "2013-03-12",
    "time": null,
    "source": "metadata",
    "raw_date": "03/12/2013",
    "confidence": "medium"
  },
  "HOUSE_OVERSIGHT_024229": {
    "date": null,
    "time": null,
    "source": "unknown",
    "raw_date": null,
    "confidence": "none"
  },
  "HOUSE_OVERSIGHT_024251": {
    "date": "2015-07-22",
    "time": "17:29:11",
    "source": "email_header",
    "raw_date": "7/22/2015 5:29:11 PM",
    "confidence": "high"
  },
  "HOUSE_OVERSIGHT_024256": {
    "date": null,
    "time": null,
    "source": "unknown",
    "raw_date": null,
    "confidence": "none"
  },
  "HOUSE_OVERSIGHT_024270": {
    "date": "2017-06-24",
    "time": null,
    "source": "content_parsed",
    "raw_date": "Saturday, June 24, 2017",
    "confidence": "low"
  },
  "HOUSE_OVERSIGHT_024271": {
    "date": null,
    "time": null,
    "source": "unknown",
    "raw_date": null,
    "confidence": "none"
  },
  "HOUSE_OVERSIGHT_024294": {
    "date": "2016-07-11",
    "time": null,
    "source": "metadata",
    "raw_date": "07/11/2016",
    "confidence": "medium"
  },
  "HOUSE_OVERSIGHT_024295": {
    "date": "2019-07-07",
    "time": "19:03:04",
    "source": "email_header",
    "raw_date": "7/7/2019 7:03:04 PM",
    "confidence": "high"
  },
  "HOUSE_OVERSIGHT_024300": {
    "date": "2018-07-08",
    "time": "19:24:05",
    "source": "email_header",
    "raw_date": "7/8/2018 7:24:05 PM",
    "confidence": "high"
  },
  "HOUSE_OVERSIGHT_024302": {
    "date": "2019-04-23",
    "time": null,
    "source": "content_parsed",
    "raw_date": "Tuesday, April 23, 2019",
    "confidence": "low"
  },
  "HOUSE_OVERSIGHT_024374": {
    "date": "2019-01-21",
    "time": null,
    "source": "metadata",
    "raw_date": "01/21/2019",
    "confidence": "medium"
  },
  "HOUSE_OVERSIGHT_024384": {
    "date": "2013-02-08",
    "time": "19:40:43",
    "source": "email_header",
    "raw_date": "2/8/2013 7:40:43 PM",
    "confidence": "high"
  },
  "HOUSE_OVERSIGHT_024395": {
    "date": "2013-02-08",
    "time": "20:10:04",
    "source": "email_header",
    "raw_date": "2/8/2013 8:10:04 PM",
    "confidence": "high"
  },
  "HOUSE_OVERSIGHT_024407": {
    "date": "2013-02-08",
    "time": "20:48:50",
    "source": "email_header",
    "raw_date": "2/8/2013 8:48:50 PM",
    "confidence": "high"
  },
  "HOUSE_OVERSIGHT_024419": {
    "date": "2013-02-08",
    "time": "21:02:08",
    "source": "email_header",
    "raw_date": "2/8/2013 9:02:08 PM",
    "confidence": "high"
  },
  "HOUSE_OVERSIGHT_024432": {
    "date": "2013-03-01",
    "time": null,
    "source": "metadata",
    "raw_date": "03/01/2013",
    "confidence": "medium"
  },
  "HOUSE_OVERSIGHT_024592": {
    "date": "2011-08-25",
    "time": null,
    "source": "metadata",
    "raw_date": "08/25/2011",
    "confidence": "medium"
  },
  "HOUSE_OVERSIGHT_024624": {
    "date": "2019-05-15",
    "time": "10:21:20",
    "source": "email_header",
    "raw_date": "5/15/2019 10:21:20 AM",
    "confidence": "high"
  },
  "HOUSE_OVERSIGHT_024631": {
    "date": "2018-02-16",
    "time": null,
    "source": "metadata",
    "raw_date": "02/16/2018",
    "confidence": "medium"
  },
  "HOUSE_OVERSIGHT_024817": {
    "date": "2019-02-26",
    "time": null,
    "source": "metadata",
    "raw_date": "02/26/2019",
    "confidence": "medium"
  },
  "HOUSE_OVERSIGHT_024923": {
    "date": "2019-05-15",
    "time": "00:17:32",
    "source": "email_header",
    "raw_date": "5/15/2019 12:17:32 AM",
    "confidence": "high"
  },
  "HOUSE_OVERSIGHT_024930": {
    "date": "2009-04-18",
    "time": "19:20:00",
    "source": "email_header",
    "raw_date": "Saturday, April 18 2009 07:20 PM",
    "confidence": "high"
  },
  "HOUSE_OVERSIGHT_024958": {
    "date": "2011-05-08",
    "time": null,
    "source": "metadata",
    "raw_date": "05/08/2011",
    "confidence": "medium"
  },
  "HOUSE_OVERSIGHT_024997": {
    "date": "2011-09-08",
    "time": null,
    "source": "metadata",
    "raw_date": "09/08/2011",
    "confidence": "medium"
  },
  "HOUSE_OVERSIGHT_025028": {
    "date": "2013-02-08",
    "time": "21:05:33",
    "source": "email_header",
    "raw_date": "2/8/2013 9:05:33 PM",
    "confidence": "high"
  },
  "HOUSE_OVERSIGHT_025041": {
    "date": "2013-02-15",
    "time": null,
    "source": "content_parsed",
    "raw_date": "2/15/2013",
    "confidence": "low"
  },
  "HOUSE_OVERSIGHT_025094": {
    "date": null,
    "time": null,
    "source": "unknown",
    "raw_date": null,
    "confidence": "none"
  },
  "HOUSE_OVERSIGHT_025100": {
    "date": "2016-10-21",
    "time": "19:48:57",
    "source": "email_header",
    "raw_date": "10/21/2016 7:48:57 PM",
    "confidence": "high"
  },
  "HOUSE_OVERSIGHT_025101": {
    "date": "2016-11-28",
    "time": "18:47:56",
    "source": "email_header",
    "raw_date": "11/28/2016 6:47:56 PM",
    "confidence": "high"
  },
  "HOUSE_OVERSIGHT_025104": {
    "date": "2017-03-18",
    "time": null,
    "source": "content_parsed",
    "raw_date": "Saturday, March 18, 2017",
    "confidence": "low"
  },
  "HOUSE_OVERSIGHT_025105": {
    "date": "2017-04-08",
    "time": "06:28:05",
    "source": "email_header",
    "raw_date": "4/8/2017 6:28:05 AM",
    "confidence": "high"
  },
  "HOUSE_OVERSIGHT_025110": {
    "date": "2017-04-08",
    "time": "17:56:40",
    "source": "email_header",
    "raw_date": "4/8/2017 5:56:40 PM",
    "confidence": "high"
  },
  "HOUSE_OVERSIGHT_025115": {
    "date": "2017-05-13",
    "time": null,
    "source": "metadata",
    "raw_date": "05/13/2017",
    "confidence": "medium"
  },
  "HOUSE_OVERSIGHT_025116": {
    "date": "2017-05-28",
    "time": null,
    "source": "content_parsed",
    "raw_date": "Sunday, May 28, 2017",
    "confidence": "low"
  },
  "HOUSE_OVERSIGHT_025118": {
    "date": "2017-05-29",
    "time": "00:49:27",
    "source": "email_header",
    "raw_date": "5/29/2017 12:49:27 AM",
    "confidence": "high"
  },
  "HOUSE_OVERSIGHT_025121": {
    "date": "2017-06-02",
    "time": "03:08:29",
    "source": "email_header",
    "raw_date": "6/2/2017 3:08:29 AM",
    "confidence": "high"
  },
  "HOUSE_OVERSIGHT_025124": {
    "date": "2017-10-27",
    "time": "15:10:13",
    "source": "email_header",
    "raw_date": "10/27/2017 3:10:13 PM",
    "confidence": "high"
  },
  "HOUSE_OVERSIGHT_025128": {
    "date": "2017-10-27",
    "time": "15:46:57",
    "source": "email_header",
    "raw_date": "10/27/2017 3:46:57 PM",
    "confidence": "high"
  },
  "HOUSE_OVERSIGHT_025133": {
    "date": "2017-10-27",
    "time": "15:59:04",
    "source": "email_header",
    "raw_date": "10/27/2017 3:59:04 PM",
    "confidence": "high"
  },
  "HOUSE_OVERSIGHT_025139": {
    "date": "2018-06-24",
    "time": "18:11:37",
    "source": "email_header",
    "raw_date": "6/24/2018 6:11:37 PM",
    "confidence": "high"
  },
  "HOUSE_OVERSIGHT_025140": {
    "date": "2018-06-24",
    "time": null,
    "source": "content_parsed",
    "raw_date": "Sun, Jun 24, 2018",
    "confidence": "low"
  },
  "HOUSE_OVERSIGHT_025143": {
    "date": "2018-05-31",
    "time": null,
    "source": "metadata",
    "raw_date": "05/31/2018",
    "confidence": "medium"
  },
  "HOUSE_OVERSIGHT_025147": {
    "date": null,
    "time": null,
    "source": "unknown",
    "raw_date": null,
    "confidence": "none"
  },
  "HOUSE_OVERSIGHT_025163": {
    "date": "2016-11-28",
    "time": "18:47:15",
    "source": "email_header",
    "raw_date": "11/28/2016 6:47:15 PM",
    "confidence": "high"
  },
  "HOUSE_OVERSIGHT_025166": {
    "date": "2016-11-28",
    "time": "18:49:51",
    "source": "email_header",
    "raw_date": "11/28/2016 6:49:51 PM",
    "confidence": "high"
  },
  "HOUSE_OVERSIGHT_025169": {
    "date": "2017-01-20",
    "time": "12:10:12",
    "source": "email_header",
    "raw_date": "1/20/2017 12:10:12 PM",
    "confidence": "high"
  },
  "HOUSE_OVERSIGHT_025172": {
    "date": "2017-01-20",
    "time": "12:14:31",
    "source": "email_header",
    "raw_date": "1/20/2017 12:14:31 PM",
    "confidence": "high"
  },
  "HOUSE_OVERSIGHT_025176": {
    "date": "2017-01-20",
    "time": "12:32:18",
    "source": "email_header",
    "raw_date": "1/20/2017 12:32:18 PM",
    "confidence": "high"
  },
  "HOUSE_OVERSIGHT_025180": {
    "date": "2017-01-20",
    "time": "13:03:10",
    "source": "email_header",
    "raw_date": "1/20/2017 1:03:10 PM",
    "confidence": "high"
  },
  "HOUSE_OVERSIGHT_025185": {
    "date": "2017-01-20",
    "time": "13:04:00",
    "source": "email_header",
    "raw_date": "1/20/2017 1:04:00 PM",
    "confidence": "high"
  },
  "HOUSE_OVERSIGHT_025190": {
    "date": "2017-04-08",
    "time": "09:46:30",
    "source": "email_header",
    "raw_date": "4/8/2017 9:46:30 AM",
    "confidence": "high"
  },
  "HOUSE_OVERSIGHT_025195": {
    "date": "2017-05-28",
    "time": "23:43:17",
    "source": "email_header",
    "raw_date": "5/28/2017 11:43:17 PM",
    "confidence": "high"
  },
  "HOUSE_OVERSIGHT_025197": {
    "date": "2017-05-28",
    "time": "23:44:32",
    "source": "email_header",
    "raw_date": "5/28/2017 11:44:32 PM",
    "confidence": "high"
  },
  "HOUSE_OVERSIGHT_025199": {
    "date": "2018-03-02",
    "time": "12:47:41",
    "source": "email_header",
    "raw_date": "3/2/2018 12:47:41 PM",
    "confidence": "high"
  },
  "HOUSE_OVERSIGHT_025200": {
    "date": "2018-05-20",
    "time": "20:02:59",
    "source": "email_header",
    "raw_date": "5/20/2018 8:02:59 PM",
    "confidence": "high"
  },
  "HOUSE_OVERSIGHT_025202": {
    "date": "2018-09-18",
    "time": "22:40:13",
    "source": "email_header",
    "raw_date": "9/18/2018 10:40:13 PM",
    "confidence": "high"
  },
  "HOUSE_OVERSIGHT_025205": {
    "date": null,
    "time": null,
    "source": "unknown",
    "raw_date": null,
    "confidence": "none"
  },
  "HOUSE_OVERSIGHT_025210": {
    "date": null,
    "time": null,
    "source": "unknown",
    "raw_date": null,
    "confidence": "none"
  },
  "HOUSE_OVERSIGHT_025215": {
    "date": "2011-07-25",
    "time": "16:33:45",
    "source": "email_header",
    "raw_date": "7/25/2011 4:33:45 PM",
    "confidence": "high"
  },
  "HOUSE_OVERSIGHT_025221": {
    "date": "2011-07-25",
    "time": null,
    "source": "metadata",
    "raw_date": "07/25/2011",
    "confidence": "medium"
  },
  "HOUSE_OVERSIGHT_025226": {
    "date": "2011-08-04",
    "time": "23:41:48",
    "source": "email_header",
    "raw_date": "8/4/2011 11:41:48 PM",
    "confidence": "high"
  },
  "HOUSE_OVERSIGHT_025229": {
    "date": "2011-08-04",
    "time": null,
    "source": "metadata",
    "raw_date": "08/04/2011",
    "confidence": "medium"
  },
  "HOUSE_OVERSIGHT_025231": {
    "date": "2011-08-12",
    "time": null,
    "source": "content_parsed",
    "raw_date": "8/12/2011",
    "confidence": "low"
  },
  "HOUSE_OVERSIGHT_025233": {
    "date": "2011-12-16",
    "time": "18:41:00",
    "source": "email_header",
    "raw_date": "Friday, December 16 2011 06:41 PM",
    "confidence": "high"
  },
  "HOUSE_OVERSIGHT_025235": {
    "date": "2012-04-09",
    "time": "14:11:03",
    "source": "email_header",
    "raw_date": "4/9/2012 2:11:03 PM",
    "confidence": "high"
  },
  "HOUSE_OVERSIGHT_025242": {
    "date": "2012-04-09",
    "time": null,
    "source": "metadata",
    "raw_date": "04/09/2012",
    "confidence": "medium"
  },
  "HOUSE_OVERSIGHT_025247": {
    "date": "2012-10-26",
    "time": null,
    "source": "metadata",
    "raw_date": "10/26/2012",
    "confidence": "medium"
  },
  "HOUSE_OVERSIGHT_025291": {
    "date": "2015-01-14",
    "time": null,
    "source": "content_parsed",
    "raw_date": "1/14/2015",
    "confidence": "low"
  },
  "HOUSE_OVERSIGHT_025292": {
    "date": null,
    "time": null,
    "source": "unknown",
    "raw_date": null,
    "confidence": "none"
  },
  "HOUSE_OVERSIGHT_025295": {
    "date": "2016-11-14",
    "time": null,
    "source": "content_parsed",
    "raw_date": "Mon, Nov 14, 2016",
    "confidence": "low"
  },
  "HOUSE_OVERSIGHT_025296": {
    "date": "1981-03-26",
    "time": null,
    "source": "content_parsed",
    "raw_date": "International, March 26, 1981",
    "confidence": "low"
  },
  "HOUSE_OVERSIGHT_025310": {
    "date": "2017-05-11",
    "time": "05:38:37",
    "source": "email_header",
    "raw_date": "5/11/2017 5:38:37 AM",
    "confidence": "high"
  },
  "HOUSE_OVERSIGHT_025313": {
    "date": "2019-07-03",
    "time": "21:01:27",
    "source": "email_header",
    "raw_date": "7/3/2019 9:01:27 PM",
    "confidence": "high"
  },
  "HOUSE_OVERSIGHT_025328": {
    "date": "2018-04-24",
    "time": null,
    "source": "metadata",
    "raw_date": "04/24/2018",
    "confidence": "medium"
  },
  "HOUSE_OVERSIGHT_025329": {
    "date": "2019-01-16",
    "time": "19:50:41",
    "source": "email_header",
    "raw_date": "1/16/2019 7:50:41 PM",
    "confidence": "high"
  },
  "HOUSE_OVERSIGHT_025332": {
    "date": "2019-06-20",
    "time": "19:34:52",
    "source": "email_header",
    "raw_date": "6/20/2019 7:34:52 PM",
    "confidence": "high"
  },
  "HOUSE_OVERSIGHT_025347": {
    "date": "2012-10-16",
    "time": "01:00:27",
    "source": "email_header",
    "raw_date": "10/16/2012 1:00:27 AM",
    "confidence": "high"
  },
  "HOUSE_OVERSIGHT_025349": {
    "date": "2017-06-02",
    "time": "07:46:46",
    "source": "email_header",
    "raw_date": "6/2/2017 7:46:46 AM",
    "confidence": "high"
  },
  "HOUSE_OVERSIGHT_025353": {
    "date": "2011-09-08",
    "time": null,
    "source": "metadata",
    "raw_date": "09/08/2011",
    "confidence": "medium"
  },
  "HOUSE_OVERSIGHT_025361": {
    "date": "2009-09-03",
    "time": "11:18:47",
    "source": "email_header",
    "raw_date": "9/3/2009 11:18:47 AM",
    "confidence": "high"
  },
  "HOUSE_OVERSIGHT_025363": {
    "date": "2018-06-22",
    "time": null,
    "source": "content_parsed",
    "raw_date": "2018-06-22",
    "confidence": "low"
  },
  "HOUSE_OVERSIGHT_025368": {
    "date": "2018-09-14",
    "time": null,
    "source": "content_parsed",
    "raw_date": "2018-09-14",
    "confidence": "low"
  },
  "HOUSE_OVERSIGHT_025400": {
    "date": "2018-10-03",
    "time": null,
    "source": "content_parsed",
    "raw_date": "2018-10-03",
    "confidence": "low"
  },
  "HOUSE_OVERSIGHT_025403": {
    "date": "2019-02-03",
    "time": null,
    "source": "content_parsed",
    "raw_date": "2019-02-03",
    "confidence": "low"
  },
  "HOUSE_OVERSIGHT_025408": {
    "date": "2019-02-13",
    "time": null,
    "source": "content_parsed",
    "raw_date": "2019-02-13",
    "confidence": "low"
  },
  "HOUSE_OVERSIGHT_025423": {
    "date": "2019-02-25",
    "time": null,
    "source": "content_parsed",
    "raw_date": "2019-02-25",
    "confidence": "low"
  },
  "HOUSE_OVERSIGHT_025426": {
    "date": "2019-02-26",
    "time": null,
    "source": "content_parsed",
    "raw_date": "2019-02-26",
    "confidence": "low"
  },
  "HOUSE_OVERSIGHT_025429": {
    "date": "2019-02-27",
    "time": null,
    "source": "content_parsed",
    "raw_date": "2019-02-27",
    "confidence": "low"
  },
  "HOUSE_OVERSIGHT_025436": {
    "date": "2019-03-31",
    "time": null,
    "source": "content_parsed",
    "raw_date": "2019-03-31",
    "confidence": "low"
  },
  "HOUSE_OVERSIGHT_025452": {
    "date": "2019-05-20",
    "time": null,
    "source": "content_parsed",
    "raw_date": "2019-05-20",
    "confidence": "low"
  },
  "HOUSE_OVERSIGHT_025479": {
    "date": "2019-06-11",
    "time": null,
    "source": "content_parsed",
    "raw_date": "2019-06-11",
    "confidence": "low"
  },
  "HOUSE_OVERSIGHT_025511": {
    "date": "2014-12-02",
    "time": "18:29:16",
    "source": "email_header",
    "raw_date": "12/2/2014 6:29:16 PM",
    "confidence": "high"
  },
  "HOUSE_OVERSIGHT_025514": {
    "date": "2014-12-02",
    "time": "19:15:11",
    "source": "email_header",
    "raw_date": "12/2/2014 7:15:11 PM",
    "confidence": "high"
  },
  "HOUSE_OVERSIGHT_025517": {
    "date": "2018-03-11",
    "time": "19:39:40",
    "source": "email_header",
    "raw_date": "3/11/2018 7:39:40 PM",
    "confidence": "high"
  },
  "HOUSE_OVERSIGHT_025520": {
    "date": "2018-03-11",
    "time": "19:47:49",
    "source": "email_header",
    "raw_date": "3/11/2018 7:47:49 PM",
    "confidence": "high"
  },
  "HOUSE_OVERSIGHT_025524": {
    "date": "2018-03-12",
    "time": "01:04:06",
    "source": "email_header",
    "raw_date": "3/12/2018 1:04:06 AM",
    "confidence": "high"
  },
  "HOUSE_OVERSIGHT_025528": {
    "date": "2018-03-11",
    "time": "21:03:53",
    "source": "email_header",
    "raw_date": "Sun, 11 Mar 2018 21:03:53 +0100",
    "confidence": "high"
  },
  "HOUSE_OVERSIGHT_025533": {
    "date": "2018-03-11",
    "time": "20:08:31",
    "source": "email_header",
    "raw_date": "3/11/2018 8:08:31 PM",
    "confidence": "high"
  },
  "HOUSE_OVERSIGHT_025537": {
    "date": "2014-12-02",
    "time": "18:57:24",
    "source": "email_header",
    "raw_date": "12/2/2014 6:57:24 PM",
    "confidence": "high"
  },
  "HOUSE_OVERSIGHT_025540": {
    "date": "2011-04-06",
    "time": null,
    "source": "metadata",
    "raw_date": "04/06/2011",
    "confidence": "medium"
  },
  "HOUSE_OVERSIGHT_025547": {
    "date": "2017-05-27",
    "time": "11:19:59",
    "source": "email_header",
    "raw_date": "5/27/2017 11:19:59 AM",
    "confidence": "high"
  },
  "HOUSE_OVERSIGHT_025548": {
    "date": "2017-08-18",
    "time": "13:23:10",
    "source": "email_header",
    "raw_date": "8/18/2017 1:23:10 PM",
    "confidence": "high"
  },
  "HOUSE_OVERSIGHT_025551": {
    "date": "2018-01-30",
    "time": null,
    "source": "metadata",
    "raw_date": "01/30/2018",
    "confidence": "medium"
  },
  "HOUSE_OVERSIGHT_025589": {
    "date": "2018-04-14",
    "time": "17:06:12",
    "source": "email_header",
    "raw_date": "4/14/2018 5:06:12 PM",
    "confidence": "high"
  },
  "HOUSE_OVERSIGHT_025591": {
    "date": "2013-05-02",
    "time": "20:59:57",
    "source": "email_header",
    "raw_date": "5/2/2013 8:59:57 PM",
    "confidence": "high"
  },
  "HOUSE_OVERSIGHT_025592": {
    "date": "2013-05-03",
    "time": "21:37:25",
    "source": "email_header",
    "raw_date": "5/3/2013 9:37:25 PM",
    "confidence": "high"
  },
  "HOUSE_OVERSIGHT_025594": {
    "date": "2019-05-06",
    "time": "11:15:00",
    "source": "email_header",
    "raw_date": "Monday, May 6 2019 11:15 AM",
    "confidence": "high"
  },
  "HOUSE_OVERSIGHT_025598": {
    "date": "2019-04-18",
    "time": "12:23:00",
    "source": "email_header",
    "raw_date": "Thursday, April 18 2019 12:23 PM",
    "confidence": "high"
  },
  "HOUSE_OVERSIGHT_025600": {
    "date": "2019-05-06",
    "time": "10:52:00",
    "source": "email_header",
    "raw_date": "Monday, May 6 2019 10:52 AM",
    "confidence": "high"
  },
  "HOUSE_OVERSIGHT_025603": {
    "date": "2019-05-06",
    "time": "11:15:00",
    "source": "email_header",
    "raw_date": "Monday, May 6 2019 11:15 AM",
    "confidence": "high"
  },
  "HOUSE_OVERSIGHT_025606": {
    "date": "2019-05-06",
    "time": "13:18:00",
    "source": "email_header",
    "raw_date": "Monday, May 6 2019 01:18 PM",
    "confidence": "high"
  },
  "HOUSE_OVERSIGHT_025610": {
    "date": "2011-04-03",
    "time": null,
    "source": "metadata",
    "raw_date": "04/03/2011",
    "confidence": "medium"
  },
  "HOUSE_OVERSIGHT_025636": {
    "date": "2015-09-10",
    "time": null,
    "source": "content_parsed",
    "raw_date": "Thu, Sep 10, 2015",
    "confidence": "low"
  },
  "HOUSE_OVERSIGHT_025639": {
    "date": "2015-09-18",
    "time": "19:02:55",
    "source": "email_header",
    "raw_date": "9/18/2015 7:02:55 PM",
    "confidence": "high"
  },
  "HOUSE_OVERSIGHT_025643": {
    "date": "2017-05-15",
    "time": "17:43:08",
    "source": "email_header",
    "raw_date": "5/15/2017 5:43:08 PM",
    "confidence": "high"
  },
  "HOUSE_OVERSIGHT_025647": {
    "date": "2018-02-25",
    "time": "22:05:17",
    "source": "email_header",
    "raw_date": "2/25/2018 10:05:17 PM",
    "confidence": "high"
  },
  "HOUSE_OVERSIGHT_025649": {
    "date": "2018-02-25",
    "time": "22:30:47",
    "source": "email_header",
    "raw_date": "2/25/2018 10:30:47 PM",
    "confidence": "high"
  },
  "HOUSE_OVERSIGHT_025651": {
    "date": "2015-09-18",
    "time": null,
    "source": "content_parsed",
    "raw_date": "Fri, Sep 18, 2015",
    "confidence": "low"
  },
  "HOUSE_OVERSIGHT_025655": {
    "date": "2017-05-15",
    "time": "17:47:57",
    "source": "email_header",
    "raw_date": "5/15/2017 5:47:57 PM",
    "confidence": "high"
  },
  "HOUSE_OVERSIGHT_025660": {
    "date": "2018-02-25",
    "time": "22:33:32",
    "source": "email_header",
    "raw_date": "2/25/2018 10:33:32 PM",
    "confidence": "high"
  },
  "HOUSE_OVERSIGHT_025663": {
    "date": "2017-09-12",
    "time": null,
    "source": "content_parsed",
    "raw_date": "Conference, September 12, 2017",
    "confidence": "low"
  },
  "HOUSE_OVERSIGHT_025699": {
    "date": "2019-07-04",
    "time": "09:34:40",
    "source": "email_header",
    "raw_date": "7/4/2019 9:34:40 AM",
    "confidence": "high"
  },
  "HOUSE_OVERSIGHT_025704": {
    "date": "2008-05-19",
    "time": null,
    "source": "content_parsed",
    "raw_date": "Monday, May 19, 2008",
    "confidence": "low"
  },
  "HOUSE_OVERSIGHT_025707": {
    "date": "2018-08-17",
    "time": null,
    "source": "content_parsed",
    "raw_date": "2018-08-17",
    "confidence": "low"
  },
  "HOUSE_OVERSIGHT_025734": {
    "date": "2018-09-03",
    "time": null,
    "source": "content_parsed",
    "raw_date": "2018-09-03",
    "confidence": "low"
  },
  "HOUSE_OVERSIGHT_025763": {
    "date": null,
    "time": null,
    "source": "unknown",
    "raw_date": null,
    "confidence": "none"
  },
  "HOUSE_OVERSIGHT_025790": {
    "date": "2015-01-29",
    "time": "20:33:35",
    "source": "email_header",
    "raw_date": "1/29/2015 8:33:35 PM",
    "confidence": "high"
  },
  "HOUSE_OVERSIGHT_025792": {
    "date": "2019-07-14",
    "time": "19:03:52",
    "source": "email_header",
    "raw_date": "7/14/2019 7:03:52 PM",
    "confidence": "high"
  },
  "HOUSE_OVERSIGHT_025797": {
    "date": "2012-08-04",
    "time": null,
    "source": "metadata",
    "raw_date": "08/04/2012",
    "confidence": "medium"
  },
  "HOUSE_OVERSIGHT_025812": {
    "date": "2014-07-16",
    "time": "17:56:14",
    "source": "email_header",
    "raw_date": "7/16/2014 5:56:14 PM",
    "confidence": "high"
  },
  "HOUSE_OVERSIGHT_025814": {
    "date": "2014-09-19",
    "time": "21:23:00",
    "source": "email_header",
    "raw_date": "Friday, September 19 2014 09:23 PM",
    "confidence": "high"
  },
  "HOUSE_OVERSIGHT_025820": {
    "date": "2014-09-19",
    "time": "21:35:00",
    "source": "email_header",
    "raw_date": "Friday, September 19 2014 09:35 PM",
    "confidence": "high"
  },
  "HOUSE_OVERSIGHT_025827": {
    "date": "2014-09-20",
    "time": "00:17:00",
    "source": "email_header",
    "raw_date": "Saturday, September 20 2014 12:17 AM",
    "confidence": "high"
  },
  "HOUSE_OVERSIGHT_025834": {
    "date": "2014-09-20",
    "time": "00:38:00",
    "source": "email_header",
    "raw_date": "Saturday, September 20 2014 12:38 AM",
    "confidence": "high"
  },
  "HOUSE_OVERSIGHT_025841": {
    "date": "2014-09-20",
    "time": "00:48:00",
    "source": "email_header",
    "raw_date": "Saturday, September 20 2014 12:48 AM",
    "confidence": "high"
  },
  "HOUSE_OVERSIGHT_025849": {
    "date": "2014-03-10",
    "time": null,
    "source": "metadata",
    "raw_date": "03/10/2014",
    "confidence": "medium"
  },
  "HOUSE_OVERSIGHT_025873": {
    "date": "2015-01-04",
    "time": "08:31:36",
    "source": "email_header",
    "raw_date": "1/4/2015 8:31:36 AM",
    "confidence": "high"
  },
  "HOUSE_OVERSIGHT_025874": {
    "date": "2015-01-22",
    "time": null,
    "source": "content_parsed",
    "raw_date": "Thu, Jan 22, 2015",
    "confidence": "low"
  },
  "HOUSE_OVERSIGHT_025875": {
    "date": "2015-03-31",
    "time": "15:23:00",
    "source": "email_header",
    "raw_date": "Tuesday, March 31 2015 03:23 PM",
    "confidence": "high"
  },
  "HOUSE_OVERSIGHT_025877": {
    "date": "2015-04-23",
    "time": "11:00:18",
    "source": "email_header",
    "raw_date": "4/23/2015 11:00:18 AM",
    "confidence": "high"
  },
  "HOUSE_OVERSIGHT_025878": {
    "date": "2015-04-23",
    "time": "13:34:41",
    "source": "email_header",
    "raw_date": "4/23/2015 1:34:41 PM",
    "confidence": "high"
  },
  "HOUSE_OVERSIGHT_025879": {
    "date": "2015-04-23",
    "time": "19:43:47",
    "source": "email_header",
    "raw_date": "4/23/2015 7:43:47 PM",
    "confidence": "high"
  },
  "HOUSE_OVERSIGHT_025882": {
    "date": "2015-04-23",
    "time": "20:11:57",
    "source": "email_header",
    "raw_date": "4/23/2015 8:11:57 PM",
    "confidence": "high"
  },
  "HOUSE_OVERSIGHT_025888": {
    "date": "2015-07-24",
    "time": "20:37:24",
    "source": "email_header",
    "raw_date": "7/24/2015 8:37:24 PM",
    "confidence": "high"
  },
  "HOUSE_OVERSIGHT_025893": {
    "date": "2015-08-09",
    "time": "22:54:41",
    "source": "email_header",
    "raw_date": "8/9/2015 10:54:41 PM",
    "confidence": "high"
  },
  "HOUSE_OVERSIGHT_025898": {
    "date": "2015-08-10",
    "time": "05:09:03",
    "source": "email_header",
    "raw_date": "8/10/2015 5:09:03 AM",
    "confidence": "high"
  },
  "HOUSE_OVERSIGHT_025904": {
    "date": "2016-02-16",
    "time": "19:23:58",
    "source": "email_header",
    "raw_date": "2/16/2016 7:23:58 PM",
    "confidence": "high"
  },
  "HOUSE_OVERSIGHT_025906": {
    "date": "2016-02-27",
    "time": "16:34:42",
    "source": "email_header",
    "raw_date": "2/27/2016 4:34:42 PM",
    "confidence": "high"
  },
  "HOUSE_OVERSIGHT_025908": {
    "date": "2016-02-27",
    "time": "19:20:42",
    "source": "email_header",
    "raw_date": "2/27/2016 7:20:42 PM",
    "confidence": "high"
  },
  "HOUSE_OVERSIGHT_025911": {
    "date": "2016-03-09",
    "time": "22:21:30",
    "source": "email_header",
    "raw_date": "3/9/2016 10:21:30 PM",
    "confidence": "high"
  },
  "HOUSE_OVERSIGHT_025918": {
    "date": "2016-03-09",
    "time": "22:22:23",
    "source": "email_header",
    "raw_date": "3/9/2016 10:22:23 PM",
    "confidence": "high"
  },
  "HOUSE_OVERSIGHT_025926": {
    "date": "2016-03-09",
    "time": "22:33:53",
    "source": "email_header",
    "raw_date": "3/9/2016 10:33:53 PM",
    "confidence": "high"
  },
  "HOUSE_OVERSIGHT_025935": {
    "date": "2016-05-25",
    "time": "11:23:50",
    "source": "email_header",
    "raw_date": "5/25/2016 11:23:50 AM",
    "confidence": "high"
  },
  "HOUSE_OVERSIGHT_025937": {
    "date": null,
    "time": null,
    "source": "unknown",
    "raw_date": null,
    "confidence": "none"
  },
  "HOUSE_OVERSIGHT_025939": {
    "date": null,
    "time": null,
    "source": "unknown",
    "raw_date": null,
    "confidence": "none"
  },
  "HOUSE_OVERSIGHT_025941": {
    "date": null,
    "time": null,
    "source": "unknown",
    "raw_date": null,
    "confidence": "none"
  },
  "HOUSE_OVERSIGHT_025942": {
    "date": "2016-06-27",
    "time": "12:23:53",
    "source": "email_header",
    "raw_date": "6/27/2016 12:23:53 PM",
    "confidence": "high"
  },
  "HOUSE_OVERSIGHT_025944": {
    "date": "2016-06-30",
    "time": "14:25:23",
    "source": "email_header",
    "raw_date": "6/30/2016 2:25:23 PM",
    "confidence": "high"
  },
  "HOUSE_OVERSIGHT_025945": {
    "date": "2016-06-30",
    "time": "18:26:23",
    "source": "email_header",
    "raw_date": "6/30/2016 6:26:23 PM",
    "confidence": "high"
  },
  "HOUSE_OVERSIGHT_025946": {
    "date": "2016-07-11",
    "time": "01:08:58",
    "source": "email_header",
    "raw_date": "7/11/2016 1:08:58 AM",
    "confidence": "high"
  },
  "HOUSE_OVERSIGHT_025949": {
    "date": "2016-07-23",
    "time": "07:02:30",
    "source": "email_header",
    "raw_date": "7/23/2016 7:02:30 AM",
    "confidence": "high"
  },
  "HOUSE_OVERSIGHT_025954": {
    "date": "2016-07-23",
    "time": "22:02:05",
    "source": "email_header",
    "raw_date": "7/23/2016 10:02:05 PM",
    "confidence": "high"
  },
  "HOUSE_OVERSIGHT_025960": {
    "date": "2016-07-24",
    "time": "05:23:46",
    "source": "email_header",
    "raw_date": "7/24/2016 5:23:46 AM",
    "confidence": "high"
  },
  "HOUSE_OVERSIGHT_025967": {
    "date": "2016-07-28",
    "time": "04:14:35",
    "source": "email_header",
    "raw_date": "7/28/2016 4:14:35 AM",
    "confidence": "high"
  },
  "HOUSE_OVERSIGHT_025970": {
    "date": "2016-07-28",
    "time": "14:48:17",
    "source": "email_header",
    "raw_date": "7/28/2016 2:48:17 PM",
    "confidence": "high"
  },
  "HOUSE_OVERSIGHT_025974": {
    "date": "2016-07-28",
    "time": "17:44:00",
    "source": "email_header",
    "raw_date": "Thursday, July 28 2016 05:44 PM",
    "confidence": "high"
  },
  "HOUSE_OVERSIGHT_025978": {
    "date": "2016-08-09",
    "time": null,
    "source": "metadata",
    "raw_date": "08/09/2016",
    "confidence": "medium"
  },
  "HOUSE_OVERSIGHT_026005": {
    "date": "2016-08-12",
    "time": "13:58:39",
    "source": "email_header",
    "raw_date": "8/12/2016 1:58:39 PM",
    "confidence": "high"
  },
  "HOUSE_OVERSIGHT_026008": {
    "date": "2016-08-20",
    "time": "14:04:14",
    "source": "email_header",
    "raw_date": "8/20/2016 2:04:14 PM",
    "confidence": "high"
  },
  "HOUSE_OVERSIGHT_026010": {
    "date": "2016-10-08",
    "time": "20:28:00",
    "source": "email_header",
    "raw_date": "Saturday, October 8 2016 08:28 PM",
    "confidence": "high"
  },
  "HOUSE_OVERSIGHT_026011": {
    "date": null,
    "time": null,
    "source": "unknown",
    "raw_date": null,
    "confidence": "none"
  },
  "HOUSE_OVERSIGHT_026014": {
    "date": "2016-11-04",
    "time": null,
    "source": "content_parsed",
    "raw_date": "Fri, Nov 4, 2016",
    "confidence": "low"
  },
  "HOUSE_OVERSIGHT_026017": {
    "date": "2016-11-10",
    "time": "22:23:00",
    "source": "email_header",
    "raw_date": "Thursday, November 10 2016 10:23 PM",
    "confidence": "high"
  },
  "HOUSE_OVERSIGHT_026018": {
    "date": "2016-11-11",
    "time": null,
    "source": "content_parsed",
    "raw_date": "Fri, Nov 11, 2016",
    "confidence": "low"
  },
  "HOUSE_OVERSIGHT_026020": {
    "date": "2016-11-28",
    "time": "04:11:04",
    "source": "email_header",
    "raw_date": "11/28/2016 4:11:04 AM",
    "confidence": "high"
  },
  "HOUSE_OVERSIGHT_026024": {
    "date": "2016-11-28",
    "time": null,
    "source": "content_parsed",
    "raw_date": "11/28/2016",
    "confidence": "low"
  },
  "HOUSE_OVERSIGHT_026026": {
    "date": "2016-11-28",
    "time": "17:23:42",
    "source": "email_header",
    "raw_date": "11/28/2016 5:23:42 PM",
    "confidence": "high"
  },
  "HOUSE_OVERSIGHT_026028": {
    "date": "2016-11-29",
    "time": "12:13:41",
    "source": "email_header",
    "raw_date": "11/29/2016 12:13:41 PM",
    "confidence": "high"
  },
  "HOUSE_OVERSIGHT_026030": {
    "date": "2016-11-29",
    "time": "13:19:56",
    "source": "email_header",
    "raw_date": "11/29/2016 1:19:56 PM",
    "confidence": "high"
  },
  "HOUSE_OVERSIGHT_026033": {
    "date": "2016-11-29",
    "time": "13:29:58",
    "source": "email_header",
    "raw_date": "11/29/2016 1:29:58 PM",
    "confidence": "high"
  },
  "HOUSE_OVERSIGHT_026036": {
    "date": "2016-12-17",
    "time": "02:43:49",
    "source": "email_header",
    "raw_date": "12/17/2016 2:43:49 AM",
    "confidence": "high"
  },
  "HOUSE_OVERSIGHT_026041": {
    "date": "2016-12-17",
    "time": "12:35:06",
    "source": "email_header",
    "raw_date": "12/17/2016 12:35:06 PM",
    "confidence": "high"
  },
  "HOUSE_OVERSIGHT_026047": {
    "date": "2016-12-20",
    "time": "17:06:06",
    "source": "email_header",
    "raw_date": "12/20/2016 5:06:06 PM",
    "confidence": "high"
  },
  "HOUSE_OVERSIGHT_026049": {
    "date": "2016-12-24",
    "time": "19:37:57",
    "source": "email_header",
    "raw_date": "12/24/2016 7:37:57 PM",
    "confidence": "high"
  },
  "HOUSE_OVERSIGHT_026053": {
    "date": "2016-12-26",
    "time": "01:19:46",
    "source": "email_header",
    "raw_date": "12/26/2016 1:19:46 AM",
    "confidence": "high"
  },
  "HOUSE_OVERSIGHT_026055": {
    "date": "2017-01-23",
    "time": "01:44:28",
    "source": "email_header",
    "raw_date": "1/23/2017 1:44:28 AM",
    "confidence": "high"
  },
  "HOUSE_OVERSIGHT_026057": {
    "date": "2017-02-03",
    "time": "15:58:55",
    "source": "email_header",
    "raw_date": "2/3/2017 3:58:55 PM",
    "confidence": "high"
  },
  "HOUSE_OVERSIGHT_026059": {
    "date": "2017-02-08",
    "time": "12:01:12",
    "source": "email_header",
    "raw_date": "2/8/2017 12:01:12 PM",
    "confidence": "high"
  },
  "HOUSE_OVERSIGHT_026064": {
    "date": "2017-02-08",
    "time": "22:20:59",
    "source": "email_header",
    "raw_date": "2/8/2017 10:20:59 PM",
    "confidence": "high"
  },
  "HOUSE_OVERSIGHT_026069": {
    "date": "2017-02-08",
    "time": "22:23:46",
    "source": "email_header",
    "raw_date": "2/8/2017 10:23:46 PM",
    "confidence": "high"
  },
  "HOUSE_OVERSIGHT_026074": {
    "date": "2017-04-21",
    "time": "17:10:00",
    "source": "email_header",
    "raw_date": "Friday, April 21 2017 05:10 PM",
    "confidence": "high"
  },
  "HOUSE_OVERSIGHT_026075": {
    "date": "2017-04-30",
    "time": "16:38:23",
    "source": "email_header",
    "raw_date": "4/30/2017 4:38:23 PM",
    "confidence": "high"
  },
  "HOUSE_OVERSIGHT_026076": {
    "date": "2017-04-30",
    "time": "20:23:59",
    "source": "email_header",
    "raw_date": "4/30/2017 8:23:59 PM",
    "confidence": "high"
  },
  "HOUSE_OVERSIGHT_026078": {
    "date": "2017-05-14",
    "time": "20:23:56",
    "source": "email_header",
    "raw_date": "5/14/2017 8:23:56 PM",
    "confidence": "high"
  },
  "HOUSE_OVERSIGHT_026080": {
    "date": "2017-05-14",
    "time": "20:27:10",
    "source": "email_header",
    "raw_date": "5/14/2017 8:27:10 PM",
    "confidence": "high"
  },
  "HOUSE_OVERSIGHT_026083": {
    "date": "2017-05-14",
    "time": "21:38:47",
    "source": "email_header",
    "raw_date": "5/14/2017 9:38:47 PM",
    "confidence": "high"
  },
  "HOUSE_OVERSIGHT_026086": {
    "date": "2017-05-14",
    "time": null,
    "source": "content_parsed",
    "raw_date": "Sun, May 14, 2017",
    "confidence": "low"
  },
  "HOUSE_OVERSIGHT_026090": {
    "date": "2017-05-15",
    "time": "14:05:53",
    "source": "email_header",
    "raw_date": "5/15/2017 2:05:53 PM",
    "confidence": "high"
  },
  "HOUSE_OVERSIGHT_026094": {
    "date": "2017-05-27",
    "time": "22:23:02",
    "source": "email_header",
    "raw_date": "5/27/2017 10:23:02 PM",
    "confidence": "high"
  },
  "HOUSE_OVERSIGHT_026096": {
    "date": "2017-05-28",
    "time": "11:36:29",
    "source": "email_header",
    "raw_date": "5/28/2017 11:36:29 AM",
    "confidence": "high"
  },
  "HOUSE_OVERSIGHT_026098": {
    "date": "2017-05-28",
    "time": "12:10:18",
    "source": "email_header",
    "raw_date": "5/28/2017 12:10:18 PM",
    "confidence": "high"
  },
  "HOUSE_OVERSIGHT_026100": {
    "date": "2017-05-28",
    "time": "12:14:48",
    "source": "email_header",
    "raw_date": "5/28/2017 12:14:48 PM",
    "confidence": "high"
  },
  "HOUSE_OVERSIGHT_026103": {
    "date": "2017-05-30",
    "time": "00:35:41",
    "source": "email_header",
    "raw_date": "5/30/2017 12:35:41 AM",
    "confidence": "high"
  },
  "HOUSE_OVERSIGHT_026106": {
    "date": "2017-06-02",
    "time": "23:22:47",
    "source": "email_header",
    "raw_date": "6/2/2017 11:22:47 PM",
    "confidence": "high"
  },
  "HOUSE_OVERSIGHT_026110": {
    "date": "2017-06-03",
    "time": "00:14:17",
    "source": "email_header",
    "raw_date": "6/3/2017 12:14:17 AM",
    "confidence": "high"
  },
  "HOUSE_OVERSIGHT_026114": {
    "date": "2017-06-03",
    "time": "00:19:29",
    "source": "email_header",
    "raw_date": "6/3/2017 12:19:29 AM",
    "confidence": "high"
  },
  "HOUSE_OVERSIGHT_026118": {
    "date": "2017-06-03",
    "time": "00:32:31",
    "source": "email_header",
    "raw_date": "6/3/2017 12:32:31 AM",
    "confidence": "high"
  },
  "HOUSE_OVERSIGHT_026123": {
    "date": "2017-06-03",
    "time": "00:39:33",
    "source": "email_header",
    "raw_date": "6/3/2017 12:39:33 AM",
    "confidence": "high"
  },
  "HOUSE_OVERSIGHT_026128": {
    "date": "2017-06-08",
    "time": "20:52:26",
    "source": "email_header",
    "raw_date": "6/8/2017 8:52:26 PM",
    "confidence": "high"
  },
  "HOUSE_OVERSIGHT_026131": {
    "date": "2017-06-08",
    "time": "21:07:00",
    "source": "email_header",
    "raw_date": "6/8/2017 9:07:00 PM",
    "confidence": "high"
  },
  "HOUSE_OVERSIGHT_026134": {
    "date": null,
    "time": null,
    "source": "unknown",
    "raw_date": null,
    "confidence": "none"
  },
  "HOUSE_OVERSIGHT_026159": {
    "date": "2017-07-11",
    "time": "09:40:01",
    "source": "email_header",
    "raw_date": "7/11/2017 9:40:01 AM",
    "confidence": "high"
  },
  "HOUSE_OVERSIGHT_026160": {
    "date": "2017-07-16",
    "time": "12:23:00",
    "source": "email_header",
    "raw_date": "7/16/2017 12:23:00 PM",
    "confidence": "high"
  },
  "HOUSE_OVERSIGHT_026161": {
    "date": "2017-07-17",
    "time": "08:48:09",
    "source": "email_header",
    "raw_date": "7/17/2017 8:48:09 AM",
    "confidence": "high"
  },
  "HOUSE_OVERSIGHT_026162": {
    "date": "2017-08-25",
    "time": "10:13:23",
    "source": "email_header",
    "raw_date": "8/25/2017 10:13:23 AM",
    "confidence": "high"
  },
  "HOUSE_OVERSIGHT_026165": {
    "date": "2017-08-25",
    "time": "11:27:40",
    "source": "email_header",
    "raw_date": "8/25/2017 11:27:40 AM",
    "confidence": "high"
  },
  "HOUSE_OVERSIGHT_026167": {
    "date": "2017-09-08",
    "time": null,
    "source": "content_parsed",
    "raw_date": "9/8/2017",
    "confidence": "low"
  },
  "HOUSE_OVERSIGHT_026168": {
    "date": "2017-09-21",
    "time": "19:23:05",
    "source": "email_header",
    "raw_date": "9/21/2017 7:23:05 PM",
    "confidence": "high"
  },
  "HOUSE_OVERSIGHT_026170": {
    "date": "2017-09-21",
    "time": "21:56:38",
    "source": "email_header",
    "raw_date": "9/21/2017 9:56:38 PM",
    "confidence": "high"
  },
  "HOUSE_OVERSIGHT_026173": {
    "date": "2017-09-22",
    "time": "02:43:24",
    "source": "email_header",
    "raw_date": "9/22/2017 2:43:24 AM",
    "confidence": "high"
  },
  "HOUSE_OVERSIGHT_026176": {
    "date": "2017-09-22",
    "time": "15:15:47",
    "source": "email_header",
    "raw_date": "9/22/2017 3:15:47 PM",
    "confidence": "high"
  },
  "HOUSE_OVERSIGHT_026180": {
    "date": "2017-09-22",
    "time": "15:40:36",
    "source": "email_header",
    "raw_date": "9/22/2017 3:40:36 PM",
    "confidence": "high"
  },
  "HOUSE_OVERSIGHT_026184": {
    "date": "2017-09-22",
    "time": null,
    "source": "content_parsed",
    "raw_date": "Fri, Sep 22, 2017",
    "confidence": "low"
  },
  "HOUSE_OVERSIGHT_026188": {
    "date": "2017-09-24",
    "time": "08:20:39",
    "source": "email_header",
    "raw_date": "9/24/2017 8:20:39 AM",
    "confidence": "high"
  },
  "HOUSE_OVERSIGHT_026193": {
    "date": "2017-09-24",
    "time": "10:31:28",
    "source": "email_header",
    "raw_date": "9/24/2017 10:31:28 AM",
    "confidence": "high"
  },
  "HOUSE_OVERSIGHT_026198": {
    "date": "2017-09-24",
    "time": "10:46:20",
    "source": "email_header",
    "raw_date": "9/24/2017 10:46:20 AM",
    "confidence": "high"
  },
  "HOUSE_OVERSIGHT_026204": {
    "date": "2017-09-24",
    "time": "11:02:00",
    "source": "email_header",
    "raw_date": "9/24/2017 11:02:00 AM",
    "confidence": "high"
  },
  "HOUSE_OVERSIGHT_026210": {
    "date": "2017-09-26",
    "time": "19:28:46",
    "source": "email_header",
    "raw_date": "9/26/2017 7:28:46 PM",
    "confidence": "high"
  },
  "HOUSE_OVERSIGHT_026216": {
    "date": "2017-10-02",
    "time": "20:23:25",
    "source": "email_header",
    "raw_date": "10/2/2017 8:23:25 PM",
    "confidence": "high"
  },
  "HOUSE_OVERSIGHT_026218": {
    "date": "2017-10-02",
    "time": "20:30:27",
    "source": "email_header",
    "raw_date": "10/2/2017 8:30:27 PM",
    "confidence": "high"
  },
  "HOUSE_OVERSIGHT_026221": {
    "date": "2017-10-02",
    "time": "21:17:38",
    "source": "email_header",
    "raw_date": "10/2/2017 9:17:38 PM",
    "confidence": "high"
  },
  "HOUSE_OVERSIGHT_026224": {
    "date": "2017-10-02",
    "time": "21:21:33",
    "source": "email_header",
    "raw_date": "10/2/2017 9:21:33 PM",
    "confidence": "high"
  },
  "HOUSE_OVERSIGHT_026228": {
    "date": "2017-11-20",
    "time": "20:09:46",
    "source": "email_header",
    "raw_date": "11/20/2017 8:09:46 PM",
    "confidence": "high"
  },
  "HOUSE_OVERSIGHT_026232": {
    "date": "2017-11-21",
    "time": "00:23:47",
    "source": "email_header",
    "raw_date": "11/21/2017 12:23:47 AM",
    "confidence": "high"
  },
  "HOUSE_OVERSIGHT_026233": {
    "date": "2017-11-21",
    "time": "01:37:36",
    "source": "email_header",
    "raw_date": "11/21/2017 1:37:36 AM",
    "confidence": "high"
  },
  "HOUSE_OVERSIGHT_026234": {
    "date": "2017-11-23",
    "time": "14:41:19",
    "source": "email_header",
    "raw_date": "11/23/2017 2:41:19 PM",
    "confidence": "high"
  },
  "HOUSE_OVERSIGHT_026237": {
    "date": "2017-12-22",
    "time": "12:23:04",
    "source": "email_header",
    "raw_date": "12/22/2017 12:23:04 PM",
    "confidence": "high"
  },
  "HOUSE_OVERSIGHT_026242": {
    "date": "2018-01-08",
    "time": "15:04:23",
    "source": "email_header",
    "raw_date": "1/8/2018 3:04:23 PM",
    "confidence": "high"
  },
  "HOUSE_OVERSIGHT_026243": {
    "date": "2018-01-12",
    "time": "14:25:40",
    "source": "email_header",
    "raw_date": "1/12/2018 2:25:40 PM",
    "confidence": "high"
  },
  "HOUSE_OVERSIGHT_026245": {
    "date": "2018-01-23",
    "time": "21:59:38",
    "source": "email_header",
    "raw_date": "1/23/2018 9:59:38 PM",
    "confidence": "high"
  },
  "HOUSE_OVERSIGHT_026248": {
    "date": "2018-02-02",
    "time": null,
    "source": "metadata",
    "raw_date": "02/02/2018",
    "confidence": "medium"
  },
  "HOUSE_OVERSIGHT_026254": {
    "date": "2018-02-24",
    "time": "12:48:36",
    "source": "email_header",
    "raw_date": "2/24/2018 12:48:36 PM",
    "confidence": "high"
  },
  "HOUSE_OVERSIGHT_026255": {
    "date": "2018-02-24",
    "time": "13:14:53",
    "source": "email_header",
    "raw_date": "2/24/2018 1:14:53 PM",
    "confidence": "high"
  },
  "HOUSE_OVERSIGHT_026256": {
    "date": "2018-02-24",
    "time": "13:21:54",
    "source": "email_header",
    "raw_date": "2/24/2018 1:21:54 PM",
    "confidence": "high"
  },
  "HOUSE_OVERSIGHT_026258": {
    "date": "2018-02-24",
    "time": "13:23:41",
    "source": "email_header",
    "raw_date": "2/24/2018 1:23:41 PM",
    "confidence": "high"
  },
  "HOUSE_OVERSIGHT_026260": {
    "date": "2018-02-24",
    "time": "13:26:54",
    "source": "email_header",
    "raw_date": "2/24/2018 1:26:54 PM",
    "confidence": "high"
  },
  "HOUSE_OVERSIGHT_026263": {
    "date": "2018-02-24",
    "time": "13:32:39",
    "source": "email_header",
    "raw_date": "2/24/2018 1:32:39 PM",
    "confidence": "high"
  },
  "HOUSE_OVERSIGHT_026266": {
    "date": "2018-02-25",
    "time": "11:42:49",
    "source": "email_header",
    "raw_date": "2/25/2018 11:42:49 AM",
    "confidence": "high"
  },
  "HOUSE_OVERSIGHT_026267": {
    "date": "2018-02-25",
    "time": "13:25:58",
    "source": "email_header",
    "raw_date": "2/25/2018 1:25:58 PM",
    "confidence": "high"
  },
  "HOUSE_OVERSIGHT_026269": {
    "date": "2018-02-25",
    "time": "21:28:23",
    "source": "email_header",
    "raw_date": "2/25/2018 9:28:23 PM",
    "confidence": "high"
  },
  "HOUSE_OVERSIGHT_026270": {
    "date": "2018-02-25",
    "time": null,
    "source": "content_parsed",
    "raw_date": "Sun, Feb 25, 2018",
    "confidence": "low"
  },
  "HOUSE_OVERSIGHT_026272": {
    "date": "2018-03-23",
    "time": "13:57:50",
    "source": "email_header",
    "raw_date": "3/23/2018 1:57:50 PM",
    "confidence": "high"
  },
  "HOUSE_OVERSIGHT_026273": {
    "date": "2018-06-23",
    "time": "12:44:08",
    "source": "email_header",
    "raw_date": "6/23/2018 12:44:08 PM",
    "confidence": "high"
  },
  "HOUSE_OVERSIGHT_026280": {
    "date": "2018-06-23",
    "time": "17:11:45",
    "source": "email_header",
    "raw_date": "6/23/2018 5:11:45 PM",
    "confidence": "high"
  },
  "HOUSE_OVERSIGHT_026287": {
    "date": "2018-07-04",
    "time": "13:23:17",
    "source": "email_header",
    "raw_date": "7/4/2018 1:23:17 PM",
    "confidence": "high"
  },
  "HOUSE_OVERSIGHT_026290": {
    "date": "2018-07-04",
    "time": "13:40:23",
    "source": "email_header",
    "raw_date": "7/4/2018 1:40:23 PM",
    "confidence": "high"
  },
  "HOUSE_OVERSIGHT_026294": {
    "date": "2018-07-29",
    "time": "17:34:28",
    "source": "email_header",
    "raw_date": "7/29/2018 5:34:28 PM",
    "confidence": "high"
  },
  "HOUSE_OVERSIGHT_026296": {
    "date": "2018-07-29",
    "time": "22:21:16",
    "source": "email_header",
    "raw_date": "7/29/2018 10:21:16 PM",
    "confidence": "high"
  },
  "HOUSE_OVERSIGHT_026298": {
    "date": "2018-08-03",
    "time": "03:49:00",
    "source": "email_header",
    "raw_date": "Friday, August 3 2018 03:49 AM",
    "confidence": "high"
  },
  "HOUSE_OVERSIGHT_026304": {
    "date": "2018-08-03",
    "time": "12:18:00",
    "source": "email_header",
    "raw_date": "Friday, August 3 2018 12:18 PM",
    "confidence": "high"
  },
  "HOUSE_OVERSIGHT_026310": {
    "date": "2018-08-11",
    "time": "02:23:22",
    "source": "email_header",
    "raw_date": "8/11/2018 2:23:22 AM",
    "confidence": "high"
  },
  "HOUSE_OVERSIGHT_026311": {
    "date": "2018-08-11",
    "time": "02:36:42",
    "source": "email_header",
    "raw_date": "8/11/2018 2:36:42 AM",
    "confidence": "high"
  },
  "HOUSE_OVERSIGHT_026312": {
    "date": "2018-08-12",
    "time": "17:23:00",
    "source": "email_header",
    "raw_date": "Sunday, August 12 2018 05:23 PM",
    "confidence": "high"
  },
  "HOUSE_OVERSIGHT_026314": {
    "date": "2018-08-12",
    "time": "17:42:00",
    "source": "email_header",
    "raw_date": "Sunday, August 12 2018 05:42 PM",
    "confidence": "high"
  },
  "HOUSE_OVERSIGHT_026317": {
    "date": "2018-08-23",
    "time": "18:28:45",
    "source": "email_header",
    "raw_date": "8/23/2018 6:28:45 PM",
    "confidence": "high"
  },
  "HOUSE_OVERSIGHT_026320": {
    "date": "2018-08-23",
    "time": "20:25:40",
    "source": "email_header",
    "raw_date": "8/23/2018 8:25:40 PM",
    "confidence": "high"
  },
  "HOUSE_OVERSIGHT_026321": {
    "date": "2018-09-12",
    "time": "03:01:20",
    "source": "email_header",
    "raw_date": "9/12/2018 3:01:20 AM",
    "confidence": "high"
  },
  "HOUSE_OVERSIGHT_026324": {
    "date": "2018-09-24",
    "time": "14:43:05",
    "source": "email_header",
    "raw_date": "9/24/2018 2:43:05 PM",
    "confidence": "high"
  },
  "HOUSE_OVERSIGHT_026326": {
    "date": "2018-11-05",
    "time": "20:25:02",
    "source": "email_header",
    "raw_date": "11/5/2018 8:25:02 PM",
    "confidence": "high"
  },
  "HOUSE_OVERSIGHT_026328": {
    "date": "2018-12-04",
    "time": "13:23:53",
    "source": "email_header",
    "raw_date": "12/4/2018 1:23:53 PM",
    "confidence": "high"
  },
  "HOUSE_OVERSIGHT_026329": {
    "date": "2019-01-04",
    "time": "19:01:05",
    "source": "email_header",
    "raw_date": "1/4/2019 7:01:05 PM",
    "confidence": "high"
  },
  "HOUSE_OVERSIGHT_026342": {
    "date": "2019-05-22",
    "time": null,
    "source": "content_parsed",
    "raw_date": "Wed, May 22, 2019",
    "confidence": "low"
  },
  "HOUSE_OVERSIGHT_026343": {
    "date": "2019-05-22",
    "time": null,
    "source": "content_parsed",
    "raw_date": "Wed, May 22, 2019",
    "confidence": "low"
  },
  "HOUSE_OVERSIGHT_026344": {
    "date": "2014-09-20",
    "time": "13:43:23",
    "source": "email_header",
    "raw_date": "9/20/2014 1:43:23 PM",
    "confidence": "high"
  },
  "HOUSE_OVERSIGHT_026345": {
    "date": "2014-10-15",
    "time": "00:23:42",
    "source": "email_header",
    "raw_date": "10/15/2014 12:23:42 AM",
    "confidence": "high"
  },
  "HOUSE_OVERSIGHT_026347": {
    "date": "2015-01-19",
    "time": "09:48:00",
    "source": "email_header",
    "raw_date": "Monday, January 19 2015 09:48 AM",
    "confidence": "high"
  },
  "HOUSE_OVERSIGHT_026348": {
    "date": "2015-03-31",
    "time": "15:26:00",
    "source": "email_header",
    "raw_date": "Tuesday, March 31 2015 03:26 PM",
    "confidence": "high"
  },
  "HOUSE_OVERSIGHT_026351": {
    "date": "2015-03-31",
    "time": "15:32:00",
    "source": "email_header",
    "raw_date": "Tuesday, March 31 2015 03:32 PM",
    "confidence": "high"
  },
  "HOUSE_OVERSIGHT_026354": {
    "date": "2015-04-23",
    "time": "14:38:55",
    "source": "email_header",
    "raw_date": "4/23/2015 2:38:55 PM",
    "confidence": "high"
  },
  "HOUSE_OVERSIGHT_026355": {
    "date": "2015-04-23",
    "time": "17:44:25",
    "source": "email_header",
    "raw_date": "4/23/2015 5:44:25 PM",
    "confidence": "high"
  },
  "HOUSE_OVERSIGHT_026356": {
    "date": "2015-04-23",
    "time": "19:44:25",
    "source": "email_header",
    "raw_date": "4/23/2015 7:44:25 PM",
    "confidence": "high"
  },
  "HOUSE_OVERSIGHT_026360": {
    "date": "2015-04-25",
    "time": "17:06:32",
    "source": "email_header",
    "raw_date": "4/25/2015 5:06:32 PM",
    "confidence": "high"
  },
  "HOUSE_OVERSIGHT_026362": {
    "date": "2015-07-24",
    "time": "20:47:39",
    "source": "email_header",
    "raw_date": "7/24/2015 8:47:39 PM",
    "confidence": "high"
  },
  "HOUSE_OVERSIGHT_026368": {
    "date": "2015-09-15",
    "time": "11:40:00",
    "source": "email_header",
    "raw_date": "Tuesday, September 15 2015 11:40 AM",
    "confidence": "high"
  },
  "HOUSE_OVERSIGHT_026369": {
    "date": "2016-01-23",
    "time": "15:28:09",
    "source": "email_header",
    "raw_date": "1/23/2016 3:28:09 PM",
    "confidence": "high"
  },
  "HOUSE_OVERSIGHT_026372": {
    "date": "2016-01-23",
    "time": "15:40:03",
    "source": "email_header",
    "raw_date": "1/23/2016 3:40:03 PM",
    "confidence": "high"
  },
  "HOUSE_OVERSIGHT_026376": {
    "date": "2016-02-27",
    "time": "16:36:43",
    "source": "email_header",
    "raw_date": "2/27/2016 4:36:43 PM",
    "confidence": "high"
  },
  "HOUSE_OVERSIGHT_026378": {
    "date": "2016-02-27",
    "time": "19:38:48",
    "source": "email_header",
    "raw_date": "2/27/2016 7:38:48 PM",
    "confidence": "high"
  },
  "HOUSE_OVERSIGHT_026381": {
    "date": "2016-03-31",
    "time": "10:23:07",
    "source": "email_header",
    "raw_date": "3/31/2016 10:23:07 AM",
    "confidence": "high"
  },
  "HOUSE_OVERSIGHT_026383": {
    "date": "2016-06-02",
    "time": null,
    "source": "content_parsed",
    "raw_date": "6/2/2016",
    "confidence": "low"
  },
  "HOUSE_OVERSIGHT_026384": {
    "date": "2016-06-20",
    "time": null,
    "source": "metadata",
    "raw_date": "06/20/2016",
    "confidence": "medium"
  },
  "HOUSE_OVERSIGHT_026393": {
    "date": "2016-07-23",
    "time": "08:41:23",
    "source": "email_header",
    "raw_date": "7/23/2016 8:41:23 AM",
    "confidence": "high"
  },
  "HOUSE_OVERSIGHT_026399": {
    "date": "2016-07-23",
    "time": "22:20:08",
    "source": "email_header",
    "raw_date": "7/23/2016 10:20:08 PM",
    "confidence": "high"
  },
  "HOUSE_OVERSIGHT_026406": {
    "date": "2016-07-24",
    "time": "05:43:22",
    "source": "email_header",
    "raw_date": "7/24/2016 5:43:22 AM",
    "confidence": "high"
  },
  "HOUSE_OVERSIGHT_026413": {
    "date": "2016-07-24",
    "time": "05:44:28",
    "source": "email_header",
    "raw_date": "7/24/2016 5:44:28 AM",
    "confidence": "high"
  },
  "HOUSE_OVERSIGHT_026420": {
    "date": "2016-11-10",
    "time": "22:15:00",
    "source": "email_header",
    "raw_date": "Thursday, November 10 2016 10:15 PM",
    "confidence": "high"
  },
  "HOUSE_OVERSIGHT_026422": {
    "date": "2016-11-28",
    "time": "04:35:10",
    "source": "email_header",
    "raw_date": "11/28/2016 4:35:10 AM",
    "confidence": "high"
  },
  "HOUSE_OVERSIGHT_026426": {
    "date": "2016-11-28",
    "time": "11:37:12",
    "source": "email_header",
    "raw_date": "11/28/2016 11:37:12 AM",
    "confidence": "high"
  },
  "HOUSE_OVERSIGHT_026428": {
    "date": "2016-11-28",
    "time": null,
    "source": "content_parsed",
    "raw_date": "Mon, Nov 28, 2016",
    "confidence": "low"
  },
  "HOUSE_OVERSIGHT_026430": {
    "date": "2016-11-29",
    "time": "00:27:23",
    "source": "email_header",
    "raw_date": "11/29/2016 12:27:23 AM",
    "confidence": "high"
  },
  "HOUSE_OVERSIGHT_026431": {
    "date": "2017-02-09",
    "time": "10:45:36",
    "source": "email_header",
    "raw_date": "2/9/2017 10:45:36 AM",
    "confidence": "high"
  },
  "HOUSE_OVERSIGHT_026437": {
    "date": "2017-02-15",
    "time": "13:23:41",
    "source": "email_header",
    "raw_date": "2/15/2017 1:23:41 PM",
    "confidence": "high"
  },
  "HOUSE_OVERSIGHT_026438": {
    "date": "2017-04-07",
    "time": "12:21:23",
    "source": "email_header",
    "raw_date": "4/7/2017 12:21:23 PM",
    "confidence": "high"
  },
  "HOUSE_OVERSIGHT_026440": {
    "date": "2017-04-23",
    "time": "11:20:28",
    "source": "email_header",
    "raw_date": "4/23/2017 11:20:28 AM",
    "confidence": "high"
  },
  "HOUSE_OVERSIGHT_026442": {
    "date": "2017-05-22",
    "time": "21:52:23",
    "source": "email_header",
    "raw_date": "5/22/2017 9:52:23 PM",
    "confidence": "high"
  },
  "HOUSE_OVERSIGHT_026444": {
    "date": "2017-05-23",
    "time": "18:46:27",
    "source": "email_header",
    "raw_date": "5/23/2017 6:46:27 PM",
    "confidence": "high"
  },
  "HOUSE_OVERSIGHT_026445": {
    "date": "2017-05-27",
    "time": "22:23:32",
    "source": "email_header",
    "raw_date": "5/27/2017 10:23:32 PM",
    "confidence": "high"
  },
  "HOUSE_OVERSIGHT_026447": {
    "date": "2017-06-07",
    "time": "12:03:23",
    "source": "email_header",
    "raw_date": "6/7/2017 12:03:23 PM",
    "confidence": "high"
  },
  "HOUSE_OVERSIGHT_026448": {
    "date": "2017-07-16",
    "time": "12:38:43",
    "source": "email_header",
    "raw_date": "7/16/2017 12:38:43 PM",
    "confidence": "high"
  },
  "HOUSE_OVERSIGHT_026449": {
    "date": "2017-07-25",
    "time": "22:03:41",
    "source": "email_header",
    "raw_date": "7/25/2017 10:03:41 PM",
    "confidence": "high"
  },
  "HOUSE_OVERSIGHT_026450": {
    "date": "2017-08-18",
    "time": "20:09:23",
    "source": "email_header",
    "raw_date": "8/18/2017 8:09:23 PM",
    "confidence": "high"
  },
  "HOUSE_OVERSIGHT_026451": {
    "date": "2017-09-26",
    "time": "00:23:33",
    "source": "email_header",
    "raw_date": "9/26/2017 12:23:33 AM",
    "confidence": "high"
  },
  "HOUSE_OVERSIGHT_026455": {
    "date": "2017-10-03",
    "time": "12:26:10",
    "source": "email_header",
    "raw_date": "10/3/2017 12:26:10 PM",
    "confidence": "high"
  },
  "HOUSE_OVERSIGHT_026459": {
    "date": "2017-11-16",
    "time": "23:47:23",
    "source": "email_header",
    "raw_date": "11/16/2017 11:47:23 PM",
    "confidence": "high"
  },
  "HOUSE_OVERSIGHT_026460": {
    "date": "2017-11-21",
    "time": "00:44:39",
    "source": "email_header",
    "raw_date": "11/21/2017 12:44:39 AM",
    "confidence": "high"
  },
  "HOUSE_OVERSIGHT_026461": {
    "date": "2017-12-02",
    "time": "14:36:15",
    "source": "email_header",
    "raw_date": "12/2/2017 2:36:15 PM",
    "confidence": "high"
  },
  "HOUSE_OVERSIGHT_026463": {
    "date": "2017-12-02",
    "time": "21:16:25",
    "source": "email_header",
    "raw_date": "12/2/2017 9:16:25 PM",
    "confidence": "high"
  },
  "HOUSE_OVERSIGHT_026466": {
    "date": "2018-01-24",
    "time": "11:35:28",
    "source": "email_header",
    "raw_date": "1/24/2018 11:35:28 AM",
    "confidence": "high"
  },
  "HOUSE_OVERSIGHT_026469": {
    "date": "2018-02-10",
    "time": "17:23:19",
    "source": "email_header",
    "raw_date": "2/10/2018 5:23:19 PM",
    "confidence": "high"
  },
  "HOUSE_OVERSIGHT_026473": {
    "date": "2018-02-24",
    "time": "12:58:14",
    "source": "email_header",
    "raw_date": "2/24/2018 12:58:14 PM",
    "confidence": "high"
  },
  "HOUSE_OVERSIGHT_026474": {
    "date": "2018-02-24",
    "time": "13:02:39",
    "source": "email_header",
    "raw_date": "2/24/2018 1:02:39 PM",
    "confidence": "high"
  },
  "HOUSE_OVERSIGHT_026475": {
    "date": "2018-03-24",
    "time": "12:23:00",
    "source": "email_header",
    "raw_date": "3/24/2018 12:23:00 PM",
    "confidence": "high"
  },
  "HOUSE_OVERSIGHT_026477": {
    "date": "2018-06-23",
    "time": "15:38:53",
    "source": "email_header",
    "raw_date": "6/23/2018 3:38:53 PM",
    "confidence": "high"
  },
  "HOUSE_OVERSIGHT_026484": {
    "date": "2018-06-23",
    "time": "16:01:37",
    "source": "email_header",
    "raw_date": "6/23/2018 4:01:37 PM",
    "confidence": "high"
  },
  "HOUSE_OVERSIGHT_026491": {
    "date": "2018-06-23",
    "time": "17:25:33",
    "source": "email_header",
    "raw_date": "6/23/2018 5:25:33 PM",
    "confidence": "high"
  },
  "HOUSE_OVERSIGHT_026499": {
    "date": "2018-08-09",
    "time": "10:47:00",
    "source": "email_header",
    "raw_date": "Thursday, August 9 2018 10:47 AM",
    "confidence": "high"
  },
  "HOUSE_OVERSIGHT_026505": {
    "date": "2018-08-23",
    "time": "15:16:47",
    "source": "email_header",
    "raw_date": "8/23/2018 3:16:47 PM",
    "confidence": "high"
  },
  "HOUSE_OVERSIGHT_026507": {
    "date": "2018-08-24",
    "time": "12:47:43",
    "source": "email_header",
    "raw_date": "8/24/2018 12:47:43 PM",
    "confidence": "high"
  },
  "HOUSE_OVERSIGHT_026508": {
    "date": "2018-09-12",
    "time": "18:15:20",
    "source": "email_header",
    "raw_date": "9/12/2018 6:15:20 PM",
    "confidence": "high"
  },
  "HOUSE_OVERSIGHT_026512": {
    "date": "2018-11-05",
    "time": "20:23:58",
    "source": "email_header",
    "raw_date": "11/5/2018 8:23:58 PM",
    "confidence": "high"
  },
  "HOUSE_OVERSIGHT_026514": {
    "date": "2019-05-23",
    "time": "00:53:04",
    "source": "email_header",
    "raw_date": "5/23/2019 12:53:04 AM",
    "confidence": "high"
  },
  "HOUSE_OVERSIGHT_026515": {
    "date": "2019-05-23",
    "time": "01:11:24",
    "source": "email_header",
    "raw_date": "5/23/2019 1:11:24 AM",
    "confidence": "high"
  },
  "HOUSE_OVERSIGHT_026517": {
    "date": "2013-08-19",
    "time": "07:35:50",
    "source": "email_header",
    "raw_date": "Mon, 19 Aug 2013 07:35:50 -0700",
    "confidence": "high"
  },
  "HOUSE_OVERSIGHT_026519": {
    "date": "2013-09-03",
    "time": null,
    "source": "content_parsed",
    "raw_date": "9/3/2013",
    "confidence": "low"
  },
  "HOUSE_OVERSIGHT_026520": {
    "date": null,
    "time": null,
    "source": "unknown",
    "raw_date": null,
    "confidence": "none"
  },
  "HOUSE_OVERSIGHT_026521": {
    "date": "2013-11-26",
    "time": null,
    "source": "metadata",
    "raw_date": "11/26/2013",
    "confidence": "medium"
  },
  "HOUSE_OVERSIGHT_026543": {
    "date": "2014-02-27",
    "time": null,
    "source": "content_parsed",
    "raw_date": "02/27/2014",
    "confidence": "low"
  },
  "HOUSE_OVERSIGHT_026547": {
    "date": "2014-04-23",
    "time": null,
    "source": "content_parsed",
    "raw_date": "4/23/2014",
    "confidence": "low"
  },
  "HOUSE_OVERSIGHT_026548": {
    "date": "2014-06-07",
    "time": "17:00:22",
    "source": "email_header",
    "raw_date": "6/7/2014 5:00:22 PM",
    "confidence": "high"
  },
  "HOUSE_OVERSIGHT_026549": {
    "date": "2012-03-19",
    "time": "17:59:00",
    "source": "email_header",
    "raw_date": "Monday, March 19 2012 05:59 PM",
    "confidence": "high"
  },
  "HOUSE_OVERSIGHT_026551": {
    "date": "2012-04-24",
    "time": null,
    "source": "content_parsed",
    "raw_date": "4/24/2012",
    "confidence": "low"
  },
  "HOUSE_OVERSIGHT_026563": {
    "date": "2012-05-07",
    "time": "23:27:15",
    "source": "email_header",
    "raw_date": "5/7/2012 11:27:15 PM",
    "confidence": "high"
  },
  "HOUSE_OVERSIGHT_026565": {
    "date": "2012-06-28",
    "time": null,
    "source": "metadata",
    "raw_date": "06/28/2012",
    "confidence": "medium"
  },
  "HOUSE_OVERSIGHT_026567": {
    "date": "2012-07-10",
    "time": "22:56:42",
    "source": "email_header",
    "raw_date": "7/10/2012 10:56:42 PM",
    "confidence": "high"
  },
  "HOUSE_OVERSIGHT_026569": {
    "date": "2012-08-20",
    "time": null,
    "source": "content_parsed",
    "raw_date": "Mon, Aug 20, 2012",
    "confidence": "low"
  },
  "HOUSE_OVERSIGHT_026571": {
    "date": "2012-11-02",
    "time": null,
    "source": "content_parsed",
    "raw_date": "11/2/2012",
    "confidence": "low"
  },
  "HOUSE_OVERSIGHT_026572": {
    "date": "2012-11-09",
    "time": null,
    "source": "metadata",
    "raw_date": "11/09/2012",
    "confidence": "medium"
  },
  "HOUSE_OVERSIGHT_026580": {
    "date": "2013-01-29",
    "time": "16:46:00",
    "source": "email_header",
    "raw_date": "Tuesday, January 29 2013 04:46 PM",
    "confidence": "high"
  },
  "HOUSE_OVERSIGHT_026582": {
    "date": "2013-01-25",
    "time": null,
    "source": "metadata",
    "raw_date": "01/25/2013",
    "confidence": "medium"
  },
  "HOUSE_OVERSIGHT_026583": {
    "date": null,
    "time": null,
    "source": "unknown",
    "raw_date": null,
    "confidence": "none"
  },
  "HOUSE_OVERSIGHT_026584": {
    "date": "2009-07-08",
    "time": null,
    "source": "metadata",
    "raw_date": "07/08/2009",
    "confidence": "medium"
  },
  "HOUSE_OVERSIGHT_026598": {
    "date": "2013-01-19",
    "time": null,
    "source": "content_parsed",
    "raw_date": "PST, January 19, 2013",
    "confidence": "low"
  },
  "HOUSE_OVERSIGHT_026601": {
    "date": "2013-04-25",
    "time": null,
    "source": "content_parsed",
    "raw_date": "4/25/2013",
    "confidence": "low"
  },
  "HOUSE_OVERSIGHT_026603": {
    "date": "2014-10-23",
    "time": "17:09:04",
    "source": "email_header",
    "raw_date": "10/23/2014 5:09:04 PM",
    "confidence": "high"
  },
  "HOUSE_OVERSIGHT_026605": {
    "date": "2014-10-24",
    "time": "18:25:22",
    "source": "email_header",
    "raw_date": "10/24/2014 6:25:22 PM",
    "confidence": "high"
  },
  "HOUSE_OVERSIGHT_026607": {
    "date": "2014-11-07",
    "time": null,
    "source": "content_parsed",
    "raw_date": "Friday, November 7, 2014",
    "confidence": "low"
  },
  "HOUSE_OVERSIGHT_026609": {
    "date": "2015-01-24",
    "time": "05:22:00",
    "source": "email_header",
    "raw_date": "Saturday, January 24 2015 05:22 AM",
    "confidence": "high"
  },
  "HOUSE_OVERSIGHT_026612": {
    "date": "2015-03-29",
    "time": "14:22:23",
    "source": "email_header",
    "raw_date": "3/29/2015 2:22:23 PM",
    "confidence": "high"
  },
  "HOUSE_OVERSIGHT_026618": {
    "date": "2015-04-23",
    "time": "15:31:35",
    "source": "email_header",
    "raw_date": "4/23/2015 3:31:35 PM",
    "confidence": "high"
  },
  "HOUSE_OVERSIGHT_026619": {
    "date": "2015-07-23",
    "time": "19:39:58",
    "source": "email_header",
    "raw_date": "7/23/2015 7:39:58 PM",
    "confidence": "high"
  },
  "HOUSE_OVERSIGHT_026620": {
    "date": "2015-08-04",
    "time": "22:23:22",
    "source": "email_header",
    "raw_date": "8/4/2015 10:23:22 PM",
    "confidence": "high"
  },
  "HOUSE_OVERSIGHT_026623": {
    "date": "2016-09-23",
    "time": "15:03:49",
    "source": "email_header",
    "raw_date": "9/23/2016 3:03:49 PM",
    "confidence": "high"
  },
  "HOUSE_OVERSIGHT_026624": {
    "date": null,
    "time": null,
    "source": "unknown",
    "raw_date": null,
    "confidence": "none"
  },
  "HOUSE_OVERSIGHT_026625": {
    "date": "2016-10-18",
    "time": null,
    "source": "content_parsed",
    "raw_date": "10/18/2016",
    "confidence": "low"
  },
  "HOUSE_OVERSIGHT_026626": {
    "date": "2016-10-25",
    "time": null,
    "source": "content_parsed",
    "raw_date": "10/25/2016",
    "confidence": "low"
  },
  "HOUSE_OVERSIGHT_026627": {
    "date": "2016-10-24",
    "time": null,
    "source": "metadata",
    "raw_date": "10/24/2016",
    "confidence": "medium"
  },
  "HOUSE_OVERSIGHT_026630": {
    "date": "2016-10-28",
    "time": "12:34:36",
    "source": "email_header",
    "raw_date": "10/28/2016 12:34:36 PM",
    "confidence": "high"
  },
  "HOUSE_OVERSIGHT_026631": {
    "date": "2016-10-30",
    "time": "16:40:14",
    "source": "email_header",
    "raw_date": "10/30/2016 4:40:14 PM",
    "confidence": "high"
  },
  "HOUSE_OVERSIGHT_026632": {
    "date": "2016-11-01",
    "time": "18:45:15",
    "source": "email_header",
    "raw_date": "11/1/2016 6:45:15 PM",
    "confidence": "high"
  },
  "HOUSE_OVERSIGHT_026634": {
    "date": null,
    "time": null,
    "source": "unknown",
    "raw_date": null,
    "confidence": "none"
  },
  "HOUSE_OVERSIGHT_026635": {
    "date": "2016-11-29",
    "time": "15:37:46",
    "source": "email_header",
    "raw_date": "11/29/2016 3:37:46 PM",
    "confidence": "high"
  },
  "HOUSE_OVERSIGHT_026637": {
    "date": "2016-11-29",
    "time": "18:33:42",
    "source": "email_header",
    "raw_date": "11/29/2016 6:33:42 PM",
    "confidence": "high"
  },
  "HOUSE_OVERSIGHT_026648": {
    "date": null,
    "time": null,
    "source": "unknown",
    "raw_date": null,
    "confidence": "none"
  },
  "HOUSE_OVERSIGHT_026650": {
    "date": "2017-01-19",
    "time": "23:12:21",
    "source": "email_header",
    "raw_date": "1/19/2017 11:12:21 PM",
    "confidence": "high"
  },
  "HOUSE_OVERSIGHT_026651": {
    "date": "2017-01-23",
    "time": "12:38:34",
    "source": "email_header",
    "raw_date": "1/23/2017 12:38:34 PM",
    "confidence": "high"
  },
  "HOUSE_OVERSIGHT_026652": {
    "date": "2017-01-24",
    "time": "16:21:55",
    "source": "email_header",
    "raw_date": "1/24/2017 4:21:55 PM",
    "confidence": "high"
  },
  "HOUSE_OVERSIGHT_026659": {
    "date": "2017-01-24",
    "time": null,
    "source": "content_parsed",
    "raw_date": "Tue, Jan 24, 2017",
    "confidence": "low"
  },
  "HOUSE_OVERSIGHT_026661": {
    "date": "2017-01-25",
    "time": "15:23:20",
    "source": "email_header",
    "raw_date": "1/25/2017 3:23:20 PM",
    "confidence": "high"
  },
  "HOUSE_OVERSIGHT_026662": {
    "date": "2017-02-13",
    "time": "23:08:13",
    "source": "email_header",
    "raw_date": "2/13/2017 11:08:13 PM",
    "confidence": "high"
  },
  "HOUSE_OVERSIGHT_026663": {
    "date": "2017-02-15",
    "time": "19:04:23",
    "source": "email_header",
    "raw_date": "2/15/2017 7:04:23 PM",
    "confidence": "high"
  },
  "HOUSE_OVERSIGHT_026668": {
    "date": "2017-02-17",
    "time": null,
    "source": "metadata",
    "raw_date": "02/17/2017",
    "confidence": "medium"
  },
  "HOUSE_OVERSIGHT_026672": {
    "date": "2017-03-17",
    "time": "16:29:23",
    "source": "email_header",
    "raw_date": "3/17/2017 4:29:23 PM",
    "confidence": "high"
  },
  "HOUSE_OVERSIGHT_026673": {
    "date": "2017-04-16",
    "time": "15:23:31",
    "source": "email_header",
    "raw_date": "4/16/2017 3:23:31 PM",
    "confidence": "high"
  },
  "HOUSE_OVERSIGHT_026674": {
    "date": "2017-04-22",
    "time": "17:46:37",
    "source": "email_header",
    "raw_date": "4/22/2017 5:46:37 PM",
    "confidence": "high"
  },
  "HOUSE_OVERSIGHT_026675": {
    "date": "2017-06-23",
    "time": null,
    "source": "content_parsed",
    "raw_date": "Friday, June 23, 2017",
    "confidence": "low"
  },
  "HOUSE_OVERSIGHT_026677": {
    "date": "2017-06-30",
    "time": "02:23:16",
    "source": "email_header",
    "raw_date": "6/30/2017 2:23:16 AM",
    "confidence": "high"
  },
  "HOUSE_OVERSIGHT_026678": {
    "date": null,
    "time": null,
    "source": "unknown",
    "raw_date": null,
    "confidence": "none"
  },
  "HOUSE_OVERSIGHT_026679": {
    "date": "2017-06-01",
    "time": null,
    "source": "metadata",
    "raw_date": "06/01/2017",
    "confidence": "medium"
  },
  "HOUSE_OVERSIGHT_026731": {
    "date": "2014-11-07",
    "time": null,
    "source": "metadata",
    "raw_date": "11/07/2014",
    "confidence": "medium"
  },
  "HOUSE_OVERSIGHT_026745": {
    "date": "2017-07-19",
    "time": "14:09:32",
    "source": "email_header",
    "raw_date": "7/19/2017 2:09:32 PM",
    "confidence": "high"
  },
  "HOUSE_OVERSIGHT_026747": {
    "date": "2017-07-17",
    "time": null,
    "source": "metadata",
    "raw_date": "07/17/2017",
    "confidence": "medium"
  },
  "HOUSE_OVERSIGHT_026751": {
    "date": "2017-08-07",
    "time": "21:23:29",
    "source": "email_header",
    "raw_date": "8/7/2017 9:23:29 PM",
    "confidence": "high"
  },
  "HOUSE_OVERSIGHT_026754": {
    "date": "2017-08-23",
    "time": "18:31:58",
    "source": "email_header",
    "raw_date": "8/23/2017 6:31:58 PM",
    "confidence": "high"
  },
  "HOUSE_OVERSIGHT_026755": {
    "date": "2017-09-05",
    "time": "22:18:41",
    "source": "email_header",
    "raw_date": "9/5/2017 10:18:41 PM",
    "confidence": "high"
  },
  "HOUSE_OVERSIGHT_026759": {
    "date": null,
    "time": null,
    "source": "unknown",
    "raw_date": null,
    "confidence": "none"
  },
  "HOUSE_OVERSIGHT_026761": {
    "date": "2017-09-13",
    "time": null,
    "source": "content_parsed",
    "raw_date": "9/13/2017",
    "confidence": "low"
  },
  "HOUSE_OVERSIGHT_026764": {
    "date": "2017-10-02",
    "time": null,
    "source": "content_parsed",
    "raw_date": "Monday, October 02, 2017",
    "confidence": "low"
  },
  "HOUSE_OVERSIGHT_026768": {
    "date": "2017-12-11",
    "time": "17:47:53",
    "source": "email_header",
    "raw_date": "12/11/2017 5:47:53 PM",
    "confidence": "high"
  },
  "HOUSE_OVERSIGHT_026777": {
    "date": "2018-01-04",
    "time": "15:19:23",
    "source": "email_header",
    "raw_date": "1/4/2018 3:19:23 PM",
    "confidence": "high"
  },
  "HOUSE_OVERSIGHT_026778": {
    "date": "2018-01-23",
    "time": "18:23:09",
    "source": "email_header",
    "raw_date": "1/23/2018 6:23:09 PM",
    "confidence": "high"
  },
  "HOUSE_OVERSIGHT_026786": {
    "date": "2018-01-26",
    "time": "17:29:23",
    "source": "email_header",
    "raw_date": "1/26/2018 5:29:23 PM",
    "confidence": "high"
  },
  "HOUSE_OVERSIGHT_026787": {
    "date": "2018-02-24",
    "time": "03:36:08",
    "source": "email_header",
    "raw_date": "2/24/2018 3:36:08 AM",
    "confidence": "high"
  },
  "HOUSE_OVERSIGHT_026788": {
    "date": "2018-03-13",
    "time": "16:21:17",
    "source": "email_header",
    "raw_date": "3/13/2018 4:21:17 PM",
    "confidence": "high"
  },
  "HOUSE_OVERSIGHT_026793": {
    "date": "2018-03-23",
    "time": null,
    "source": "metadata",
    "raw_date": "03/23/2018",
    "confidence": "medium"
  },
  "HOUSE_OVERSIGHT_026794": {
    "date": "2015-11-10",
    "time": null,
    "source": "content_parsed",
    "raw_date": "11/10/2015",
    "confidence": "low"
  },
  "HOUSE_OVERSIGHT_026825": {
    "date": "2015-11-20",
    "time": null,
    "source": "metadata",
    "raw_date": "11/20/2015",
    "confidence": "medium"
  },
  "HOUSE_OVERSIGHT_026827": {
    "date": null,
    "time": null,
    "source": "unknown",
    "raw_date": null,
    "confidence": "none"
  },
  "HOUSE_OVERSIGHT_026829": {
    "date": "2015-12-24",
    "time": "00:52:15",
    "source": "email_header",
    "raw_date": "12/24/2015 12:52:15 AM",
    "confidence": "high"
  },
  "HOUSE_OVERSIGHT_026834": {
    "date": "2016-02-19",
    "time": null,
    "source": "content_parsed",
    "raw_date": "2/19/2016",
    "confidence": "low"
  },
  "HOUSE_OVERSIGHT_026835": {
    "date": "2016-03-11",
    "time": "12:24:18",
    "source": "email_header",
    "raw_date": "3/11/2016 12:24:18 PM",
    "confidence": "high"
  },
  "HOUSE_OVERSIGHT_026840": {
    "date": "2016-05-04",
    "time": "18:06:21",
    "source": "email_header",
    "raw_date": "5/4/2016 6:06:21 PM",
    "confidence": "high"
  },
  "HOUSE_OVERSIGHT_026849": {
    "date": "2016-05-20",
    "time": "03:54:08",
    "source": "email_header",
    "raw_date": "5/20/2016 3:54:08 AM",
    "confidence": "high"
  },
  "HOUSE_OVERSIGHT_026851": {
    "date": null,
    "time": null,
    "source": "unknown",
    "raw_date": null,
    "confidence": "none"
  },
  "HOUSE_OVERSIGHT_026852": {
    "date": "2016-07-23",
    "time": "23:38:22",
    "source": "email_header",
    "raw_date": "7/23/2016 11:38:22 PM",
    "confidence": "high"
  },
  "HOUSE_OVERSIGHT_026854": {
    "date": "2016-06-20",
    "time": null,
    "source": "content_parsed",
    "raw_date": "06/20/2016",
    "confidence": "low"
  },
  "HOUSE_OVERSIGHT_026856": {
    "date": "2018-06-27",
    "time": null,
    "source": "metadata",
    "raw_date": "06/27/2018",
    "confidence": "medium"
  },
  "HOUSE_OVERSIGHT_026866": {
    "date": "2018-08-01",
    "time": "13:34:23",
    "source": "email_header",
    "raw_date": "8/1/2018 1:34:23 PM",
    "confidence": "high"
  },
  "HOUSE_OVERSIGHT_026868": {
    "date": "2018-09-18",
    "time": null,
    "source": "content_parsed",
    "raw_date": "Kuhn, September 18, 2018",
    "confidence": "low"
  },
  "HOUSE_OVERSIGHT_026877": {
    "date": "2018-09-18",
    "time": null,
    "source": "content_parsed",
    "raw_date": "Kuhn, September 18, 2018",
    "confidence": "low"
  },
  "HOUSE_OVERSIGHT_026887": {
    "date": "2018-09-18",
    "time": null,
    "source": "content_parsed",
    "raw_date": "Kuhn, September 18, 2018",
    "confidence": "low"
  },
  "HOUSE_OVERSIGHT_026893": {
    "date": "2018-10-15",
    "time": "18:56:57",
    "source": "email_header",
    "raw_date": "10/15/2018 6:56:57 PM",
    "confidence": "high"
  },
  "HOUSE_OVERSIGHT_026909": {
    "date": "2018-10-15",
    "time": null,
    "source": "metadata",
    "raw_date": "10/15/2018",
    "confidence": "medium"
  },
  "HOUSE_OVERSIGHT_026924": {
    "date": "2018-12-20",
    "time": "20:09:23",
    "source": "email_header",
    "raw_date": "12/20/2018 8:09:23 PM",
    "confidence": "high"
  },
  "HOUSE_OVERSIGHT_026934": {
    "date": "2018-12-23",
    "time": "22:57:55",
    "source": "email_header",
    "raw_date": "12/23/2018 10:57:55 PM",
    "confidence": "high"
  },
  "HOUSE_OVERSIGHT_026935": {
    "date": "2019-01-10",
    "time": "20:23:40",
    "source": "email_header",
    "raw_date": "1/10/2019 8:23:40 PM",
    "confidence": "high"
  },
  "HOUSE_OVERSIGHT_026936": {
    "date": "2019-01-23",
    "time": "19:12:03",
    "source": "email_header",
    "raw_date": "1/23/2019 7:12:03 PM",
    "confidence": "high"
  },
  "HOUSE_OVERSIGHT_026937": {
    "date": "2019-02-08",
    "time": "13:23:55",
    "source": "email_header",
    "raw_date": "2/8/2019 1:23:55 PM",
    "confidence": "high"
  },
  "HOUSE_OVERSIGHT_026938": {
    "date": "2019-03-30",
    "time": "04:23:32",
    "source": "email_header",
    "raw_date": "3/30/2019 4:23:32 AM",
    "confidence": "high"
  },
  "HOUSE_OVERSIGHT_026942": {
    "date": "2019-04-18",
    "time": "13:39:23",
    "source": "email_header",
    "raw_date": "4/18/2019 1:39:23 PM",
    "confidence": "high"
  },
  "HOUSE_OVERSIGHT_026943": {
    "date": null,
    "time": null,
    "source": "unknown",
    "raw_date": null,
    "confidence": "none"
  },
  "HOUSE_OVERSIGHT_026944": {
    "date": "2019-05-05",
    "time": null,
    "source": "content_parsed",
    "raw_date": "Gulf, May 5, 2019",
    "confidence": "low"
  },
  "HOUSE_OVERSIGHT_026970": {
    "date": "2019-06-06",
    "time": "08:06:22",
    "source": "email_header",
    "raw_date": "6/6/2019 8:06:22 AM",
    "confidence": "high"
  },
  "HOUSE_OVERSIGHT_026975": {
    "date": "2019-06-13",
    "time": "10:17:44",
    "source": "email_header",
    "raw_date": "6/13/2019 10:17:44 AM",
    "confidence": "high"
  },
  "HOUSE_OVERSIGHT_026980": {
    "date": "2019-06-23",
    "time": "19:04:40",
    "source": "email_header",
    "raw_date": "6/23/2019 7:04:40 PM",
    "confidence": "high"
  },
  "HOUSE_OVERSIGHT_026985": {
    "date": "2019-06-25",
    "time": "08:15:05",
    "source": "email_header",
    "raw_date": "6/25/2019 8:15:05 AM",
    "confidence": "high"
  },
  "HOUSE_OVERSIGHT_026998": {
    "date": "2019-06-25",
    "time": "22:23:28",
    "source": "email_header",
    "raw_date": "6/25/2019 10:23:28 PM",
    "confidence": "high"
  },
  "HOUSE_OVERSIGHT_026999": {
    "date": "2019-06-27",
    "time": null,
    "source": "content_parsed",
    "raw_date": "6/27/2019",
    "confidence": "low"
  },
  "HOUSE_OVERSIGHT_027004": {
    "date": null,
    "time": null,
    "source": "unknown",
    "raw_date": null,
    "confidence": "none"
  },
  "HOUSE_OVERSIGHT_027009": {
    "date": "2013-03-04",
    "time": null,
    "source": "metadata",
    "raw_date": "03/04/2013",
    "confidence": "medium"
  },
  "HOUSE_OVERSIGHT_027024": {
    "date": "2013-05-15",
    "time": null,
    "source": "content_parsed",
    "raw_date": "PDT, May 15, 2013",
    "confidence": "low"
  },
  "HOUSE_OVERSIGHT_027028": {
    "date": "2013-05-23",
    "time": "03:15:37",
    "source": "email_header",
    "raw_date": "5/23/2013 3:15:37 AM",
    "confidence": "high"
  },
  "HOUSE_OVERSIGHT_027030": {
    "date": "2013-05-23",
    "time": "11:45:14",
    "source": "email_header",
    "raw_date": "5/23/2013 11:45:14 AM",
    "confidence": "high"
  },
  "HOUSE_OVERSIGHT_027032": {
    "date": "2013-09-16",
    "time": "11:12:33",
    "source": "email_header",
    "raw_date": "9/16/2013 11:12:33 AM",
    "confidence": "high"
  },
  "HOUSE_OVERSIGHT_027034": {
    "date": "2013-09-17",
    "time": "20:55:54",
    "source": "email_header",
    "raw_date": "9/17/2013 8:55:54 PM",
    "confidence": "high"
  },
  "HOUSE_OVERSIGHT_027035": {
    "date": "2013-10-05",
    "time": "17:59:23",
    "source": "email_header",
    "raw_date": "10/5/2013 5:59:23 PM",
    "confidence": "high"
  },
  "HOUSE_OVERSIGHT_027036": {
    "date": "2013-10-05",
    "time": "19:26:32",
    "source": "email_header",
    "raw_date": "10/5/2013 7:26:32 PM",
    "confidence": "high"
  },
  "HOUSE_OVERSIGHT_027038": {
    "date": "2013-10-06",
    "time": "02:59:43",
    "source": "email_header",
    "raw_date": "10/6/2013 2:59:43 AM",
    "confidence": "high"
  },
  "HOUSE_OVERSIGHT_027041": {
    "date": "2013-10-06",
    "time": "12:57:52",
    "source": "email_header",
    "raw_date": "10/6/2013 12:57:52 PM",
    "confidence": "high"
  },
  "HOUSE_OVERSIGHT_027044": {
    "date": "2018-06-10",
    "time": "12:23:04",
    "source": "email_header",
    "raw_date": "6/10/2018 12:23:04 PM",
    "confidence": "high"
  },
  "HOUSE_OVERSIGHT_027045": {
    "date": "2018-06-10",
    "time": "12:35:20",
    "source": "email_header",
    "raw_date": "6/10/2018 12:35:20 PM",
    "confidence": "high"
  },
  "HOUSE_OVERSIGHT_027046": {
    "date": "2012-01-12",
    "time": "15:23:25",
    "source": "email_header",
    "raw_date": "1/12/2012 3:23:25 PM",
    "confidence": "high"
  },
  "HOUSE_OVERSIGHT_027048": {
    "date": "2012-01-23",
    "time": "15:16:01",
    "source": "email_header",
    "raw_date": "1/23/2012 3:16:01 PM",
    "confidence": "high"
  },
  "HOUSE_OVERSIGHT_027049": {
    "date": "2012-05-07",
    "time": "23:21:03",
    "source": "email_header",
    "raw_date": "5/7/2012 11:21:03 PM",
    "confidence": "high"
  },
  "HOUSE_OVERSIGHT_027051": {
    "date": "2012-05-03",
    "time": null,
    "source": "metadata",
    "raw_date": "05/03/2012",
    "confidence": "medium"
  },
  "HOUSE_OVERSIGHT_027053": {
    "date": "2012-05-07",
    "time": null,
    "source": "content_parsed",
    "raw_date": "Monday, May 07, 2012",
    "confidence": "low"
  },
  "HOUSE_OVERSIGHT_027056": {
    "date": "2012-05-07",
    "time": null,
    "source": "content_parsed",
    "raw_date": "Monday, May 07, 2012",
    "confidence": "low"
  },
  "HOUSE_OVERSIGHT_027059": {
    "date": "2013-01-01",
    "time": "00:51:25",
    "source": "email_header",
    "raw_date": "1/1/2013 12:51:25 AM",
    "confidence": "high"
  },
  "HOUSE_OVERSIGHT_027061": {
    "date": "2017-04-16",
    "time": "15:26:55",
    "source": "email_header",
    "raw_date": "4/16/2017 3:26:55 PM",
    "confidence": "high"
  },
  "HOUSE_OVERSIGHT_027062": {
    "date": "2018-03-24",
    "time": "01:49:52",
    "source": "email_header",
    "raw_date": "3/24/2018 1:49:52 AM",
    "confidence": "high"
  },
  "HOUSE_OVERSIGHT_027063": {
    "date": "2018-10-12",
    "time": "19:27:19",
    "source": "email_header",
    "raw_date": "10/12/2018 7:27:19 PM",
    "confidence": "high"
  },
  "HOUSE_OVERSIGHT_027067": {
    "date": "2018-08-23",
    "time": "20:26:12",
    "source": "email_header",
    "raw_date": "8/23/2018 8:26:12 PM",
    "confidence": "high"
  },
  "HOUSE_OVERSIGHT_027068": {
    "date": null,
    "time": null,
    "source": "unknown",
    "raw_date": null,
    "confidence": "none"
  },
  "HOUSE_OVERSIGHT_027071": {
    "date": "2018-10-24",
    "time": null,
    "source": "metadata",
    "raw_date": "10/24/2018",
    "confidence": "medium"
  },
  "HOUSE_OVERSIGHT_027074": {
    "date": "2016-07-27",
    "time": null,
    "source": "metadata",
    "raw_date": "07/27/2016",
    "confidence": "medium"
  },
  "HOUSE_OVERSIGHT_027094": {
    "date": "2018-12-23",
    "time": null,
    "source": "content_parsed",
    "raw_date": "12/23/2018",
    "confidence": "low"
  },
  "HOUSE_OVERSIGHT_027095": {
    "date": "2018-12-23",
    "time": "16:04:58",
    "source": "email_header",
    "raw_date": "12/23/2018 4:04:58 PM",
    "confidence": "high"
  },
  "HOUSE_OVERSIGHT_027096": {
    "date": "2019-02-23",
    "time": null,
    "source": "content_parsed",
    "raw_date": "Saturday, February 23, 2019",
    "confidence": "low"
  },
  "HOUSE_OVERSIGHT_027097": {
    "date": "2012-01-12",
    "time": "16:57:10",
    "source": "email_header",
    "raw_date": "1/12/2012 4:57:10 PM",
    "confidence": "high"
  },
  "HOUSE_OVERSIGHT_027099": {
    "date": "2012-08-27",
    "time": "11:05:23",
    "source": "email_header",
    "raw_date": "8/27/2012 11:05:23 AM",
    "confidence": "high"
  },
  "HOUSE_OVERSIGHT_027102": {
    "date": "2013-02-11",
    "time": "17:45:09",
    "source": "email_header",
    "raw_date": "2/11/2013 5:45:09 PM",
    "confidence": "high"
  },
  "HOUSE_OVERSIGHT_027126": {
    "date": "2013-09-16",
    "time": "11:15:03",
    "source": "email_header",
    "raw_date": "9/16/2013 11:15:03 AM",
    "confidence": "high"
  },
  "HOUSE_OVERSIGHT_027128": {
    "date": "2017-01-20",
    "time": null,
    "source": "content_parsed",
    "raw_date": "2017-01-20",
    "confidence": "low"
  },
  "HOUSE_OVERSIGHT_027133": {
    "date": "2017-01-27",
    "time": null,
    "source": "content_parsed",
    "raw_date": "2017-01-27",
    "confidence": "low"
  },
  "HOUSE_OVERSIGHT_027141": {
    "date": "2017-01-28",
    "time": null,
    "source": "content_parsed",
    "raw_date": "2017-01-28",
    "confidence": "low"
  },
  "HOUSE_OVERSIGHT_027148": {
    "date": "2017-02-18",
    "time": null,
    "source": "content_parsed",
    "raw_date": "2017-02-18",
    "confidence": "low"
  },
  "HOUSE_OVERSIGHT_027165": {
    "date": "2017-02-23",
    "time": null,
    "source": "content_parsed",
    "raw_date": "2017-02-23",
    "confidence": "low"
  },
  "HOUSE_OVERSIGHT_027184": {
    "date": "2017-03-15",
    "time": null,
    "source": "content_parsed",
    "raw_date": "2017-03-15",
    "confidence": "low"
  },
  "HOUSE_OVERSIGHT_027214": {
    "date": "2017-03-17",
    "time": null,
    "source": "content_parsed",
    "raw_date": "2017-03-17",
    "confidence": "low"
  },
  "HOUSE_OVERSIGHT_027217": {
    "date": "2017-03-23",
    "time": null,
    "source": "content_parsed",
    "raw_date": "2017-03-23",
    "confidence": "low"
  },
  "HOUSE_OVERSIGHT_027221": {
    "date": "2017-03-29",
    "time": null,
    "source": "content_parsed",
    "raw_date": "2017-03-29",
    "confidence": "low"
  },
  "HOUSE_OVERSIGHT_027225": {
    "date": "2017-04-09",
    "time": null,
    "source": "content_parsed",
    "raw_date": "2017-04-09",
    "confidence": "low"
  },
  "HOUSE_OVERSIGHT_027232": {
    "date": "2017-04-20",
    "time": null,
    "source": "content_parsed",
    "raw_date": "2017-04-20",
    "confidence": "low"
  },
  "HOUSE_OVERSIGHT_027244": {
    "date": "2017-06-30",
    "time": null,
    "source": "content_parsed",
    "raw_date": "2017-06-30",
    "confidence": "low"
  },
  "HOUSE_OVERSIGHT_027248": {
    "date": "2017-09-27",
    "time": null,
    "source": "content_parsed",
    "raw_date": "2017-09-27",
    "confidence": "low"
  },
  "HOUSE_OVERSIGHT_027250": {
    "date": "2017-10-20",
    "time": null,
    "source": "content_parsed",
    "raw_date": "2017-10-20",
    "confidence": "low"
  },
  "HOUSE_OVERSIGHT_027255": {
    "date": "2018-01-25",
    "time": null,
    "source": "content_parsed",
    "raw_date": "2018-01-25",
    "confidence": "low"
  },
  "HOUSE_OVERSIGHT_027257": {
    "date": "2018-03-14",
    "time": null,
    "source": "content_parsed",
    "raw_date": "2018-03-14",
    "confidence": "low"
  },
  "HOUSE_OVERSIGHT_027260": {
    "date": "2018-04-09",
    "time": null,
    "source": "content_parsed",
    "raw_date": "2018-04-09",
    "confidence": "low"
  },
  "HOUSE_OVERSIGHT_027275": {
    "date": "2018-04-10",
    "time": null,
    "source": "content_parsed",
    "raw_date": "2018-04-10",
    "confidence": "low"
  },
  "HOUSE_OVERSIGHT_027278": {
    "date": "2018-06-16",
    "time": null,
    "source": "content_parsed",
    "raw_date": "2018-06-16",
    "confidence": "low"
  },
  "HOUSE_OVERSIGHT_027281": {
    "date": "2018-06-17",
    "time": null,
    "source": "content_parsed",
    "raw_date": "2018-06-17",
    "confidence": "low"
  },
  "HOUSE_OVERSIGHT_027307": {
    "date": "2018-07-10",
    "time": null,
    "source": "content_parsed",
    "raw_date": "2018-07-10",
    "confidence": "low"
  },
  "HOUSE_OVERSIGHT_027330": {
    "date": "2018-07-17",
    "time": null,
    "source": "content_parsed",
    "raw_date": "2018-07-17",
    "confidence": "low"
  },
  "HOUSE_OVERSIGHT_027332": {
    "date": "2018-07-23",
    "time": null,
    "source": "content_parsed",
    "raw_date": "2018-07-23",
    "confidence": "low"
  },
  "HOUSE_OVERSIGHT_027333": {
    "date": "2018-07-26",
    "time": null,
    "source": "content_parsed",
    "raw_date": "2018-07-26",
    "confidence": "low"
  },
  "HOUSE_OVERSIGHT_027346": {
    "date": "2018-07-24",
    "time": null,
    "source": "content_parsed",
    "raw_date": "2018-07-24",
    "confidence": "low"
  },
  "HOUSE_OVERSIGHT_027365": {
    "date": "2018-07-31",
    "time": null,
    "source": "content_parsed",
    "raw_date": "2018-07-31",
    "confidence": "low"
  },
  "HOUSE_OVERSIGHT_027374": {
    "date": "2018-08-01",
    "time": null,
    "source": "content_parsed",
    "raw_date": "2018-08-01",
    "confidence": "low"
  },
  "HOUSE_OVERSIGHT_027396": {
    "date": "2018-08-20",
    "time": null,
    "source": "content_parsed",
    "raw_date": "2018-08-20",
    "confidence": "low"
  },
  "HOUSE_OVERSIGHT_027401": {
    "date": "2018-08-23",
    "time": null,
    "source": "content_parsed",
    "raw_date": "2018-08-23",
    "confidence": "low"
  },
  "HOUSE_OVERSIGHT_027406": {
    "date": "2018-09-23",
    "time": null,
    "source": "content_parsed",
    "raw_date": "2018-09-23",
    "confidence": "low"
  },
  "HOUSE_OVERSIGHT_027428": {
    "date": "2018-09-28",
    "time": null,
    "source": "content_parsed",
    "raw_date": "2018-09-28",
    "confidence": "low"
  },
  "HOUSE_OVERSIGHT_027434": {
    "date": "2018-09-30",
    "time": null,
    "source": "content_parsed",
    "raw_date": "2018-09-30",
    "confidence": "low"
  },
  "HOUSE_OVERSIGHT_027440": {
    "date": "2018-10-02",
    "time": null,
    "source": "content_parsed",
    "raw_date": "2018-10-02",
    "confidence": "low"
  },
  "HOUSE_OVERSIGHT_027445": {
    "date": "2018-10-09",
    "time": null,
    "source": "content_parsed",
    "raw_date": "2018-10-09",
    "confidence": "low"
  },
  "HOUSE_OVERSIGHT_027452": {
    "date": "2018-10-23",
    "time": null,
    "source": "content_parsed",
    "raw_date": "2018-10-23",
    "confidence": "low"
  },
  "HOUSE_OVERSIGHT_027455": {
    "date": "2018-10-24",
    "time": null,
    "source": "content_parsed",
    "raw_date": "2018-10-24",
    "confidence": "low"
  },
  "HOUSE_OVERSIGHT_027460": {
    "date": "2018-11-28",
    "time": null,
    "source": "content_parsed",
    "raw_date": "2018-11-28",
    "confidence": "low"
  },
  "HOUSE_OVERSIGHT_027515": {
    "date": "2018-11-29",
    "time": null,
    "source": "content_parsed",
    "raw_date": "2018-11-29",
    "confidence": "low"
  },
  "HOUSE_OVERSIGHT_027536": {
    "date": "2018-12-04",
    "time": null,
    "source": "content_parsed",
    "raw_date": "2018-12-04",
    "confidence": "low"
  },
  "HOUSE_OVERSIGHT_027549": {
    "date": "2018-12-10",
    "time": null,
    "source": "content_parsed",
    "raw_date": "2018-12-10",
    "confidence": "low"
  },
  "HOUSE_OVERSIGHT_027568": {
    "date": "2019-02-02",
    "time": null,
    "source": "content_parsed",
    "raw_date": "2019-02-02",
    "confidence": "low"
  },
  "HOUSE_OVERSIGHT_027576": {
    "date": "2019-02-13",
    "time": null,
    "source": "content_parsed",
    "raw_date": "2019-02-13",
    "confidence": "low"
  },
  "HOUSE_OVERSIGHT_027583": {
    "date": "2019-02-27",
    "time": null,
    "source": "content_parsed",
    "raw_date": "2019-02-27",
    "confidence": "low"
  },
  "HOUSE_OVERSIGHT_027585": {
    "date": "2019-03-07",
    "time": null,
    "source": "content_parsed",
    "raw_date": "2019-03-07",
    "confidence": "low"
  },
  "HOUSE_OVERSIGHT_027594": {
    "date": "2019-03-31",
    "time": null,
    "source": "content_parsed",
    "raw_date": "2019-03-31",
    "confidence": "low"
  },
  "HOUSE_OVERSIGHT_027650": {
    "date": "2019-05-06",
    "time": null,
    "source": "content_parsed",
    "raw_date": "2019-05-06",
    "confidence": "low"
  },
  "HOUSE_OVERSIGHT_027655": {
    "date": "2019-05-06",
    "time": null,
    "source": "content_parsed",
    "raw_date": "2019-05-06",
    "confidence": "low"
  },
  "HOUSE_OVERSIGHT_027694": {
    "date": "2019-05-13",
    "time": null,
    "source": "content_parsed",
    "raw_date": "2019-05-13",
    "confidence": "low"
  },
  "HOUSE_OVERSIGHT_027695": {
    "date": "2019-05-21",
    "time": null,
    "source": "content_parsed",
    "raw_date": "2019-05-21",
    "confidence": "low"
  },
  "HOUSE_OVERSIGHT_027707": {
    "date": "2019-05-22",
    "time": null,
    "source": "content_parsed",
    "raw_date": "2019-05-22",
    "confidence": "low"
  },
  "HOUSE_OVERSIGHT_027720": {
    "date": "2019-05-23",
    "time": null,
    "source": "content_parsed",
    "raw_date": "2019-05-23",
    "confidence": "low"
  },
  "HOUSE_OVERSIGHT_027722": {
    "date": "2019-06-01",
    "time": null,
    "source": "content_parsed",
    "raw_date": "2019-06-01",
    "confidence": "low"
  },
  "HOUSE_OVERSIGHT_027735": {
    "date": "2019-06-01",
    "time": null,
    "source": "content_parsed",
    "raw_date": "2019-06-01",
    "confidence": "low"
  },
  "HOUSE_OVERSIGHT_027762": {
    "date": "2019-06-12",
    "time": null,
    "source": "content_parsed",
    "raw_date": "2019-06-12",
    "confidence": "low"
  },
  "HOUSE_OVERSIGHT_027764": {
    "date": "2019-06-13",
    "time": null,
    "source": "content_parsed",
    "raw_date": "2019-06-13",
    "confidence": "low"
  },
  "HOUSE_OVERSIGHT_027774": {
    "date": "2019-06-13",
    "time": null,
    "source": "content_parsed",
    "raw_date": "2019-06-13",
    "confidence": "low"
  },
  "HOUSE_OVERSIGHT_027777": {
    "date": "2019-07-05",
    "time": null,
    "source": "content_parsed",
    "raw_date": "2019-07-05",
    "confidence": "low"
  },
  "HOUSE_OVERSIGHT_027792": {
    "date": "2019-07-05",
    "time": null,
    "source": "content_parsed",
    "raw_date": "2019-07-05",
    "confidence": "low"
  },
  "HOUSE_OVERSIGHT_027794": {
    "date": "2019-07-06",
    "time": null,
    "source": "content_parsed",
    "raw_date": "2019-07-06",
    "confidence": "low"
  },
  "HOUSE_OVERSIGHT_027849": {
    "date": "2017-11-29",
    "time": null,
    "source": "metadata",
    "raw_date": "11/29/2017",
    "confidence": "medium"
  },
  "HOUSE_OVERSIGHT_028281": {
    "date": "2017-01-30",
    "time": null,
    "source": "metadata",
    "raw_date": "01/30/2017",
    "confidence": "medium"
  },
  "HOUSE_OVERSIGHT_028326": {
    "date": "2018-09-25",
    "time": null,
    "source": "metadata",
    "raw_date": "09/25/2018",
    "confidence": "medium"
  },
  "HOUSE_OVERSIGHT_028336": {
    "date": "2018-09-25",
    "time": null,
    "source": "metadata",
    "raw_date": "09/25/2018",
    "confidence": "medium"
  },
  "HOUSE_OVERSIGHT_028347": {
    "date": "2018-09-24",
    "time": null,
    "source": "metadata",
    "raw_date": "09/24/2018",
    "confidence": "medium"
  },
  "HOUSE_OVERSIGHT_028375": {
    "date": "2018-09-25",
    "time": null,
    "source": "metadata",
    "raw_date": "09/25/2018",
    "confidence": "medium"
  },
  "HOUSE_OVERSIGHT_028382": {
    "date": "2018-09-25",
    "time": null,
    "source": "metadata",
    "raw_date": "09/25/2018",
    "confidence": "medium"
  },
  "HOUSE_OVERSIGHT_028397": {
    "date": "2018-09-25",
    "time": null,
    "source": "metadata",
    "raw_date": "09/25/2018",
    "confidence": "medium"
  },
  "HOUSE_OVERSIGHT_028406": {
    "date": "2018-09-25",
    "time": null,
    "source": "metadata",
    "raw_date": "09/25/2018",
    "confidence": "medium"
  },
  "HOUSE_OVERSIGHT_028413": {
    "date": "2018-09-25",
    "time": null,
    "source": "metadata",
    "raw_date": "09/25/2018",
    "confidence": "medium"
  },
  "HOUSE_OVERSIGHT_028425": {
    "date": "2018-09-25",
    "time": null,
    "source": "metadata",
    "raw_date": "09/25/2018",
    "confidence": "medium"
  },
  "HOUSE_OVERSIGHT_028432": {
    "date": "2018-09-25",
    "time": null,
    "source": "metadata",
    "raw_date": "09/25/2018",
    "confidence": "medium"
  },
  "HOUSE_OVERSIGHT_028440": {
    "date": "2018-09-25",
    "time": null,
    "source": "metadata",
    "raw_date": "09/25/2018",
    "confidence": "medium"
  },
  "HOUSE_OVERSIGHT_028446": {
    "date": "2018-09-25",
    "time": null,
    "source": "metadata",
    "raw_date": "09/25/2018",
    "confidence": "medium"
  },
  "HOUSE_OVERSIGHT_028453": {
    "date": "2018-09-25",
    "time": null,
    "source": "metadata",
    "raw_date": "09/25/2018",
    "confidence": "medium"
  },
  "HOUSE_OVERSIGHT_028467": {
    "date": "2018-09-25",
    "time": null,
    "source": "metadata",
    "raw_date": "09/25/2018",
    "confidence": "medium"
  },
  "HOUSE_OVERSIGHT_028481": {
    "date": "2018-03-10",
    "time": null,
    "source": "metadata",
    "raw_date": "03/10/2018",
    "confidence": "medium"
  },
  "HOUSE_OVERSIGHT_028482": {
    "date": "2015-08-04",
    "time": "22:00:42",
    "source": "email_header",
    "raw_date": "Tue, 4 Aug 2015 22:00:42 +0000",
    "confidence": "high"
  },
  "HOUSE_OVERSIGHT_028485": {
    "date": "2015-04-23",
    "time": "15:31:35",
    "source": "email_header",
    "raw_date": "4/23/2015 3:31:35 PM",
    "confidence": "high"
  },
  "HOUSE_OVERSIGHT_028486": {
    "date": "2015-04-23",
    "time": "13:34:41",
    "source": "email_header",
    "raw_date": "4/23/2015 1:34:41 PM",
    "confidence": "high"
  },
  "HOUSE_OVERSIGHT_028487": {
    "date": "2015-03-29",
    "time": "14:22:23",
    "source": "email_header",
    "raw_date": "3/29/2015 2:22:23 PM",
    "confidence": "high"
  },
  "HOUSE_OVERSIGHT_028493": {
    "date": "2018-01-04",
    "time": "15:19:23",
    "source": "email_header",
    "raw_date": "1/4/2018 3:19:23 PM",
    "confidence": "high"
  },
  "HOUSE_OVERSIGHT_028494": {
    "date": "2017-11-23",
    "time": "14:41:19",
    "source": "email_header",
    "raw_date": "11/23/2017 2:41:19 PM",
    "confidence": "high"
  },
  "HOUSE_OVERSIGHT_028497": {
    "date": "2017-11-20",
    "time": "20:09:46",
    "source": "email_header",
    "raw_date": "11/20/2017 8:09:46 PM",
    "confidence": "high"
  },
  "HOUSE_OVERSIGHT_028501": {
    "date": "2017-11-16",
    "time": "21:23:58",
    "source": "email_header",
    "raw_date": "11/16/2017 9:23:58 PM",
    "confidence": "high"
  },
  "HOUSE_OVERSIGHT_028505": {
    "date": "2017-07-16",
    "time": "12:23:00",
    "source": "email_header",
    "raw_date": "7/16/2017 12:23:00 PM",
    "confidence": "high"
  },
  "HOUSE_OVERSIGHT_028506": {
    "date": "2017-05-27",
    "time": "11:19:59",
    "source": "email_header",
    "raw_date": "5/27/2017 11:19:59 AM",
    "confidence": "high"
  },
  "HOUSE_OVERSIGHT_028507": {
    "date": "2017-05-08",
    "time": "15:23:05",
    "source": "email_header",
    "raw_date": "5/8/2017 3:23:05 PM",
    "confidence": "high"
  },
  "HOUSE_OVERSIGHT_028508": {
    "date": "2014-06-06",
    "time": "14:23:23",
    "source": "email_header",
    "raw_date": "6/6/2014 2:23:23 PM",
    "confidence": "high"
  },
  "HOUSE_OVERSIGHT_028513": {
    "date": "2019-06-12",
    "time": "11:23:58",
    "source": "email_header",
    "raw_date": "6/12/2019 11:23:58 AM",
    "confidence": "high"
  },
  "HOUSE_OVERSIGHT_028524": {
    "date": "2014-03-24",
    "time": "07:06:50",
    "source": "email_header",
    "raw_date": "3/24/2014 7:06:50 AM",
    "confidence": "high"
  },
  "HOUSE_OVERSIGHT_028529": {
    "date": "2014-01-13",
    "time": "20:14:00",
    "source": "email_header",
    "raw_date": "Monday, January 13 2014 08:14 PM",
    "confidence": "high"
  },
  "HOUSE_OVERSIGHT_028531": {
    "date": "2013-09-16",
    "time": "11:12:33",
    "source": "email_header",
    "raw_date": "9/16/2013 11:12:33 AM",
    "confidence": "high"
  },
  "HOUSE_OVERSIGHT_028533": {
    "date": "2018-08-22",
    "time": "19:23:38",
    "source": "email_header",
    "raw_date": "8/22/2018 7:23:38 PM",
    "confidence": "high"
  },
  "HOUSE_OVERSIGHT_028536": {
    "date": "2018-05-30",
    "time": "23:23:48",
    "source": "email_header",
    "raw_date": "5/30/2018 11:23:48 PM",
    "confidence": "high"
  },
  "HOUSE_OVERSIGHT_028540": {
    "date": null,
    "time": null,
    "source": "unknown",
    "raw_date": null,
    "confidence": "none"
  },
  "HOUSE_OVERSIGHT_028576": {
    "date": "2019-01-26",
    "time": "21:24:09",
    "source": "email_header",
    "raw_date": "1/26/2019 9:24:09 PM",
    "confidence": "high"
  },
  "HOUSE_OVERSIGHT_028589": {
    "date": "2019-01-26",
    "time": null,
    "source": "content_parsed",
    "raw_date": "Saturday, January 26, 2019",
    "confidence": "low"
  },
  "HOUSE_OVERSIGHT_028601": {
    "date": "2019-01-26",
    "time": "17:56:07",
    "source": "email_header",
    "raw_date": "1/26/2019 5:56:07 PM",
    "confidence": "high"
  },
  "HOUSE_OVERSIGHT_028611": {
    "date": "2019-01-23",
    "time": "02:42:14",
    "source": "email_header",
    "raw_date": "1/23/2019 2:42:14 AM",
    "confidence": "high"
  },
  "HOUSE_OVERSIGHT_028620": {
    "date": "2018-12-23",
    "time": "14:04:15",
    "source": "email_header",
    "raw_date": "12/23/2018 2:04:15 PM",
    "confidence": "high"
  },
  "HOUSE_OVERSIGHT_028621": {
    "date": "2013-08-26",
    "time": "14:46:00",
    "source": "email_header",
    "raw_date": "Monday, August 26 2013 02:46 PM",
    "confidence": "high"
  },
  "HOUSE_OVERSIGHT_028648": {
    "date": "2013-02-15",
    "time": "16:52:58",
    "source": "email_header",
    "raw_date": "2/15/2013 4:52:58 PM",
    "confidence": "high"
  },
  "HOUSE_OVERSIGHT_028675": {
    "date": "2013-02-15",
    "time": null,
    "source": "content_parsed",
    "raw_date": "2/15/2013",
    "confidence": "low"
  },
  "HOUSE_OVERSIGHT_028728": {
    "date": "2013-02-11",
    "time": "17:45:09",
    "source": "email_header",
    "raw_date": "2/11/2013 5:45:09 PM",
    "confidence": "high"
  },
  "HOUSE_OVERSIGHT_028752": {
    "date": "2012-08-20",
    "time": "13:23:57",
    "source": "email_header",
    "raw_date": "8/20/2012 1:23:57 PM",
    "confidence": "high"
  },
  "HOUSE_OVERSIGHT_028757": {
    "date": "2012-07-26",
    "time": "18:30:00",
    "source": "email_header",
    "raw_date": "Thursday, July 26 2012 06:30 PM",
    "confidence": "high"
  },
  "HOUSE_OVERSIGHT_028760": {
    "date": "2012-07-26",
    "time": "18:12:00",
    "source": "email_header",
    "raw_date": "Thursday, July 26 2012 06:12 PM",
    "confidence": "high"
  },
  "HOUSE_OVERSIGHT_028762": {
    "date": "2012-05-07",
    "time": null,
    "source": "content_parsed",
    "raw_date": "Monday, May 07, 2012",
    "confidence": "low"
  },
  "HOUSE_OVERSIGHT_028765": {
    "date": "2012-05-07",
    "time": null,
    "source": "content_parsed",
    "raw_date": "Monday, May 07, 2012",
    "confidence": "low"
  },
  "HOUSE_OVERSIGHT_028768": {
    "date": "2012-05-07",
    "time": "23:27:15",
    "source": "email_header",
    "raw_date": "5/7/2012 11:27:15 PM",
    "confidence": "high"
  },
  "HOUSE_OVERSIGHT_028770": {
    "date": "2012-05-07",
    "time": null,
    "source": "content_parsed",
    "raw_date": "Mon, May 7, 2012",
    "confidence": "low"
  },
  "HOUSE_OVERSIGHT_028773": {
    "date": "2012-05-07",
    "time": "23:21:03",
    "source": "email_header",
    "raw_date": "5/7/2012 11:21:03 PM",
    "confidence": "high"
  },
  "HOUSE_OVERSIGHT_028775": {
    "date": "2016-03-11",
    "time": "12:24:18",
    "source": "email_header",
    "raw_date": "3/11/2016 12:24:18 PM",
    "confidence": "high"
  },
  "HOUSE_OVERSIGHT_028780": {
    "date": "2016-02-19",
    "time": null,
    "source": "content_parsed",
    "raw_date": "2/19/2016",
    "confidence": "low"
  },
  "HOUSE_OVERSIGHT_028781": {
    "date": "2012-03-23",
    "time": "19:10:58",
    "source": "email_header",
    "raw_date": "3/23/2012 7:10:58 PM",
    "confidence": "high"
  },
  "HOUSE_OVERSIGHT_028784": {
    "date": "2012-03-19",
    "time": "17:59:00",
    "source": "email_header",
    "raw_date": "Monday, March 19 2012 05:59 PM",
    "confidence": "high"
  },
  "HOUSE_OVERSIGHT_028786": {
    "date": "2012-01-23",
    "time": "14:54:42",
    "source": "email_header",
    "raw_date": "1/23/2012 2:54:42 PM",
    "confidence": "high"
  },
  "HOUSE_OVERSIGHT_028787": {
    "date": "2012-01-12",
    "time": "16:57:10",
    "source": "email_header",
    "raw_date": "1/12/2012 4:57:10 PM",
    "confidence": "high"
  },
  "HOUSE_OVERSIGHT_028789": {
    "date": "2012-01-12",
    "time": null,
    "source": "content_parsed",
    "raw_date": "1/12/2012",
    "confidence": "low"
  },
  "HOUSE_OVERSIGHT_028791": {
    "date": "2016-05-18",
    "time": null,
    "source": "content_parsed",
    "raw_date": "5/18/2016",
    "confidence": "low"
  },
  "HOUSE_OVERSIGHT_028801": {
    "date": "2019-07-13",
    "time": "18:48:31",
    "source": "email_header",
    "raw_date": "7/13/2019 6:48:31 PM",
    "confidence": "high"
  },
  "HOUSE_OVERSIGHT_028815": {
    "date": null,
    "time": null,
    "source": "unknown",
    "raw_date": null,
    "confidence": "none"
  },
  "HOUSE_OVERSIGHT_028846": {
    "date": "2014-04-27",
    "time": "10:54:13",
    "source": "email_header",
    "raw_date": "4/27/2014 10:54:13 AM",
    "confidence": "high"
  },
  "HOUSE_OVERSIGHT_028847": {
    "date": "2014-04-27",
    "time": "14:34:04",
    "source": "email_header",
    "raw_date": "4/27/2014 2:34:04 PM",
    "confidence": "high"
  },
  "HOUSE_OVERSIGHT_028848": {
    "date": "2014-04-27",
    "time": "18:55:07",
    "source": "email_header",
    "raw_date": "4/27/2014 6:55:07 PM",
    "confidence": "high"
  },
  "HOUSE_OVERSIGHT_028849": {
    "date": "2014-04-27",
    "time": null,
    "source": "content_parsed",
    "raw_date": "Sun, Apr 27, 2014",
    "confidence": "low"
  },
  "HOUSE_OVERSIGHT_028850": {
    "date": "2014-04-27",
    "time": "18:57:02",
    "source": "email_header",
    "raw_date": "4/27/2014 6:57:02 PM",
    "confidence": "high"
  },
  "HOUSE_OVERSIGHT_028851": {
    "date": "2014-04-27",
    "time": null,
    "source": "content_parsed",
    "raw_date": "Sun, Apr 27, 2014",
    "confidence": "low"
  },
  "HOUSE_OVERSIGHT_028852": {
    "date": "2014-07-17",
    "time": "11:55:40",
    "source": "email_header",
    "raw_date": "7/17/2014 11:55:40 AM",
    "confidence": "high"
  },
  "HOUSE_OVERSIGHT_028854": {
    "date": "2014-09-19",
    "time": "11:54:57",
    "source": "email_header",
    "raw_date": "9/19/2014 11:54:57 AM",
    "confidence": "high"
  },
  "HOUSE_OVERSIGHT_028856": {
    "date": "2014-09-19",
    "time": "18:57:04",
    "source": "email_header",
    "raw_date": "9/19/2014 6:57:04 PM",
    "confidence": "high"
  },
  "HOUSE_OVERSIGHT_028859": {
    "date": "2014-09-19",
    "time": "18:59:27",
    "source": "email_header",
    "raw_date": "9/19/2014 6:59:27 PM",
    "confidence": "high"
  },
  "HOUSE_OVERSIGHT_028862": {
    "date": "2014-09-19",
    "time": "19:02:09",
    "source": "email_header",
    "raw_date": "9/19/2014 7:02:09 PM",
    "confidence": "high"
  },
  "HOUSE_OVERSIGHT_028866": {
    "date": "2014-09-19",
    "time": "19:44:17",
    "source": "email_header",
    "raw_date": "9/19/2014 7:44:17 PM",
    "confidence": "high"
  },
  "HOUSE_OVERSIGHT_028870": {
    "date": "2014-09-19",
    "time": "19:46:28",
    "source": "email_header",
    "raw_date": "9/19/2014 7:46:28 PM",
    "confidence": "high"
  },
  "HOUSE_OVERSIGHT_028875": {
    "date": "2014-09-19",
    "time": "21:12:49",
    "source": "email_header",
    "raw_date": "9/19/2014 9:12:49 PM",
    "confidence": "high"
  },
  "HOUSE_OVERSIGHT_028880": {
    "date": "2014-10-09",
    "time": "03:39:53",
    "source": "email_header",
    "raw_date": "10/9/2014 3:39:53 AM",
    "confidence": "high"
  },
  "HOUSE_OVERSIGHT_028882": {
    "date": "2014-10-27",
    "time": "13:48:05",
    "source": "email_header",
    "raw_date": "10/27/2014 1:48:05 PM",
    "confidence": "high"
  },
  "HOUSE_OVERSIGHT_028884": {
    "date": "2014-10-27",
    "time": "17:09:58",
    "source": "email_header",
    "raw_date": "10/27/2014 5:09:58 PM",
    "confidence": "high"
  },
  "HOUSE_OVERSIGHT_028887": {
    "date": "2014-05-12",
    "time": null,
    "source": "content_parsed",
    "raw_date": "05/12/2014",
    "confidence": "low"
  },
  "HOUSE_OVERSIGHT_028921": {
    "date": "2015-01-02",
    "time": "23:14:00",
    "source": "email_header",
    "raw_date": "Friday, January 2 2015 11:14 PM",
    "confidence": "high"
  },
  "HOUSE_OVERSIGHT_028924": {
    "date": "2015-01-04",
    "time": "11:45:43",
    "source": "email_header",
    "raw_date": "1/4/2015 11:45:43 AM",
    "confidence": "high"
  },
  "HOUSE_OVERSIGHT_028925": {
    "date": "2015-01-04",
    "time": "20:34:13",
    "source": "email_header",
    "raw_date": "1/4/2015 8:34:13 PM",
    "confidence": "high"
  },
  "HOUSE_OVERSIGHT_028926": {
    "date": "2015-03-19",
    "time": "20:40:59",
    "source": "email_header",
    "raw_date": "3/19/2015 8:40:59 PM",
    "confidence": "high"
  },
  "HOUSE_OVERSIGHT_028928": {
    "date": null,
    "time": null,
    "source": "unknown",
    "raw_date": null,
    "confidence": "none"
  },
  "HOUSE_OVERSIGHT_028931": {
    "date": "2015-09-10",
    "time": "17:52:30",
    "source": "email_header",
    "raw_date": "9/10/2015 5:52:30 PM",
    "confidence": "high"
  },
  "HOUSE_OVERSIGHT_028933": {
    "date": "2015-09-10",
    "time": null,
    "source": "content_parsed",
    "raw_date": "Thursday, September 10, 2015",
    "confidence": "low"
  },
  "HOUSE_OVERSIGHT_028936": {
    "date": "2015-09-10",
    "time": "20:09:42",
    "source": "email_header",
    "raw_date": "9/10/2015 8:09:42 PM",
    "confidence": "high"
  },
  "HOUSE_OVERSIGHT_028939": {
    "date": "2015-09-10",
    "time": "20:10:36",
    "source": "email_header",
    "raw_date": "9/10/2015 8:10:36 PM",
    "confidence": "high"
  },
  "HOUSE_OVERSIGHT_028942": {
    "date": "2015-10-25",
    "time": "13:02:26",
    "source": "email_header",
    "raw_date": "10/25/2015 1:02:26 PM",
    "confidence": "high"
  },
  "HOUSE_OVERSIGHT_028943": {
    "date": "2015-12-02",
    "time": "15:17:58",
    "source": "email_header",
    "raw_date": "12/2/2015 3:17:58 PM",
    "confidence": "high"
  },
  "HOUSE_OVERSIGHT_028946": {
    "date": "2015-12-02",
    "time": "16:55:05",
    "source": "email_header",
    "raw_date": "12/2/2015 4:55:05 PM",
    "confidence": "high"
  },
  "HOUSE_OVERSIGHT_028950": {
    "date": "2015-12-02",
    "time": "17:54:55",
    "source": "email_header",
    "raw_date": "12/2/2015 5:54:55 PM",
    "confidence": "high"
  },
  "HOUSE_OVERSIGHT_028955": {
    "date": "2015-12-07",
    "time": "19:01:10",
    "source": "email_header",
    "raw_date": "12/7/2015 7:01:10 PM",
    "confidence": "high"
  },
  "HOUSE_OVERSIGHT_028957": {
    "date": "2015-12-08",
    "time": "15:33:09",
    "source": "email_header",
    "raw_date": "12/8/2015 3:33:09 PM",
    "confidence": "high"
  },
  "HOUSE_OVERSIGHT_028958": {
    "date": "2015-12-08",
    "time": "17:58:45",
    "source": "email_header",
    "raw_date": "12/8/2015 5:58:45 PM",
    "confidence": "high"
  },
  "HOUSE_OVERSIGHT_028960": {
    "date": "2015-12-24",
    "time": "17:37:14",
    "source": "email_header",
    "raw_date": "12/24/2015 5:37:14 PM",
    "confidence": "high"
  },
  "HOUSE_OVERSIGHT_028964": {
    "date": "2016-03-20",
    "time": "19:33:11",
    "source": "email_header",
    "raw_date": "3/20/2016 7:33:11 PM",
    "confidence": "high"
  },
  "HOUSE_OVERSIGHT_028965": {
    "date": null,
    "time": null,
    "source": "unknown",
    "raw_date": null,
    "confidence": "none"
  },
  "HOUSE_OVERSIGHT_028968": {
    "date": "2016-04-28",
    "time": null,
    "source": "content_parsed",
    "raw_date": "Thursday, April 28, 2016",
    "confidence": "low"
  },
  "HOUSE_OVERSIGHT_028970": {
    "date": "2016-04-28",
    "time": "16:51:57",
    "source": "email_header",
    "raw_date": "4/28/2016 4:51:57 PM",
    "confidence": "high"
  },
  "HOUSE_OVERSIGHT_028972": {
    "date": "2016-04-28",
    "time": "16:59:27",
    "source": "email_header",
    "raw_date": "4/28/2016 4:59:27 PM",
    "confidence": "high"
  },
  "HOUSE_OVERSIGHT_028974": {
    "date": "2016-05-03",
    "time": "16:51:28",
    "source": "email_header",
    "raw_date": "5/3/2016 4:51:28 PM",
    "confidence": "high"
  },
  "HOUSE_OVERSIGHT_028976": {
    "date": "2016-05-04",
    "time": "18:25:26",
    "source": "email_header",
    "raw_date": "5/4/2016 6:25:26 PM",
    "confidence": "high"
  },
  "HOUSE_OVERSIGHT_028977": {
    "date": "2016-05-25",
    "time": "11:12:16",
    "source": "email_header",
    "raw_date": "5/25/2016 11:12:16 AM",
    "confidence": "high"
  },
  "HOUSE_OVERSIGHT_028978": {
    "date": "2016-05-25",
    "time": "11:19:00",
    "source": "email_header",
    "raw_date": "5/25/2016 11:19:00 AM",
    "confidence": "high"
  },
  "HOUSE_OVERSIGHT_028980": {
    "date": "2016-07-29",
    "time": "13:12:10",
    "source": "email_header",
    "raw_date": "7/29/2016 1:12:10 PM",
    "confidence": "high"
  },
  "HOUSE_OVERSIGHT_028985": {
    "date": "2016-08-08",
    "time": null,
    "source": "content_parsed",
    "raw_date": "8/8/2016",
    "confidence": "low"
  },
  "HOUSE_OVERSIGHT_028986": {
    "date": "2016-08-08",
    "time": null,
    "source": "content_parsed",
    "raw_date": "Mon, Aug 8, 2016",
    "confidence": "low"
  },
  "HOUSE_OVERSIGHT_028988": {
    "date": null,
    "time": null,
    "source": "unknown",
    "raw_date": null,
    "confidence": "none"
  },
  "HOUSE_OVERSIGHT_029003": {
    "date": "2016-09-17",
    "time": null,
    "source": "content_parsed",
    "raw_date": "Sat, Sep 17, 2016",
    "confidence": "low"
  },
  "HOUSE_OVERSIGHT_029005": {
    "date": "2016-09-17",
    "time": "12:33:56",
    "source": "email_header",
    "raw_date": "9/17/2016 12:33:56 PM",
    "confidence": "high"
  },
  "HOUSE_OVERSIGHT_029007": {
    "date": "2016-09-17",
    "time": "12:44:10",
    "source": "email_header",
    "raw_date": "9/17/2016 12:44:10 PM",
    "confidence": "high"
  },
  "HOUSE_OVERSIGHT_029010": {
    "date": "2016-09-17",
    "time": "15:10:41",
    "source": "email_header",
    "raw_date": "9/17/2016 3:10:41 PM",
    "confidence": "high"
  },
  "HOUSE_OVERSIGHT_029013": {
    "date": "2016-10-02",
    "time": null,
    "source": "content_parsed",
    "raw_date": "Sun, Oct 2, 2016",
    "confidence": "low"
  },
  "HOUSE_OVERSIGHT_029015": {
    "date": "2016-10-02",
    "time": "12:34:29",
    "source": "email_header",
    "raw_date": "10/2/2016 12:34:29 PM",
    "confidence": "high"
  },
  "HOUSE_OVERSIGHT_029017": {
    "date": "2016-11-10",
    "time": "22:30:08",
    "source": "email_header",
    "raw_date": "11/10/2016 10:30:08 PM",
    "confidence": "high"
  },
  "HOUSE_OVERSIGHT_029020": {
    "date": "2016-11-10",
    "time": null,
    "source": "content_parsed",
    "raw_date": "Thu, Nov 10, 2016",
    "confidence": "low"
  },
  "HOUSE_OVERSIGHT_029021": {
    "date": "2016-11-18",
    "time": "11:12:27",
    "source": "email_header",
    "raw_date": "11/18/2016 11:12:27 AM",
    "confidence": "high"
  },
  "HOUSE_OVERSIGHT_029042": {
    "date": "2016-11-18",
    "time": "11:18:14",
    "source": "email_header",
    "raw_date": "11/18/2016 11:18:14 AM",
    "confidence": "high"
  },
  "HOUSE_OVERSIGHT_029063": {
    "date": "2016-11-18",
    "time": "11:30:28",
    "source": "email_header",
    "raw_date": "11/18/2016 11:30:28 AM",
    "confidence": "high"
  },
  "HOUSE_OVERSIGHT_029084": {
    "date": "2016-12-12",
    "time": "18:26:29",
    "source": "email_header",
    "raw_date": "12/12/2016 6:26:29 PM",
    "confidence": "high"
  },
  "HOUSE_OVERSIGHT_029085": {
    "date": "2017-01-20",
    "time": "06:28:10",
    "source": "email_header",
    "raw_date": "1/20/2017 6:28:10 AM",
    "confidence": "high"
  },
  "HOUSE_OVERSIGHT_029087": {
    "date": "2017-02-01",
    "time": "05:18:08",
    "source": "email_header",
    "raw_date": "2/1/2017 5:18:08 AM",
    "confidence": "high"
  },
  "HOUSE_OVERSIGHT_029088": {
    "date": "2017-02-03",
    "time": "15:16:15",
    "source": "email_header",
    "raw_date": "2/3/2017 3:16:15 PM",
    "confidence": "high"
  },
  "HOUSE_OVERSIGHT_029090": {
    "date": "2017-02-04",
    "time": "04:18:58",
    "source": "email_header",
    "raw_date": "2/4/2017 4:18:58 AM",
    "confidence": "high"
  },
  "HOUSE_OVERSIGHT_029092": {
    "date": "2017-02-04",
    "time": "13:53:41",
    "source": "email_header",
    "raw_date": "2/4/2017 1:53:41 PM",
    "confidence": "high"
  },
  "HOUSE_OVERSIGHT_029094": {
    "date": "2017-06-01",
    "time": "12:12:02",
    "source": "email_header",
    "raw_date": "6/1/2017 12:12:02 PM",
    "confidence": "high"
  },
  "HOUSE_OVERSIGHT_029095": {
    "date": "2017-06-01",
    "time": "12:16:28",
    "source": "email_header",
    "raw_date": "6/1/2017 12:16:28 PM",
    "confidence": "high"
  },
  "HOUSE_OVERSIGHT_029096": {
    "date": "2017-06-01",
    "time": "12:37:55",
    "source": "email_header",
    "raw_date": "6/1/2017 12:37:55 PM",
    "confidence": "high"
  },
  "HOUSE_OVERSIGHT_029098": {
    "date": "2017-07-25",
    "time": "12:57:37",
    "source": "email_header",
    "raw_date": "7/25/2017 12:57:37 PM",
    "confidence": "high"
  },
  "HOUSE_OVERSIGHT_029100": {
    "date": "2017-07-30",
    "time": "18:18:25",
    "source": "email_header",
    "raw_date": "7/30/2017 6:18:25 PM",
    "confidence": "high"
  },
  "HOUSE_OVERSIGHT_029102": {
    "date": null,
    "time": null,
    "source": "unknown",
    "raw_date": null,
    "confidence": "none"
  },
  "HOUSE_OVERSIGHT_029104": {
    "date": null,
    "time": null,
    "source": "unknown",
    "raw_date": null,
    "confidence": "none"
  },
  "HOUSE_OVERSIGHT_029106": {
    "date": "2017-10-11",
    "time": "15:04:05",
    "source": "email_header",
    "raw_date": "10/11/2017 3:04:05 PM",
    "confidence": "high"
  },
  "HOUSE_OVERSIGHT_029108": {
    "date": "2017-10-27",
    "time": "14:59:48",
    "source": "email_header",
    "raw_date": "10/27/2017 2:59:48 PM",
    "confidence": "high"
  },
  "HOUSE_OVERSIGHT_029111": {
    "date": "2017-11-22",
    "time": "18:14:38",
    "source": "email_header",
    "raw_date": "11/22/2017 6:14:38 PM",
    "confidence": "high"
  },
  "HOUSE_OVERSIGHT_029113": {
    "date": "2017-12-08",
    "time": "23:13:41",
    "source": "email_header",
    "raw_date": "12/8/2017 11:13:41 PM",
    "confidence": "high"
  },
  "HOUSE_OVERSIGHT_029117": {
    "date": "2017-12-29",
    "time": "22:03:58",
    "source": "email_header",
    "raw_date": "12/29/2017 10:03:58 PM",
    "confidence": "high"
  },
  "HOUSE_OVERSIGHT_029122": {
    "date": "2017-12-31",
    "time": "01:04:06",
    "source": "email_header",
    "raw_date": "12/31/2017 1:04:06 AM",
    "confidence": "high"
  },
  "HOUSE_OVERSIGHT_029126": {
    "date": "2017-12-31",
    "time": "01:58:32",
    "source": "email_header",
    "raw_date": "12/31/2017 1:58:32 AM",
    "confidence": "high"
  },
  "HOUSE_OVERSIGHT_029131": {
    "date": "2017-12-31",
    "time": "21:21:59",
    "source": "email_header",
    "raw_date": "12/31/2017 9:21:59 PM",
    "confidence": "high"
  },
  "HOUSE_OVERSIGHT_029137": {
    "date": "2017-12-31",
    "time": "21:32:53",
    "source": "email_header",
    "raw_date": "12/31/2017 9:32:53 PM",
    "confidence": "high"
  },
  "HOUSE_OVERSIGHT_029143": {
    "date": "2017-12-31",
    "time": "21:35:13",
    "source": "email_header",
    "raw_date": "12/31/2017 9:35:13 PM",
    "confidence": "high"
  },
  "HOUSE_OVERSIGHT_029150": {
    "date": "2018-01-01",
    "time": "22:36:46",
    "source": "email_header",
    "raw_date": "1/1/2018 10:36:46 PM",
    "confidence": "high"
  },
  "HOUSE_OVERSIGHT_029154": {
    "date": "2018-03-19",
    "time": "03:19:49",
    "source": "email_header",
    "raw_date": "3/19/2018 3:19:49 AM",
    "confidence": "high"
  },
  "HOUSE_OVERSIGHT_029155": {
    "date": "2018-03-08",
    "time": null,
    "source": "metadata",
    "raw_date": "03/08/2018",
    "confidence": "medium"
  },
  "HOUSE_OVERSIGHT_029163": {
    "date": "2018-03-19",
    "time": "09:10:54",
    "source": "email_header",
    "raw_date": "3/19/2018 9:10:54 AM",
    "confidence": "high"
  },
  "HOUSE_OVERSIGHT_029165": {
    "date": null,
    "time": null,
    "source": "unknown",
    "raw_date": null,
    "confidence": "none"
  },
  "HOUSE_OVERSIGHT_029174": {
    "date": "2018-08-19",
    "time": null,
    "source": "content_parsed",
    "raw_date": "8/19/2018",
    "confidence": "low"
  },
  "HOUSE_OVERSIGHT_029176": {
    "date": "2018-08-02",
    "time": null,
    "source": "content_parsed",
    "raw_date": "Kuhn, August 2, 2018",
    "confidence": "low"
  },
  "HOUSE_OVERSIGHT_029180": {
    "date": "2018-08-29",
    "time": "18:06:32",
    "source": "email_header",
    "raw_date": "8/29/2018 6:06:32 PM",
    "confidence": "high"
  },
  "HOUSE_OVERSIGHT_029185": {
    "date": "2018-08-29",
    "time": "18:29:24",
    "source": "email_header",
    "raw_date": "8/29/2018 6:29:24 PM",
    "confidence": "high"
  },
  "HOUSE_OVERSIGHT_029190": {
    "date": "2018-08-29",
    "time": "19:07:18",
    "source": "email_header",
    "raw_date": "8/29/2018 7:07:18 PM",
    "confidence": "high"
  },
  "HOUSE_OVERSIGHT_029196": {
    "date": "2018-08-29",
    "time": null,
    "source": "content_parsed",
    "raw_date": "Wed, Aug 29, 2018",
    "confidence": "low"
  },
  "HOUSE_OVERSIGHT_029203": {
    "date": "2018-11-30",
    "time": "15:32:06",
    "source": "email_header",
    "raw_date": "11/30/2018 3:32:06 PM",
    "confidence": "high"
  },
  "HOUSE_OVERSIGHT_029204": {
    "date": "2014-04-27",
    "time": "18:58:54",
    "source": "email_header",
    "raw_date": "4/27/2014 6:58:54 PM",
    "confidence": "high"
  },
  "HOUSE_OVERSIGHT_029206": {
    "date": "2014-06-20",
    "time": "10:50:00",
    "source": "email_header",
    "raw_date": "Friday, June 20 2014 10:50 AM",
    "confidence": "high"
  },
  "HOUSE_OVERSIGHT_029207": {
    "date": "2014-07-14",
    "time": "09:45:41",
    "source": "email_header",
    "raw_date": "7/14/2014 9:45:41 AM",
    "confidence": "high"
  },
  "HOUSE_OVERSIGHT_029209": {
    "date": "2014-07-17",
    "time": "13:47:48",
    "source": "email_header",
    "raw_date": "7/17/2014 1:47:48 PM",
    "confidence": "high"
  },
  "HOUSE_OVERSIGHT_029211": {
    "date": "2014-09-19",
    "time": "11:48:18",
    "source": "email_header",
    "raw_date": "9/19/2014 11:48:18 AM",
    "confidence": "high"
  },
  "HOUSE_OVERSIGHT_029213": {
    "date": "2014-09-19",
    "time": "19:48:29",
    "source": "email_header",
    "raw_date": "9/19/2014 7:48:29 PM",
    "confidence": "high"
  },
  "HOUSE_OVERSIGHT_029218": {
    "date": "2014-10-09",
    "time": "10:15:19",
    "source": "email_header",
    "raw_date": "10/9/2014 10:15:19 AM",
    "confidence": "high"
  },
  "HOUSE_OVERSIGHT_029221": {
    "date": "2014-10-27",
    "time": "15:53:38",
    "source": "email_header",
    "raw_date": "10/27/2014 3:53:38 PM",
    "confidence": "high"
  },
  "HOUSE_OVERSIGHT_029223": {
    "date": "2015-01-04",
    "time": "10:25:34",
    "source": "email_header",
    "raw_date": "1/4/2015 10:25:34 AM",
    "confidence": "high"
  },
  "HOUSE_OVERSIGHT_029224": {
    "date": "2015-01-04",
    "time": "12:19:34",
    "source": "email_header",
    "raw_date": "1/4/2015 12:19:34 PM",
    "confidence": "high"
  },
  "HOUSE_OVERSIGHT_029225": {
    "date": "2015-02-10",
    "time": "17:22:52",
    "source": "email_header",
    "raw_date": "2/10/2015 5:22:52 PM",
    "confidence": "high"
  },
  "HOUSE_OVERSIGHT_029228": {
    "date": "2015-03-19",
    "time": "21:15:06",
    "source": "email_header",
    "raw_date": "3/19/2015 9:15:06 PM",
    "confidence": "high"
  },
  "HOUSE_OVERSIGHT_029231": {
    "date": "2015-03-19",
    "time": "21:43:40",
    "source": "email_header",
    "raw_date": "3/19/2015 9:43:40 PM",
    "confidence": "high"
  },
  "HOUSE_OVERSIGHT_029234": {
    "date": "2015-09-18",
    "time": "16:08:16",
    "source": "email_header",
    "raw_date": "9/18/2015 4:08:16 PM",
    "confidence": "high"
  },
  "HOUSE_OVERSIGHT_029237": {
    "date": "2015-10-25",
    "time": "11:46:21",
    "source": "email_header",
    "raw_date": "10/25/2015 11:46:21 AM",
    "confidence": "high"
  },
  "HOUSE_OVERSIGHT_029238": {
    "date": "2015-11-24",
    "time": null,
    "source": "content_parsed",
    "raw_date": "11/24/2015",
    "confidence": "low"
  },
  "HOUSE_OVERSIGHT_029239": {
    "date": "2015-12-02",
    "time": "15:31:35",
    "source": "email_header",
    "raw_date": "12/2/2015 3:31:35 PM",
    "confidence": "high"
  },
  "HOUSE_OVERSIGHT_029242": {
    "date": "2015-12-02",
    "time": "17:52:40",
    "source": "email_header",
    "raw_date": "12/2/2015 5:52:40 PM",
    "confidence": "high"
  },
  "HOUSE_OVERSIGHT_029246": {
    "date": "2015-12-02",
    "time": "17:58:02",
    "source": "email_header",
    "raw_date": "12/2/2015 5:58:02 PM",
    "confidence": "high"
  },
  "HOUSE_OVERSIGHT_029251": {
    "date": "2015-12-07",
    "time": "19:04:18",
    "source": "email_header",
    "raw_date": "12/7/2015 7:04:18 PM",
    "confidence": "high"
  },
  "HOUSE_OVERSIGHT_029253": {
    "date": "2015-12-08",
    "time": "17:59:54",
    "source": "email_header",
    "raw_date": "12/8/2015 5:59:54 PM",
    "confidence": "high"
  },
  "HOUSE_OVERSIGHT_029255": {
    "date": "2016-04-28",
    "time": null,
    "source": "content_parsed",
    "raw_date": "Thu, Apr 28, 2016",
    "confidence": "low"
  },
  "HOUSE_OVERSIGHT_029257": {
    "date": "2016-04-28",
    "time": null,
    "source": "metadata",
    "raw_date": "04/28/2016",
    "confidence": "medium"
  },
  "HOUSE_OVERSIGHT_029266": {
    "date": "2016-05-03",
    "time": "18:37:06",
    "source": "email_header",
    "raw_date": "5/3/2016 6:37:06 PM",
    "confidence": "high"
  },
  "HOUSE_OVERSIGHT_029269": {
    "date": "2016-05-04",
    "time": "18:28:25",
    "source": "email_header",
    "raw_date": "5/4/2016 6:28:25 PM",
    "confidence": "high"
  },
  "HOUSE_OVERSIGHT_029271": {
    "date": "2016-05-25",
    "time": "11:09:21",
    "source": "email_header",
    "raw_date": "5/25/2016 11:09:21 AM",
    "confidence": "high"
  },
  "HOUSE_OVERSIGHT_029272": {
    "date": "2016-05-25",
    "time": "11:16:19",
    "source": "email_header",
    "raw_date": "5/25/2016 11:16:19 AM",
    "confidence": "high"
  },
  "HOUSE_OVERSIGHT_029274": {
    "date": "2016-05-25",
    "time": "11:21:11",
    "source": "email_header",
    "raw_date": "5/25/2016 11:21:11 AM",
    "confidence": "high"
  },
  "HOUSE_OVERSIGHT_029276": {
    "date": "2016-08-08",
    "time": null,
    "source": "content_parsed",
    "raw_date": "Mon, Aug 8, 2016",
    "confidence": "low"
  },
  "HOUSE_OVERSIGHT_029277": {
    "date": "2016-10-02",
    "time": "21:00:42",
    "source": "email_header",
    "raw_date": "10/2/2016 9:00:42 PM",
    "confidence": "high"
  },
  "HOUSE_OVERSIGHT_029279": {
    "date": "2016-11-10",
    "time": "21:53:43",
    "source": "email_header",
    "raw_date": "11/10/2016 9:53:43 PM",
    "confidence": "high"
  },
  "HOUSE_OVERSIGHT_029280": {
    "date": "2016-12-12",
    "time": "19:52:15",
    "source": "email_header",
    "raw_date": "12/12/2016 7:52:15 PM",
    "confidence": "high"
  },
  "HOUSE_OVERSIGHT_029282": {
    "date": "2017-03-16",
    "time": "11:26:44",
    "source": "email_header",
    "raw_date": "3/16/2017 11:26:44 AM",
    "confidence": "high"
  },
  "HOUSE_OVERSIGHT_029283": {
    "date": "2017-06-01",
    "time": "12:12:39",
    "source": "email_header",
    "raw_date": "6/1/2017 12:12:39 PM",
    "confidence": "high"
  },
  "HOUSE_OVERSIGHT_029285": {
    "date": "2017-10-11",
    "time": "15:15:45",
    "source": "email_header",
    "raw_date": "10/11/2017 3:15:45 PM",
    "confidence": "high"
  },
  "HOUSE_OVERSIGHT_029288": {
    "date": "2017-10-27",
    "time": "14:50:59",
    "source": "email_header",
    "raw_date": "10/27/2017 2:50:59 PM",
    "confidence": "high"
  },
  "HOUSE_OVERSIGHT_029291": {
    "date": "2018-01-06",
    "time": "21:20:31",
    "source": "email_header",
    "raw_date": "1/6/2018 9:20:31 PM",
    "confidence": "high"
  },
  "HOUSE_OVERSIGHT_029293": {
    "date": "2018-08-19",
    "time": "11:46:04",
    "source": "email_header",
    "raw_date": "8/19/2018 11:46:04 AM",
    "confidence": "high"
  },
  "HOUSE_OVERSIGHT_029295": {
    "date": "2018-08-19",
    "time": "14:58:17",
    "source": "email_header",
    "raw_date": "8/19/2018 2:58:17 PM",
    "confidence": "high"
  },
  "HOUSE_OVERSIGHT_029298": {
    "date": null,
    "time": null,
    "source": "unknown",
    "raw_date": null,
    "confidence": "none"
  },
  "HOUSE_OVERSIGHT_029299": {
    "date": "2011-08-07",
    "time": "16:01:33",
    "source": "email_header",
    "raw_date": "8/7/2011 4:01:33 PM",
    "confidence": "high"
  },
  "HOUSE_OVERSIGHT_029301": {
    "date": null,
    "time": null,
    "source": "unknown",
    "raw_date": null,
    "confidence": "none"
  },
  "HOUSE_OVERSIGHT_029302": {
    "date": null,
    "time": null,
    "source": "unknown",
    "raw_date": null,
    "confidence": "none"
  },
  "HOUSE_OVERSIGHT_029304": {
    "date": null,
    "time": null,
    "source": "unknown",
    "raw_date": null,
    "confidence": "none"
  },
  "HOUSE_OVERSIGHT_029305": {
    "date": "2013-06-27",
    "time": null,
    "source": "metadata",
    "raw_date": "06/27/2013",
    "confidence": "medium"
  },
  "HOUSE_OVERSIGHT_029315": {
    "date": "2013-10-01",
    "time": null,
    "source": "content_parsed",
    "raw_date": "Tuesday, October 1, 2013",
    "confidence": "low"
  },
  "HOUSE_OVERSIGHT_029324": {
    "date": "2014-03-14",
    "time": "14:24:48",
    "source": "email_header",
    "raw_date": "3/14/2014 2:24:48 PM",
    "confidence": "high"
  },
  "HOUSE_OVERSIGHT_029325": {
    "date": "2014-03-20",
    "time": "14:46:17",
    "source": "email_header",
    "raw_date": "3/20/2014 2:46:17 PM",
    "confidence": "high"
  },
  "HOUSE_OVERSIGHT_029326": {
    "date": "2013-01-14",
    "time": null,
    "source": "metadata",
    "raw_date": "01/14/2013",
    "confidence": "medium"
  },
  "HOUSE_OVERSIGHT_029328": {
    "date": "2012-05-07",
    "time": null,
    "source": "metadata",
    "raw_date": "05/07/2012",
    "confidence": "medium"
  },
  "HOUSE_OVERSIGHT_029336": {
    "date": "2013-03-25",
    "time": "19:47:22",
    "source": "email_header",
    "raw_date": "3/25/2013 7:47:22 PM",
    "confidence": "high"
  },
  "HOUSE_OVERSIGHT_029340": {
    "date": "2013-04-29",
    "time": null,
    "source": "metadata",
    "raw_date": "04/29/2013",
    "confidence": "medium"
  },
  "HOUSE_OVERSIGHT_029342": {
    "date": "2013-05-07",
    "time": "17:55:30",
    "source": "email_header",
    "raw_date": "5/7/2013 5:55:30 PM",
    "confidence": "high"
  },
  "HOUSE_OVERSIGHT_029344": {
    "date": "2014-07-02",
    "time": null,
    "source": "content_parsed",
    "raw_date": "7/2/2014",
    "confidence": "low"
  },
  "HOUSE_OVERSIGHT_029350": {
    "date": "2014-07-28",
    "time": null,
    "source": "content_parsed",
    "raw_date": "YORK, July 28, 2014",
    "confidence": "low"
  },
  "HOUSE_OVERSIGHT_029351": {
    "date": null,
    "time": null,
    "source": "unknown",
    "raw_date": null,
    "confidence": "none"
  },
  "HOUSE_OVERSIGHT_029352": {
    "date": null,
    "time": null,
    "source": "unknown",
    "raw_date": null,
    "confidence": "none"
  },
  "HOUSE_OVERSIGHT_029353": {
    "date": null,
    "time": null,
    "source": "unknown",
    "raw_date": null,
    "confidence": "none"
  },
  "HOUSE_OVERSIGHT_029354": {
    "date": null,
    "time": null,
    "source": "unknown",
    "raw_date": null,
    "confidence": "none"
  },
  "HOUSE_OVERSIGHT_029355": {
    "date": null,
    "time": null,
    "source": "unknown",
    "raw_date": null,
    "confidence": "none"
  },
  "HOUSE_OVERSIGHT_029356": {
    "date": null,
    "time": null,
    "source": "unknown",
    "raw_date": null,
    "confidence": "none"
  },
  "HOUSE_OVERSIGHT_029357": {
    "date": "2014-05-12",
    "time": null,
    "source": "content_parsed",
    "raw_date": "05/12/2014",
    "confidence": "low"
  },
  "HOUSE_OVERSIGHT_029398": {
    "date": "2016-10-11",
    "time": null,
    "source": "content_parsed",
    "raw_date": "10/11/2016",
    "confidence": "low"
  },
  "HOUSE_OVERSIGHT_029401": {
    "date": "2017-01-22",
    "time": "19:31:32",
    "source": "email_header",
    "raw_date": "1/22/2017 7:31:32 PM",
    "confidence": "high"
  },
  "HOUSE_OVERSIGHT_029402": {
    "date": "2017-03-22",
    "time": "19:29:01",
    "source": "email_header",
    "raw_date": "3/22/2017 7:29:01 PM",
    "confidence": "high"
  },
  "HOUSE_OVERSIGHT_029405": {
    "date": "2017-05-27",
    "time": null,
    "source": "metadata",
    "raw_date": "05/27/2017",
    "confidence": "medium"
  },
  "HOUSE_OVERSIGHT_029416": {
    "date": "2017-05-27",
    "time": null,
    "source": "metadata",
    "raw_date": "05/27/2017",
    "confidence": "medium"
  },
  "HOUSE_OVERSIGHT_029427": {
    "date": "2017-06-19",
    "time": null,
    "source": "content_parsed",
    "raw_date": "MONDAY, JUNE 19, 2017",
    "confidence": "low"
  },
  "HOUSE_OVERSIGHT_029429": {
    "date": "2017-07-07",
    "time": "12:05:21",
    "source": "email_header",
    "raw_date": "7/7/2017 12:05:21 PM",
    "confidence": "high"
  },
  "HOUSE_OVERSIGHT_029431": {
    "date": "2017-12-17",
    "time": null,
    "source": "content_parsed",
    "raw_date": "12/17/2017",
    "confidence": "low"
  },
  "HOUSE_OVERSIGHT_029433": {
    "date": "2018-01-03",
    "time": "23:00:51",
    "source": "email_header",
    "raw_date": "1/3/2018 11:00:51 PM",
    "confidence": "high"
  },
  "HOUSE_OVERSIGHT_029437": {
    "date": "2018-01-04",
    "time": null,
    "source": "content_parsed",
    "raw_date": "1/4/2018",
    "confidence": "low"
  },
  "HOUSE_OVERSIGHT_029438": {
    "date": "2018-01-02",
    "time": null,
    "source": "metadata",
    "raw_date": "01/02/2018",
    "confidence": "medium"
  },
  "HOUSE_OVERSIGHT_029446": {
    "date": "2018-01-13",
    "time": "23:29:05",
    "source": "email_header",
    "raw_date": "1/13/2018 11:29:05 PM",
    "confidence": "high"
  },
  "HOUSE_OVERSIGHT_029447": {
    "date": "2018-02-09",
    "time": "01:35:43",
    "source": "email_header",
    "raw_date": "2/9/2018 1:35:43 AM",
    "confidence": "high"
  },
  "HOUSE_OVERSIGHT_029448": {
    "date": "2017-09-06",
    "time": null,
    "source": "metadata",
    "raw_date": "09/06/2017",
    "confidence": "medium"
  },
  "HOUSE_OVERSIGHT_029452": {
    "date": null,
    "time": null,
    "source": "unknown",
    "raw_date": null,
    "confidence": "none"
  },
  "HOUSE_OVERSIGHT_029458": {
    "date": "2018-03-14",
    "time": "16:51:41",
    "source": "email_header",
    "raw_date": "3/14/2018 4:51:41 PM",
    "confidence": "high"
  },
  "HOUSE_OVERSIGHT_029475": {
    "date": "2018-03-11",
    "time": null,
    "source": "metadata",
    "raw_date": "03/11/2018",
    "confidence": "medium"
  },
  "HOUSE_OVERSIGHT_029497": {
    "date": "2018-04-01",
    "time": "16:03:51",
    "source": "email_header",
    "raw_date": "4/1/2018 4:03:51 PM",
    "confidence": "high"
  },
  "HOUSE_OVERSIGHT_029498": {
    "date": "2018-04-11",
    "time": "02:18:04",
    "source": "email_header",
    "raw_date": "4/11/2018 2:18:04 AM",
    "confidence": "high"
  },
  "HOUSE_OVERSIGHT_029499": {
    "date": "2016-03-18",
    "time": "11:50:05",
    "source": "email_header",
    "raw_date": "3/18/2016 11:50:05 AM",
    "confidence": "high"
  },
  "HOUSE_OVERSIGHT_029500": {
    "date": "2016-05-10",
    "time": "15:44:04",
    "source": "email_header",
    "raw_date": "5/10/2016 3:44:04 PM",
    "confidence": "high"
  },
  "HOUSE_OVERSIGHT_029501": {
    "date": "2016-06-30",
    "time": "14:45:27",
    "source": "email_header",
    "raw_date": "6/30/2016 2:45:27 PM",
    "confidence": "high"
  },
  "HOUSE_OVERSIGHT_029503": {
    "date": "2016-07-17",
    "time": "19:26:43",
    "source": "email_header",
    "raw_date": "7/17/2016 7:26:43 PM",
    "confidence": "high"
  },
  "HOUSE_OVERSIGHT_029504": {
    "date": null,
    "time": null,
    "source": "unknown",
    "raw_date": null,
    "confidence": "none"
  },
  "HOUSE_OVERSIGHT_029505": {
    "date": "2018-05-28",
    "time": "22:56:02",
    "source": "email_header",
    "raw_date": "5/28/2018 10:56:02 PM",
    "confidence": "high"
  },
  "HOUSE_OVERSIGHT_029509": {
    "date": "2018-06-06",
    "time": "11:32:09",
    "source": "email_header",
    "raw_date": "6/6/2018 11:32:09 AM",
    "confidence": "high"
  },
  "HOUSE_OVERSIGHT_029516": {
    "date": "2018-10-14",
    "time": "17:16:21",
    "source": "email_header",
    "raw_date": "10/14/2018 5:16:21 PM",
    "confidence": "high"
  },
  "HOUSE_OVERSIGHT_029517": {
    "date": null,
    "time": null,
    "source": "unknown",
    "raw_date": null,
    "confidence": "none"
  },
  "HOUSE_OVERSIGHT_029518": {
    "date": "2018-12-05",
    "time": null,
    "source": "content_parsed",
    "raw_date": "Wednesday, December 5, 2018",
    "confidence": "low"
  },
  "HOUSE_OVERSIGHT_029519": {
    "date": "2019-04-20",
    "time": "10:49:45",
    "source": "email_header",
    "raw_date": "4/20/2019 10:49:45 AM",
    "confidence": "high"
  },
  "HOUSE_OVERSIGHT_029520": {
    "date": null,
    "time": null,
    "source": "unknown",
    "raw_date": null,
    "confidence": "none"
  },
  "HOUSE_OVERSIGHT_029530": {
    "date": "2013-01-27",
    "time": "03:49:54",
    "source": "email_header",
    "raw_date": "1/27/2013 3:49:54 AM",
    "confidence": "high"
  },
  "HOUSE_OVERSIGHT_029534": {
    "date": "2013-01-27",
    "time": "04:33:18",
    "source": "email_header",
    "raw_date": "1/27/2013 4:33:18 AM",
    "confidence": "high"
  },
  "HOUSE_OVERSIGHT_029539": {
    "date": "2013-05-29",
    "time": null,
    "source": "content_parsed",
    "raw_date": "5/29/2013",
    "confidence": "low"
  },
  "HOUSE_OVERSIGHT_029543": {
    "date": null,
    "time": null,
    "source": "unknown",
    "raw_date": null,
    "confidence": "none"
  },
  "HOUSE_OVERSIGHT_029545": {
    "date": "2014-02-08",
    "time": "01:32:58",
    "source": "email_header",
    "raw_date": "2/8/2014 1:32:58 AM",
    "confidence": "high"
  },
  "HOUSE_OVERSIGHT_029549": {
    "date": "2014-02-08",
    "time": "02:07:34",
    "source": "email_header",
    "raw_date": "2/8/2014 2:07:34 AM",
    "confidence": "high"
  },
  "HOUSE_OVERSIGHT_029553": {
    "date": "2011-10-28",
    "time": "16:33:44",
    "source": "email_header",
    "raw_date": "10/28/2011 4:33:44 PM",
    "confidence": "high"
  },
  "HOUSE_OVERSIGHT_029558": {
    "date": "2011-10-31",
    "time": "08:21:27",
    "source": "email_header",
    "raw_date": "10/31/2011 8:21:27 AM",
    "confidence": "high"
  },
  "HOUSE_OVERSIGHT_029564": {
    "date": null,
    "time": null,
    "source": "unknown",
    "raw_date": null,
    "confidence": "none"
  },
  "HOUSE_OVERSIGHT_029565": {
    "date": "2018-01-04",
    "time": "19:45:38",
    "source": "email_header",
    "raw_date": "1/4/2018 7:45:38 PM",
    "confidence": "high"
  },
  "HOUSE_OVERSIGHT_029566": {
    "date": "2018-11-25",
    "time": "23:40:36",
    "source": "email_header",
    "raw_date": "11/25/2018 11:40:36 PM",
    "confidence": "high"
  },
  "HOUSE_OVERSIGHT_029569": {
    "date": "2018-11-25",
    "time": "23:55:13",
    "source": "email_header",
    "raw_date": "11/25/2018 11:55:13 PM",
    "confidence": "high"
  },
  "HOUSE_OVERSIGHT_029573": {
    "date": "2018-11-25",
    "time": "23:56:06",
    "source": "email_header",
    "raw_date": "11/25/2018 11:56:06 PM",
    "confidence": "high"
  },
  "HOUSE_OVERSIGHT_029575": {
    "date": "2018-11-26",
    "time": "02:40:00",
    "source": "email_header",
    "raw_date": "11/26/2018 2:40:00 AM",
    "confidence": "high"
  },
  "HOUSE_OVERSIGHT_029578": {
    "date": "2018-11-26",
    "time": "15:26:46",
    "source": "email_header",
    "raw_date": "11/26/2018 3:26:46 PM",
    "confidence": "high"
  },
  "HOUSE_OVERSIGHT_029581": {
    "date": "2018-12-12",
    "time": "17:28:38",
    "source": "email_header",
    "raw_date": "12/12/2018 5:28:38 PM",
    "confidence": "high"
  },
  "HOUSE_OVERSIGHT_029582": {
    "date": "2018-12-12",
    "time": null,
    "source": "content_parsed",
    "raw_date": "Wed, Dec 12, 2018",
    "confidence": "low"
  },
  "HOUSE_OVERSIGHT_029583": {
    "date": "2018-12-22",
    "time": "15:48:55",
    "source": "email_header",
    "raw_date": "12/22/2018 3:48:55 PM",
    "confidence": "high"
  },
  "HOUSE_OVERSIGHT_029585": {
    "date": "2019-01-15",
    "time": null,
    "source": "content_parsed",
    "raw_date": "Tue, Jan 15, 2019",
    "confidence": "low"
  },
  "HOUSE_OVERSIGHT_029587": {
    "date": "2019-03-04",
    "time": "23:27:03",
    "source": "email_header",
    "raw_date": "3/4/2019 11:27:03 PM",
    "confidence": "high"
  },
  "HOUSE_OVERSIGHT_029589": {
    "date": null,
    "time": null,
    "source": "unknown",
    "raw_date": null,
    "confidence": "none"
  },
  "HOUSE_OVERSIGHT_029590": {
    "date": "2018-11-25",
    "time": null,
    "source": "content_parsed",
    "raw_date": "Sun, Nov 25, 2018",
    "confidence": "low"
  },
  "HOUSE_OVERSIGHT_029592": {
    "date": null,
    "time": null,
    "source": "unknown",
    "raw_date": null,
    "confidence": "none"
  },
  "HOUSE_OVERSIGHT_029593": {
    "date": "2018-11-25",
    "time": "23:45:45",
    "source": "email_header",
    "raw_date": "11/25/2018 11:45:45 PM",
    "confidence": "high"
  },
  "HOUSE_OVERSIGHT_029597": {
    "date": "2018-11-26",
    "time": "00:06:18",
    "source": "email_header",
    "raw_date": "11/26/2018 12:06:18 AM",
    "confidence": "high"
  },
  "HOUSE_OVERSIGHT_029600": {
    "date": "2018-11-26",
    "time": "14:31:48",
    "source": "email_header",
    "raw_date": "11/26/2018 2:31:48 PM",
    "confidence": "high"
  },
  "HOUSE_OVERSIGHT_029603": {
    "date": null,
    "time": null,
    "source": "unknown",
    "raw_date": null,
    "confidence": "none"
  },
  "HOUSE_OVERSIGHT_029604": {
    "date": "2018-12-12",
    "time": "17:27:36",
    "source": "email_header",
    "raw_date": "12/12/2018 5:27:36 PM",
    "confidence": "high"
  },
  "HOUSE_OVERSIGHT_029605": {
    "date": "2018-12-12",
    "time": "17:44:32",
    "source": "email_header",
    "raw_date": "12/12/2018 5:44:32 PM",
    "confidence": "high"
  },
  "HOUSE_OVERSIGHT_029606": {
    "date": "2018-12-12",
    "time": "19:50:12",
    "source": "email_header",
    "raw_date": "12/12/2018 7:50:12 PM",
    "confidence": "high"
  },
  "HOUSE_OVERSIGHT_029608": {
    "date": "2019-02-22",
    "time": null,
    "source": "content_parsed",
    "raw_date": "Friday, February 22, 2019",
    "confidence": "low"
  },
  "HOUSE_OVERSIGHT_029609": {
    "date": "2019-03-04",
    "time": "16:08:40",
    "source": "email_header",
    "raw_date": "3/4/2019 4:08:40 PM",
    "confidence": "high"
  },
  "HOUSE_OVERSIGHT_029611": {
    "date": "2019-03-16",
    "time": "21:38:20",
    "source": "email_header",
    "raw_date": "3/16/2019 9:38:20 PM",
    "confidence": "high"
  },
  "HOUSE_OVERSIGHT_029616": {
    "date": "2019-03-17",
    "time": "01:56:54",
    "source": "email_header",
    "raw_date": "3/17/2019 1:56:54 AM",
    "confidence": "high"
  },
  "HOUSE_OVERSIGHT_029622": {
    "date": "2019-06-30",
    "time": "11:41:28",
    "source": "email_header",
    "raw_date": "6/30/2019 11:41:28 AM",
    "confidence": "high"
  },
  "HOUSE_OVERSIGHT_029623": {
    "date": "2009-04-10",
    "time": null,
    "source": "metadata",
    "raw_date": "04/10/2009",
    "confidence": "medium"
  },
  "HOUSE_OVERSIGHT_029624": {
    "date": "2009-10-16",
    "time": "11:20:59",
    "source": "email_header",
    "raw_date": "10/16/2009 11:20:59 AM",
    "confidence": "high"
  },
  "HOUSE_OVERSIGHT_029625": {
    "date": "2011-04-03",
    "time": "20:44:00",
    "source": "email_header",
    "raw_date": "Sunday, April 3 2011 08:44 PM",
    "confidence": "high"
  },
  "HOUSE_OVERSIGHT_029628": {
    "date": "2011-06-04",
    "time": null,
    "source": "metadata",
    "raw_date": "06/04/2011",
    "confidence": "medium"
  },
  "HOUSE_OVERSIGHT_029658": {
    "date": "2011-10-28",
    "time": "16:32:02",
    "source": "email_header",
    "raw_date": "10/28/2011 4:32:02 PM",
    "confidence": "high"
  },
  "HOUSE_OVERSIGHT_029663": {
    "date": "2011-10-31",
    "time": "10:50:46",
    "source": "email_header",
    "raw_date": "10/31/2011 10:50:46 AM",
    "confidence": "high"
  },
  "HOUSE_OVERSIGHT_029671": {
    "date": "2011-10-31",
    "time": "15:08:38",
    "source": "email_header",
    "raw_date": "10/31/2011 3:08:38 PM",
    "confidence": "high"
  },
  "HOUSE_OVERSIGHT_029679": {
    "date": "2012-10-24",
    "time": "16:58:47",
    "source": "email_header",
    "raw_date": "10/24/2012 4:58:47 PM",
    "confidence": "high"
  },
  "HOUSE_OVERSIGHT_029680": {
    "date": "2013-01-27",
    "time": "04:15:30",
    "source": "email_header",
    "raw_date": "1/27/2013 4:15:30 AM",
    "confidence": "high"
  },
  "HOUSE_OVERSIGHT_029684": {
    "date": "2013-01-29",
    "time": "12:06:15",
    "source": "email_header",
    "raw_date": "1/29/2013 12:06:15 PM",
    "confidence": "high"
  },
  "HOUSE_OVERSIGHT_029689": {
    "date": "2013-02-14",
    "time": "20:45:53",
    "source": "email_header",
    "raw_date": "2/14/2013 8:45:53 PM",
    "confidence": "high"
  },
  "HOUSE_OVERSIGHT_029692": {
    "date": "2013-02-14",
    "time": null,
    "source": "content_parsed",
    "raw_date": "2/14/2013",
    "confidence": "low"
  },
  "HOUSE_OVERSIGHT_029744": {
    "date": "2018-12-05",
    "time": null,
    "source": "content_parsed",
    "raw_date": "2018-12-05",
    "confidence": "low"
  },
  "HOUSE_OVERSIGHT_029752": {
    "date": "2015-05-09",
    "time": "19:17:32",
    "source": "email_header",
    "raw_date": "5/9/2015 7:17:32 PM",
    "confidence": "high"
  },
  "HOUSE_OVERSIGHT_029766": {
    "date": "2011-04-03",
    "time": "14:08:00",
    "source": "email_header",
    "raw_date": "Sunday, April 3 2011 02:08 PM",
    "confidence": "high"
  },
  "HOUSE_OVERSIGHT_029773": {
    "date": "2011-03-04",
    "time": "23:15:40",
    "source": "email_header",
    "raw_date": "3/4/2011 11:15:40 PM",
    "confidence": "high"
  },
  "HOUSE_OVERSIGHT_029778": {
    "date": "2009-10-16",
    "time": "11:20:59",
    "source": "email_header",
    "raw_date": "10/16/2009 11:20:59 AM",
    "confidence": "high"
  },
  "HOUSE_OVERSIGHT_029779": {
    "date": "2013-02-14",
    "time": null,
    "source": "content_parsed",
    "raw_date": "2/14/2013",
    "confidence": "low"
  },
  "HOUSE_OVERSIGHT_029831": {
    "date": "2016-04-28",
    "time": "16:59:27",
    "source": "email_header",
    "raw_date": "4/28/2016 4:59:27 PM",
    "confidence": "high"
  },
  "HOUSE_OVERSIGHT_029833": {
    "date": "2016-04-28",
    "time": "16:51:57",
    "source": "email_header",
    "raw_date": "4/28/2016 4:51:57 PM",
    "confidence": "high"
  },
  "HOUSE_OVERSIGHT_029835": {
    "date": "2016-04-28",
    "time": "16:47:41",
    "source": "email_header",
    "raw_date": "4/28/2016 4:47:41 PM",
    "confidence": "high"
  },
  "HOUSE_OVERSIGHT_029837": {
    "date": "2016-04-28",
    "time": "16:39:12",
    "source": "email_header",
    "raw_date": "4/28/2016 4:39:12 PM",
    "confidence": "high"
  },
  "HOUSE_OVERSIGHT_029839": {
    "date": "2015-12-08",
    "time": "17:58:45",
    "source": "email_header",
    "raw_date": "12/8/2015 5:58:45 PM",
    "confidence": "high"
  },
  "HOUSE_OVERSIGHT_029841": {
    "date": "2011-06-14",
    "time": "16:54:35",
    "source": "email_header",
    "raw_date": "6/14/2011 4:54:35 PM",
    "confidence": "high"
  },
  "HOUSE_OVERSIGHT_029848": {
    "date": "2017-01-26",
    "time": "14:16:35",
    "source": "email_header",
    "raw_date": "1/26/2017 2:16:35 PM",
    "confidence": "high"
  },
  "HOUSE_OVERSIGHT_029849": {
    "date": "2015-09-18",
    "time": "05:26:12",
    "source": "email_header",
    "raw_date": "9/18/2015 5:26:12 AM",
    "confidence": "high"
  },
  "HOUSE_OVERSIGHT_029851": {
    "date": "2017-05-22",
    "time": "20:39:37",
    "source": "email_header",
    "raw_date": "5/22/2017 8:39:37 PM",
    "confidence": "high"
  },
  "HOUSE_OVERSIGHT_029852": {
    "date": "2017-05-22",
    "time": "20:53:05",
    "source": "email_header",
    "raw_date": "5/22/2017 8:53:05 PM",
    "confidence": "high"
  },
  "HOUSE_OVERSIGHT_029854": {
    "date": "2017-05-22",
    "time": "21:28:04",
    "source": "email_header",
    "raw_date": "5/22/2017 9:28:04 PM",
    "confidence": "high"
  },
  "HOUSE_OVERSIGHT_029856": {
    "date": "2017-05-22",
    "time": "20:41:33",
    "source": "email_header",
    "raw_date": "5/22/2017 8:41:33 PM",
    "confidence": "high"
  },
  "HOUSE_OVERSIGHT_029858": {
    "date": "2012-08-20",
    "time": null,
    "source": "content_parsed",
    "raw_date": "Monday, August 20, 2012",
    "confidence": "low"
  },
  "HOUSE_OVERSIGHT_029859": {
    "date": "2019-03-02",
    "time": "16:56:48",
    "source": "email_header",
    "raw_date": "3/2/2019 4:56:48 PM",
    "confidence": "high"
  },
  "HOUSE_OVERSIGHT_029864": {
    "date": "2015-09-17",
    "time": "22:00:33",
    "source": "email_header",
    "raw_date": "9/17/2015 10:00:33 PM",
    "confidence": "high"
  },
  "HOUSE_OVERSIGHT_029865": {
    "date": null,
    "time": null,
    "source": "unknown",
    "raw_date": null,
    "confidence": "none"
  },
  "HOUSE_OVERSIGHT_029866": {
    "date": "2019-07-06",
    "time": "18:57:33",
    "source": "email_header",
    "raw_date": "7/6/2019 6:57:33 PM",
    "confidence": "high"
  },
  "HOUSE_OVERSIGHT_029880": {
    "date": "2009-08-11",
    "time": "18:55:54",
    "source": "email_header",
    "raw_date": "8/11/2009 6:55:54 PM",
    "confidence": "high"
  },
  "HOUSE_OVERSIGHT_029884": {
    "date": "2009-08-11",
    "time": "19:00:05",
    "source": "email_header",
    "raw_date": "8/11/2009 7:00:05 PM",
    "confidence": "high"
  },
  "HOUSE_OVERSIGHT_029889": {
    "date": "2009-08-11",
    "time": "19:16:00",
    "source": "email_header",
    "raw_date": "8/11/2009 7:16:00 PM",
    "confidence": "high"
  },
  "HOUSE_OVERSIGHT_029893": {
    "date": "2009-08-11",
    "time": "19:00:57",
    "source": "email_header",
    "raw_date": "8/11/2009 7:00:57 PM",
    "confidence": "high"
  },
  "HOUSE_OVERSIGHT_029898": {
    "date": "2015-01-08",
    "time": "01:26:40",
    "source": "email_header",
    "raw_date": "1/8/2015 1:26:40 AM",
    "confidence": "high"
  },
  "HOUSE_OVERSIGHT_029899": {
    "date": "2015-01-08",
    "time": "15:11:21",
    "source": "email_header",
    "raw_date": "1/8/2015 3:11:21 PM",
    "confidence": "high"
  },
  "HOUSE_OVERSIGHT_029901": {
    "date": "2010-12-31",
    "time": "18:23:47",
    "source": "email_header",
    "raw_date": "12/31/2010 6:23:47 PM",
    "confidence": "high"
  },
  "HOUSE_OVERSIGHT_029903": {
    "date": "2019-03-07",
    "time": "12:02:12",
    "source": "email_header",
    "raw_date": "3/7/2019 12:02:12 PM",
    "confidence": "high"
  },
  "HOUSE_OVERSIGHT_029905": {
    "date": "2019-03-07",
    "time": "04:27:09",
    "source": "email_header",
    "raw_date": "3/7/2019 4:27:09 AM",
    "confidence": "high"
  },
  "HOUSE_OVERSIGHT_029907": {
    "date": "2019-03-07",
    "time": "15:02:42",
    "source": "email_header",
    "raw_date": "3/7/2019 3:02:42 PM",
    "confidence": "high"
  },
  "HOUSE_OVERSIGHT_029910": {
    "date": "2016-08-08",
    "time": "21:28:25",
    "source": "email_header",
    "raw_date": "8/8/2016 9:28:25 PM",
    "confidence": "high"
  },
  "HOUSE_OVERSIGHT_029912": {
    "date": "2016-08-08",
    "time": "21:30:03",
    "source": "email_header",
    "raw_date": "8/8/2016 9:30:03 PM",
    "confidence": "high"
  },
  "HOUSE_OVERSIGHT_029914": {
    "date": "2011-01-22",
    "time": "15:00:54",
    "source": "email_header",
    "raw_date": "1/22/2011 3:00:54 PM",
    "confidence": "high"
  },
  "HOUSE_OVERSIGHT_029918": {
    "date": "2012-08-30",
    "time": null,
    "source": "metadata",
    "raw_date": "08/30/2012",
    "confidence": "medium"
  },
  "HOUSE_OVERSIGHT_029923": {
    "date": "2014-01-20",
    "time": "16:26:13",
    "source": "email_header",
    "raw_date": "1/20/2014 4:26:13 PM",
    "confidence": "high"
  },
  "HOUSE_OVERSIGHT_029925": {
    "date": "2011-12-12",
    "time": null,
    "source": "content_parsed",
    "raw_date": "YORKER, DECEMBER 12, 2011",
    "confidence": "low"
  },
  "HOUSE_OVERSIGHT_029932": {
    "date": "2011-07-03",
    "time": null,
    "source": "metadata",
    "raw_date": "07/03/2011",
    "confidence": "medium"
  },
  "HOUSE_OVERSIGHT_029958": {
    "date": "2016-02-03",
    "time": "13:15:33",
    "source": "email_header",
    "raw_date": "2/3/2016 1:15:33 PM",
    "confidence": "high"
  },
  "HOUSE_OVERSIGHT_029959": {
    "date": "2016-05-18",
    "time": "14:42:38",
    "source": "email_header",
    "raw_date": "5/18/2016 2:42:38 PM",
    "confidence": "high"
  },
  "HOUSE_OVERSIGHT_029960": {
    "date": "2016-05-18",
    "time": "16:41:19",
    "source": "email_header",
    "raw_date": "5/18/2016 4:41:19 PM",
    "confidence": "high"
  },
  "HOUSE_OVERSIGHT_029962": {
    "date": "2016-02-03",
    "time": "13:22:56",
    "source": "email_header",
    "raw_date": "2/3/2016 1:22:56 PM",
    "confidence": "high"
  },
  "HOUSE_OVERSIGHT_029963": {
    "date": "2013-11-22",
    "time": "15:48:56",
    "source": "email_header",
    "raw_date": "11/22/2013 3:48:56 PM",
    "confidence": "high"
  },
  "HOUSE_OVERSIGHT_029968": {
    "date": "2013-01-22",
    "time": "22:45:31",
    "source": "email_header",
    "raw_date": "1/22/2013 10:45:31 PM",
    "confidence": "high"
  },
  "HOUSE_OVERSIGHT_029969": {
    "date": "2017-06-25",
    "time": "20:53:16",
    "source": "email_header",
    "raw_date": "6/25/2017 8:53:16 PM",
    "confidence": "high"
  },
  "HOUSE_OVERSIGHT_029970": {
    "date": "2017-06-25",
    "time": "21:10:33",
    "source": "email_header",
    "raw_date": "6/25/2017 9:10:33 PM",
    "confidence": "high"
  },
  "HOUSE_OVERSIGHT_029972": {
    "date": "2015-10-13",
    "time": "18:48:37",
    "source": "email_header",
    "raw_date": "10/13/2015 6:48:37 PM",
    "confidence": "high"
  },
  "HOUSE_OVERSIGHT_029973": {
    "date": "2011-08-04",
    "time": "20:21:25",
    "source": "email_header",
    "raw_date": "8/4/2011 8:21:25 PM",
    "confidence": "high"
  },
  "HOUSE_OVERSIGHT_029975": {
    "date": "2015-01-20",
    "time": "00:14:00",
    "source": "email_header",
    "raw_date": "Tuesday, January 20 2015 12:14 AM",
    "confidence": "high"
  },
  "HOUSE_OVERSIGHT_029976": {
    "date": "2012-09-10",
    "time": "17:01:27",
    "source": "email_header",
    "raw_date": "9/10/2012 5:01:27 PM",
    "confidence": "high"
  },
  "HOUSE_OVERSIGHT_029977": {
    "date": "2012-09-28",
    "time": null,
    "source": "content_parsed",
    "raw_date": "9/28/2012",
    "confidence": "low"
  },
  "HOUSE_OVERSIGHT_029978": {
    "date": "2016-07-15",
    "time": "03:40:00",
    "source": "email_header",
    "raw_date": "Friday, July 15 2016 03:40 AM",
    "confidence": "high"
  },
  "HOUSE_OVERSIGHT_029979": {
    "date": "2012-07-17",
    "time": "20:05:30",
    "source": "email_header",
    "raw_date": "7/17/2012 8:05:30 PM",
    "confidence": "high"
  },
  "HOUSE_OVERSIGHT_029981": {
    "date": "2013-03-31",
    "time": "00:54:05",
    "source": "email_header",
    "raw_date": "3/31/2013 12:54:05 AM",
    "confidence": "high"
  },
  "HOUSE_OVERSIGHT_029982": {
    "date": "2016-11-01",
    "time": null,
    "source": "content_parsed",
    "raw_date": "11/1/2016",
    "confidence": "low"
  },
  "HOUSE_OVERSIGHT_029983": {
    "date": "2015-07-06",
    "time": "17:04:31",
    "source": "email_header",
    "raw_date": "7/6/2015 5:04:31 PM",
    "confidence": "high"
  },
  "HOUSE_OVERSIGHT_029985": {
    "date": "2016-07-01",
    "time": "07:01:36",
    "source": "email_header",
    "raw_date": "Fri, 1 Jul 2016 07:01:36 -0400",
    "confidence": "high"
  },
  "HOUSE_OVERSIGHT_029992": {
    "date": "2016-07-01",
    "time": "11:15:57",
    "source": "email_header",
    "raw_date": "7/1/2016 11:15:57 AM",
    "confidence": "high"
  },
  "HOUSE_OVERSIGHT_030000": {
    "date": "2016-11-10",
    "time": "21:45:19",
    "source": "email_header",
    "raw_date": "11/10/2016 9:45:19 PM",
    "confidence": "high"
  },
  "HOUSE_OVERSIGHT_030002": {
    "date": "2015-07-05",
    "time": "21:30:29",
    "source": "email_header",
    "raw_date": "7/5/2015 9:30:29 PM",
    "confidence": "high"
  },
  "HOUSE_OVERSIGHT_030005": {
    "date": "2018-02-28",
    "time": "16:52:58",
    "source": "email_header",
    "raw_date": "2/28/2018 4:52:58 PM",
    "confidence": "high"
  },
  "HOUSE_OVERSIGHT_030006": {
    "date": "2011-06-14",
    "time": "11:54:12",
    "source": "email_header",
    "raw_date": "6/14/2011 11:54:12 AM",
    "confidence": "high"
  },
  "HOUSE_OVERSIGHT_030010": {
    "date": "2011-06-14",
    "time": null,
    "source": "metadata",
    "raw_date": "06/14/2011",
    "confidence": "medium"
  },
  "HOUSE_OVERSIGHT_030013": {
    "date": "2012-06-29",
    "time": null,
    "source": "metadata",
    "raw_date": "06/29/2012",
    "confidence": "medium"
  },
  "HOUSE_OVERSIGHT_030015": {
    "date": "2015-08-06",
    "time": "00:41:53",
    "source": "email_header",
    "raw_date": "8/6/2015 12:41:53 AM",
    "confidence": "high"
  },
  "HOUSE_OVERSIGHT_030017": {
    "date": "2019-06-27",
    "time": "19:35:06",
    "source": "email_header",
    "raw_date": "6/27/2019 7:35:06 PM",
    "confidence": "high"
  },
  "HOUSE_OVERSIGHT_030030": {
    "date": "2011-03-29",
    "time": null,
    "source": "metadata",
    "raw_date": "03/29/2011",
    "confidence": "medium"
  },
  "HOUSE_OVERSIGHT_030060": {
    "date": "2011-05-12",
    "time": null,
    "source": "metadata",
    "raw_date": "05/12/2011",
    "confidence": "medium"
  },
  "HOUSE_OVERSIGHT_030094": {
    "date": "2019-07-03",
    "time": null,
    "source": "content_parsed",
    "raw_date": "Wednesday, July 3, 2019",
    "confidence": "low"
  },
  "HOUSE_OVERSIGHT_030095": {
    "date": "2009-12-17",
    "time": "05:54:29",
    "source": "email_header",
    "raw_date": "12/17/2009 5:54:29 AM",
    "confidence": "high"
  },
  "HOUSE_OVERSIGHT_030096": {
    "date": "2009-12-19",
    "time": "08:06:51",
    "source": "email_header",
    "raw_date": "12/19/2009 8:06:51 AM",
    "confidence": "high"
  },
  "HOUSE_OVERSIGHT_030097": {
    "date": "2009-12-19",
    "time": "08:25:45",
    "source": "email_header",
    "raw_date": "12/19/2009 8:25:45 AM",
    "confidence": "high"
  },
  "HOUSE_OVERSIGHT_030098": {
    "date": "2016-08-12",
    "time": "02:54:25",
    "source": "email_header",
    "raw_date": "8/12/2016 2:54:25 AM",
    "confidence": "high"
  },
  "HOUSE_OVERSIGHT_030101": {
    "date": "2016-08-12",
    "time": "12:38:13",
    "source": "email_header",
    "raw_date": "8/12/2016 12:38:13 PM",
    "confidence": "high"
  },
  "HOUSE_OVERSIGHT_030105": {
    "date": "2016-08-12",
    "time": "04:15:15",
    "source": "email_header",
    "raw_date": "8/12/2016 4:15:15 AM",
    "confidence": "high"
  },
  "HOUSE_OVERSIGHT_030109": {
    "date": "2014-09-20",
    "time": "22:41:12",
    "source": "email_header",
    "raw_date": "9/20/2014 10:41:12 PM",
    "confidence": "high"
  },
  "HOUSE_OVERSIGHT_030113": {
    "date": "2014-09-20",
    "time": "23:13:01",
    "source": "email_header",
    "raw_date": "9/20/2014 11:13:01 PM",
    "confidence": "high"
  },
  "HOUSE_OVERSIGHT_030118": {
    "date": "2014-09-20",
    "time": "23:45:34",
    "source": "email_header",
    "raw_date": "9/20/2014 11:45:34 PM",
    "confidence": "high"
  },
  "HOUSE_OVERSIGHT_030123": {
    "date": "2014-09-21",
    "time": "02:54:20",
    "source": "email_header",
    "raw_date": "9/21/2014 2:54:20 AM",
    "confidence": "high"
  },
  "HOUSE_OVERSIGHT_030129": {
    "date": "2014-09-21",
    "time": "04:55:16",
    "source": "email_header",
    "raw_date": "9/21/2014 4:55:16 AM",
    "confidence": "high"
  },
  "HOUSE_OVERSIGHT_030135": {
    "date": "2014-09-21",
    "time": "13:02:01",
    "source": "email_header",
    "raw_date": "9/21/2014 1:02:01 PM",
    "confidence": "high"
  },
  "HOUSE_OVERSIGHT_030141": {
    "date": "2019-02-02",
    "time": "00:56:59",
    "source": "email_header",
    "raw_date": "2/2/2019 12:56:59 AM",
    "confidence": "high"
  },
  "HOUSE_OVERSIGHT_030142": {
    "date": "2016-11-30",
    "time": null,
    "source": "metadata",
    "raw_date": "11/30/2016",
    "confidence": "medium"
  },
  "HOUSE_OVERSIGHT_030149": {
    "date": "2019-05-29",
    "time": "17:19:07",
    "source": "email_header",
    "raw_date": "5/29/2019 5:19:07 PM",
    "confidence": "high"
  },
  "HOUSE_OVERSIGHT_030152": {
    "date": "2010-07-24",
    "time": "13:32:05",
    "source": "email_header",
    "raw_date": "7/24/2010 1:32:05 PM",
    "confidence": "high"
  },
  "HOUSE_OVERSIGHT_030154": {
    "date": "2010-07-24",
    "time": "16:13:00",
    "source": "email_header",
    "raw_date": "Saturday, July 24 2010 04:13 PM",
    "confidence": "high"
  },
  "HOUSE_OVERSIGHT_030156": {
    "date": "2011-06-21",
    "time": null,
    "source": "metadata",
    "raw_date": "06/21/2011",
    "confidence": "medium"
  },
  "HOUSE_OVERSIGHT_030187": {
    "date": "2017-01-10",
    "time": null,
    "source": "metadata",
    "raw_date": "01/10/2017",
    "confidence": "medium"
  },
  "HOUSE_OVERSIGHT_030199": {
    "date": null,
    "time": null,
    "source": "unknown",
    "raw_date": null,
    "confidence": "none"
  },
  "HOUSE_OVERSIGHT_030200": {
    "date": "2018-06-19",
    "time": "17:30:40",
    "source": "email_header",
    "raw_date": "6/19/2018 5:30:40 PM",
    "confidence": "high"
  },
  "HOUSE_OVERSIGHT_030209": {
    "date": "2013-07-11",
    "time": null,
    "source": "content_parsed",
    "raw_date": "7/11/2013",
    "confidence": "low"
  },
  "HOUSE_OVERSIGHT_030211": {
    "date": "2013-07-11",
    "time": "15:22:21",
    "source": "email_header",
    "raw_date": "7/11/2013 3:22:21 PM",
    "confidence": "high"
  },
  "HOUSE_OVERSIGHT_030214": {
    "date": "2017-02-07",
    "time": "19:12:15",
    "source": "email_header",
    "raw_date": "2/7/2017 7:12:15 PM",
    "confidence": "high"
  },
  "HOUSE_OVERSIGHT_030215": {
    "date": "2014-09-09",
    "time": "11:53:57",
    "source": "email_header",
    "raw_date": "9/9/2014 11:53:57 AM",
    "confidence": "high"
  },
  "HOUSE_OVERSIGHT_030216": {
    "date": "2017-02-07",
    "time": "19:18:38",
    "source": "email_header",
    "raw_date": "2/7/2017 7:18:38 PM",
    "confidence": "high"
  },
  "HOUSE_OVERSIGHT_030217": {
    "date": "2016-09-05",
    "time": "19:10:16",
    "source": "email_header",
    "raw_date": "9/5/2016 7:10:16 PM",
    "confidence": "high"
  },
  "HOUSE_OVERSIGHT_030218": {
    "date": "2015-05-13",
    "time": "23:27:12",
    "source": "email_header",
    "raw_date": "5/13/2015 11:27:12 PM",
    "confidence": "high"
  },
  "HOUSE_OVERSIGHT_030222": {
    "date": "2011-03-11",
    "time": "00:54:00",
    "source": "email_header",
    "raw_date": "Friday, March 11 2011 12:54 AM",
    "confidence": "high"
  },
  "HOUSE_OVERSIGHT_030229": {
    "date": "2011-03-12",
    "time": "02:15:00",
    "source": "email_header",
    "raw_date": "Saturday, March 12 2011 02:15 AM",
    "confidence": "high"
  },
  "HOUSE_OVERSIGHT_030235": {
    "date": "2011-07-16",
    "time": "18:42:55",
    "source": "email_header",
    "raw_date": "7/16/2011 6:42:55 PM",
    "confidence": "high"
  },
  "HOUSE_OVERSIGHT_030238": {
    "date": "2012-08-14",
    "time": "13:05:43",
    "source": "email_header",
    "raw_date": "8/14/2012 1:05:43 PM",
    "confidence": "high"
  },
  "HOUSE_OVERSIGHT_030242": {
    "date": "2014-04-12",
    "time": "11:24:06",
    "source": "email_header",
    "raw_date": "4/12/2014 11:24:06 AM",
    "confidence": "high"
  },
  "HOUSE_OVERSIGHT_030244": {
    "date": "2011-12-22",
    "time": "22:14:55",
    "source": "email_header",
    "raw_date": "12/22/2011 10:14:55 PM",
    "confidence": "high"
  },
  "HOUSE_OVERSIGHT_030245": {
    "date": "2016-07-17",
    "time": "13:35:22",
    "source": "email_header",
    "raw_date": "7/17/2016 1:35:22 PM",
    "confidence": "high"
  },
  "HOUSE_OVERSIGHT_030248": {
    "date": null,
    "time": null,
    "source": "unknown",
    "raw_date": null,
    "confidence": "none"
  },
  "HOUSE_OVERSIGHT_030255": {
    "date": "2018-12-15",
    "time": "18:40:52",
    "source": "email_header",
    "raw_date": "12/15/2018 6:40:52 PM",
    "confidence": "high"
  },
  "HOUSE_OVERSIGHT_030258": {
    "date": null,
    "time": null,
    "source": "unknown",
    "raw_date": null,
    "confidence": "none"
  },
  "HOUSE_OVERSIGHT_030266": {
    "date": "2018-12-03",
    "time": null,
    "source": "content_parsed",
    "raw_date": "12/3/2018",
    "confidence": "low"
  },
  "HOUSE_OVERSIGHT_030268": {
    "date": "2011-05-29",
    "time": null,
    "source": "metadata",
    "raw_date": "05/29/2011",
    "confidence": "medium"
  },
  "HOUSE_OVERSIGHT_030295": {
    "date": "2015-01-10",
    "time": "18:27:12",
    "source": "email_header",
    "raw_date": "Sat, 10 Jan 2015 18:27:12 +0000",
    "confidence": "high"
  },
  "HOUSE_OVERSIGHT_030299": {
    "date": "2010-02-26",
    "time": null,
    "source": "content_parsed",
    "raw_date": "Fri, Feb 26, 2010",
    "confidence": "low"
  },
  "HOUSE_OVERSIGHT_030311": {
    "date": "2010-02-26",
    "time": "18:37:49",
    "source": "email_header",
    "raw_date": "2/26/2010 6:37:49 PM",
    "confidence": "high"
  },
  "HOUSE_OVERSIGHT_030315": {
    "date": "2018-12-15",
    "time": "18:40:52",
    "source": "email_header",
    "raw_date": "12/15/2018 6:40:52 PM",
    "confidence": "high"
  },
  "HOUSE_OVERSIGHT_030318": {
    "date": "2018-12-15",
    "time": "17:03:19",
    "source": "email_header",
    "raw_date": "12/15/2018 5:03:19 PM",
    "confidence": "high"
  },
  "HOUSE_OVERSIGHT_030321": {
    "date": "2018-04-09",
    "time": null,
    "source": "content_parsed",
    "raw_date": "Monday, April 09, 2018",
    "confidence": "low"
  },
  "HOUSE_OVERSIGHT_030324": {
    "date": "2011-02-10",
    "time": "21:45:51",
    "source": "email_header",
    "raw_date": "2/10/2011 9:45:51 PM",
    "confidence": "high"
  },
  "HOUSE_OVERSIGHT_030326": {
    "date": "2018-08-01",
    "time": "13:34:05",
    "source": "email_header",
    "raw_date": "8/1/2018 1:34:05 PM",
    "confidence": "high"
  },
  "HOUSE_OVERSIGHT_030328": {
    "date": "2016-12-26",
    "time": "18:56:58",
    "source": "email_header",
    "raw_date": "12/26/2016 6:56:58 PM",
    "confidence": "high"
  },
  "HOUSE_OVERSIGHT_030330": {
    "date": "2014-01-09",
    "time": "13:39:00",
    "source": "email_header",
    "raw_date": "Thursday, January 9 2014 01:39 PM",
    "confidence": "high"
  },
  "HOUSE_OVERSIGHT_030332": {
    "date": "2014-09-26",
    "time": "22:57:00",
    "source": "email_header",
    "raw_date": "Friday, September 26 2014 10:57 PM",
    "confidence": "high"
  },
  "HOUSE_OVERSIGHT_030333": {
    "date": "2015-01-08",
    "time": null,
    "source": "metadata",
    "raw_date": "01/08/2015",
    "confidence": "medium"
  },
  "HOUSE_OVERSIGHT_030335": {
    "date": "2015-01-30",
    "time": "17:54:21",
    "source": "email_header",
    "raw_date": "1/30/2015 5:54:21 PM",
    "confidence": "high"
  },
  "HOUSE_OVERSIGHT_030339": {
    "date": "2015-01-30",
    "time": "19:03:47",
    "source": "email_header",
    "raw_date": "1/30/2015 7:03:47 PM",
    "confidence": "high"
  },
  "HOUSE_OVERSIGHT_030343": {
    "date": "2015-01-30",
    "time": "20:20:19",
    "source": "email_header",
    "raw_date": "1/30/2015 8:20:19 PM",
    "confidence": "high"
  },
  "HOUSE_OVERSIGHT_030347": {
    "date": "2016-11-04",
    "time": "22:58:00",
    "source": "email_header",
    "raw_date": "Friday, November 4 2016 10:58 PM",
    "confidence": "high"
  },
  "HOUSE_OVERSIGHT_030348": {
    "date": "2017-01-15",
    "time": "14:10:00",
    "source": "email_header",
    "raw_date": "Sunday, January 15 2017 02:10 PM",
    "confidence": "high"
  },
  "HOUSE_OVERSIGHT_030349": {
    "date": "2017-01-30",
    "time": "15:52:45",
    "source": "email_header",
    "raw_date": "1/30/2017 3:52:45 PM",
    "confidence": "high"
  },
  "HOUSE_OVERSIGHT_030350": {
    "date": "2017-03-25",
    "time": "00:41:05",
    "source": "email_header",
    "raw_date": "3/25/2017 12:41:05 AM",
    "confidence": "high"
  },
  "HOUSE_OVERSIGHT_030351": {
    "date": "2017-05-11",
    "time": "20:22:00",
    "source": "email_header",
    "raw_date": "Thursday, May 11 2017 08:22 PM",
    "confidence": "high"
  },
  "HOUSE_OVERSIGHT_030358": {
    "date": "2017-05-11",
    "time": "20:35:00",
    "source": "email_header",
    "raw_date": "Thursday, May 11 2017 08:35 PM",
    "confidence": "high"
  },
  "HOUSE_OVERSIGHT_030365": {
    "date": "2017-12-14",
    "time": "21:32:10",
    "source": "email_header",
    "raw_date": "12/14/2017 9:32:10 PM",
    "confidence": "high"
  },
  "HOUSE_OVERSIGHT_030366": {
    "date": "2017-12-15",
    "time": "20:25:35",
    "source": "email_header",
    "raw_date": "12/15/2017 8:25:35 PM",
    "confidence": "high"
  },
  "HOUSE_OVERSIGHT_030367": {
    "date": "2018-01-03",
    "time": null,
    "source": "content_parsed",
    "raw_date": "Wednesday, January 3, 2018",
    "confidence": "low"
  },
  "HOUSE_OVERSIGHT_030368": {
    "date": "2018-04-07",
    "time": "20:51:55",
    "source": "email_header",
    "raw_date": "4/7/2018 8:51:55 PM",
    "confidence": "high"
  },
  "HOUSE_OVERSIGHT_030369": {
    "date": "2018-04-07",
    "time": "21:36:20",
    "source": "email_header",
    "raw_date": "4/7/2018 9:36:20 PM",
    "confidence": "high"
  },
  "HOUSE_OVERSIGHT_030371": {
    "date": "2018-04-21",
    "time": "21:34:41",
    "source": "email_header",
    "raw_date": "4/21/2018 9:34:41 PM",
    "confidence": "high"
  },
  "HOUSE_OVERSIGHT_030372": {
    "date": "2018-08-08",
    "time": "14:07:34",
    "source": "email_header",
    "raw_date": "8/8/2018 2:07:34 PM",
    "confidence": "high"
  },
  "HOUSE_OVERSIGHT_030373": {
    "date": "2018-10-02",
    "time": null,
    "source": "content_parsed",
    "raw_date": "Tuesday, Oct 02, 2018",
    "confidence": "low"
  },
  "HOUSE_OVERSIGHT_030374": {
    "date": "2019-02-21",
    "time": "16:12:19",
    "source": "email_header",
    "raw_date": "2/21/2019 4:12:19 PM",
    "confidence": "high"
  },
  "HOUSE_OVERSIGHT_030375": {
    "date": "2019-02-21",
    "time": "16:49:48",
    "source": "email_header",
    "raw_date": "2/21/2019 4:49:48 PM",
    "confidence": "high"
  },
  "HOUSE_OVERSIGHT_030376": {
    "date": "2014-10-15",
    "time": "13:06:39",
    "source": "email_header",
    "raw_date": "10/15/2014 1:06:39 PM",
    "confidence": "high"
  },
  "HOUSE_OVERSIGHT_030377": {
    "date": "2015-01-30",
    "time": "19:04:56",
    "source": "email_header",
    "raw_date": "1/30/2015 7:04:56 PM",
    "confidence": "high"
  },
  "HOUSE_OVERSIGHT_030381": {
    "date": "2015-10-26",
    "time": "18:08:48",
    "source": "email_header",
    "raw_date": "10/26/2015 6:08:48 PM",
    "confidence": "high"
  },
  "HOUSE_OVERSIGHT_030382": {
    "date": "2015-10-26",
    "time": "18:11:47",
    "source": "email_header",
    "raw_date": "10/26/2015 6:11:47 PM",
    "confidence": "high"
  },
  "HOUSE_OVERSIGHT_030383": {
    "date": "2016-09-24",
    "time": "13:26:00",
    "source": "email_header",
    "raw_date": "Saturday, September 24 2016 01:26 PM",
    "confidence": "high"
  },
  "HOUSE_OVERSIGHT_030384": {
    "date": "2016-10-17",
    "time": "14:39:57",
    "source": "email_header",
    "raw_date": "10/17/2016 2:39:57 PM",
    "confidence": "high"
  },
  "HOUSE_OVERSIGHT_030385": {
    "date": "2017-01-15",
    "time": "14:16:00",
    "source": "email_header",
    "raw_date": "Sunday, January 15 2017 02:16 PM",
    "confidence": "high"
  },
  "HOUSE_OVERSIGHT_030386": {
    "date": "2017-01-30",
    "time": "15:50:06",
    "source": "email_header",
    "raw_date": "1/30/2017 3:50:06 PM",
    "confidence": "high"
  },
  "HOUSE_OVERSIGHT_030387": {
    "date": "2017-01-30",
    "time": "15:53:38",
    "source": "email_header",
    "raw_date": "1/30/2017 3:53:38 PM",
    "confidence": "high"
  },
  "HOUSE_OVERSIGHT_030389": {
    "date": "2017-05-11",
    "time": "20:30:00",
    "source": "email_header",
    "raw_date": "Thursday, May 11 2017 08:30 PM",
    "confidence": "high"
  },
  "HOUSE_OVERSIGHT_030396": {
    "date": "2017-11-09",
    "time": "16:08:49",
    "source": "email_header",
    "raw_date": "11/9/2017 4:08:49 PM",
    "confidence": "high"
  },
  "HOUSE_OVERSIGHT_030397": {
    "date": "2017-12-14",
    "time": "21:31:07",
    "source": "email_header",
    "raw_date": "12/14/2017 9:31:07 PM",
    "confidence": "high"
  },
  "HOUSE_OVERSIGHT_030398": {
    "date": "2017-12-15",
    "time": "19:50:42",
    "source": "email_header",
    "raw_date": "12/15/2017 7:50:42 PM",
    "confidence": "high"
  },
  "HOUSE_OVERSIGHT_030399": {
    "date": "2018-01-03",
    "time": "18:31:20",
    "source": "email_header",
    "raw_date": "1/3/2018 6:31:20 PM",
    "confidence": "high"
  },
  "HOUSE_OVERSIGHT_030400": {
    "date": "2018-01-03",
    "time": "18:50:43",
    "source": "email_header",
    "raw_date": "1/3/2018 6:50:43 PM",
    "confidence": "high"
  },
  "HOUSE_OVERSIGHT_030402": {
    "date": "2018-06-13",
    "time": "14:36:34",
    "source": "email_header",
    "raw_date": "6/13/2018 2:36:34 PM",
    "confidence": "high"
  },
  "HOUSE_OVERSIGHT_030406": {
    "date": "2018-07-08",
    "time": "09:51:20",
    "source": "email_header",
    "raw_date": "7/8/2018 9:51:20 AM",
    "confidence": "high"
  },
  "HOUSE_OVERSIGHT_030408": {
    "date": "2018-08-08",
    "time": "15:08:21",
    "source": "email_header",
    "raw_date": "8/8/2018 3:08:21 PM",
    "confidence": "high"
  },
  "HOUSE_OVERSIGHT_030410": {
    "date": "2018-10-02",
    "time": "23:26:53",
    "source": "email_header",
    "raw_date": "10/2/2018 11:26:53 PM",
    "confidence": "high"
  },
  "HOUSE_OVERSIGHT_030411": {
    "date": "2019-01-31",
    "time": "22:47:52",
    "source": "email_header",
    "raw_date": "1/31/2019 10:47:52 PM",
    "confidence": "high"
  },
  "HOUSE_OVERSIGHT_030412": {
    "date": "2019-01-31",
    "time": "23:22:00",
    "source": "email_header",
    "raw_date": "Thursday, January 31 2019 11:22 PM",
    "confidence": "high"
  },
  "HOUSE_OVERSIGHT_030413": {
    "date": "2019-02-21",
    "time": "15:50:48",
    "source": "email_header",
    "raw_date": "2/21/2019 3:50:48 PM",
    "confidence": "high"
  },
  "HOUSE_OVERSIGHT_030414": {
    "date": "2011-03-08",
    "time": "22:51:00",
    "source": "email_header",
    "raw_date": "Tuesday, March 8 2011 10:51 PM",
    "confidence": "high"
  },
  "HOUSE_OVERSIGHT_030417": {
    "date": "2011-03-08",
    "time": "23:49:00",
    "source": "email_header",
    "raw_date": "Tuesday, March 8 2011 11:49 PM",
    "confidence": "high"
  },
  "HOUSE_OVERSIGHT_030420": {
    "date": "2011-03-09",
    "time": "01:51:00",
    "source": "email_header",
    "raw_date": "Wednesday, March 9 2011 01:51 AM",
    "confidence": "high"
  },
  "HOUSE_OVERSIGHT_030423": {
    "date": "2011-04-28",
    "time": "12:31:12",
    "source": "email_header",
    "raw_date": "4/28/2011 12:31:12 PM",
    "confidence": "high"
  },
  "HOUSE_OVERSIGHT_030426": {
    "date": null,
    "time": null,
    "source": "unknown",
    "raw_date": null,
    "confidence": "none"
  },
  "HOUSE_OVERSIGHT_030429": {
    "date": "2014-03-20",
    "time": "18:19:00",
    "source": "email_header",
    "raw_date": "Thursday, March 20 2014 06:19 PM",
    "confidence": "high"
  },
  "HOUSE_OVERSIGHT_030430": {
    "date": "2017-02-06",
    "time": "20:34:19",
    "source": "email_header",
    "raw_date": "2/6/2017 8:34:19 PM",
    "confidence": "high"
  },
  "HOUSE_OVERSIGHT_030431": {
    "date": "2018-03-24",
    "time": "01:37:40",
    "source": "email_header",
    "raw_date": "3/24/2018 1:37:40 AM",
    "confidence": "high"
  },
  "HOUSE_OVERSIGHT_030432": {
    "date": "2018-04-15",
    "time": "17:01:00",
    "source": "email_header",
    "raw_date": "Sunday, April 15 2018 05:01 PM",
    "confidence": "high"
  },
  "HOUSE_OVERSIGHT_030433": {
    "date": "2019-07-06",
    "time": null,
    "source": "content_parsed",
    "raw_date": "Saturday, July 6, 2019",
    "confidence": "low"
  },
  "HOUSE_OVERSIGHT_030434": {
    "date": "2019-07-09",
    "time": "06:31:56",
    "source": "email_header",
    "raw_date": "7/9/2019 6:31:56 AM",
    "confidence": "high"
  },
  "HOUSE_OVERSIGHT_030444": {
    "date": "2018-05-06",
    "time": "01:54:36",
    "source": "email_header",
    "raw_date": "5/6/2018 1:54:36 AM",
    "confidence": "high"
  },
  "HOUSE_OVERSIGHT_030445": {
    "date": "2019-06-14",
    "time": "06:32:20",
    "source": "email_header",
    "raw_date": "6/14/2019 6:32:20 AM",
    "confidence": "high"
  },
  "HOUSE_OVERSIGHT_030454": {
    "date": "2011-03-07",
    "time": "16:18:00",
    "source": "email_header",
    "raw_date": "Monday, March 7 2011 04:18 PM",
    "confidence": "high"
  },
  "HOUSE_OVERSIGHT_030456": {
    "date": "2011-03-07",
    "time": "17:16:00",
    "source": "email_header",
    "raw_date": "Monday, March 7 2011 05:16 PM",
    "confidence": "high"
  },
  "HOUSE_OVERSIGHT_030458": {
    "date": "2011-03-07",
    "time": "21:53:00",
    "source": "email_header",
    "raw_date": "Monday, March 7 2011 09:53 PM",
    "confidence": "high"
  },
  "HOUSE_OVERSIGHT_030460": {
    "date": "2011-03-08",
    "time": "20:17:39",
    "source": "email_header",
    "raw_date": "3/8/2011 8:17:39 PM",
    "confidence": "high"
  },
  "HOUSE_OVERSIGHT_030462": {
    "date": "2011-03-08",
    "time": "20:48:00",
    "source": "email_header",
    "raw_date": "Tuesday, March 8 2011 08:48 PM",
    "confidence": "high"
  },
  "HOUSE_OVERSIGHT_030464": {
    "date": "2011-03-08",
    "time": null,
    "source": "content_parsed",
    "raw_date": "Tuesday, March 08, 2011",
    "confidence": "low"
  },
  "HOUSE_OVERSIGHT_030467": {
    "date": "2011-03-08",
    "time": "20:58:30",
    "source": "email_header",
    "raw_date": "3/8/2011 8:58:30 PM",
    "confidence": "high"
  },
  "HOUSE_OVERSIGHT_030470": {
    "date": "2011-03-08",
    "time": "21:08:46",
    "source": "email_header",
    "raw_date": "3/8/2011 9:08:46 PM",
    "confidence": "high"
  },
  "HOUSE_OVERSIGHT_030472": {
    "date": "2011-03-08",
    "time": "21:34:45",
    "source": "email_header",
    "raw_date": "3/8/2011 9:34:45 PM",
    "confidence": "high"
  },
  "HOUSE_OVERSIGHT_030475": {
    "date": "2011-03-08",
    "time": "23:17:34",
    "source": "email_header",
    "raw_date": "3/8/2011 11:17:34 PM",
    "confidence": "high"
  },
  "HOUSE_OVERSIGHT_030478": {
    "date": "2011-03-08",
    "time": "12:40:10",
    "source": "email_header",
    "raw_date": "Tue, 8 Mar 2011 12:40:10 -0800",
    "confidence": "high"
  },
  "HOUSE_OVERSIGHT_030482": {
    "date": "2011-08-03",
    "time": "00:55:00",
    "source": "email_header",
    "raw_date": "Wednesday, August 3 2011 12:55 AM",
    "confidence": "high"
  },
  "HOUSE_OVERSIGHT_030483": {
    "date": "2009-10-31",
    "time": "11:43:00",
    "source": "email_header",
    "raw_date": "Saturday, October 31 2009 11:43 AM",
    "confidence": "high"
  },
  "HOUSE_OVERSIGHT_030484": {
    "date": "2009-10-31",
    "time": "12:13:00",
    "source": "email_header",
    "raw_date": "Saturday, October 31 2009 12:13 PM",
    "confidence": "high"
  },
  "HOUSE_OVERSIGHT_030486": {
    "date": "2010-01-24",
    "time": "14:57:00",
    "source": "email_header",
    "raw_date": "Sunday, January 24 2010 02:57 PM",
    "confidence": "high"
  },
  "HOUSE_OVERSIGHT_030487": {
    "date": "2010-01-24",
    "time": "15:01:00",
    "source": "email_header",
    "raw_date": "Sunday, January 24 2010 03:01 PM",
    "confidence": "high"
  },
  "HOUSE_OVERSIGHT_030490": {
    "date": "2010-01-25",
    "time": "12:51:00",
    "source": "email_header",
    "raw_date": "Monday, January 25 2010 12:51 PM",
    "confidence": "high"
  },
  "HOUSE_OVERSIGHT_030491": {
    "date": "2010-01-28",
    "time": "10:24:00",
    "source": "email_header",
    "raw_date": "Thursday, January 28 2010 10:24 AM",
    "confidence": "high"
  },
  "HOUSE_OVERSIGHT_030493": {
    "date": "2010-01-28",
    "time": "10:29:00",
    "source": "email_header",
    "raw_date": "Thursday, January 28 2010 10:29 AM",
    "confidence": "high"
  },
  "HOUSE_OVERSIGHT_030495": {
    "date": "2010-01-28",
    "time": "10:39:00",
    "source": "email_header",
    "raw_date": "Thursday, January 28 2010 10:39 AM",
    "confidence": "high"
  },
  "HOUSE_OVERSIGHT_030498": {
    "date": "2010-01-28",
    "time": "10:40:00",
    "source": "email_header",
    "raw_date": "Thursday, January 28 2010 10:40 AM",
    "confidence": "high"
  },
  "HOUSE_OVERSIGHT_030501": {
    "date": "2010-01-28",
    "time": "11:21:00",
    "source": "email_header",
    "raw_date": "Thursday, January 28 2010 11:21 AM",
    "confidence": "high"
  },
  "HOUSE_OVERSIGHT_030502": {
    "date": "2010-01-28",
    "time": "14:46:00",
    "source": "email_header",
    "raw_date": "Thursday, January 28 2010 02:46 PM",
    "confidence": "high"
  },
  "HOUSE_OVERSIGHT_030506": {
    "date": "2010-11-03",
    "time": "14:40:00",
    "source": "email_header",
    "raw_date": "Wednesday, November 3 2010 02:40 PM",
    "confidence": "high"
  },
  "HOUSE_OVERSIGHT_030507": {
    "date": "2010-11-03",
    "time": "14:43:00",
    "source": "email_header",
    "raw_date": "Wednesday, November 3 2010 02:43 PM",
    "confidence": "high"
  },
  "HOUSE_OVERSIGHT_030508": {
    "date": "2010-11-03",
    "time": "14:53:00",
    "source": "email_header",
    "raw_date": "Wednesday, November 3 2010 02:53 PM",
    "confidence": "high"
  },
  "HOUSE_OVERSIGHT_030509": {
    "date": "2010-11-03",
    "time": "15:07:00",
    "source": "email_header",
    "raw_date": "Wednesday, November 3 2010 03:07 PM",
    "confidence": "high"
  },
  "HOUSE_OVERSIGHT_030510": {
    "date": "2010-11-15",
    "time": "19:13:00",
    "source": "email_header",
    "raw_date": "Monday, November 15 2010 07:13 PM",
    "confidence": "high"
  },
  "HOUSE_OVERSIGHT_030511": {
    "date": "2011-03-06",
    "time": "08:51:00",
    "source": "email_header",
    "raw_date": "Sunday, March 6 2011 08:51 AM",
    "confidence": "high"
  },
  "HOUSE_OVERSIGHT_030512": {
    "date": "2011-03-07",
    "time": null,
    "source": "content_parsed",
    "raw_date": "Mon, Mar 7, 2011",
    "confidence": "low"
  },
  "HOUSE_OVERSIGHT_030514": {
    "date": "2011-03-07",
    "time": "17:03:12",
    "source": "email_header",
    "raw_date": "3/7/2011 5:03:12 PM",
    "confidence": "high"
  },
  "HOUSE_OVERSIGHT_030516": {
    "date": "2011-03-07",
    "time": null,
    "source": "content_parsed",
    "raw_date": "Mon, Mar 7, 2011",
    "confidence": "low"
  },
  "HOUSE_OVERSIGHT_030519": {
    "date": "2011-03-08",
    "time": "01:48:24",
    "source": "email_header",
    "raw_date": "3/8/2011 1:48:24 AM",
    "confidence": "high"
  },
  "HOUSE_OVERSIGHT_030522": {
    "date": "2011-03-08",
    "time": "20:40:00",
    "source": "email_header",
    "raw_date": "Tuesday, March 8 2011 08:40 PM",
    "confidence": "high"
  },
  "HOUSE_OVERSIGHT_030525": {
    "date": "2011-03-08",
    "time": "22:48:00",
    "source": "email_header",
    "raw_date": "Tuesday, March 8 2011 10:48 PM",
    "confidence": "high"
  },
  "HOUSE_OVERSIGHT_030528": {
    "date": "2011-03-08",
    "time": "23:57:00",
    "source": "email_header",
    "raw_date": "Tuesday, March 8 2011 11:57 PM",
    "confidence": "high"
  },
  "HOUSE_OVERSIGHT_030531": {
    "date": "2011-04-19",
    "time": null,
    "source": "metadata",
    "raw_date": "04/19/2011",
    "confidence": "medium"
  },
  "HOUSE_OVERSIGHT_030570": {
    "date": "2011-05-04",
    "time": "10:51:00",
    "source": "email_header",
    "raw_date": "Wednesday, May 4 2011 10:51 AM",
    "confidence": "high"
  },
  "HOUSE_OVERSIGHT_030571": {
    "date": "2011-07-27",
    "time": "17:17:00",
    "source": "email_header",
    "raw_date": "Wednesday, July 27 2011 05:17 PM",
    "confidence": "high"
  },
  "HOUSE_OVERSIGHT_030572": {
    "date": "2011-08-02",
    "time": "20:40:00",
    "source": "email_header",
    "raw_date": "Tuesday, August 2 2011 08:40 PM",
    "confidence": "high"
  },
  "HOUSE_OVERSIGHT_030573": {
    "date": null,
    "time": null,
    "source": "unknown",
    "raw_date": null,
    "confidence": "none"
  },
  "HOUSE_OVERSIGHT_030574": {
    "date": "2014-02-26",
    "time": "17:08:53",
    "source": "email_header",
    "raw_date": "2/26/2014 5:08:53 PM",
    "confidence": "high"
  },
  "HOUSE_OVERSIGHT_030575": {
    "date": "2011-03-08",
    "time": "23:17:00",
    "source": "email_header",
    "raw_date": "Tuesday, March 8 2011 11:17 PM",
    "confidence": "high"
  },
  "HOUSE_OVERSIGHT_030578": {
    "date": "2011-03-08",
    "time": "22:51:00",
    "source": "email_header",
    "raw_date": "Tuesday, March 8 2011 10:51 PM",
    "confidence": "high"
  },
  "HOUSE_OVERSIGHT_030581": {
    "date": "2011-03-08",
    "time": "22:48:00",
    "source": "email_header",
    "raw_date": "Tuesday, March 8 2011 10:48 PM",
    "confidence": "high"
  },
  "HOUSE_OVERSIGHT_030584": {
    "date": "2011-03-08",
    "time": "20:58:00",
    "source": "email_header",
    "raw_date": "Tuesday, March 8 2011 08:58 PM",
    "confidence": "high"
  },
  "HOUSE_OVERSIGHT_030587": {
    "date": "2011-03-07",
    "time": "17:03:12",
    "source": "email_header",
    "raw_date": "3/7/2011 5:03:12 PM",
    "confidence": "high"
  },
  "HOUSE_OVERSIGHT_030589": {
    "date": "2011-03-04",
    "time": "16:31:00",
    "source": "email_header",
    "raw_date": "Friday, March 4 2011 04:31 PM",
    "confidence": "high"
  },
  "HOUSE_OVERSIGHT_030592": {
    "date": "2015-01-30",
    "time": "19:03:47",
    "source": "email_header",
    "raw_date": "1/30/2015 7:03:47 PM",
    "confidence": "high"
  },
  "HOUSE_OVERSIGHT_030596": {
    "date": "2015-01-30",
    "time": "17:54:21",
    "source": "email_header",
    "raw_date": "1/30/2015 5:54:21 PM",
    "confidence": "high"
  },
  "HOUSE_OVERSIGHT_030600": {
    "date": "2015-01-09",
    "time": "14:52:36",
    "source": "email_header",
    "raw_date": "1/9/2015 2:52:36 PM",
    "confidence": "high"
  },
  "HOUSE_OVERSIGHT_030602": {
    "date": "2010-01-28",
    "time": "14:46:00",
    "source": "email_header",
    "raw_date": "Thursday, January 28 2010 02:46 PM",
    "confidence": "high"
  },
  "HOUSE_OVERSIGHT_030606": {
    "date": "2010-01-28",
    "time": "10:40:00",
    "source": "email_header",
    "raw_date": "Thursday, January 28 2010 10:40 AM",
    "confidence": "high"
  },
  "HOUSE_OVERSIGHT_030609": {
    "date": "2010-01-28",
    "time": "10:39:00",
    "source": "email_header",
    "raw_date": "Thursday, January 28 2010 10:39 AM",
    "confidence": "high"
  },
  "HOUSE_OVERSIGHT_030612": {
    "date": "2010-01-28",
    "time": "10:29:00",
    "source": "email_header",
    "raw_date": "Thursday, January 28 2010 10:29 AM",
    "confidence": "high"
  },
  "HOUSE_OVERSIGHT_030614": {
    "date": "2010-01-28",
    "time": "10:24:00",
    "source": "email_header",
    "raw_date": "Thursday, January 28 2010 10:24 AM",
    "confidence": "high"
  },
  "HOUSE_OVERSIGHT_030616": {
    "date": "2009-06-19",
    "time": "23:01:00",
    "source": "email_header",
    "raw_date": "Friday, June 19 2009 11:01 PM",
    "confidence": "high"
  },
  "HOUSE_OVERSIGHT_030617": {
    "date": "2014-02-26",
    "time": "17:08:53",
    "source": "email_header",
    "raw_date": "2/26/2014 5:08:53 PM",
    "confidence": "high"
  },
  "HOUSE_OVERSIGHT_030618": {
    "date": "2013-10-19",
    "time": "00:27:41",
    "source": "email_header",
    "raw_date": "10/19/2013 12:27:41 AM",
    "confidence": "high"
  },
  "HOUSE_OVERSIGHT_030620": {
    "date": "2013-10-19",
    "time": "00:30:10",
    "source": "email_header",
    "raw_date": "10/19/2013 12:30:10 AM",
    "confidence": "high"
  },
  "HOUSE_OVERSIGHT_030622": {
    "date": "2013-10-19",
    "time": "00:10:27",
    "source": "email_header",
    "raw_date": "10/19/2013 12:10:27 AM",
    "confidence": "high"
  },
  "HOUSE_OVERSIGHT_030624": {
    "date": "2013-10-18",
    "time": "22:38:16",
    "source": "email_header",
    "raw_date": "10/18/2013 10:38:16 PM",
    "confidence": "high"
  },
  "HOUSE_OVERSIGHT_030626": {
    "date": "2018-12-21",
    "time": "21:22:54",
    "source": "email_header",
    "raw_date": "12/21/2018 9:22:54 PM",
    "confidence": "high"
  },
  "HOUSE_OVERSIGHT_030628": {
    "date": "2011-07-01",
    "time": "22:38:00",
    "source": "email_header",
    "raw_date": "Friday, July 1 2011 10:38 PM",
    "confidence": "high"
  },
  "HOUSE_OVERSIGHT_030630": {
    "date": "2016-07-08",
    "time": "20:10:26",
    "source": "email_header",
    "raw_date": "7/8/2016 8:10:26 PM",
    "confidence": "high"
  },
  "HOUSE_OVERSIGHT_030631": {
    "date": "2015-08-27",
    "time": "14:27:09",
    "source": "email_header",
    "raw_date": "8/27/2015 2:27:09 PM",
    "confidence": "high"
  },
  "HOUSE_OVERSIGHT_030634": {
    "date": "2016-06-24",
    "time": null,
    "source": "content_parsed",
    "raw_date": "6/24/2016",
    "confidence": "low"
  },
  "HOUSE_OVERSIGHT_030635": {
    "date": "2016-06-24",
    "time": "10:49:32",
    "source": "email_header",
    "raw_date": "6/24/2016 10:49:32 AM",
    "confidence": "high"
  },
  "HOUSE_OVERSIGHT_030636": {
    "date": "2016-09-25",
    "time": "19:10:59",
    "source": "email_header",
    "raw_date": "9/25/2016 7:10:59 PM",
    "confidence": "high"
  },
  "HOUSE_OVERSIGHT_030637": {
    "date": "2016-09-25",
    "time": "19:46:45",
    "source": "email_header",
    "raw_date": "9/25/2016 7:46:45 PM",
    "confidence": "high"
  },
  "HOUSE_OVERSIGHT_030639": {
    "date": "2016-09-26",
    "time": "05:14:01",
    "source": "email_header",
    "raw_date": "9/26/2016 5:14:01 AM",
    "confidence": "high"
  },
  "HOUSE_OVERSIGHT_030641": {
    "date": "2016-11-13",
    "time": "13:53:35",
    "source": "email_header",
    "raw_date": "11/13/2016 1:53:35 PM",
    "confidence": "high"
  },
  "HOUSE_OVERSIGHT_030643": {
    "date": "2016-11-13",
    "time": "15:19:37",
    "source": "email_header",
    "raw_date": "11/13/2016 3:19:37 PM",
    "confidence": "high"
  },
  "HOUSE_OVERSIGHT_030646": {
    "date": "2016-11-19",
    "time": "16:54:50",
    "source": "email_header",
    "raw_date": "11/19/2016 4:54:50 PM",
    "confidence": "high"
  },
  "HOUSE_OVERSIGHT_030647": {
    "date": "2016-11-28",
    "time": "17:11:02",
    "source": "email_header",
    "raw_date": "11/28/2016 5:11:02 PM",
    "confidence": "high"
  },
  "HOUSE_OVERSIGHT_030648": {
    "date": "2016-11-28",
    "time": "17:13:40",
    "source": "email_header",
    "raw_date": "11/28/2016 5:13:40 PM",
    "confidence": "high"
  },
  "HOUSE_OVERSIGHT_030649": {
    "date": "2016-11-28",
    "time": "17:18:00",
    "source": "email_header",
    "raw_date": "11/28/2016 5:18:00 PM",
    "confidence": "high"
  },
  "HOUSE_OVERSIGHT_030651": {
    "date": "2017-02-03",
    "time": "12:39:05",
    "source": "email_header",
    "raw_date": "2/3/2017 12:39:05 PM",
    "confidence": "high"
  },
  "HOUSE_OVERSIGHT_030652": {
    "date": "2017-04-05",
    "time": "17:00:25",
    "source": "email_header",
    "raw_date": "4/5/2017 5:00:25 PM",
    "confidence": "high"
  },
  "HOUSE_OVERSIGHT_030653": {
    "date": "2017-04-27",
    "time": "12:56:47",
    "source": "email_header",
    "raw_date": "4/27/2017 12:56:47 PM",
    "confidence": "high"
  },
  "HOUSE_OVERSIGHT_030654": {
    "date": "2017-06-21",
    "time": null,
    "source": "content_parsed",
    "raw_date": "6/21/2017",
    "confidence": "low"
  },
  "HOUSE_OVERSIGHT_030655": {
    "date": "2017-08-18",
    "time": "20:08:31",
    "source": "email_header",
    "raw_date": "8/18/2017 8:08:31 PM",
    "confidence": "high"
  },
  "HOUSE_OVERSIGHT_030656": {
    "date": "2017-09-26",
    "time": "00:12:50",
    "source": "email_header",
    "raw_date": "9/26/2017 12:12:50 AM",
    "confidence": "high"
  },
  "HOUSE_OVERSIGHT_030659": {
    "date": "2017-11-02",
    "time": "17:36:25",
    "source": "email_header",
    "raw_date": "11/2/2017 5:36:25 PM",
    "confidence": "high"
  },
  "HOUSE_OVERSIGHT_030662": {
    "date": "2017-11-02",
    "time": "17:44:41",
    "source": "email_header",
    "raw_date": "11/2/2017 5:44:41 PM",
    "confidence": "high"
  },
  "HOUSE_OVERSIGHT_030666": {
    "date": "2017-11-02",
    "time": "18:05:42",
    "source": "email_header",
    "raw_date": "11/2/2017 6:05:42 PM",
    "confidence": "high"
  },
  "HOUSE_OVERSIGHT_030670": {
    "date": "2017-11-02",
    "time": "18:07:15",
    "source": "email_header",
    "raw_date": "11/2/2017 6:07:15 PM",
    "confidence": "high"
  },
  "HOUSE_OVERSIGHT_030674": {
    "date": "2017-11-02",
    "time": "18:31:26",
    "source": "email_header",
    "raw_date": "11/2/2017 6:31:26 PM",
    "confidence": "high"
  },
  "HOUSE_OVERSIGHT_030679": {
    "date": "2017-11-21",
    "time": null,
    "source": "content_parsed",
    "raw_date": "Tuesday, November 21, 2017",
    "confidence": "low"
  },
  "HOUSE_OVERSIGHT_030683": {
    "date": "2017-12-11",
    "time": "16:47:33",
    "source": "email_header",
    "raw_date": "12/11/2017 4:47:33 PM",
    "confidence": "high"
  },
  "HOUSE_OVERSIGHT_030684": {
    "date": "2017-12-11",
    "time": "16:57:12",
    "source": "email_header",
    "raw_date": "12/11/2017 4:57:12 PM",
    "confidence": "high"
  },
  "HOUSE_OVERSIGHT_030686": {
    "date": "2017-12-11",
    "time": "19:52:00",
    "source": "email_header",
    "raw_date": "12/11/2017 7:52:00 PM",
    "confidence": "high"
  },
  "HOUSE_OVERSIGHT_030688": {
    "date": "2018-01-18",
    "time": "13:42:21",
    "source": "email_header",
    "raw_date": "1/18/2018 1:42:21 PM",
    "confidence": "high"
  },
  "HOUSE_OVERSIGHT_030689": {
    "date": "2018-01-18",
    "time": "14:08:34",
    "source": "email_header",
    "raw_date": "1/18/2018 2:08:34 PM",
    "confidence": "high"
  },
  "HOUSE_OVERSIGHT_030691": {
    "date": "2018-01-18",
    "time": "14:16:32",
    "source": "email_header",
    "raw_date": "1/18/2018 2:16:32 PM",
    "confidence": "high"
  },
  "HOUSE_OVERSIGHT_030693": {
    "date": "2018-01-18",
    "time": "14:20:01",
    "source": "email_header",
    "raw_date": "1/18/2018 2:20:01 PM",
    "confidence": "high"
  },
  "HOUSE_OVERSIGHT_030696": {
    "date": "2018-01-18",
    "time": "14:32:20",
    "source": "email_header",
    "raw_date": "1/18/2018 2:32:20 PM",
    "confidence": "high"
  },
  "HOUSE_OVERSIGHT_030699": {
    "date": "2018-01-18",
    "time": "14:42:25",
    "source": "email_header",
    "raw_date": "1/18/2018 2:42:25 PM",
    "confidence": "high"
  },
  "HOUSE_OVERSIGHT_030703": {
    "date": "2018-02-10",
    "time": "17:20:54",
    "source": "email_header",
    "raw_date": "2/10/2018 5:20:54 PM",
    "confidence": "high"
  },
  "HOUSE_OVERSIGHT_030706": {
    "date": "2018-02-10",
    "time": "17:28:33",
    "source": "email_header",
    "raw_date": "2/10/2018 5:28:33 PM",
    "confidence": "high"
  },
  "HOUSE_OVERSIGHT_030710": {
    "date": "2018-03-15",
    "time": "10:04:58",
    "source": "email_header",
    "raw_date": "3/15/2018 10:04:58 AM",
    "confidence": "high"
  },
  "HOUSE_OVERSIGHT_030711": {
    "date": "2018-03-15",
    "time": "10:54:45",
    "source": "email_header",
    "raw_date": "3/15/2018 10:54:45 AM",
    "confidence": "high"
  },
  "HOUSE_OVERSIGHT_030712": {
    "date": "2018-03-15",
    "time": "11:07:24",
    "source": "email_header",
    "raw_date": "3/15/2018 11:07:24 AM",
    "confidence": "high"
  },
  "HOUSE_OVERSIGHT_030714": {
    "date": "2018-03-16",
    "time": "11:19:55",
    "source": "email_header",
    "raw_date": "3/16/2018 11:19:55 AM",
    "confidence": "high"
  },
  "HOUSE_OVERSIGHT_030715": {
    "date": "2018-03-16",
    "time": "11:25:35",
    "source": "email_header",
    "raw_date": "3/16/2018 11:25:35 AM",
    "confidence": "high"
  },
  "HOUSE_OVERSIGHT_030716": {
    "date": "2018-03-21",
    "time": "08:32:08",
    "source": "email_header",
    "raw_date": "3/21/2018 8:32:08 AM",
    "confidence": "high"
  },
  "HOUSE_OVERSIGHT_030717": {
    "date": "2018-03-21",
    "time": "13:54:31",
    "source": "email_header",
    "raw_date": "3/21/2018 1:54:31 PM",
    "confidence": "high"
  },
  "HOUSE_OVERSIGHT_030719": {
    "date": "2018-03-21",
    "time": "14:54:13",
    "source": "email_header",
    "raw_date": "3/21/2018 2:54:13 PM",
    "confidence": "high"
  },
  "HOUSE_OVERSIGHT_030721": {
    "date": "2018-03-24",
    "time": "08:08:37",
    "source": "email_header",
    "raw_date": "3/24/2018 8:08:37 AM",
    "confidence": "high"
  },
  "HOUSE_OVERSIGHT_030722": {
    "date": "2018-07-08",
    "time": "00:53:09",
    "source": "email_header",
    "raw_date": "7/8/2018 12:53:09 AM",
    "confidence": "high"
  },
  "HOUSE_OVERSIGHT_030723": {
    "date": "2018-07-12",
    "time": "07:55:54",
    "source": "email_header",
    "raw_date": "7/12/2018 7:55:54 AM",
    "confidence": "high"
  },
  "HOUSE_OVERSIGHT_030724": {
    "date": "2018-07-12",
    "time": "10:51:21",
    "source": "email_header",
    "raw_date": "7/12/2018 10:51:21 AM",
    "confidence": "high"
  },
  "HOUSE_OVERSIGHT_030725": {
    "date": "2018-07-12",
    "time": "11:02:32",
    "source": "email_header",
    "raw_date": "7/12/2018 11:02:32 AM",
    "confidence": "high"
  },
  "HOUSE_OVERSIGHT_030727": {
    "date": "2018-07-12",
    "time": "11:03:10",
    "source": "email_header",
    "raw_date": "7/12/2018 11:03:10 AM",
    "confidence": "high"
  },
  "HOUSE_OVERSIGHT_030729": {
    "date": "2018-07-12",
    "time": "11:08:45",
    "source": "email_header",
    "raw_date": "7/12/2018 11:08:45 AM",
    "confidence": "high"
  },
  "HOUSE_OVERSIGHT_030731": {
    "date": "2018-07-20",
    "time": "10:16:04",
    "source": "email_header",
    "raw_date": "7/20/2018 10:16:04 AM",
    "confidence": "high"
  },
  "HOUSE_OVERSIGHT_030732": {
    "date": "2018-07-20",
    "time": "14:11:44",
    "source": "email_header",
    "raw_date": "7/20/2018 2:11:44 PM",
    "confidence": "high"
  },
  "HOUSE_OVERSIGHT_030733": {
    "date": "2018-07-21",
    "time": "11:40:00",
    "source": "email_header",
    "raw_date": "7/21/2018 11:40:00 AM",
    "confidence": "high"
  },
  "HOUSE_OVERSIGHT_030734": {
    "date": "2018-07-21",
    "time": "12:31:16",
    "source": "email_header",
    "raw_date": "7/21/2018 12:31:16 PM",
    "confidence": "high"
  },
  "HOUSE_OVERSIGHT_030736": {
    "date": "2018-08-20",
    "time": "01:41:12",
    "source": "email_header",
    "raw_date": "8/20/2018 1:41:12 AM",
    "confidence": "high"
  },
  "HOUSE_OVERSIGHT_030737": {
    "date": "2018-08-20",
    "time": "02:21:37",
    "source": "email_header",
    "raw_date": "8/20/2018 2:21:37 AM",
    "confidence": "high"
  },
  "HOUSE_OVERSIGHT_030738": {
    "date": "2018-08-20",
    "time": "02:28:22",
    "source": "email_header",
    "raw_date": "8/20/2018 2:28:22 AM",
    "confidence": "high"
  },
  "HOUSE_OVERSIGHT_030740": {
    "date": "2018-11-05",
    "time": "19:35:30",
    "source": "email_header",
    "raw_date": "11/5/2018 7:35:30 PM",
    "confidence": "high"
  },
  "HOUSE_OVERSIGHT_030741": {
    "date": "2018-11-08",
    "time": "19:17:03",
    "source": "email_header",
    "raw_date": "11/8/2018 7:17:03 PM",
    "confidence": "high"
  },
  "HOUSE_OVERSIGHT_030742": {
    "date": "2019-05-30",
    "time": "11:13:27",
    "source": "email_header",
    "raw_date": "5/30/2019 11:13:27 AM",
    "confidence": "high"
  },
  "HOUSE_OVERSIGHT_030743": {
    "date": "2019-05-30",
    "time": "11:24:24",
    "source": "email_header",
    "raw_date": "5/30/2019 11:24:24 AM",
    "confidence": "high"
  },
  "HOUSE_OVERSIGHT_030745": {
    "date": "2015-01-10",
    "time": "14:36:20",
    "source": "email_header",
    "raw_date": "1/10/2015 2:36:20 PM",
    "confidence": "high"
  },
  "HOUSE_OVERSIGHT_030748": {
    "date": "2015-01-10",
    "time": "14:41:47",
    "source": "email_header",
    "raw_date": "1/10/2015 2:41:47 PM",
    "confidence": "high"
  },
  "HOUSE_OVERSIGHT_030751": {
    "date": "2015-03-30",
    "time": "01:52:00",
    "source": "email_header",
    "raw_date": "3/30/2015 1:52:00 AM",
    "confidence": "high"
  },
  "HOUSE_OVERSIGHT_030752": {
    "date": "2015-08-27",
    "time": "14:26:33",
    "source": "email_header",
    "raw_date": "8/27/2015 2:26:33 PM",
    "confidence": "high"
  },
  "HOUSE_OVERSIGHT_030755": {
    "date": "2016-06-24",
    "time": "10:51:32",
    "source": "email_header",
    "raw_date": "6/24/2016 10:51:32 AM",
    "confidence": "high"
  },
  "HOUSE_OVERSIGHT_030757": {
    "date": "2016-09-26",
    "time": null,
    "source": "content_parsed",
    "raw_date": "Mon, Sep 26, 2016",
    "confidence": "low"
  },
  "HOUSE_OVERSIGHT_030760": {
    "date": "2016-10-02",
    "time": "04:14:41",
    "source": "email_header",
    "raw_date": "10/2/2016 4:14:41 AM",
    "confidence": "high"
  },
  "HOUSE_OVERSIGHT_030761": {
    "date": "2016-11-19",
    "time": "17:09:17",
    "source": "email_header",
    "raw_date": "11/19/2016 5:09:17 PM",
    "confidence": "high"
  },
  "HOUSE_OVERSIGHT_030762": {
    "date": "2016-11-28",
    "time": "17:16:31",
    "source": "email_header",
    "raw_date": "11/28/2016 5:16:31 PM",
    "confidence": "high"
  },
  "HOUSE_OVERSIGHT_030764": {
    "date": "2017-02-19",
    "time": "10:17:46",
    "source": "email_header",
    "raw_date": "2/19/2017 10:17:46 AM",
    "confidence": "high"
  },
  "HOUSE_OVERSIGHT_030766": {
    "date": "2017-04-05",
    "time": "16:56:22",
    "source": "email_header",
    "raw_date": "4/5/2017 4:56:22 PM",
    "confidence": "high"
  },
  "HOUSE_OVERSIGHT_030767": {
    "date": "2017-04-27",
    "time": "12:57:44",
    "source": "email_header",
    "raw_date": "4/27/2017 12:57:44 PM",
    "confidence": "high"
  },
  "HOUSE_OVERSIGHT_030768": {
    "date": "2017-06-21",
    "time": null,
    "source": "content_parsed",
    "raw_date": "Wed, Jun 21, 2017",
    "confidence": "low"
  },
  "HOUSE_OVERSIGHT_030769": {
    "date": "2017-11-07",
    "time": null,
    "source": "metadata",
    "raw_date": "11/07/2017",
    "confidence": "medium"
  },
  "HOUSE_OVERSIGHT_030770": {
    "date": "2017-12-11",
    "time": "16:52:48",
    "source": "email_header",
    "raw_date": "12/11/2017 4:52:48 PM",
    "confidence": "high"
  },
  "HOUSE_OVERSIGHT_030771": {
    "date": "2017-12-11",
    "time": "19:39:17",
    "source": "email_header",
    "raw_date": "12/11/2017 7:39:17 PM",
    "confidence": "high"
  },
  "HOUSE_OVERSIGHT_030773": {
    "date": "2017-12-11",
    "time": "19:54:19",
    "source": "email_header",
    "raw_date": "12/11/2017 7:54:19 PM",
    "confidence": "high"
  },
  "HOUSE_OVERSIGHT_030775": {
    "date": "2018-01-18",
    "time": "14:12:02",
    "source": "email_header",
    "raw_date": "1/18/2018 2:12:02 PM",
    "confidence": "high"
  },
  "HOUSE_OVERSIGHT_030777": {
    "date": "2018-01-18",
    "time": "14:44:02",
    "source": "email_header",
    "raw_date": "1/18/2018 2:44:02 PM",
    "confidence": "high"
  },
  "HOUSE_OVERSIGHT_030781": {
    "date": "2018-02-26",
    "time": "05:01:50",
    "source": "email_header",
    "raw_date": "2/26/2018 5:01:50 AM",
    "confidence": "high"
  },
  "HOUSE_OVERSIGHT_030784": {
    "date": "2018-03-07",
    "time": "12:17:54",
    "source": "email_header",
    "raw_date": "3/7/2018 12:17:54 PM",
    "confidence": "high"
  },
  "HOUSE_OVERSIGHT_030785": {
    "date": "2018-03-24",
    "time": "10:43:53",
    "source": "email_header",
    "raw_date": "3/24/2018 10:43:53 AM",
    "confidence": "high"
  },
  "HOUSE_OVERSIGHT_030786": {
    "date": "2018-04-10",
    "time": "09:01:05",
    "source": "email_header",
    "raw_date": "4/10/2018 9:01:05 AM",
    "confidence": "high"
  },
  "HOUSE_OVERSIGHT_030787": {
    "date": "2018-05-05",
    "time": "23:34:36",
    "source": "email_header",
    "raw_date": "5/5/2018 11:34:36 PM",
    "confidence": "high"
  },
  "HOUSE_OVERSIGHT_030788": {
    "date": "2018-05-09",
    "time": "10:57:12",
    "source": "email_header",
    "raw_date": "5/9/2018 10:57:12 AM",
    "confidence": "high"
  },
  "HOUSE_OVERSIGHT_030789": {
    "date": "2018-07-12",
    "time": "10:36:12",
    "source": "email_header",
    "raw_date": "7/12/2018 10:36:12 AM",
    "confidence": "high"
  },
  "HOUSE_OVERSIGHT_030790": {
    "date": "2018-07-12",
    "time": "11:14:48",
    "source": "email_header",
    "raw_date": "7/12/2018 11:14:48 AM",
    "confidence": "high"
  },
  "HOUSE_OVERSIGHT_030793": {
    "date": "2018-07-20",
    "time": "10:42:07",
    "source": "email_header",
    "raw_date": "7/20/2018 10:42:07 AM",
    "confidence": "high"
  },
  "HOUSE_OVERSIGHT_030794": {
    "date": "2018-07-20",
    "time": "14:32:16",
    "source": "email_header",
    "raw_date": "7/20/2018 2:32:16 PM",
    "confidence": "high"
  },
  "HOUSE_OVERSIGHT_030795": {
    "date": "2018-08-18",
    "time": "16:54:58",
    "source": "email_header",
    "raw_date": "8/18/2018 4:54:58 PM",
    "confidence": "high"
  },
  "HOUSE_OVERSIGHT_030797": {
    "date": "2018-08-20",
    "time": "02:34:11",
    "source": "email_header",
    "raw_date": "8/20/2018 2:34:11 AM",
    "confidence": "high"
  },
  "HOUSE_OVERSIGHT_030799": {
    "date": "2018-12-26",
    "time": "14:33:08",
    "source": "email_header",
    "raw_date": "12/26/2018 2:33:08 PM",
    "confidence": "high"
  },
  "HOUSE_OVERSIGHT_030801": {
    "date": "2018-12-30",
    "time": "20:01:43",
    "source": "email_header",
    "raw_date": "12/30/2018 8:01:43 PM",
    "confidence": "high"
  },
  "HOUSE_OVERSIGHT_030802": {
    "date": "2019-05-30",
    "time": "11:43:25",
    "source": "email_header",
    "raw_date": "5/30/2019 11:43:25 AM",
    "confidence": "high"
  },
  "HOUSE_OVERSIGHT_030804": {
    "date": "2019-05-30",
    "time": "11:46:19",
    "source": "email_header",
    "raw_date": "5/30/2019 11:46:19 AM",
    "confidence": "high"
  },
  "HOUSE_OVERSIGHT_030806": {
    "date": "2011-01-29",
    "time": "00:36:57",
    "source": "email_header",
    "raw_date": "1/29/2011 12:36:57 AM",
    "confidence": "high"
  },
  "HOUSE_OVERSIGHT_030807": {
    "date": "2011-04-27",
    "time": "22:14:56",
    "source": "email_header",
    "raw_date": "4/27/2011 10:14:56 PM",
    "confidence": "high"
  },
  "HOUSE_OVERSIGHT_030808": {
    "date": "2011-07-11",
    "time": null,
    "source": "metadata",
    "raw_date": "07/11/2011",
    "confidence": "medium"
  },
  "HOUSE_OVERSIGHT_030814": {
    "date": "2011-11-21",
    "time": null,
    "source": "metadata",
    "raw_date": "11/21/2011",
    "confidence": "medium"
  },
  "HOUSE_OVERSIGHT_030823": {
    "date": "2011-11-23",
    "time": "17:29:30",
    "source": "email_header",
    "raw_date": "11/23/2011 5:29:30 PM",
    "confidence": "high"
  },
  "HOUSE_OVERSIGHT_030825": {
    "date": "2013-08-10",
    "time": null,
    "source": "metadata",
    "raw_date": "08/10/2013",
    "confidence": "medium"
  },
  "HOUSE_OVERSIGHT_030829": {
    "date": "2014-04-21",
    "time": null,
    "source": "content_parsed",
    "raw_date": "Monday, April 21, 2014",
    "confidence": "low"
  },
  "HOUSE_OVERSIGHT_030837": {
    "date": "2012-11-06",
    "time": "22:24:50",
    "source": "email_header",
    "raw_date": "11/6/2012 10:24:50 PM",
    "confidence": "high"
  },
  "HOUSE_OVERSIGHT_030840": {
    "date": "2012-11-15",
    "time": null,
    "source": "metadata",
    "raw_date": "11/15/2012",
    "confidence": "medium"
  },
  "HOUSE_OVERSIGHT_030844": {
    "date": "2013-03-29",
    "time": "20:48:11",
    "source": "email_header",
    "raw_date": "3/29/2013 8:48:11 PM",
    "confidence": "high"
  },
  "HOUSE_OVERSIGHT_030848": {
    "date": "2013-03-28",
    "time": null,
    "source": "metadata",
    "raw_date": "03/28/2013",
    "confidence": "medium"
  },
  "HOUSE_OVERSIGHT_030856": {
    "date": "2015-01-09",
    "time": "01:53:22",
    "source": "email_header",
    "raw_date": "1/9/2015 1:53:22 AM",
    "confidence": "high"
  },
  "HOUSE_OVERSIGHT_030859": {
    "date": "2015-03-27",
    "time": "02:34:05",
    "source": "email_header",
    "raw_date": "3/27/2015 2:34:05 AM",
    "confidence": "high"
  },
  "HOUSE_OVERSIGHT_030861": {
    "date": "2015-03-31",
    "time": "20:06:56",
    "source": "email_header",
    "raw_date": "3/31/2015 8:06:56 PM",
    "confidence": "high"
  },
  "HOUSE_OVERSIGHT_030863": {
    "date": "2015-07-21",
    "time": null,
    "source": "content_parsed",
    "raw_date": "7/21/2015",
    "confidence": "low"
  },
  "HOUSE_OVERSIGHT_030865": {
    "date": "2016-09-16",
    "time": null,
    "source": "content_parsed",
    "raw_date": "Friday, September 16, 2016",
    "confidence": "low"
  },
  "HOUSE_OVERSIGHT_030868": {
    "date": "2017-02-10",
    "time": "15:43:30",
    "source": "email_header",
    "raw_date": "2/10/2017 3:43:30 PM",
    "confidence": "high"
  },
  "HOUSE_OVERSIGHT_030871": {
    "date": "2017-07-21",
    "time": "04:13:33",
    "source": "email_header",
    "raw_date": "7/21/2017 4:13:33 AM",
    "confidence": "high"
  },
  "HOUSE_OVERSIGHT_030873": {
    "date": "2017-10-09",
    "time": "13:18:25",
    "source": "email_header",
    "raw_date": "10/9/2017 1:18:25 PM",
    "confidence": "high"
  },
  "HOUSE_OVERSIGHT_030874": {
    "date": "2017-10-12",
    "time": "18:36:24",
    "source": "email_header",
    "raw_date": "10/12/2017 6:36:24 PM",
    "confidence": "high"
  },
  "HOUSE_OVERSIGHT_030875": {
    "date": null,
    "time": null,
    "source": "unknown",
    "raw_date": null,
    "confidence": "none"
  },
  "HOUSE_OVERSIGHT_030876": {
    "date": "2018-06-01",
    "time": "22:54:16",
    "source": "email_header",
    "raw_date": "6/1/2018 10:54:16 PM",
    "confidence": "high"
  },
  "HOUSE_OVERSIGHT_030878": {
    "date": "2018-09-15",
    "time": "01:09:39",
    "source": "email_header",
    "raw_date": "9/15/2018 1:09:39 AM",
    "confidence": "high"
  },
  "HOUSE_OVERSIGHT_030880": {
    "date": "2019-03-11",
    "time": "20:08:25",
    "source": "email_header",
    "raw_date": "3/11/2019 8:08:25 PM",
    "confidence": "high"
  },
  "HOUSE_OVERSIGHT_030881": {
    "date": "2013-09-22",
    "time": "14:08:00",
    "source": "email_header",
    "raw_date": "9/22/2013 2:08:00 PM",
    "confidence": "high"
  },
  "HOUSE_OVERSIGHT_030882": {
    "date": "2013-12-15",
    "time": "05:16:35",
    "source": "email_header",
    "raw_date": "12/15/2013 5:16:35 AM",
    "confidence": "high"
  },
  "HOUSE_OVERSIGHT_030883": {
    "date": "2018-05-05",
    "time": "02:09:16",
    "source": "email_header",
    "raw_date": "5/5/2018 2:09:16 AM",
    "confidence": "high"
  },
  "HOUSE_OVERSIGHT_030884": {
    "date": null,
    "time": null,
    "source": "unknown",
    "raw_date": null,
    "confidence": "none"
  },
  "HOUSE_OVERSIGHT_030885": {
    "date": "2010-12-17",
    "time": "13:13:39",
    "source": "email_header",
    "raw_date": "12/17/2010 1:13:39 PM",
    "confidence": "high"
  },
  "HOUSE_OVERSIGHT_030886": {
    "date": "2011-01-30",
    "time": "23:29:14",
    "source": "email_header",
    "raw_date": "1/30/2011 11:29:14 PM",
    "confidence": "high"
  },
  "HOUSE_OVERSIGHT_030887": {
    "date": "2011-01-30",
    "time": "23:39:47",
    "source": "email_header",
    "raw_date": "1/30/2011 11:39:47 PM",
    "confidence": "high"
  },
  "HOUSE_OVERSIGHT_030889": {
    "date": "2011-04-03",
    "time": "02:40:39",
    "source": "email_header",
    "raw_date": "4/3/2011 2:40:39 AM",
    "confidence": "high"
  },
  "HOUSE_OVERSIGHT_030890": {
    "date": "2011-04-04",
    "time": "00:16:17",
    "source": "email_header",
    "raw_date": "4/4/2011 12:16:17 AM",
    "confidence": "high"
  },
  "HOUSE_OVERSIGHT_030892": {
    "date": "2011-04-04",
    "time": "01:36:28",
    "source": "email_header",
    "raw_date": "4/4/2011 1:36:28 AM",
    "confidence": "high"
  },
  "HOUSE_OVERSIGHT_030895": {
    "date": "2011-04-06",
    "time": "21:31:19",
    "source": "email_header",
    "raw_date": "4/6/2011 9:31:19 PM",
    "confidence": "high"
  },
  "HOUSE_OVERSIGHT_030899": {
    "date": "2011-04-06",
    "time": "22:18:31",
    "source": "email_header",
    "raw_date": "4/6/2011 10:18:31 PM",
    "confidence": "high"
  },
  "HOUSE_OVERSIGHT_030904": {
    "date": "2011-04-06",
    "time": "22:58:21",
    "source": "email_header",
    "raw_date": "4/6/2011 10:58:21 PM",
    "confidence": "high"
  },
  "HOUSE_OVERSIGHT_030909": {
    "date": "2011-04-06",
    "time": "23:42:24",
    "source": "email_header",
    "raw_date": "4/6/2011 11:42:24 PM",
    "confidence": "high"
  },
  "HOUSE_OVERSIGHT_030915": {
    "date": "2011-04-07",
    "time": "02:05:28",
    "source": "email_header",
    "raw_date": "4/7/2011 2:05:28 AM",
    "confidence": "high"
  },
  "HOUSE_OVERSIGHT_030920": {
    "date": "2011-04-07",
    "time": "04:12:11",
    "source": "email_header",
    "raw_date": "4/7/2011 4:12:11 AM",
    "confidence": "high"
  },
  "HOUSE_OVERSIGHT_030927": {
    "date": "2009-10-12",
    "time": null,
    "source": "content_parsed",
    "raw_date": "Monday, October 12, 2009",
    "confidence": "low"
  },
  "HOUSE_OVERSIGHT_030950": {
    "date": "2012-09-07",
    "time": "02:40:14",
    "source": "email_header",
    "raw_date": "9/7/2012 2:40:14 AM",
    "confidence": "high"
  },
  "HOUSE_OVERSIGHT_030954": {
    "date": "2018-05-03",
    "time": "13:46:48",
    "source": "email_header",
    "raw_date": "5/3/2018 1:46:48 PM",
    "confidence": "high"
  },
  "HOUSE_OVERSIGHT_030956": {
    "date": "2018-05-05",
    "time": "05:46:34",
    "source": "email_header",
    "raw_date": "5/5/2018 5:46:34 AM",
    "confidence": "high"
  },
  "HOUSE_OVERSIGHT_030957": {
    "date": "2018-05-05",
    "time": "10:07:11",
    "source": "email_header",
    "raw_date": "5/5/2018 10:07:11 AM",
    "confidence": "high"
  },
  "HOUSE_OVERSIGHT_030958": {
    "date": "2018-12-06",
    "time": "22:25:30",
    "source": "email_header",
    "raw_date": "12/6/2018 10:25:30 PM",
    "confidence": "high"
  },
  "HOUSE_OVERSIGHT_030962": {
    "date": "2018-12-06",
    "time": "22:26:10",
    "source": "email_header",
    "raw_date": "12/6/2018 10:26:10 PM",
    "confidence": "high"
  },
  "HOUSE_OVERSIGHT_030966": {
    "date": "2018-12-22",
    "time": "13:59:38",
    "source": "email_header",
    "raw_date": "12/22/2018 1:59:38 PM",
    "confidence": "high"
  },
  "HOUSE_OVERSIGHT_030967": {
    "date": "2018-12-22",
    "time": "14:17:57",
    "source": "email_header",
    "raw_date": "12/22/2018 2:17:57 PM",
    "confidence": "high"
  },
  "HOUSE_OVERSIGHT_030968": {
    "date": "2018-12-22",
    "time": "15:35:08",
    "source": "email_header",
    "raw_date": "12/22/2018 3:35:08 PM",
    "confidence": "high"
  },
  "HOUSE_OVERSIGHT_030970": {
    "date": "2018-12-22",
    "time": "15:44:28",
    "source": "email_header",
    "raw_date": "12/22/2018 3:44:28 PM",
    "confidence": "high"
  },
  "HOUSE_OVERSIGHT_030972": {
    "date": "2019-02-01",
    "time": "16:11:28",
    "source": "email_header",
    "raw_date": "2/1/2019 4:11:28 PM",
    "confidence": "high"
  },
  "HOUSE_OVERSIGHT_030974": {
    "date": "2019-02-01",
    "time": "16:46:54",
    "source": "email_header",
    "raw_date": "2/1/2019 4:46:54 PM",
    "confidence": "high"
  },
  "HOUSE_OVERSIGHT_030976": {
    "date": "2019-05-29",
    "time": "16:46:05",
    "source": "email_header",
    "raw_date": "5/29/2019 4:46:05 PM",
    "confidence": "high"
  },
  "HOUSE_OVERSIGHT_030978": {
    "date": "2019-05-29",
    "time": "16:47:32",
    "source": "email_header",
    "raw_date": "5/29/2019 4:47:32 PM",
    "confidence": "high"
  },
  "HOUSE_OVERSIGHT_030980": {
    "date": "2019-05-29",
    "time": "22:38:12",
    "source": "email_header",
    "raw_date": "5/29/2019 10:38:12 PM",
    "confidence": "high"
  },
  "HOUSE_OVERSIGHT_030983": {
    "date": "2018-12-06",
    "time": "22:17:57",
    "source": "email_header",
    "raw_date": "12/6/2018 10:17:57 PM",
    "confidence": "high"
  },
  "HOUSE_OVERSIGHT_030986": {
    "date": "2018-12-22",
    "time": "15:31:34",
    "source": "email_header",
    "raw_date": "12/22/2018 3:31:34 PM",
    "confidence": "high"
  },
  "HOUSE_OVERSIGHT_030987": {
    "date": "2019-02-01",
    "time": "16:07:11",
    "source": "email_header",
    "raw_date": "2/1/2019 4:07:11 PM",
    "confidence": "high"
  },
  "HOUSE_OVERSIGHT_030989": {
    "date": "2019-05-29",
    "time": "22:28:52",
    "source": "email_header",
    "raw_date": "5/29/2019 10:28:52 PM",
    "confidence": "high"
  },
  "HOUSE_OVERSIGHT_030992": {
    "date": "2009-04-12",
    "time": null,
    "source": "content_parsed",
    "raw_date": "Sun, Apr 12, 2009",
    "confidence": "low"
  },
  "HOUSE_OVERSIGHT_030997": {
    "date": "2009-05-29",
    "time": "09:58:45",
    "source": "email_header",
    "raw_date": "Fri, 29 May 2009 09:58:45 -0400",
    "confidence": "high"
  },
  "HOUSE_OVERSIGHT_030999": {
    "date": "2009-10-09",
    "time": "16:43:25",
    "source": "email_header",
    "raw_date": "10/9/2009 4:43:25 PM",
    "confidence": "high"
  },
  "HOUSE_OVERSIGHT_031002": {
    "date": "2009-10-09",
    "time": "16:52:57",
    "source": "email_header",
    "raw_date": "10/9/2009 4:52:57 PM",
    "confidence": "high"
  },
  "HOUSE_OVERSIGHT_031005": {
    "date": "2009-10-09",
    "time": "17:19:34",
    "source": "email_header",
    "raw_date": "10/9/2009 5:19:34 PM",
    "confidence": "high"
  },
  "HOUSE_OVERSIGHT_031008": {
    "date": "2009-10-09",
    "time": "17:24:34",
    "source": "email_header",
    "raw_date": "10/9/2009 5:24:34 PM",
    "confidence": "high"
  },
  "HOUSE_OVERSIGHT_031011": {
    "date": "2010-06-14",
    "time": "20:18:52",
    "source": "email_header",
    "raw_date": "6/14/2010 8:18:52 PM",
    "confidence": "high"
  },
  "HOUSE_OVERSIGHT_031017": {
    "date": "2011-01-29",
    "time": "00:36:51",
    "source": "email_header",
    "raw_date": "1/29/2011 12:36:51 AM",
    "confidence": "high"
  },
  "HOUSE_OVERSIGHT_031018": {
    "date": "2011-01-30",
    "time": "23:35:21",
    "source": "email_header",
    "raw_date": "1/30/2011 11:35:21 PM",
    "confidence": "high"
  },
  "HOUSE_OVERSIGHT_031020": {
    "date": "2011-01-30",
    "time": "23:45:40",
    "source": "email_header",
    "raw_date": "1/30/2011 11:45:40 PM",
    "confidence": "high"
  },
  "HOUSE_OVERSIGHT_031022": {
    "date": "2011-04-06",
    "time": "22:15:22",
    "source": "email_header",
    "raw_date": "4/6/2011 10:15:22 PM",
    "confidence": "high"
  },
  "HOUSE_OVERSIGHT_031026": {
    "date": "2011-04-06",
    "time": "22:55:39",
    "source": "email_header",
    "raw_date": "4/6/2011 10:55:39 PM",
    "confidence": "high"
  },
  "HOUSE_OVERSIGHT_031031": {
    "date": "2011-04-06",
    "time": "22:56:35",
    "source": "email_header",
    "raw_date": "4/6/2011 10:56:35 PM",
    "confidence": "high"
  },
  "HOUSE_OVERSIGHT_031036": {
    "date": "2011-05-16",
    "time": "20:28:27",
    "source": "email_header",
    "raw_date": "5/16/2011 8:28:27 PM",
    "confidence": "high"
  },
  "HOUSE_OVERSIGHT_031038": {
    "date": "2012-06-05",
    "time": null,
    "source": "content_parsed",
    "raw_date": "6/5/2012",
    "confidence": "low"
  },
  "HOUSE_OVERSIGHT_031039": {
    "date": "2013-12-15",
    "time": "01:07:51",
    "source": "email_header",
    "raw_date": "12/15/2013 1:07:51 AM",
    "confidence": "high"
  },
  "HOUSE_OVERSIGHT_031040": {
    "date": "2013-12-15",
    "time": "12:59:34",
    "source": "email_header",
    "raw_date": "12/15/2013 12:59:34 PM",
    "confidence": "high"
  },
  "HOUSE_OVERSIGHT_031042": {
    "date": "2018-01-26",
    "time": null,
    "source": "content_parsed",
    "raw_date": "2018-01-26",
    "confidence": "low"
  },
  "HOUSE_OVERSIGHT_031045": {
    "date": "2018-08-24",
    "time": null,
    "source": "content_parsed",
    "raw_date": "2018-08-24",
    "confidence": "low"
  },
  "HOUSE_OVERSIGHT_031054": {
    "date": "2018-08-24",
    "time": null,
    "source": "content_parsed",
    "raw_date": "2018-08-24",
    "confidence": "low"
  },
  "HOUSE_OVERSIGHT_031059": {
    "date": "2018-09-25",
    "time": null,
    "source": "metadata",
    "raw_date": "09/25/2018",
    "confidence": "medium"
  },
  "HOUSE_OVERSIGHT_031067": {
    "date": "2015-03-27",
    "time": "02:34:05",
    "source": "email_header",
    "raw_date": "3/27/2015 2:34:05 AM",
    "confidence": "high"
  },
  "HOUSE_OVERSIGHT_031069": {
    "date": "2011-04-06",
    "time": "22:58:21",
    "source": "email_header",
    "raw_date": "4/6/2011 10:58:21 PM",
    "confidence": "high"
  },
  "HOUSE_OVERSIGHT_031074": {
    "date": "2011-04-06",
    "time": "22:56:35",
    "source": "email_header",
    "raw_date": "4/6/2011 10:56:35 PM",
    "confidence": "high"
  },
  "HOUSE_OVERSIGHT_031079": {
    "date": "2011-04-06",
    "time": "22:55:39",
    "source": "email_header",
    "raw_date": "4/6/2011 10:55:39 PM",
    "confidence": "high"
  },
  "HOUSE_OVERSIGHT_031084": {
    "date": "2011-01-30",
    "time": "23:45:40",
    "source": "email_header",
    "raw_date": "1/30/2011 11:45:40 PM",
    "confidence": "high"
  },
  "HOUSE_OVERSIGHT_031086": {
    "date": "2011-01-30",
    "time": "23:35:21",
    "source": "email_header",
    "raw_date": "1/30/2011 11:35:21 PM",
    "confidence": "high"
  },
  "HOUSE_OVERSIGHT_031088": {
    "date": "2010-12-17",
    "time": "13:13:39",
    "source": "email_header",
    "raw_date": "12/17/2010 1:13:39 PM",
    "confidence": "high"
  },
  "HOUSE_OVERSIGHT_031089": {
    "date": "2010-10-28",
    "time": "16:16:11",
    "source": "email_header",
    "raw_date": "10/28/2010 4:16:11 PM",
    "confidence": "high"
  },
  "HOUSE_OVERSIGHT_031090": {
    "date": "2010-06-14",
    "time": "20:18:52",
    "source": "email_header",
    "raw_date": "6/14/2010 8:18:52 PM",
    "confidence": "high"
  },
  "HOUSE_OVERSIGHT_031096": {
    "date": "2015-01-10",
    "time": "15:31:13",
    "source": "email_header",
    "raw_date": "1/10/2015 3:31:13 PM",
    "confidence": "high"
  },
  "HOUSE_OVERSIGHT_031099": {
    "date": "2009-10-09",
    "time": "17:24:34",
    "source": "email_header",
    "raw_date": "10/9/2009 5:24:34 PM",
    "confidence": "high"
  },
  "HOUSE_OVERSIGHT_031102": {
    "date": "2009-08-05",
    "time": "12:59:57",
    "source": "email_header",
    "raw_date": "8/5/2009 12:59:57 PM",
    "confidence": "high"
  },
  "HOUSE_OVERSIGHT_031103": {
    "date": "2019-07-06",
    "time": "12:50:57",
    "source": "email_header",
    "raw_date": "7/6/2019 12:50:57 PM",
    "confidence": "high"
  },
  "HOUSE_OVERSIGHT_031106": {
    "date": "2013-10-19",
    "time": "11:21:35",
    "source": "email_header",
    "raw_date": "10/19/2013 11:21:35 AM",
    "confidence": "high"
  },
  "HOUSE_OVERSIGHT_031112": {
    "date": "2018-06-01",
    "time": "22:54:16",
    "source": "email_header",
    "raw_date": "6/1/2018 10:54:16 PM",
    "confidence": "high"
  },
  "HOUSE_OVERSIGHT_031114": {
    "date": "2013-03-29",
    "time": "20:48:11",
    "source": "email_header",
    "raw_date": "3/29/2013 8:48:11 PM",
    "confidence": "high"
  },
  "HOUSE_OVERSIGHT_031118": {
    "date": "2013-03-07",
    "time": "14:03:11",
    "source": "email_header",
    "raw_date": "3/7/2013 2:03:11 PM",
    "confidence": "high"
  },
  "HOUSE_OVERSIGHT_031120": {
    "date": "2013-01-22",
    "time": "22:45:31",
    "source": "email_header",
    "raw_date": "1/22/2013 10:45:31 PM",
    "confidence": "high"
  },
  "HOUSE_OVERSIGHT_031121": {
    "date": "2013-01-11",
    "time": "23:38:48",
    "source": "email_header",
    "raw_date": "1/11/2013 11:38:48 PM",
    "confidence": "high"
  },
  "HOUSE_OVERSIGHT_031125": {
    "date": "2016-11-10",
    "time": "23:49:04",
    "source": "email_header",
    "raw_date": "11/10/2016 11:49:04 PM",
    "confidence": "high"
  },
  "HOUSE_OVERSIGHT_031126": {
    "date": "2012-11-06",
    "time": "22:24:50",
    "source": "email_header",
    "raw_date": "11/6/2012 10:24:50 PM",
    "confidence": "high"
  },
  "HOUSE_OVERSIGHT_031129": {
    "date": "2012-09-28",
    "time": "14:41:02",
    "source": "email_header",
    "raw_date": "9/28/2012 2:41:02 PM",
    "confidence": "high"
  },
  "HOUSE_OVERSIGHT_031130": {
    "date": "2012-08-14",
    "time": "13:05:43",
    "source": "email_header",
    "raw_date": "8/14/2012 1:05:43 PM",
    "confidence": "high"
  },
  "HOUSE_OVERSIGHT_031134": {
    "date": "2016-06-24",
    "time": "10:49:32",
    "source": "email_header",
    "raw_date": "6/24/2016 10:49:32 AM",
    "confidence": "high"
  },
  "HOUSE_OVERSIGHT_031135": {
    "date": "2016-06-24",
    "time": "10:34:22",
    "source": "email_header",
    "raw_date": "6/24/2016 10:34:22 AM",
    "confidence": "high"
  },
  "HOUSE_OVERSIGHT_031136": {
    "date": "2016-05-18",
    "time": "17:45:03",
    "source": "email_header",
    "raw_date": "5/18/2016 5:45:03 PM",
    "confidence": "high"
  },
  "HOUSE_OVERSIGHT_031146": {
    "date": "2012-02-27",
    "time": "17:50:08",
    "source": "email_header",
    "raw_date": "2/27/2012 5:50:08 PM",
    "confidence": "high"
  },
  "HOUSE_OVERSIGHT_031152": {
    "date": "2011-11-10",
    "time": "14:46:50",
    "source": "email_header",
    "raw_date": "11/10/2011 2:46:50 PM",
    "confidence": "high"
  },
  "HOUSE_OVERSIGHT_031156": {
    "date": "2011-08-04",
    "time": "23:41:48",
    "source": "email_header",
    "raw_date": "8/4/2011 11:41:48 PM",
    "confidence": "high"
  },
  "HOUSE_OVERSIGHT_031159": {
    "date": "2011-07-25",
    "time": "16:33:45",
    "source": "email_header",
    "raw_date": "7/25/2011 4:33:45 PM",
    "confidence": "high"
  },
  "HOUSE_OVERSIGHT_031165": {
    "date": "2011-06-14",
    "time": "11:54:12",
    "source": "email_header",
    "raw_date": "6/14/2011 11:54:12 AM",
    "confidence": "high"
  },
  "HOUSE_OVERSIGHT_031169": {
    "date": "2016-11-10",
    "time": "22:40:00",
    "source": "email_header",
    "raw_date": "Thursday, November 10 2016 10:40 PM",
    "confidence": "high"
  },
  "HOUSE_OVERSIGHT_031170": {
    "date": null,
    "time": null,
    "source": "unknown",
    "raw_date": null,
    "confidence": "none"
  },
  "HOUSE_OVERSIGHT_031171": {
    "date": null,
    "time": null,
    "source": "unknown",
    "raw_date": null,
    "confidence": "none"
  },
  "HOUSE_OVERSIGHT_031172": {
    "date": "2012-03-01",
    "time": "13:41:00",
    "source": "email_header",
    "raw_date": "Thursday, March 1 2012 01:41 PM",
    "confidence": "high"
  },
  "HOUSE_OVERSIGHT_031173": {
    "date": "2019-02-19",
    "time": null,
    "source": "content_parsed",
    "raw_date": "2019-02-19",
    "confidence": "low"
  },
  "HOUSE_OVERSIGHT_031174": {
    "date": "2014-01-04",
    "time": "18:05:00",
    "source": "email_header",
    "raw_date": "Saturday, January 4 2014 06:05 PM",
    "confidence": "high"
  },
  "HOUSE_OVERSIGHT_031177": {
    "date": "2010-07-16",
    "time": "16:47:00",
    "source": "email_header",
    "raw_date": "Friday, July 16 2010 04:47 PM",
    "confidence": "high"
  },
  "HOUSE_OVERSIGHT_031178": {
    "date": "2012-02-20",
    "time": null,
    "source": "content_parsed",
    "raw_date": "2012-02-20",
    "confidence": "low"
  },
  "HOUSE_OVERSIGHT_031183": {
    "date": "2017-12-15",
    "time": "19:51:34",
    "source": "email_header",
    "raw_date": "12/15/2017 7:51:34 PM",
    "confidence": "high"
  },
  "HOUSE_OVERSIGHT_031184": {
    "date": "2012-09-27",
    "time": null,
    "source": "content_parsed",
    "raw_date": "Thursday, September 27, 2012",
    "confidence": "low"
  },
  "HOUSE_OVERSIGHT_031186": {
    "date": null,
    "time": null,
    "source": "unknown",
    "raw_date": null,
    "confidence": "none"
  },
  "HOUSE_OVERSIGHT_031189": {
    "date": "2017-01-20",
    "time": "22:55:49",
    "source": "email_header",
    "raw_date": "1/20/2017 10:55:49 PM",
    "confidence": "high"
  },
  "HOUSE_OVERSIGHT_031191": {
    "date": null,
    "time": null,
    "source": "unknown",
    "raw_date": null,
    "confidence": "none"
  },
  "HOUSE_OVERSIGHT_031192": {
    "date": "2015-12-24",
    "time": "17:04:27",
    "source": "email_header",
    "raw_date": "12/24/2015 5:04:27 PM",
    "confidence": "high"
  },
  "HOUSE_OVERSIGHT_031195": {
    "date": "2016-01-27",
    "time": "17:02:21",
    "source": "email_header",
    "raw_date": "1/27/2016 5:02:21 PM",
    "confidence": "high"
  },
  "HOUSE_OVERSIGHT_031198": {
    "date": "2016-06-24",
    "time": "00:00:00",
    "source": "content_parsed",
    "raw_date": "PM, JUN 24, 2016",
    "confidence": "low"
  },
  "HOUSE_OVERSIGHT_031203": {
    "date": "2016-07-13",
    "time": null,
    "source": "content_parsed",
    "raw_date": "7/13/2016",
    "confidence": "low"
  },
  "HOUSE_OVERSIGHT_031206": {
    "date": "2016-07-13",
    "time": "18:02:16",
    "source": "email_header",
    "raw_date": "7/13/2016 6:02:16 PM",
    "confidence": "high"
  },
  "HOUSE_OVERSIGHT_031209": {
    "date": null,
    "time": null,
    "source": "unknown",
    "raw_date": null,
    "confidence": "none"
  },
  "HOUSE_OVERSIGHT_031213": {
    "date": "2012-08-20",
    "time": null,
    "source": "content_parsed",
    "raw_date": "Mon, Aug 20, 2012",
    "confidence": "low"
  },
  "HOUSE_OVERSIGHT_031215": {
    "date": "2017-07-19",
    "time": "14:09:32",
    "source": "email_header",
    "raw_date": "7/19/2017 2:09:32 PM",
    "confidence": "high"
  },
  "HOUSE_OVERSIGHT_031217": {
    "date": "2010-02-26",
    "time": "14:59:54",
    "source": "email_header",
    "raw_date": "2/26/2010 2:59:54 PM",
    "confidence": "high"
  },
  "HOUSE_OVERSIGHT_031220": {
    "date": "2017-01-20",
    "time": "22:55:49",
    "source": "email_header",
    "raw_date": "1/20/2017 10:55:49 PM",
    "confidence": "high"
  },
  "HOUSE_OVERSIGHT_031221": {
    "date": "2012-08-21",
    "time": "09:12:11",
    "source": "email_header",
    "raw_date": "8/21/2012 9:12:11 AM",
    "confidence": "high"
  },
  "HOUSE_OVERSIGHT_031226": {
    "date": "2012-08-18",
    "time": "16:11:07",
    "source": "email_header",
    "raw_date": "8/18/2012 4:11:07 PM",
    "confidence": "high"
  },
  "HOUSE_OVERSIGHT_031227": {
    "date": "2016-07-13",
    "time": null,
    "source": "content_parsed",
    "raw_date": "Wednesday, July 13, 2016",
    "confidence": "low"
  },
  "HOUSE_OVERSIGHT_031230": {
    "date": "2016-07-13",
    "time": "13:37:19",
    "source": "email_header",
    "raw_date": "7/13/2016 1:37:19 PM",
    "confidence": "high"
  },
  "HOUSE_OVERSIGHT_031233": {
    "date": "2017-12-11",
    "time": null,
    "source": "content_parsed",
    "raw_date": "12/11/2017",
    "confidence": "low"
  },
  "HOUSE_OVERSIGHT_031239": {
    "date": "2017-12-11",
    "time": "05:53:12",
    "source": "email_header",
    "raw_date": "12/11/2017 5:53:12 AM",
    "confidence": "high"
  },
  "HOUSE_OVERSIGHT_031246": {
    "date": "2017-12-11",
    "time": "06:31:28",
    "source": "email_header",
    "raw_date": "12/11/2017 6:31:28 AM",
    "confidence": "high"
  },
  "HOUSE_OVERSIGHT_031255": {
    "date": "2017-12-11",
    "time": "17:18:30",
    "source": "email_header",
    "raw_date": "12/11/2017 5:18:30 PM",
    "confidence": "high"
  },
  "HOUSE_OVERSIGHT_031263": {
    "date": "2017-12-11",
    "time": "18:34:49",
    "source": "email_header",
    "raw_date": "12/11/2017 6:34:49 PM",
    "confidence": "high"
  },
  "HOUSE_OVERSIGHT_031269": {
    "date": "2017-12-12",
    "time": "01:47:22",
    "source": "email_header",
    "raw_date": "12/12/2017 1:47:22 AM",
    "confidence": "high"
  },
  "HOUSE_OVERSIGHT_031278": {
    "date": "2016-08-15",
    "time": null,
    "source": "content_parsed",
    "raw_date": "Monday, August 15, 2016",
    "confidence": "low"
  },
  "HOUSE_OVERSIGHT_031281": {
    "date": "2016-08-17",
    "time": "16:01:19",
    "source": "email_header",
    "raw_date": "8/17/2016 4:01:19 PM",
    "confidence": "high"
  },
  "HOUSE_OVERSIGHT_031286": {
    "date": "2016-08-17",
    "time": null,
    "source": "content_parsed",
    "raw_date": "Wednesday, August 17, 2016",
    "confidence": "low"
  },
  "HOUSE_OVERSIGHT_031291": {
    "date": "2016-11-18",
    "time": "16:38:21",
    "source": "email_header",
    "raw_date": "11/18/2016 4:38:21 PM",
    "confidence": "high"
  },
  "HOUSE_OVERSIGHT_031292": {
    "date": "2017-01-13",
    "time": "05:07:22",
    "source": "email_header",
    "raw_date": "1/13/2017 5:07:22 AM",
    "confidence": "high"
  },
  "HOUSE_OVERSIGHT_031293": {
    "date": null,
    "time": null,
    "source": "unknown",
    "raw_date": null,
    "confidence": "none"
  },
  "HOUSE_OVERSIGHT_031294": {
    "date": "2017-11-21",
    "time": "13:29:32",
    "source": "email_header",
    "raw_date": "11/21/2017 1:29:32 PM",
    "confidence": "high"
  },
  "HOUSE_OVERSIGHT_031299": {
    "date": "2018-10-03",
    "time": "15:10:21",
    "source": "email_header",
    "raw_date": "10/3/2018 3:10:21 PM",
    "confidence": "high"
  },
  "HOUSE_OVERSIGHT_031301": {
    "date": "2015-01-20",
    "time": "00:14:30",
    "source": "email_header",
    "raw_date": "1/20/2015 12:14:30 AM",
    "confidence": "high"
  },
  "HOUSE_OVERSIGHT_031302": {
    "date": "2016-08-17",
    "time": "15:50:43",
    "source": "email_header",
    "raw_date": "8/17/2016 3:50:43 PM",
    "confidence": "high"
  },
  "HOUSE_OVERSIGHT_031307": {
    "date": "2016-08-17",
    "time": "16:11:25",
    "source": "email_header",
    "raw_date": "8/17/2016 4:11:25 PM",
    "confidence": "high"
  },
  "HOUSE_OVERSIGHT_031313": {
    "date": "2016-08-18",
    "time": "14:47:14",
    "source": "email_header",
    "raw_date": "8/18/2016 2:47:14 PM",
    "confidence": "high"
  },
  "HOUSE_OVERSIGHT_031319": {
    "date": "2016-11-18",
    "time": "18:27:24",
    "source": "email_header",
    "raw_date": "11/18/2016 6:27:24 PM",
    "confidence": "high"
  },
  "HOUSE_OVERSIGHT_031320": {
    "date": "2017-11-21",
    "time": "13:44:04",
    "source": "email_header",
    "raw_date": "11/21/2017 1:44:04 PM",
    "confidence": "high"
  },
  "HOUSE_OVERSIGHT_031325": {
    "date": "2019-02-25",
    "time": "19:25:08",
    "source": "email_header",
    "raw_date": "2/25/2019 7:25:08 PM",
    "confidence": "high"
  },
  "HOUSE_OVERSIGHT_031326": {
    "date": "2011-04-02",
    "time": "19:09:39",
    "source": "email_header",
    "raw_date": "4/2/2011 7:09:39 PM",
    "confidence": "high"
  },
  "HOUSE_OVERSIGHT_031327": {
    "date": "2011-05-18",
    "time": "11:27:04",
    "source": "email_header",
    "raw_date": "5/18/2011 11:27:04 AM",
    "confidence": "high"
  },
  "HOUSE_OVERSIGHT_031328": {
    "date": "2011-05-18",
    "time": "11:27:18",
    "source": "email_header",
    "raw_date": "5/18/2011 11:27:18 AM",
    "confidence": "high"
  },
  "HOUSE_OVERSIGHT_031329": {
    "date": "2011-06-01",
    "time": "22:47:23",
    "source": "email_header",
    "raw_date": "6/1/2011 10:47:23 PM",
    "confidence": "high"
  },
  "HOUSE_OVERSIGHT_031332": {
    "date": "2011-06-02",
    "time": "14:20:56",
    "source": "email_header",
    "raw_date": "6/2/2011 2:20:56 PM",
    "confidence": "high"
  },
  "HOUSE_OVERSIGHT_031333": {
    "date": "2011-06-18",
    "time": "14:51:44",
    "source": "email_header",
    "raw_date": "6/18/2011 2:51:44 PM",
    "confidence": "high"
  },
  "HOUSE_OVERSIGHT_031335": {
    "date": "2011-06-18",
    "time": null,
    "source": "content_parsed",
    "raw_date": "6/18/2011",
    "confidence": "low"
  },
  "HOUSE_OVERSIGHT_031338": {
    "date": "2015-02-28",
    "time": "03:47:18",
    "source": "email_header",
    "raw_date": "2/28/2015 3:47:18 AM",
    "confidence": "high"
  },
  "HOUSE_OVERSIGHT_031339": {
    "date": "2016-08-12",
    "time": "13:28:18",
    "source": "email_header",
    "raw_date": "8/12/2016 1:28:18 PM",
    "confidence": "high"
  },
  "HOUSE_OVERSIGHT_031340": {
    "date": "2018-08-01",
    "time": "23:59:13",
    "source": "email_header",
    "raw_date": "8/1/2018 11:59:13 PM",
    "confidence": "high"
  },
  "HOUSE_OVERSIGHT_031343": {
    "date": "2019-02-19",
    "time": "19:25:25",
    "source": "email_header",
    "raw_date": "2/19/2019 7:25:25 PM",
    "confidence": "high"
  },
  "HOUSE_OVERSIGHT_031344": {
    "date": "2019-03-06",
    "time": "18:26:30",
    "source": "email_header",
    "raw_date": "3/6/2019 6:26:30 PM",
    "confidence": "high"
  },
  "HOUSE_OVERSIGHT_031345": {
    "date": "2019-03-12",
    "time": "12:55:51",
    "source": "email_header",
    "raw_date": "3/12/2019 12:55:51 PM",
    "confidence": "high"
  },
  "HOUSE_OVERSIGHT_031346": {
    "date": "2019-03-28",
    "time": "19:41:52",
    "source": "email_header",
    "raw_date": "3/28/2019 7:41:52 PM",
    "confidence": "high"
  },
  "HOUSE_OVERSIGHT_031347": {
    "date": "2014-01-24",
    "time": "20:20:13",
    "source": "email_header",
    "raw_date": "1/24/2014 8:20:13 PM",
    "confidence": "high"
  },
  "HOUSE_OVERSIGHT_031350": {
    "date": "2014-01-24",
    "time": "20:25:54",
    "source": "email_header",
    "raw_date": "1/24/2014 8:25:54 PM",
    "confidence": "high"
  },
  "HOUSE_OVERSIGHT_031354": {
    "date": "2010-09-21",
    "time": null,
    "source": "metadata",
    "raw_date": "09/21/2010",
    "confidence": "medium"
  },
  "HOUSE_OVERSIGHT_031359": {
    "date": "2010-09-21",
    "time": null,
    "source": "metadata",
    "raw_date": "09/21/2010",
    "confidence": "medium"
  },
  "HOUSE_OVERSIGHT_031383": {
    "date": "2011-04-02",
    "time": "14:15:40",
    "source": "email_header",
    "raw_date": "4/2/2011 2:15:40 PM",
    "confidence": "high"
  },
  "HOUSE_OVERSIGHT_031384": {
    "date": "2019-03-05",
    "time": "23:12:41",
    "source": "email_header",
    "raw_date": "3/5/2019 11:12:41 PM",
    "confidence": "high"
  },
  "HOUSE_OVERSIGHT_031388": {
    "date": "2019-03-05",
    "time": "23:19:19",
    "source": "email_header",
    "raw_date": "3/5/2019 11:19:19 PM",
    "confidence": "high"
  },
  "HOUSE_OVERSIGHT_031392": {
    "date": "2019-03-05",
    "time": "23:21:53",
    "source": "email_header",
    "raw_date": "3/5/2019 11:21:53 PM",
    "confidence": "high"
  },
  "HOUSE_OVERSIGHT_031396": {
    "date": null,
    "time": null,
    "source": "unknown",
    "raw_date": null,
    "confidence": "none"
  },
  "HOUSE_OVERSIGHT_031399": {
    "date": "2019-03-05",
    "time": null,
    "source": "content_parsed",
    "raw_date": "3/5/2019",
    "confidence": "low"
  },
  "HOUSE_OVERSIGHT_031403": {
    "date": "2019-03-05",
    "time": "23:26:49",
    "source": "email_header",
    "raw_date": "3/5/2019 11:26:49 PM",
    "confidence": "high"
  },
  "HOUSE_OVERSIGHT_031407": {
    "date": "2019-03-05",
    "time": "23:51:43",
    "source": "email_header",
    "raw_date": "3/5/2019 11:51:43 PM",
    "confidence": "high"
  },
  "HOUSE_OVERSIGHT_031411": {
    "date": "2010-11-10",
    "time": "20:53:53",
    "source": "email_header",
    "raw_date": "11/10/2010 8:53:53 PM",
    "confidence": "high"
  },
  "HOUSE_OVERSIGHT_031412": {
    "date": "2011-05-18",
    "time": "10:37:36",
    "source": "email_header",
    "raw_date": "5/18/2011 10:37:36 AM",
    "confidence": "high"
  },
  "HOUSE_OVERSIGHT_031413": {
    "date": "2011-07-01",
    "time": "08:26:40",
    "source": "email_header",
    "raw_date": "7/1/2011 8:26:40 AM",
    "confidence": "high"
  },
  "HOUSE_OVERSIGHT_031415": {
    "date": "2019-02-13",
    "time": null,
    "source": "metadata",
    "raw_date": "02/13/2019",
    "confidence": "medium"
  },
  "HOUSE_OVERSIGHT_031418": {
    "date": "2015-09-22",
    "time": "02:40:08",
    "source": "email_header",
    "raw_date": "9/22/2015 2:40:08 AM",
    "confidence": "high"
  },
  "HOUSE_OVERSIGHT_031420": {
    "date": "2015-09-22",
    "time": "02:17:30",
    "source": "email_header",
    "raw_date": "9/22/2015 2:17:30 AM",
    "confidence": "high"
  },
  "HOUSE_OVERSIGHT_031422": {
    "date": "2015-02-28",
    "time": "03:47:18",
    "source": "email_header",
    "raw_date": "2/28/2015 3:47:18 AM",
    "confidence": "high"
  },
  "HOUSE_OVERSIGHT_031423": {
    "date": "2009-09-03",
    "time": "11:18:47",
    "source": "email_header",
    "raw_date": "9/3/2009 11:18:47 AM",
    "confidence": "high"
  },
  "HOUSE_OVERSIGHT_031425": {
    "date": null,
    "time": null,
    "source": "unknown",
    "raw_date": null,
    "confidence": "none"
  },
  "HOUSE_OVERSIGHT_031426": {
    "date": "2019-03-28",
    "time": "19:41:52",
    "source": "email_header",
    "raw_date": "3/28/2019 7:41:52 PM",
    "confidence": "high"
  },
  "HOUSE_OVERSIGHT_031427": {
    "date": "2019-03-12",
    "time": "12:55:51",
    "source": "email_header",
    "raw_date": "3/12/2019 12:55:51 PM",
    "confidence": "high"
  },
  "HOUSE_OVERSIGHT_031428": {
    "date": "2019-03-05",
    "time": "23:19:19",
    "source": "email_header",
    "raw_date": "3/5/2019 11:19:19 PM",
    "confidence": "high"
  },
  "HOUSE_OVERSIGHT_031432": {
    "date": "2019-02-19",
    "time": null,
    "source": "content_parsed",
    "raw_date": "2/19/2019",
    "confidence": "low"
  },
  "HOUSE_OVERSIGHT_031433": {
    "date": "2017-12-12",
    "time": "02:22:11",
    "source": "email_header",
    "raw_date": "12/12/2017 2:22:11 AM",
    "confidence": "high"
  },
  "HOUSE_OVERSIGHT_031441": {
    "date": "2015-01-05",
    "time": "22:12:19",
    "source": "email_header",
    "raw_date": "1/5/2015 10:12:19 PM",
    "confidence": "high"
  },
  "HOUSE_OVERSIGHT_031442": {
    "date": "2015-01-06",
    "time": "01:15:20",
    "source": "email_header",
    "raw_date": "1/6/2015 1:15:20 AM",
    "confidence": "high"
  },
  "HOUSE_OVERSIGHT_031445": {
    "date": "2015-03-29",
    "time": "16:22:30",
    "source": "email_header",
    "raw_date": "3/29/2015 4:22:30 PM",
    "confidence": "high"
  },
  "HOUSE_OVERSIGHT_031447": {
    "date": null,
    "time": null,
    "source": "unknown",
    "raw_date": null,
    "confidence": "none"
  },
  "HOUSE_OVERSIGHT_031450": {
    "date": "2015-12-08",
    "time": "21:41:11",
    "source": "email_header",
    "raw_date": "12/8/2015 9:41:11 PM",
    "confidence": "high"
  },
  "HOUSE_OVERSIGHT_031451": {
    "date": "2015-12-08",
    "time": "21:50:13",
    "source": "email_header",
    "raw_date": "12/8/2015 9:50:13 PM",
    "confidence": "high"
  },
  "HOUSE_OVERSIGHT_031452": {
    "date": "2015-12-08",
    "time": "22:17:45",
    "source": "email_header",
    "raw_date": "12/8/2015 10:17:45 PM",
    "confidence": "high"
  },
  "HOUSE_OVERSIGHT_031454": {
    "date": "2015-12-08",
    "time": "22:18:54",
    "source": "email_header",
    "raw_date": "12/8/2015 10:18:54 PM",
    "confidence": "high"
  },
  "HOUSE_OVERSIGHT_031457": {
    "date": "2015-12-08",
    "time": "23:08:16",
    "source": "email_header",
    "raw_date": "12/8/2015 11:08:16 PM",
    "confidence": "high"
  },
  "HOUSE_OVERSIGHT_031460": {
    "date": "2015-12-19",
    "time": "02:36:13",
    "source": "email_header",
    "raw_date": "12/19/2015 2:36:13 AM",
    "confidence": "high"
  },
  "HOUSE_OVERSIGHT_031462": {
    "date": "2016-04-28",
    "time": "16:46:00",
    "source": "email_header",
    "raw_date": "4/28/2016 4:46:00 PM",
    "confidence": "high"
  },
  "HOUSE_OVERSIGHT_031464": {
    "date": "2016-04-28",
    "time": "19:00:45",
    "source": "email_header",
    "raw_date": "4/28/2016 7:00:45 PM",
    "confidence": "high"
  },
  "HOUSE_OVERSIGHT_031466": {
    "date": "2016-05-16",
    "time": "14:52:57",
    "source": "email_header",
    "raw_date": "5/16/2016 2:52:57 PM",
    "confidence": "high"
  },
  "HOUSE_OVERSIGHT_031467": {
    "date": "2016-05-16",
    "time": "15:56:57",
    "source": "email_header",
    "raw_date": "5/16/2016 3:56:57 PM",
    "confidence": "high"
  },
  "HOUSE_OVERSIGHT_031469": {
    "date": "2016-05-21",
    "time": "10:53:15",
    "source": "email_header",
    "raw_date": "5/21/2016 10:53:15 AM",
    "confidence": "high"
  },
  "HOUSE_OVERSIGHT_031470": {
    "date": "2016-05-21",
    "time": "12:31:20",
    "source": "email_header",
    "raw_date": "5/21/2016 12:31:20 PM",
    "confidence": "high"
  },
  "HOUSE_OVERSIGHT_031472": {
    "date": "2016-08-05",
    "time": "19:11:50",
    "source": "email_header",
    "raw_date": "8/5/2016 7:11:50 PM",
    "confidence": "high"
  },
  "HOUSE_OVERSIGHT_031480": {
    "date": "2016-08-05",
    "time": "19:39:39",
    "source": "email_header",
    "raw_date": "8/5/2016 7:39:39 PM",
    "confidence": "high"
  },
  "HOUSE_OVERSIGHT_031489": {
    "date": "2016-10-07",
    "time": null,
    "source": "content_parsed",
    "raw_date": "Friday, October 7, 2016",
    "confidence": "low"
  },
  "HOUSE_OVERSIGHT_031491": {
    "date": "2016-10-10",
    "time": "00:45:19",
    "source": "email_header",
    "raw_date": "10/10/2016 12:45:19 AM",
    "confidence": "high"
  },
  "HOUSE_OVERSIGHT_031492": {
    "date": "2016-10-11",
    "time": "03:34:03",
    "source": "email_header",
    "raw_date": "10/11/2016 3:34:03 AM",
    "confidence": "high"
  },
  "HOUSE_OVERSIGHT_031496": {
    "date": "2016-10-19",
    "time": "13:41:38",
    "source": "email_header",
    "raw_date": "10/19/2016 1:41:38 PM",
    "confidence": "high"
  },
  "HOUSE_OVERSIGHT_031498": {
    "date": "2016-10-19",
    "time": "13:42:43",
    "source": "email_header",
    "raw_date": "10/19/2016 1:42:43 PM",
    "confidence": "high"
  },
  "HOUSE_OVERSIGHT_031501": {
    "date": "2016-10-19",
    "time": "13:47:35",
    "source": "email_header",
    "raw_date": "10/19/2016 1:47:35 PM",
    "confidence": "high"
  },
  "HOUSE_OVERSIGHT_031504": {
    "date": "2016-10-19",
    "time": "13:55:18",
    "source": "email_header",
    "raw_date": "10/19/2016 1:55:18 PM",
    "confidence": "high"
  },
  "HOUSE_OVERSIGHT_031507": {
    "date": "2016-10-19",
    "time": "14:28:11",
    "source": "email_header",
    "raw_date": "10/19/2016 2:28:11 PM",
    "confidence": "high"
  },
  "HOUSE_OVERSIGHT_031511": {
    "date": "2016-10-19",
    "time": "15:13:21",
    "source": "email_header",
    "raw_date": "10/19/2016 3:13:21 PM",
    "confidence": "high"
  },
  "HOUSE_OVERSIGHT_031516": {
    "date": "2016-10-21",
    "time": "11:33:11",
    "source": "email_header",
    "raw_date": "10/21/2016 11:33:11 AM",
    "confidence": "high"
  },
  "HOUSE_OVERSIGHT_031517": {
    "date": "2016-10-25",
    "time": null,
    "source": "content_parsed",
    "raw_date": "10/25/2016",
    "confidence": "low"
  },
  "HOUSE_OVERSIGHT_031518": {
    "date": "2016-11-11",
    "time": "05:21:53",
    "source": "email_header",
    "raw_date": "11/11/2016 5:21:53 AM",
    "confidence": "high"
  },
  "HOUSE_OVERSIGHT_031519": {
    "date": "2016-11-11",
    "time": "05:57:02",
    "source": "email_header",
    "raw_date": "11/11/2016 5:57:02 AM",
    "confidence": "high"
  },
  "HOUSE_OVERSIGHT_031521": {
    "date": "2016-11-11",
    "time": "06:34:29",
    "source": "email_header",
    "raw_date": "11/11/2016 6:34:29 AM",
    "confidence": "high"
  },
  "HOUSE_OVERSIGHT_031523": {
    "date": "2016-11-11",
    "time": "15:13:53",
    "source": "email_header",
    "raw_date": "11/11/2016 3:13:53 PM",
    "confidence": "high"
  },
  "HOUSE_OVERSIGHT_031526": {
    "date": "2016-11-11",
    "time": "15:24:02",
    "source": "email_header",
    "raw_date": "11/11/2016 3:24:02 PM",
    "confidence": "high"
  },
  "HOUSE_OVERSIGHT_031529": {
    "date": "2016-11-27",
    "time": "20:41:01",
    "source": "email_header",
    "raw_date": "11/27/2016 8:41:01 PM",
    "confidence": "high"
  },
  "HOUSE_OVERSIGHT_031531": {
    "date": "2016-11-27",
    "time": "20:44:06",
    "source": "email_header",
    "raw_date": "11/27/2016 8:44:06 PM",
    "confidence": "high"
  },
  "HOUSE_OVERSIGHT_031533": {
    "date": "2016-11-29",
    "time": null,
    "source": "metadata",
    "raw_date": "11/29/2016",
    "confidence": "medium"
  },
  "HOUSE_OVERSIGHT_031540": {
    "date": "2017-04-22",
    "time": "22:02:03",
    "source": "email_header",
    "raw_date": "4/22/2017 10:02:03 PM",
    "confidence": "high"
  },
  "HOUSE_OVERSIGHT_031541": {
    "date": "2017-07-26",
    "time": "15:12:01",
    "source": "email_header",
    "raw_date": "7/26/2017 3:12:01 PM",
    "confidence": "high"
  },
  "HOUSE_OVERSIGHT_031544": {
    "date": "2017-08-24",
    "time": "23:13:38",
    "source": "email_header",
    "raw_date": "8/24/2017 11:13:38 PM",
    "confidence": "high"
  },
  "HOUSE_OVERSIGHT_031545": {
    "date": "2017-12-01",
    "time": "17:42:37",
    "source": "email_header",
    "raw_date": "12/1/2017 5:42:37 PM",
    "confidence": "high"
  },
  "HOUSE_OVERSIGHT_031546": {
    "date": null,
    "time": null,
    "source": "unknown",
    "raw_date": null,
    "confidence": "none"
  },
  "HOUSE_OVERSIGHT_031547": {
    "date": "2018-01-16",
    "time": "17:37:47",
    "source": "email_header",
    "raw_date": "1/16/2018 5:37:47 PM",
    "confidence": "high"
  },
  "HOUSE_OVERSIGHT_031549": {
    "date": "2018-01-16",
    "time": "20:42:03",
    "source": "email_header",
    "raw_date": "1/16/2018 8:42:03 PM",
    "confidence": "high"
  },
  "HOUSE_OVERSIGHT_031552": {
    "date": "2018-01-16",
    "time": "21:10:40",
    "source": "email_header",
    "raw_date": "1/16/2018 9:10:40 PM",
    "confidence": "high"
  },
  "HOUSE_OVERSIGHT_031555": {
    "date": "2018-02-15",
    "time": "22:41:00",
    "source": "email_header",
    "raw_date": "2/15/2018 10:41:00 PM",
    "confidence": "high"
  },
  "HOUSE_OVERSIGHT_031556": {
    "date": "2018-02-26",
    "time": null,
    "source": "content_parsed",
    "raw_date": "Mon, Feb 26, 2018",
    "confidence": "low"
  },
  "HOUSE_OVERSIGHT_031559": {
    "date": "2018-05-19",
    "time": "17:07:10",
    "source": "email_header",
    "raw_date": "5/19/2018 5:07:10 PM",
    "confidence": "high"
  },
  "HOUSE_OVERSIGHT_031560": {
    "date": "2018-07-04",
    "time": "13:02:08",
    "source": "email_header",
    "raw_date": "7/4/2018 1:02:08 PM",
    "confidence": "high"
  },
  "HOUSE_OVERSIGHT_031563": {
    "date": "2018-08-22",
    "time": "19:17:35",
    "source": "email_header",
    "raw_date": "8/22/2018 7:17:35 PM",
    "confidence": "high"
  },
  "HOUSE_OVERSIGHT_031565": {
    "date": "2018-12-13",
    "time": "22:03:53",
    "source": "email_header",
    "raw_date": "12/13/2018 10:03:53 PM",
    "confidence": "high"
  },
  "HOUSE_OVERSIGHT_031566": {
    "date": "2019-05-30",
    "time": "21:37:43",
    "source": "email_header",
    "raw_date": "5/30/2019 9:37:43 PM",
    "confidence": "high"
  },
  "HOUSE_OVERSIGHT_031567": {
    "date": "2019-05-30",
    "time": "21:40:54",
    "source": "email_header",
    "raw_date": "5/30/2019 9:40:54 PM",
    "confidence": "high"
  },
  "HOUSE_OVERSIGHT_031569": {
    "date": "2014-05-19",
    "time": "10:37:05",
    "source": "email_header",
    "raw_date": "5/19/2014 10:37:05 AM",
    "confidence": "high"
  },
  "HOUSE_OVERSIGHT_031591": {
    "date": "2015-01-06",
    "time": "01:15:19",
    "source": "email_header",
    "raw_date": "1/6/2015 1:15:19 AM",
    "confidence": "high"
  },
  "HOUSE_OVERSIGHT_031593": {
    "date": "2015-03-29",
    "time": "16:20:37",
    "source": "email_header",
    "raw_date": "3/29/2015 4:20:37 PM",
    "confidence": "high"
  },
  "HOUSE_OVERSIGHT_031595": {
    "date": "2015-12-08",
    "time": "21:49:18",
    "source": "email_header",
    "raw_date": "12/8/2015 9:49:18 PM",
    "confidence": "high"
  },
  "HOUSE_OVERSIGHT_031596": {
    "date": "2015-12-08",
    "time": "21:51:09",
    "source": "email_header",
    "raw_date": "12/8/2015 9:51:09 PM",
    "confidence": "high"
  },
  "HOUSE_OVERSIGHT_031597": {
    "date": "2015-12-08",
    "time": "21:52:40",
    "source": "email_header",
    "raw_date": "12/8/2015 9:52:40 PM",
    "confidence": "high"
  },
  "HOUSE_OVERSIGHT_031599": {
    "date": "2015-12-08",
    "time": "21:53:39",
    "source": "email_header",
    "raw_date": "12/8/2015 9:53:39 PM",
    "confidence": "high"
  },
  "HOUSE_OVERSIGHT_031601": {
    "date": "2015-12-08",
    "time": "22:14:34",
    "source": "email_header",
    "raw_date": "12/8/2015 10:14:34 PM",
    "confidence": "high"
  },
  "HOUSE_OVERSIGHT_031604": {
    "date": "2015-12-08",
    "time": "22:59:55",
    "source": "email_header",
    "raw_date": "12/8/2015 10:59:55 PM",
    "confidence": "high"
  },
  "HOUSE_OVERSIGHT_031607": {
    "date": "2015-12-19",
    "time": "14:28:32",
    "source": "email_header",
    "raw_date": "12/19/2015 2:28:32 PM",
    "confidence": "high"
  },
  "HOUSE_OVERSIGHT_031610": {
    "date": "2016-04-28",
    "time": null,
    "source": "content_parsed",
    "raw_date": "Thu, Apr 28, 2016",
    "confidence": "low"
  },
  "HOUSE_OVERSIGHT_031612": {
    "date": "2016-04-28",
    "time": null,
    "source": "content_parsed",
    "raw_date": "Thu, Apr 28, 2016",
    "confidence": "low"
  },
  "HOUSE_OVERSIGHT_031614": {
    "date": "2016-04-28",
    "time": null,
    "source": "content_parsed",
    "raw_date": "Thu, Apr 28, 2016",
    "confidence": "low"
  },
  "HOUSE_OVERSIGHT_031616": {
    "date": "2016-04-28",
    "time": "19:03:16",
    "source": "email_header",
    "raw_date": "4/28/2016 7:03:16 PM",
    "confidence": "high"
  },
  "HOUSE_OVERSIGHT_031618": {
    "date": "2016-05-16",
    "time": "15:41:25",
    "source": "email_header",
    "raw_date": "5/16/2016 3:41:25 PM",
    "confidence": "high"
  },
  "HOUSE_OVERSIGHT_031619": {
    "date": "2016-10-07",
    "time": null,
    "source": "content_parsed",
    "raw_date": "Fri, Oct 7, 2016",
    "confidence": "low"
  },
  "HOUSE_OVERSIGHT_031622": {
    "date": "2016-10-19",
    "time": "13:43:18",
    "source": "email_header",
    "raw_date": "10/19/2016 1:43:18 PM",
    "confidence": "high"
  },
  "HOUSE_OVERSIGHT_031624": {
    "date": "2016-10-19",
    "time": null,
    "source": "content_parsed",
    "raw_date": "Wed, Oct 19, 2016",
    "confidence": "low"
  },
  "HOUSE_OVERSIGHT_031627": {
    "date": "2016-10-19",
    "time": "14:26:25",
    "source": "email_header",
    "raw_date": "10/19/2016 2:26:25 PM",
    "confidence": "high"
  },
  "HOUSE_OVERSIGHT_031631": {
    "date": "2016-10-19",
    "time": "15:02:57",
    "source": "email_header",
    "raw_date": "10/19/2016 3:02:57 PM",
    "confidence": "high"
  },
  "HOUSE_OVERSIGHT_031636": {
    "date": "2016-10-21",
    "time": "11:55:13",
    "source": "email_header",
    "raw_date": "10/21/2016 11:55:13 AM",
    "confidence": "high"
  },
  "HOUSE_OVERSIGHT_031637": {
    "date": "2016-11-05",
    "time": "13:38:24",
    "source": "email_header",
    "raw_date": "11/5/2016 1:38:24 PM",
    "confidence": "high"
  },
  "HOUSE_OVERSIGHT_031639": {
    "date": "2016-11-09",
    "time": "19:57:45",
    "source": "email_header",
    "raw_date": "11/9/2016 7:57:45 PM",
    "confidence": "high"
  },
  "HOUSE_OVERSIGHT_031640": {
    "date": "2016-11-11",
    "time": "05:29:35",
    "source": "email_header",
    "raw_date": "11/11/2016 5:29:35 AM",
    "confidence": "high"
  },
  "HOUSE_OVERSIGHT_031642": {
    "date": "2016-11-11",
    "time": "15:26:54",
    "source": "email_header",
    "raw_date": "11/11/2016 3:26:54 PM",
    "confidence": "high"
  },
  "HOUSE_OVERSIGHT_031646": {
    "date": "2016-11-11",
    "time": "17:05:04",
    "source": "email_header",
    "raw_date": "11/11/2016 5:05:04 PM",
    "confidence": "high"
  },
  "HOUSE_OVERSIGHT_031649": {
    "date": "2016-11-11",
    "time": "21:26:17",
    "source": "email_header",
    "raw_date": "11/11/2016 9:26:17 PM",
    "confidence": "high"
  },
  "HOUSE_OVERSIGHT_031652": {
    "date": "2016-11-13",
    "time": "13:09:02",
    "source": "email_header",
    "raw_date": "11/13/2016 1:09:02 PM",
    "confidence": "high"
  },
  "HOUSE_OVERSIGHT_031656": {
    "date": "2016-11-27",
    "time": "17:54:15",
    "source": "email_header",
    "raw_date": "11/27/2016 5:54:15 PM",
    "confidence": "high"
  },
  "HOUSE_OVERSIGHT_031657": {
    "date": "2017-02-08",
    "time": "05:24:07",
    "source": "email_header",
    "raw_date": "2/8/2017 5:24:07 AM",
    "confidence": "high"
  },
  "HOUSE_OVERSIGHT_031659": {
    "date": "2017-02-08",
    "time": "09:53:21",
    "source": "email_header",
    "raw_date": "2/8/2017 9:53:21 AM",
    "confidence": "high"
  },
  "HOUSE_OVERSIGHT_031661": {
    "date": "2017-02-16",
    "time": "00:21:27",
    "source": "email_header",
    "raw_date": "2/16/2017 12:21:27 AM",
    "confidence": "high"
  },
  "HOUSE_OVERSIGHT_031662": {
    "date": "2017-02-17",
    "time": "11:31:08",
    "source": "email_header",
    "raw_date": "2/17/2017 11:31:08 AM",
    "confidence": "high"
  },
  "HOUSE_OVERSIGHT_031667": {
    "date": "2017-05-17",
    "time": "22:12:08",
    "source": "email_header",
    "raw_date": "5/17/2017 10:12:08 PM",
    "confidence": "high"
  },
  "HOUSE_OVERSIGHT_031668": {
    "date": "2017-05-19",
    "time": "10:45:11",
    "source": "email_header",
    "raw_date": "5/19/2017 10:45:11 AM",
    "confidence": "high"
  },
  "HOUSE_OVERSIGHT_031670": {
    "date": null,
    "time": null,
    "source": "unknown",
    "raw_date": null,
    "confidence": "none"
  },
  "HOUSE_OVERSIGHT_031676": {
    "date": "2018-02-27",
    "time": "00:14:26",
    "source": "email_header",
    "raw_date": "2/27/2018 12:14:26 AM",
    "confidence": "high"
  },
  "HOUSE_OVERSIGHT_031679": {
    "date": "2018-12-13",
    "time": "22:01:57",
    "source": "email_header",
    "raw_date": "12/13/2018 10:01:57 PM",
    "confidence": "high"
  },
  "HOUSE_OVERSIGHT_031680": {
    "date": "2018-12-13",
    "time": "22:02:38",
    "source": "email_header",
    "raw_date": "12/13/2018 10:02:38 PM",
    "confidence": "high"
  },
  "HOUSE_OVERSIGHT_031681": {
    "date": "2019-02-01",
    "time": "19:20:44",
    "source": "email_header",
    "raw_date": "2/1/2019 7:20:44 PM",
    "confidence": "high"
  },
  "HOUSE_OVERSIGHT_031682": {
    "date": "2019-04-20",
    "time": "22:09:26",
    "source": "email_header",
    "raw_date": "4/20/2019 10:09:26 PM",
    "confidence": "high"
  },
  "HOUSE_OVERSIGHT_031683": {
    "date": "2019-05-30",
    "time": "21:34:38",
    "source": "email_header",
    "raw_date": "5/30/2019 9:34:38 PM",
    "confidence": "high"
  },
  "HOUSE_OVERSIGHT_031684": {
    "date": "2019-05-30",
    "time": "21:43:09",
    "source": "email_header",
    "raw_date": "5/30/2019 9:43:09 PM",
    "confidence": "high"
  },
  "HOUSE_OVERSIGHT_031686": {
    "date": "2019-05-30",
    "time": "21:43:42",
    "source": "email_header",
    "raw_date": "5/30/2019 9:43:42 PM",
    "confidence": "high"
  },
  "HOUSE_OVERSIGHT_031688": {
    "date": "2011-03-08",
    "time": null,
    "source": "content_parsed",
    "raw_date": "3/8/2011",
    "confidence": "low"
  },
  "HOUSE_OVERSIGHT_031691": {
    "date": "2011-04-30",
    "time": "21:20:14",
    "source": "email_header",
    "raw_date": "4/30/2011 9:20:14 PM",
    "confidence": "high"
  },
  "HOUSE_OVERSIGHT_031694": {
    "date": "2011-04-30",
    "time": "21:36:09",
    "source": "email_header",
    "raw_date": "4/30/2011 9:36:09 PM",
    "confidence": "high"
  },
  "HOUSE_OVERSIGHT_031696": {
    "date": "2011-05-16",
    "time": "20:08:35",
    "source": "email_header",
    "raw_date": "5/16/2011 8:08:35 PM",
    "confidence": "high"
  },
  "HOUSE_OVERSIGHT_031697": {
    "date": "2011-05-23",
    "time": "19:42:56",
    "source": "email_header",
    "raw_date": "5/23/2011 7:42:56 PM",
    "confidence": "high"
  },
  "HOUSE_OVERSIGHT_031699": {
    "date": "2013-11-04",
    "time": "16:06:12",
    "source": "email_header",
    "raw_date": "11/4/2013 4:06:12 PM",
    "confidence": "high"
  },
  "HOUSE_OVERSIGHT_031705": {
    "date": "2012-08-02",
    "time": "17:57:19",
    "source": "email_header",
    "raw_date": "8/2/2012 5:57:19 PM",
    "confidence": "high"
  },
  "HOUSE_OVERSIGHT_031708": {
    "date": "2016-10-01",
    "time": null,
    "source": "content_parsed",
    "raw_date": "10/1/2016",
    "confidence": "low"
  },
  "HOUSE_OVERSIGHT_031709": {
    "date": "2016-10-12",
    "time": "07:53:37",
    "source": "email_header",
    "raw_date": "10/12/2016 7:53:37 AM",
    "confidence": "high"
  },
  "HOUSE_OVERSIGHT_031710": {
    "date": "2016-10-13",
    "time": "17:48:10",
    "source": "email_header",
    "raw_date": "10/13/2016 5:48:10 PM",
    "confidence": "high"
  },
  "HOUSE_OVERSIGHT_031712": {
    "date": "2016-10-13",
    "time": "22:01:10",
    "source": "email_header",
    "raw_date": "10/13/2016 10:01:10 PM",
    "confidence": "high"
  },
  "HOUSE_OVERSIGHT_031714": {
    "date": "2016-10-20",
    "time": "19:00:22",
    "source": "email_header",
    "raw_date": "10/20/2016 7:00:22 PM",
    "confidence": "high"
  },
  "HOUSE_OVERSIGHT_031716": {
    "date": "2016-10-22",
    "time": null,
    "source": "metadata",
    "raw_date": "10/22/2016",
    "confidence": "medium"
  },
  "HOUSE_OVERSIGHT_031724": {
    "date": "2016-11-02",
    "time": "21:07:47",
    "source": "email_header",
    "raw_date": "11/2/2016 9:07:47 PM",
    "confidence": "high"
  },
  "HOUSE_OVERSIGHT_031725": {
    "date": null,
    "time": null,
    "source": "unknown",
    "raw_date": null,
    "confidence": "none"
  },
  "HOUSE_OVERSIGHT_031728": {
    "date": "2017-02-17",
    "time": "13:42:03",
    "source": "email_header",
    "raw_date": "2/17/2017 1:42:03 PM",
    "confidence": "high"
  },
  "HOUSE_OVERSIGHT_031729": {
    "date": "2017-03-13",
    "time": "20:16:55",
    "source": "email_header",
    "raw_date": "3/13/2017 8:16:55 PM",
    "confidence": "high"
  },
  "HOUSE_OVERSIGHT_031732": {
    "date": "2017-04-07",
    "time": "12:28:56",
    "source": "email_header",
    "raw_date": "4/7/2017 12:28:56 PM",
    "confidence": "high"
  },
  "HOUSE_OVERSIGHT_031734": {
    "date": "2017-04-20",
    "time": "15:54:45",
    "source": "email_header",
    "raw_date": "4/20/2017 3:54:45 PM",
    "confidence": "high"
  },
  "HOUSE_OVERSIGHT_031735": {
    "date": "2017-05-20",
    "time": "09:48:34",
    "source": "email_header",
    "raw_date": "5/20/2017 9:48:34 AM",
    "confidence": "high"
  },
  "HOUSE_OVERSIGHT_031736": {
    "date": "2017-05-20",
    "time": null,
    "source": "metadata",
    "raw_date": "05/20/2017",
    "confidence": "medium"
  },
  "HOUSE_OVERSIGHT_031740": {
    "date": "2017-05-20",
    "time": "21:59:21",
    "source": "email_header",
    "raw_date": "5/20/2017 9:59:21 PM",
    "confidence": "high"
  },
  "HOUSE_OVERSIGHT_031742": {
    "date": "2017-08-11",
    "time": "15:05:31",
    "source": "email_header",
    "raw_date": "8/11/2017 3:05:31 PM",
    "confidence": "high"
  },
  "HOUSE_OVERSIGHT_031743": {
    "date": null,
    "time": null,
    "source": "unknown",
    "raw_date": null,
    "confidence": "none"
  },
  "HOUSE_OVERSIGHT_031746": {
    "date": "2018-04-09",
    "time": "20:04:42",
    "source": "email_header",
    "raw_date": "4/9/2018 8:04:42 PM",
    "confidence": "high"
  },
  "HOUSE_OVERSIGHT_031747": {
    "date": "2015-10-31",
    "time": "11:24:38",
    "source": "email_header",
    "raw_date": "10/31/2015 11:24:38 AM",
    "confidence": "high"
  },
  "HOUSE_OVERSIGHT_031748": {
    "date": "2016-07-17",
    "time": "19:46:17",
    "source": "email_header",
    "raw_date": "7/17/2016 7:46:17 PM",
    "confidence": "high"
  },
  "HOUSE_OVERSIGHT_031751": {
    "date": "2018-05-03",
    "time": "21:44:08",
    "source": "email_header",
    "raw_date": "5/3/2018 9:44:08 PM",
    "confidence": "high"
  },
  "HOUSE_OVERSIGHT_031753": {
    "date": "2018-07-01",
    "time": null,
    "source": "metadata",
    "raw_date": "07/01/2018",
    "confidence": "medium"
  },
  "HOUSE_OVERSIGHT_031764": {
    "date": "2018-08-18",
    "time": "16:51:06",
    "source": "email_header",
    "raw_date": "8/18/2018 4:51:06 PM",
    "confidence": "high"
  },
  "HOUSE_OVERSIGHT_031768": {
    "date": "2018-10-17",
    "time": null,
    "source": "content_parsed",
    "raw_date": "10/17/2018",
    "confidence": "low"
  },
  "HOUSE_OVERSIGHT_031770": {
    "date": "2019-01-25",
    "time": "13:11:27",
    "source": "email_header",
    "raw_date": "1/25/2019 1:11:27 PM",
    "confidence": "high"
  },
  "HOUSE_OVERSIGHT_031771": {
    "date": "2019-02-05",
    "time": "01:41:49",
    "source": "email_header",
    "raw_date": "2/5/2019 1:41:49 AM",
    "confidence": "high"
  },
  "HOUSE_OVERSIGHT_031772": {
    "date": "2019-02-22",
    "time": "17:18:49",
    "source": "email_header",
    "raw_date": "2/22/2019 5:18:49 PM",
    "confidence": "high"
  },
  "HOUSE_OVERSIGHT_031773": {
    "date": "2019-02-22",
    "time": "22:56:44",
    "source": "email_header",
    "raw_date": "2/22/2019 10:56:44 PM",
    "confidence": "high"
  },
  "HOUSE_OVERSIGHT_031774": {
    "date": "2019-03-14",
    "time": "22:26:57",
    "source": "email_header",
    "raw_date": "3/14/2019 10:26:57 PM",
    "confidence": "high"
  },
  "HOUSE_OVERSIGHT_031775": {
    "date": "2019-03-22",
    "time": "12:11:49",
    "source": "email_header",
    "raw_date": "3/22/2019 12:11:49 PM",
    "confidence": "high"
  },
  "HOUSE_OVERSIGHT_031776": {
    "date": "2019-03-27",
    "time": null,
    "source": "metadata",
    "raw_date": "03/27/2019",
    "confidence": "medium"
  },
  "HOUSE_OVERSIGHT_031779": {
    "date": "2019-03-29",
    "time": "23:28:13",
    "source": "email_header",
    "raw_date": "3/29/2019 11:28:13 PM",
    "confidence": "high"
  },
  "HOUSE_OVERSIGHT_031786": {
    "date": "2019-05-28",
    "time": "15:18:36",
    "source": "email_header",
    "raw_date": "5/28/2019 3:18:36 PM",
    "confidence": "high"
  },
  "HOUSE_OVERSIGHT_031787": {
    "date": "2019-05-29",
    "time": null,
    "source": "content_parsed",
    "raw_date": "5/29/2019",
    "confidence": "low"
  },
  "HOUSE_OVERSIGHT_031788": {
    "date": "2018-06-15",
    "time": "13:06:12",
    "source": "email_header",
    "raw_date": "6/15/2018 1:06:12 PM",
    "confidence": "high"
  },
  "HOUSE_OVERSIGHT_031789": {
    "date": "2018-06-15",
    "time": "13:47:13",
    "source": "email_header",
    "raw_date": "6/15/2018 1:47:13 PM",
    "confidence": "high"
  },
  "HOUSE_OVERSIGHT_031791": {
    "date": "2009-08-05",
    "time": "16:25:51",
    "source": "email_header",
    "raw_date": "8/5/2009 4:25:51 PM",
    "confidence": "high"
  },
  "HOUSE_OVERSIGHT_031794": {
    "date": null,
    "time": null,
    "source": "unknown",
    "raw_date": null,
    "confidence": "none"
  },
  "HOUSE_OVERSIGHT_031795": {
    "date": "2017-02-17",
    "time": "18:45:14",
    "source": "email_header",
    "raw_date": "2/17/2017 6:45:14 PM",
    "confidence": "high"
  },
  "HOUSE_OVERSIGHT_031796": {
    "date": "2018-06-15",
    "time": "13:26:04",
    "source": "email_header",
    "raw_date": "6/15/2018 1:26:04 PM",
    "confidence": "high"
  },
  "HOUSE_OVERSIGHT_031798": {
    "date": "2018-11-29",
    "time": "03:59:27",
    "source": "email_header",
    "raw_date": "11/29/2018 3:59:27 AM",
    "confidence": "high"
  },
  "HOUSE_OVERSIGHT_031799": {
    "date": "2018-12-15",
    "time": "16:24:32",
    "source": "email_header",
    "raw_date": "12/15/2018 4:24:32 PM",
    "confidence": "high"
  },
  "HOUSE_OVERSIGHT_031800": {
    "date": "2018-12-22",
    "time": "13:04:05",
    "source": "email_header",
    "raw_date": "12/22/2018 1:04:05 PM",
    "confidence": "high"
  },
  "HOUSE_OVERSIGHT_031802": {
    "date": "2019-03-26",
    "time": "11:11:17",
    "source": "email_header",
    "raw_date": "3/26/2019 11:11:17 AM",
    "confidence": "high"
  },
  "HOUSE_OVERSIGHT_031803": {
    "date": "2019-06-15",
    "time": "09:57:14",
    "source": "email_header",
    "raw_date": "6/15/2019 9:57:14 AM",
    "confidence": "high"
  },
  "HOUSE_OVERSIGHT_031804": {
    "date": "2018-07-13",
    "time": "17:40:46",
    "source": "email_header",
    "raw_date": "7/13/2018 5:40:46 PM",
    "confidence": "high"
  },
  "HOUSE_OVERSIGHT_031806": {
    "date": "2018-07-13",
    "time": "18:13:06",
    "source": "email_header",
    "raw_date": "7/13/2018 6:13:06 PM",
    "confidence": "high"
  },
  "HOUSE_OVERSIGHT_031809": {
    "date": "2018-07-13",
    "time": "18:35:08",
    "source": "email_header",
    "raw_date": "7/13/2018 6:35:08 PM",
    "confidence": "high"
  },
  "HOUSE_OVERSIGHT_031813": {
    "date": "2018-07-13",
    "time": "18:46:14",
    "source": "email_header",
    "raw_date": "7/13/2018 6:46:14 PM",
    "confidence": "high"
  },
  "HOUSE_OVERSIGHT_031818": {
    "date": "2018-07-13",
    "time": "18:57:15",
    "source": "email_header",
    "raw_date": "7/13/2018 6:57:15 PM",
    "confidence": "high"
  },
  "HOUSE_OVERSIGHT_031822": {
    "date": "2019-02-07",
    "time": "03:36:37",
    "source": "email_header",
    "raw_date": "2/7/2019 3:36:37 AM",
    "confidence": "high"
  },
  "HOUSE_OVERSIGHT_031823": {
    "date": "2019-03-26",
    "time": "10:56:00",
    "source": "email_header",
    "raw_date": "3/26/2019 10:56:00 AM",
    "confidence": "high"
  },
  "HOUSE_OVERSIGHT_031824": {
    "date": "2019-06-15",
    "time": "00:20:06",
    "source": "email_header",
    "raw_date": "6/15/2019 12:20:06 AM",
    "confidence": "high"
  },
  "HOUSE_OVERSIGHT_031825": {
    "date": "2019-06-15",
    "time": "00:21:00",
    "source": "email_header",
    "raw_date": "6/15/2019 12:21:00 AM",
    "confidence": "high"
  },
  "HOUSE_OVERSIGHT_031826": {
    "date": "2011-02-06",
    "time": null,
    "source": "content_parsed",
    "raw_date": "Sun, Feb 6, 2011",
    "confidence": "low"
  },
  "HOUSE_OVERSIGHT_031830": {
    "date": "2011-02-06",
    "time": null,
    "source": "content_parsed",
    "raw_date": "Sun, Feb 6, 2011",
    "confidence": "low"
  },
  "HOUSE_OVERSIGHT_031834": {
    "date": "2011-05-16",
    "time": null,
    "source": "metadata",
    "raw_date": "05/16/2011",
    "confidence": "medium"
  },
  "HOUSE_OVERSIGHT_031876": {
    "date": "2011-06-14",
    "time": null,
    "source": "metadata",
    "raw_date": "06/14/2011",
    "confidence": "medium"
  },
  "HOUSE_OVERSIGHT_031912": {
    "date": "2011-07-01",
    "time": "11:18:25",
    "source": "email_header",
    "raw_date": "7/1/2011 11:18:25 AM",
    "confidence": "high"
  },
  "HOUSE_OVERSIGHT_031913": {
    "date": "2011-08-24",
    "time": null,
    "source": "metadata",
    "raw_date": "08/24/2011",
    "confidence": "medium"
  },
  "HOUSE_OVERSIGHT_031941": {
    "date": "2011-11-17",
    "time": null,
    "source": "metadata",
    "raw_date": "11/17/2011",
    "confidence": "medium"
  },
  "HOUSE_OVERSIGHT_031964": {
    "date": "2013-08-31",
    "time": "19:21:40",
    "source": "email_header",
    "raw_date": "8/31/2013 7:21:40 PM",
    "confidence": "high"
  },
  "HOUSE_OVERSIGHT_031966": {
    "date": "2018-12-14",
    "time": null,
    "source": "content_parsed",
    "raw_date": "2018-12-14",
    "confidence": "low"
  },
  "HOUSE_OVERSIGHT_031972": {
    "date": "2018-03-08",
    "time": null,
    "source": "metadata",
    "raw_date": "03/08/2018",
    "confidence": "medium"
  },
  "HOUSE_OVERSIGHT_031973": {
    "date": "2019-05-15",
    "time": "00:17:32",
    "source": "email_header",
    "raw_date": "5/15/2019 12:17:32 AM",
    "confidence": "high"
  },
  "HOUSE_OVERSIGHT_031980": {
    "date": "2011-03-08",
    "time": "16:41:04",
    "source": "email_header",
    "raw_date": "3/8/2011 4:41:04 PM",
    "confidence": "high"
  },
  "HOUSE_OVERSIGHT_031983": {
    "date": "2011-03-07",
    "time": "19:12:54",
    "source": "email_header",
    "raw_date": "3/7/2011 7:12:54 PM",
    "confidence": "high"
  },
  "HOUSE_OVERSIGHT_031986": {
    "date": "2011-02-06",
    "time": "21:35:06",
    "source": "email_header",
    "raw_date": "2/6/2011 9:35:06 PM",
    "confidence": "high"
  },
  "HOUSE_OVERSIGHT_031988": {
    "date": "2011-02-06",
    "time": "08:26:59",
    "source": "email_header",
    "raw_date": "2/6/2011 8:26:59 AM",
    "confidence": "high"
  },
  "HOUSE_OVERSIGHT_031990": {
    "date": "2010-12-27",
    "time": "21:04:41",
    "source": "email_header",
    "raw_date": "12/27/2010 9:04:41 PM",
    "confidence": "high"
  },
  "HOUSE_OVERSIGHT_031992": {
    "date": "2010-07-24",
    "time": "17:10:54",
    "source": "email_header",
    "raw_date": "7/24/2010 5:10:54 PM",
    "confidence": "high"
  },
  "HOUSE_OVERSIGHT_031994": {
    "date": "2015-01-29",
    "time": "20:33:35",
    "source": "email_header",
    "raw_date": "1/29/2015 8:33:35 PM",
    "confidence": "high"
  },
  "HOUSE_OVERSIGHT_031996": {
    "date": "2015-01-06",
    "time": "01:15:20",
    "source": "email_header",
    "raw_date": "1/6/2015 1:15:20 AM",
    "confidence": "high"
  },
  "HOUSE_OVERSIGHT_031999": {
    "date": "2010-01-12",
    "time": "11:18:58",
    "source": "email_header",
    "raw_date": "1/12/2010 11:18:58 AM",
    "confidence": "high"
  },
  "HOUSE_OVERSIGHT_032005": {
    "date": "2010-01-12",
    "time": "00:28:25",
    "source": "email_header",
    "raw_date": "1/12/2010 12:28:25 AM",
    "confidence": "high"
  },
  "HOUSE_OVERSIGHT_032011": {
    "date": "2019-05-29",
    "time": "14:14:44",
    "source": "email_header",
    "raw_date": "5/29/2019 2:14:44 PM",
    "confidence": "high"
  },
  "HOUSE_OVERSIGHT_032012": {
    "date": "2019-07-04",
    "time": "12:46:27",
    "source": "email_header",
    "raw_date": "7/4/2019 12:46:27 PM",
    "confidence": "high"
  },
  "HOUSE_OVERSIGHT_032023": {
    "date": "2019-07-01",
    "time": "12:46:20",
    "source": "email_header",
    "raw_date": "7/1/2019 12:46:20 PM",
    "confidence": "high"
  },
  "HOUSE_OVERSIGHT_032034": {
    "date": "2019-06-08",
    "time": "12:06:43",
    "source": "email_header",
    "raw_date": "6/8/2019 12:06:43 PM",
    "confidence": "high"
  },
  "HOUSE_OVERSIGHT_032048": {
    "date": "2014-04-12",
    "time": null,
    "source": "content_parsed",
    "raw_date": "4/12/2014",
    "confidence": "low"
  },
  "HOUSE_OVERSIGHT_032050": {
    "date": "2019-02-22",
    "time": "22:56:44",
    "source": "email_header",
    "raw_date": "2/22/2019 10:56:44 PM",
    "confidence": "high"
  },
  "HOUSE_OVERSIGHT_032051": {
    "date": "2019-02-05",
    "time": "01:41:49",
    "source": "email_header",
    "raw_date": "2/5/2019 1:41:49 AM",
    "confidence": "high"
  },
  "HOUSE_OVERSIGHT_032052": {
    "date": "2017-04-07",
    "time": null,
    "source": "content_parsed",
    "raw_date": "Fri, Apr 7, 2017",
    "confidence": "low"
  },
  "HOUSE_OVERSIGHT_032054": {
    "date": "2017-02-16",
    "time": "23:51:27",
    "source": "email_header",
    "raw_date": "2/16/2017 11:51:27 PM",
    "confidence": "high"
  },
  "HOUSE_OVERSIGHT_032056": {
    "date": "2017-02-16",
    "time": "20:17:01",
    "source": "email_header",
    "raw_date": "2/16/2017 8:17:01 PM",
    "confidence": "high"
  },
  "HOUSE_OVERSIGHT_032057": {
    "date": "2016-11-06",
    "time": "14:08:35",
    "source": "email_header",
    "raw_date": "11/6/2016 2:08:35 PM",
    "confidence": "high"
  },
  "HOUSE_OVERSIGHT_032058": {
    "date": "2016-10-13",
    "time": "18:14:55",
    "source": "email_header",
    "raw_date": "10/13/2016 6:14:55 PM",
    "confidence": "high"
  },
  "HOUSE_OVERSIGHT_032060": {
    "date": "2016-10-11",
    "time": "03:50:20",
    "source": "email_header",
    "raw_date": "10/11/2016 3:50:20 AM",
    "confidence": "high"
  },
  "HOUSE_OVERSIGHT_032061": {
    "date": "2016-10-09",
    "time": "03:26:04",
    "source": "email_header",
    "raw_date": "10/9/2016 3:26:04 AM",
    "confidence": "high"
  },
  "HOUSE_OVERSIGHT_032062": {
    "date": "2016-10-08",
    "time": null,
    "source": "content_parsed",
    "raw_date": "Saturday, October 08, 2016",
    "confidence": "low"
  },
  "HOUSE_OVERSIGHT_032063": {
    "date": "2016-10-09",
    "time": "01:52:26",
    "source": "email_header",
    "raw_date": "10/9/2016 1:52:26 AM",
    "confidence": "high"
  },
  "HOUSE_OVERSIGHT_032064": {
    "date": "2016-10-09",
    "time": "01:07:24",
    "source": "email_header",
    "raw_date": "10/9/2016 1:07:24 AM",
    "confidence": "high"
  },
  "HOUSE_OVERSIGHT_032065": {
    "date": "2016-04-28",
    "time": "21:10:25",
    "source": "email_header",
    "raw_date": "4/28/2016 9:10:25 PM",
    "confidence": "high"
  },
  "HOUSE_OVERSIGHT_032066": {
    "date": "2016-04-28",
    "time": null,
    "source": "content_parsed",
    "raw_date": "Thu, Apr 28, 2016",
    "confidence": "low"
  },
  "HOUSE_OVERSIGHT_032068": {
    "date": "2011-09-22",
    "time": "10:19:51",
    "source": "email_header",
    "raw_date": "9/22/2011 10:19:51 AM",
    "confidence": "high"
  },
  "HOUSE_OVERSIGHT_032107": {
    "date": "2011-08-03",
    "time": "14:11:03",
    "source": "email_header",
    "raw_date": "8/3/2011 2:11:03 PM",
    "confidence": "high"
  },
  "HOUSE_OVERSIGHT_032125": {
    "date": "2011-07-27",
    "time": "14:09:40",
    "source": "email_header",
    "raw_date": "7/27/2011 2:09:40 PM",
    "confidence": "high"
  },
  "HOUSE_OVERSIGHT_032157": {
    "date": "2011-07-01",
    "time": "18:43:30",
    "source": "email_header",
    "raw_date": "7/1/2011 6:43:30 PM",
    "confidence": "high"
  },
  "HOUSE_OVERSIGHT_032158": {
    "date": "2011-07-01",
    "time": "11:18:25",
    "source": "email_header",
    "raw_date": "7/1/2011 11:18:25 AM",
    "confidence": "high"
  },
  "HOUSE_OVERSIGHT_032159": {
    "date": "2014-08-19",
    "time": null,
    "source": "metadata",
    "raw_date": "08/19/2014",
    "confidence": "medium"
  },
  "HOUSE_OVERSIGHT_032162": {
    "date": "2014-10-30",
    "time": "02:50:38",
    "source": "email_header",
    "raw_date": "10/30/2014 2:50:38 AM",
    "confidence": "high"
  },
  "HOUSE_OVERSIGHT_032171": {
    "date": "2011-06-26",
    "time": null,
    "source": "metadata",
    "raw_date": "06/26/2011",
    "confidence": "medium"
  },
  "HOUSE_OVERSIGHT_032204": {
    "date": "2019-06-01",
    "time": "12:36:57",
    "source": "email_header",
    "raw_date": "6/1/2019 12:36:57 PM",
    "confidence": "high"
  },
  "HOUSE_OVERSIGHT_032206": {
    "date": "2017-08-24",
    "time": "02:20:29",
    "source": "email_header",
    "raw_date": "8/24/2017 2:20:29 AM",
    "confidence": "high"
  },
  "HOUSE_OVERSIGHT_032208": {
    "date": "2017-07-11",
    "time": "23:42:34",
    "source": "email_header",
    "raw_date": "07/11/2017 11:42:34 PM",
    "confidence": "high"
  },
  "HOUSE_OVERSIGHT_032209": {
    "date": "2017-07-05",
    "time": "20:29:33",
    "source": "email_header",
    "raw_date": "07/05/2017 8:29:33 PM",
    "confidence": "high"
  },
  "HOUSE_OVERSIGHT_032210": {
    "date": "2019-04-05",
    "time": "11:06:20",
    "source": "email_header",
    "raw_date": "4/5/2019 11:06:20 AM",
    "confidence": "high"
  },
  "HOUSE_OVERSIGHT_032212": {
    "date": "2018-03-24",
    "time": "21:55:46",
    "source": "email_header",
    "raw_date": "3/24/2018 9:55:46 PM",
    "confidence": "high"
  },
  "HOUSE_OVERSIGHT_032213": {
    "date": "2018-03-24",
    "time": null,
    "source": "content_parsed",
    "raw_date": "3/24/2018",
    "confidence": "low"
  },
  "HOUSE_OVERSIGHT_032214": {
    "date": "2018-03-24",
    "time": null,
    "source": "content_parsed",
    "raw_date": "Sat, Mar 24, 2018",
    "confidence": "low"
  },
  "HOUSE_OVERSIGHT_032216": {
    "date": "2016-10-10",
    "time": "00:29:04",
    "source": "email_header",
    "raw_date": "10/10/2016 12:29:04 AM",
    "confidence": "high"
  },
  "HOUSE_OVERSIGHT_032217": {
    "date": "2017-05-22",
    "time": "06:58:42",
    "source": "email_header",
    "raw_date": "5/22/2017 6:58:42 AM",
    "confidence": "high"
  },
  "HOUSE_OVERSIGHT_032218": {
    "date": "2018-04-25",
    "time": "20:15:47",
    "source": "email_header",
    "raw_date": "4/25/2018 8:15:47 PM",
    "confidence": "high"
  },
  "HOUSE_OVERSIGHT_032219": {
    "date": "2015-03-24",
    "time": "16:56:34",
    "source": "email_header",
    "raw_date": "3/24/2015 4:56:34 PM",
    "confidence": "high"
  },
  "HOUSE_OVERSIGHT_032220": {
    "date": "2015-08-12",
    "time": "05:22:10",
    "source": "email_header",
    "raw_date": "8/12/2015 5:22:10 AM",
    "confidence": "high"
  },
  "HOUSE_OVERSIGHT_032221": {
    "date": "2015-08-12",
    "time": "13:40:14",
    "source": "email_header",
    "raw_date": "8/12/2015 1:40:14 PM",
    "confidence": "high"
  },
  "HOUSE_OVERSIGHT_032222": {
    "date": "2015-08-27",
    "time": null,
    "source": "content_parsed",
    "raw_date": "8/27/2015",
    "confidence": "low"
  },
  "HOUSE_OVERSIGHT_032223": {
    "date": "2015-08-27",
    "time": "02:18:39",
    "source": "email_header",
    "raw_date": "8/27/2015 2:18:39 AM",
    "confidence": "high"
  },
  "HOUSE_OVERSIGHT_032224": {
    "date": "2015-08-26",
    "time": null,
    "source": "content_parsed",
    "raw_date": "Wed, Aug 26, 2015",
    "confidence": "low"
  },
  "HOUSE_OVERSIGHT_032226": {
    "date": "2015-08-26",
    "time": null,
    "source": "content_parsed",
    "raw_date": "Wed, Aug 26, 2015",
    "confidence": "low"
  },
  "HOUSE_OVERSIGHT_032228": {
    "date": "2015-12-16",
    "time": "01:00:36",
    "source": "email_header",
    "raw_date": "12/16/2015 1:00:36 AM",
    "confidence": "high"
  },
  "HOUSE_OVERSIGHT_032229": {
    "date": "2015-12-16",
    "time": "16:26:32",
    "source": "email_header",
    "raw_date": "12/16/2015 4:26:32 PM",
    "confidence": "high"
  },
  "HOUSE_OVERSIGHT_032230": {
    "date": "2016-01-21",
    "time": "00:18:58",
    "source": "email_header",
    "raw_date": "1/21/2016 12:18:58 AM",
    "confidence": "high"
  },
  "HOUSE_OVERSIGHT_032231": {
    "date": "2016-01-21",
    "time": "02:06:40",
    "source": "email_header",
    "raw_date": "1/21/2016 2:06:40 AM",
    "confidence": "high"
  },
  "HOUSE_OVERSIGHT_032233": {
    "date": "2016-01-21",
    "time": "02:42:21",
    "source": "email_header",
    "raw_date": "1/21/2016 2:42:21 AM",
    "confidence": "high"
  },
  "HOUSE_OVERSIGHT_032235": {
    "date": "2016-02-10",
    "time": "18:46:25",
    "source": "email_header",
    "raw_date": "2/10/2016 6:46:25 PM",
    "confidence": "high"
  },
  "HOUSE_OVERSIGHT_032236": {
    "date": "2016-02-10",
    "time": "19:13:36",
    "source": "email_header",
    "raw_date": "2/10/2016 7:13:36 PM",
    "confidence": "high"
  },
  "HOUSE_OVERSIGHT_032238": {
    "date": "2016-02-19",
    "time": "17:44:47",
    "source": "email_header",
    "raw_date": "2/19/2016 5:44:47 PM",
    "confidence": "high"
  },
  "HOUSE_OVERSIGHT_032239": {
    "date": "2016-02-19",
    "time": "21:58:09",
    "source": "email_header",
    "raw_date": "2/19/2016 9:58:09 PM",
    "confidence": "high"
  },
  "HOUSE_OVERSIGHT_032241": {
    "date": "2016-02-21",
    "time": "12:38:14",
    "source": "email_header",
    "raw_date": "2/21/2016 12:38:14 PM",
    "confidence": "high"
  },
  "HOUSE_OVERSIGHT_032242": {
    "date": "2016-02-24",
    "time": "15:14:36",
    "source": "email_header",
    "raw_date": "2/24/2016 3:14:36 PM",
    "confidence": "high"
  },
  "HOUSE_OVERSIGHT_032243": {
    "date": "2016-03-09",
    "time": "17:28:29",
    "source": "email_header",
    "raw_date": "3/9/2016 5:28:29 PM",
    "confidence": "high"
  },
  "HOUSE_OVERSIGHT_032244": {
    "date": "2016-03-18",
    "time": "15:39:39",
    "source": "email_header",
    "raw_date": "3/18/2016 3:39:39 PM",
    "confidence": "high"
  },
  "HOUSE_OVERSIGHT_032246": {
    "date": "2016-03-18",
    "time": "15:57:19",
    "source": "email_header",
    "raw_date": "3/18/2016 3:57:19 PM",
    "confidence": "high"
  },
  "HOUSE_OVERSIGHT_032248": {
    "date": "2016-03-18",
    "time": "15:57:38",
    "source": "email_header",
    "raw_date": "3/18/2016 3:57:38 PM",
    "confidence": "high"
  },
  "HOUSE_OVERSIGHT_032250": {
    "date": "2016-03-18",
    "time": "16:30:13",
    "source": "email_header",
    "raw_date": "3/18/2016 4:30:13 PM",
    "confidence": "high"
  },
  "HOUSE_OVERSIGHT_032252": {
    "date": "2016-03-31",
    "time": "08:27:13",
    "source": "email_header",
    "raw_date": "3/31/2016 8:27:13 AM",
    "confidence": "high"
  },
  "HOUSE_OVERSIGHT_032253": {
    "date": "2016-05-08",
    "time": "13:08:03",
    "source": "email_header",
    "raw_date": "5/8/2016 1:08:03 PM",
    "confidence": "high"
  },
  "HOUSE_OVERSIGHT_032254": {
    "date": "2016-05-11",
    "time": "14:52:06",
    "source": "email_header",
    "raw_date": "5/11/2016 2:52:06 PM",
    "confidence": "high"
  },
  "HOUSE_OVERSIGHT_032256": {
    "date": "2016-05-17",
    "time": "13:53:36",
    "source": "email_header",
    "raw_date": "5/17/2016 1:53:36 PM",
    "confidence": "high"
  },
  "HOUSE_OVERSIGHT_032259": {
    "date": "2016-05-21",
    "time": "14:27:24",
    "source": "email_header",
    "raw_date": "5/21/2016 2:27:24 PM",
    "confidence": "high"
  },
  "HOUSE_OVERSIGHT_032261": {
    "date": "2016-05-21",
    "time": "16:47:49",
    "source": "email_header",
    "raw_date": "5/21/2016 4:47:49 PM",
    "confidence": "high"
  },
  "HOUSE_OVERSIGHT_032263": {
    "date": "2016-05-25",
    "time": "11:05:51",
    "source": "email_header",
    "raw_date": "5/25/2016 11:05:51 AM",
    "confidence": "high"
  },
  "HOUSE_OVERSIGHT_032264": {
    "date": "2016-06-01",
    "time": "15:25:15",
    "source": "email_header",
    "raw_date": "6/1/2016 3:25:15 PM",
    "confidence": "high"
  },
  "HOUSE_OVERSIGHT_032265": {
    "date": "2016-06-01",
    "time": "15:54:43",
    "source": "email_header",
    "raw_date": "6/1/2016 3:54:43 PM",
    "confidence": "high"
  },
  "HOUSE_OVERSIGHT_032267": {
    "date": "2016-06-22",
    "time": "21:58:45",
    "source": "email_header",
    "raw_date": "6/22/2016 9:58:45 PM",
    "confidence": "high"
  },
  "HOUSE_OVERSIGHT_032268": {
    "date": "2016-06-28",
    "time": "18:38:55",
    "source": "email_header",
    "raw_date": "6/28/2016 6:38:55 PM",
    "confidence": "high"
  },
  "HOUSE_OVERSIGHT_032269": {
    "date": "2016-06-28",
    "time": "18:58:59",
    "source": "email_header",
    "raw_date": "6/28/2016 6:58:59 PM",
    "confidence": "high"
  },
  "HOUSE_OVERSIGHT_032271": {
    "date": "2016-06-28",
    "time": "20:42:34",
    "source": "email_header",
    "raw_date": "6/28/2016 8:42:34 PM",
    "confidence": "high"
  },
  "HOUSE_OVERSIGHT_032272": {
    "date": "2016-07-07",
    "time": "13:04:06",
    "source": "email_header",
    "raw_date": "7/7/2016 1:04:06 PM",
    "confidence": "high"
  },
  "HOUSE_OVERSIGHT_032273": {
    "date": "2016-07-07",
    "time": "13:15:26",
    "source": "email_header",
    "raw_date": "7/7/2016 1:15:26 PM",
    "confidence": "high"
  },
  "HOUSE_OVERSIGHT_032274": {
    "date": "2016-07-14",
    "time": "11:59:52",
    "source": "email_header",
    "raw_date": "7/14/2016 11:59:52 AM",
    "confidence": "high"
  },
  "HOUSE_OVERSIGHT_032275": {
    "date": "2016-07-14",
    "time": "23:32:51",
    "source": "email_header",
    "raw_date": "7/14/2016 11:32:51 PM",
    "confidence": "high"
  },
  "HOUSE_OVERSIGHT_032277": {
    "date": "2016-07-15",
    "time": "13:38:11",
    "source": "email_header",
    "raw_date": "7/15/2016 1:38:11 PM",
    "confidence": "high"
  },
  "HOUSE_OVERSIGHT_032279": {
    "date": "2016-09-13",
    "time": "11:04:37",
    "source": "email_header",
    "raw_date": "9/13/2016 11:04:37 AM",
    "confidence": "high"
  },
  "HOUSE_OVERSIGHT_032280": {
    "date": "2016-09-15",
    "time": "17:02:37",
    "source": "email_header",
    "raw_date": "9/15/2016 5:02:37 PM",
    "confidence": "high"
  },
  "HOUSE_OVERSIGHT_032281": {
    "date": null,
    "time": null,
    "source": "unknown",
    "raw_date": null,
    "confidence": "none"
  },
  "HOUSE_OVERSIGHT_032283": {
    "date": null,
    "time": null,
    "source": "unknown",
    "raw_date": null,
    "confidence": "none"
  },
  "HOUSE_OVERSIGHT_032284": {
    "date": "2016-09-16",
    "time": "17:08:05",
    "source": "email_header",
    "raw_date": "9/16/2016 5:08:05 PM",
    "confidence": "high"
  },
  "HOUSE_OVERSIGHT_032285": {
    "date": "2016-09-16",
    "time": "20:07:51",
    "source": "email_header",
    "raw_date": "9/16/2016 8:07:51 PM",
    "confidence": "high"
  },
  "HOUSE_OVERSIGHT_032287": {
    "date": "2016-09-16",
    "time": "20:24:19",
    "source": "email_header",
    "raw_date": "9/16/2016 8:24:19 PM",
    "confidence": "high"
  },
  "HOUSE_OVERSIGHT_032289": {
    "date": "2016-09-16",
    "time": "20:49:29",
    "source": "email_header",
    "raw_date": "9/16/2016 8:49:29 PM",
    "confidence": "high"
  },
  "HOUSE_OVERSIGHT_032292": {
    "date": "2016-09-16",
    "time": "20:56:07",
    "source": "email_header",
    "raw_date": "9/16/2016 8:56:07 PM",
    "confidence": "high"
  },
  "HOUSE_OVERSIGHT_032296": {
    "date": "2016-09-17",
    "time": "11:51:24",
    "source": "email_header",
    "raw_date": "9/17/2016 11:51:24 AM",
    "confidence": "high"
  },
  "HOUSE_OVERSIGHT_032297": {
    "date": "2016-09-27",
    "time": "10:48:58",
    "source": "email_header",
    "raw_date": "9/27/2016 10:48:58 AM",
    "confidence": "high"
  },
  "HOUSE_OVERSIGHT_032301": {
    "date": "2016-09-30",
    "time": null,
    "source": "content_parsed",
    "raw_date": "2016-09-30",
    "confidence": "low"
  },
  "HOUSE_OVERSIGHT_032302": {
    "date": "2016-10-01",
    "time": null,
    "source": "content_parsed",
    "raw_date": "Sat, Oct 1, 2016",
    "confidence": "low"
  },
  "HOUSE_OVERSIGHT_032303": {
    "date": "2016-10-02",
    "time": "00:32:18",
    "source": "email_header",
    "raw_date": "10/2/2016 12:32:18 AM",
    "confidence": "high"
  },
  "HOUSE_OVERSIGHT_032304": {
    "date": "2016-10-08",
    "time": "22:48:32",
    "source": "email_header",
    "raw_date": "10/8/2016 10:48:32 PM",
    "confidence": "high"
  },
  "HOUSE_OVERSIGHT_032306": {
    "date": "2016-10-09",
    "time": "02:53:46",
    "source": "email_header",
    "raw_date": "10/9/2016 2:53:46 AM",
    "confidence": "high"
  },
  "HOUSE_OVERSIGHT_032308": {
    "date": "2016-10-09",
    "time": "05:53:22",
    "source": "email_header",
    "raw_date": "10/9/2016 5:53:22 AM",
    "confidence": "high"
  },
  "HOUSE_OVERSIGHT_032309": {
    "date": "2016-10-09",
    "time": "06:14:21",
    "source": "email_header",
    "raw_date": "10/9/2016 6:14:21 AM",
    "confidence": "high"
  },
  "HOUSE_OVERSIGHT_032311": {
    "date": "2016-10-10",
    "time": "20:09:15",
    "source": "email_header",
    "raw_date": "10/10/2016 8:09:15 PM",
    "confidence": "high"
  },
  "HOUSE_OVERSIGHT_032312": {
    "date": "2016-10-10",
    "time": "21:30:57",
    "source": "email_header",
    "raw_date": "10/10/2016 9:30:57 PM",
    "confidence": "high"
  },
  "HOUSE_OVERSIGHT_032314": {
    "date": "2016-10-10",
    "time": null,
    "source": "content_parsed",
    "raw_date": "Mon, Oct 10, 2016",
    "confidence": "low"
  },
  "HOUSE_OVERSIGHT_032317": {
    "date": "2016-10-19",
    "time": "12:54:06",
    "source": "email_header",
    "raw_date": "10/19/2016 12:54:06 PM",
    "confidence": "high"
  },
  "HOUSE_OVERSIGHT_032319": {
    "date": "2016-10-29",
    "time": "13:40:09",
    "source": "email_header",
    "raw_date": "10/29/2016 1:40:09 PM",
    "confidence": "high"
  },
  "HOUSE_OVERSIGHT_032320": {
    "date": "2016-10-29",
    "time": "21:04:53",
    "source": "email_header",
    "raw_date": "10/29/2016 9:04:53 PM",
    "confidence": "high"
  },
  "HOUSE_OVERSIGHT_032321": {
    "date": "2016-10-04",
    "time": null,
    "source": "content_parsed",
    "raw_date": "10/4/2016",
    "confidence": "low"
  },
  "HOUSE_OVERSIGHT_032323": {
    "date": "2016-11-04",
    "time": "12:43:32",
    "source": "email_header",
    "raw_date": "11/4/2016 12:43:32 PM",
    "confidence": "high"
  },
  "HOUSE_OVERSIGHT_032324": {
    "date": null,
    "time": null,
    "source": "unknown",
    "raw_date": null,
    "confidence": "none"
  },
  "HOUSE_OVERSIGHT_032325": {
    "date": "2016-11-04",
    "time": "13:07:21",
    "source": "email_header",
    "raw_date": "11/4/2016 1:07:21 PM",
    "confidence": "high"
  },
  "HOUSE_OVERSIGHT_032329": {
    "date": "2016-11-04",
    "time": "22:14:16",
    "source": "email_header",
    "raw_date": "11/4/2016 10:14:16 PM",
    "confidence": "high"
  },
  "HOUSE_OVERSIGHT_032331": {
    "date": "2016-11-04",
    "time": "22:16:32",
    "source": "email_header",
    "raw_date": "11/4/2016 10:16:32 PM",
    "confidence": "high"
  },
  "HOUSE_OVERSIGHT_032334": {
    "date": "2016-11-04",
    "time": null,
    "source": "content_parsed",
    "raw_date": "Friday, November 04, 2016",
    "confidence": "low"
  },
  "HOUSE_OVERSIGHT_032336": {
    "date": "2016-11-07",
    "time": "03:54:57",
    "source": "email_header",
    "raw_date": "11/7/2016 3:54:57 AM",
    "confidence": "high"
  },
  "HOUSE_OVERSIGHT_032338": {
    "date": "2016-11-09",
    "time": null,
    "source": "content_parsed",
    "raw_date": "11/9/2016",
    "confidence": "low"
  },
  "HOUSE_OVERSIGHT_032339": {
    "date": "2016-11-10",
    "time": "21:36:16",
    "source": "email_header",
    "raw_date": "11/10/2016 9:36:16 PM",
    "confidence": "high"
  },
  "HOUSE_OVERSIGHT_032340": {
    "date": "2016-11-10",
    "time": "21:40:43",
    "source": "email_header",
    "raw_date": "11/10/2016 9:40:43 PM",
    "confidence": "high"
  },
  "HOUSE_OVERSIGHT_032341": {
    "date": "2016-11-10",
    "time": null,
    "source": "content_parsed",
    "raw_date": "Thu, Nov 10, 2016",
    "confidence": "low"
  },
  "HOUSE_OVERSIGHT_032342": {
    "date": "2016-11-10",
    "time": "21:59:45",
    "source": "email_header",
    "raw_date": "11/10/2016 9:59:45 PM",
    "confidence": "high"
  },
  "HOUSE_OVERSIGHT_032343": {
    "date": "2016-11-10",
    "time": "22:08:03",
    "source": "email_header",
    "raw_date": "11/10/2016 10:08:03 PM",
    "confidence": "high"
  },
  "HOUSE_OVERSIGHT_032344": {
    "date": "2016-11-10",
    "time": "22:10:27",
    "source": "email_header",
    "raw_date": "11/10/2016 10:10:27 PM",
    "confidence": "high"
  },
  "HOUSE_OVERSIGHT_032346": {
    "date": "2016-11-10",
    "time": "22:11:46",
    "source": "email_header",
    "raw_date": "11/10/2016 10:11:46 PM",
    "confidence": "high"
  },
  "HOUSE_OVERSIGHT_032348": {
    "date": "2016-11-10",
    "time": "22:12:20",
    "source": "email_header",
    "raw_date": "11/10/2016 10:12:20 PM",
    "confidence": "high"
  },
  "HOUSE_OVERSIGHT_032349": {
    "date": "2016-11-10",
    "time": "22:12:34",
    "source": "email_header",
    "raw_date": "11/10/2016 10:12:34 PM",
    "confidence": "high"
  },
  "HOUSE_OVERSIGHT_032350": {
    "date": "2016-11-10",
    "time": "22:14:40",
    "source": "email_header",
    "raw_date": "11/10/2016 10:14:40 PM",
    "confidence": "high"
  },
  "HOUSE_OVERSIGHT_032351": {
    "date": "2016-11-10",
    "time": "22:16:11",
    "source": "email_header",
    "raw_date": "11/10/2016 10:16:11 PM",
    "confidence": "high"
  },
  "HOUSE_OVERSIGHT_032353": {
    "date": "2016-11-10",
    "time": "22:19:12",
    "source": "email_header",
    "raw_date": "11/10/2016 10:19:12 PM",
    "confidence": "high"
  },
  "HOUSE_OVERSIGHT_032355": {
    "date": "2016-11-10",
    "time": "22:19:17",
    "source": "email_header",
    "raw_date": "11/10/2016 10:19:17 PM",
    "confidence": "high"
  },
  "HOUSE_OVERSIGHT_032358": {
    "date": "2016-11-10",
    "time": "22:28:58",
    "source": "email_header",
    "raw_date": "11/10/2016 10:28:58 PM",
    "confidence": "high"
  },
  "HOUSE_OVERSIGHT_032359": {
    "date": "2016-11-11",
    "time": "05:13:57",
    "source": "email_header",
    "raw_date": "11/11/2016 5:13:57 AM",
    "confidence": "high"
  },
  "HOUSE_OVERSIGHT_032360": {
    "date": "2016-11-11",
    "time": "11:00:04",
    "source": "email_header",
    "raw_date": "11/11/2016 11:00:04 AM",
    "confidence": "high"
  },
  "HOUSE_OVERSIGHT_032362": {
    "date": "2016-11-13",
    "time": "18:26:33",
    "source": "email_header",
    "raw_date": "11/13/2016 6:26:33 PM",
    "confidence": "high"
  },
  "HOUSE_OVERSIGHT_032363": {
    "date": "2016-11-13",
    "time": "18:34:38",
    "source": "email_header",
    "raw_date": "11/13/2016 6:34:38 PM",
    "confidence": "high"
  },
  "HOUSE_OVERSIGHT_032365": {
    "date": "2016-11-13",
    "time": "18:37:59",
    "source": "email_header",
    "raw_date": "11/13/2016 6:37:59 PM",
    "confidence": "high"
  },
  "HOUSE_OVERSIGHT_032366": {
    "date": "2016-11-14",
    "time": "13:13:43",
    "source": "email_header",
    "raw_date": "11/14/2016 1:13:43 PM",
    "confidence": "high"
  },
  "HOUSE_OVERSIGHT_032367": {
    "date": "2016-11-14",
    "time": "13:25:37",
    "source": "email_header",
    "raw_date": "11/14/2016 1:25:37 PM",
    "confidence": "high"
  },
  "HOUSE_OVERSIGHT_032369": {
    "date": "2016-11-14",
    "time": "14:51:53",
    "source": "email_header",
    "raw_date": "11/14/2016 2:51:53 PM",
    "confidence": "high"
  },
  "HOUSE_OVERSIGHT_032370": {
    "date": "2016-11-14",
    "time": "14:54:06",
    "source": "email_header",
    "raw_date": "11/14/2016 2:54:06 PM",
    "confidence": "high"
  },
  "HOUSE_OVERSIGHT_032372": {
    "date": "2016-11-14",
    "time": "14:59:28",
    "source": "email_header",
    "raw_date": "11/14/2016 2:59:28 PM",
    "confidence": "high"
  },
  "HOUSE_OVERSIGHT_032374": {
    "date": "2016-11-16",
    "time": null,
    "source": "content_parsed",
    "raw_date": "11/16/2016",
    "confidence": "low"
  },
  "HOUSE_OVERSIGHT_032375": {
    "date": "2016-11-16",
    "time": "18:55:56",
    "source": "email_header",
    "raw_date": "11/16/2016 6:55:56 PM",
    "confidence": "high"
  },
  "HOUSE_OVERSIGHT_032376": {
    "date": "2016-11-25",
    "time": "11:53:06",
    "source": "email_header",
    "raw_date": "11/25/2016 11:53:06 AM",
    "confidence": "high"
  },
  "HOUSE_OVERSIGHT_032378": {
    "date": "2016-11-25",
    "time": "22:28:28",
    "source": "email_header",
    "raw_date": "11/25/2016 10:28:28 PM",
    "confidence": "high"
  },
  "HOUSE_OVERSIGHT_032379": {
    "date": "2016-11-27",
    "time": null,
    "source": "content_parsed",
    "raw_date": "Sun, Nov 27, 2016",
    "confidence": "low"
  },
  "HOUSE_OVERSIGHT_032381": {
    "date": "2016-11-27",
    "time": "19:05:19",
    "source": "email_header",
    "raw_date": "11/27/2016 7:05:19 PM",
    "confidence": "high"
  },
  "HOUSE_OVERSIGHT_032383": {
    "date": "2016-11-28",
    "time": "12:52:19",
    "source": "email_header",
    "raw_date": "11/28/2016 12:52:19 PM",
    "confidence": "high"
  },
  "HOUSE_OVERSIGHT_032384": {
    "date": "2016-11-29",
    "time": "07:34:18",
    "source": "email_header",
    "raw_date": "11/29/2016 7:34:18 AM",
    "confidence": "high"
  },
  "HOUSE_OVERSIGHT_032386": {
    "date": "2016-12-01",
    "time": "03:58:05",
    "source": "email_header",
    "raw_date": "12/1/2016 3:58:05 AM",
    "confidence": "high"
  },
  "HOUSE_OVERSIGHT_032387": {
    "date": "2016-12-02",
    "time": "12:41:57",
    "source": "email_header",
    "raw_date": "12/2/2016 12:41:57 PM",
    "confidence": "high"
  },
  "HOUSE_OVERSIGHT_032388": {
    "date": "2016-12-07",
    "time": "17:01:04",
    "source": "email_header",
    "raw_date": "12/7/2016 5:01:04 PM",
    "confidence": "high"
  },
  "HOUSE_OVERSIGHT_032389": {
    "date": "2016-12-07",
    "time": "17:29:21",
    "source": "email_header",
    "raw_date": "12/7/2016 5:29:21 PM",
    "confidence": "high"
  },
  "HOUSE_OVERSIGHT_032390": {
    "date": "2016-12-15",
    "time": null,
    "source": "content_parsed",
    "raw_date": "Thursday, December 15, 2016",
    "confidence": "low"
  },
  "HOUSE_OVERSIGHT_032391": {
    "date": "2016-12-15",
    "time": "16:07:24",
    "source": "email_header",
    "raw_date": "12/15/2016 4:07:24 PM",
    "confidence": "high"
  },
  "HOUSE_OVERSIGHT_032393": {
    "date": "2016-12-15",
    "time": "16:29:32",
    "source": "email_header",
    "raw_date": "12/15/2016 4:29:32 PM",
    "confidence": "high"
  },
  "HOUSE_OVERSIGHT_032394": {
    "date": "2016-12-20",
    "time": "19:37:59",
    "source": "email_header",
    "raw_date": "12/20/2016 7:37:59 PM",
    "confidence": "high"
  },
  "HOUSE_OVERSIGHT_032395": {
    "date": "2016-12-25",
    "time": "17:46:20",
    "source": "email_header",
    "raw_date": "12/25/2016 5:46:20 PM",
    "confidence": "high"
  },
  "HOUSE_OVERSIGHT_032396": {
    "date": "2016-12-25",
    "time": "19:39:30",
    "source": "email_header",
    "raw_date": "12/25/2016 7:39:30 PM",
    "confidence": "high"
  },
  "HOUSE_OVERSIGHT_032398": {
    "date": "2016-12-29",
    "time": "11:35:31",
    "source": "email_header",
    "raw_date": "12/29/2016 11:35:31 AM",
    "confidence": "high"
  },
  "HOUSE_OVERSIGHT_032404": {
    "date": "2017-01-01",
    "time": "00:44:33",
    "source": "email_header",
    "raw_date": "1/1/2017 12:44:33 AM",
    "confidence": "high"
  },
  "HOUSE_OVERSIGHT_032405": {
    "date": "2017-01-02",
    "time": "16:39:38",
    "source": "email_header",
    "raw_date": "1/2/2017 4:39:38 PM",
    "confidence": "high"
  },
  "HOUSE_OVERSIGHT_032414": {
    "date": "2017-01-06",
    "time": "11:28:17",
    "source": "email_header",
    "raw_date": "1/6/2017 11:28:17 AM",
    "confidence": "high"
  },
  "HOUSE_OVERSIGHT_032415": {
    "date": "2017-01-08",
    "time": "21:11:37",
    "source": "email_header",
    "raw_date": "1/8/2017 9:11:37 PM",
    "confidence": "high"
  },
  "HOUSE_OVERSIGHT_032417": {
    "date": "2017-01-09",
    "time": "17:10:35",
    "source": "email_header",
    "raw_date": "1/9/2017 5:10:35 PM",
    "confidence": "high"
  },
  "HOUSE_OVERSIGHT_032419": {
    "date": "2017-01-09",
    "time": "19:27:38",
    "source": "email_header",
    "raw_date": "1/9/2017 7:27:38 PM",
    "confidence": "high"
  },
  "HOUSE_OVERSIGHT_032422": {
    "date": "2017-01-12",
    "time": "02:02:04",
    "source": "email_header",
    "raw_date": "1/12/2017 2:02:04 AM",
    "confidence": "high"
  },
  "HOUSE_OVERSIGHT_032423": {
    "date": "2017-01-12",
    "time": "14:12:30",
    "source": "email_header",
    "raw_date": "1/12/2017 2:12:30 PM",
    "confidence": "high"
  },
  "HOUSE_OVERSIGHT_032424": {
    "date": "2017-01-12",
    "time": "14:14:38",
    "source": "email_header",
    "raw_date": "1/12/2017 2:14:38 PM",
    "confidence": "high"
  },
  "HOUSE_OVERSIGHT_032426": {
    "date": "2017-01-12",
    "time": "14:21:31",
    "source": "email_header",
    "raw_date": "1/12/2017 2:21:31 PM",
    "confidence": "high"
  },
  "HOUSE_OVERSIGHT_032428": {
    "date": "2017-01-12",
    "time": "14:52:17",
    "source": "email_header",
    "raw_date": "1/12/2017 2:52:17 PM",
    "confidence": "high"
  },
  "HOUSE_OVERSIGHT_032430": {
    "date": "2017-01-12",
    "time": "15:00:17",
    "source": "email_header",
    "raw_date": "1/12/2017 3:00:17 PM",
    "confidence": "high"
  },
  "HOUSE_OVERSIGHT_032433": {
    "date": "2017-01-12",
    "time": "15:19:45",
    "source": "email_header",
    "raw_date": "1/12/2017 3:19:45 PM",
    "confidence": "high"
  },
  "HOUSE_OVERSIGHT_032435": {
    "date": "2017-01-15",
    "time": null,
    "source": "content_parsed",
    "raw_date": "Sunday, January 15, 2017",
    "confidence": "low"
  },
  "HOUSE_OVERSIGHT_032436": {
    "date": "2017-01-15",
    "time": "13:49:11",
    "source": "email_header",
    "raw_date": "1/15/2017 1:49:11 PM",
    "confidence": "high"
  },
  "HOUSE_OVERSIGHT_032437": {
    "date": "2017-01-15",
    "time": "14:20:36",
    "source": "email_header",
    "raw_date": "1/15/2017 2:20:36 PM",
    "confidence": "high"
  },
  "HOUSE_OVERSIGHT_032439": {
    "date": "2017-01-15",
    "time": "14:27:28",
    "source": "email_header",
    "raw_date": "1/15/2017 2:27:28 PM",
    "confidence": "high"
  },
  "HOUSE_OVERSIGHT_032441": {
    "date": "2017-01-15",
    "time": "14:27:43",
    "source": "email_header",
    "raw_date": "1/15/2017 2:27:43 PM",
    "confidence": "high"
  },
  "HOUSE_OVERSIGHT_032443": {
    "date": "2017-01-22",
    "time": "19:33:34",
    "source": "email_header",
    "raw_date": "1/22/2017 7:33:34 PM",
    "confidence": "high"
  },
  "HOUSE_OVERSIGHT_032444": {
    "date": "2017-01-22",
    "time": "21:49:16",
    "source": "email_header",
    "raw_date": "1/22/2017 9:49:16 PM",
    "confidence": "high"
  },
  "HOUSE_OVERSIGHT_032446": {
    "date": "2017-01-25",
    "time": "19:26:47",
    "source": "email_header",
    "raw_date": "1/25/2017 7:26:47 PM",
    "confidence": "high"
  },
  "HOUSE_OVERSIGHT_032448": {
    "date": "2017-01-31",
    "time": "02:49:24",
    "source": "email_header",
    "raw_date": "1/31/2017 2:49:24 AM",
    "confidence": "high"
  },
  "HOUSE_OVERSIGHT_032449": {
    "date": "2017-02-03",
    "time": "06:02:37",
    "source": "email_header",
    "raw_date": "2/3/2017 6:02:37 AM",
    "confidence": "high"
  },
  "HOUSE_OVERSIGHT_032451": {
    "date": "2017-02-03",
    "time": "10:00:49",
    "source": "email_header",
    "raw_date": "2/3/2017 10:00:49 AM",
    "confidence": "high"
  },
  "HOUSE_OVERSIGHT_032453": {
    "date": "2017-02-03",
    "time": "15:37:10",
    "source": "email_header",
    "raw_date": "2/3/2017 3:37:10 PM",
    "confidence": "high"
  },
  "HOUSE_OVERSIGHT_032455": {
    "date": "2017-02-03",
    "time": "23:47:50",
    "source": "email_header",
    "raw_date": "2/3/2017 11:47:50 PM",
    "confidence": "high"
  },
  "HOUSE_OVERSIGHT_032456": {
    "date": "2017-02-05",
    "time": "00:32:54",
    "source": "email_header",
    "raw_date": "2/5/2017 12:32:54 AM",
    "confidence": "high"
  },
  "HOUSE_OVERSIGHT_032457": {
    "date": "2017-02-08",
    "time": null,
    "source": "content_parsed",
    "raw_date": "2/8/2017",
    "confidence": "low"
  },
  "HOUSE_OVERSIGHT_032458": {
    "date": "2017-02-10",
    "time": "17:40:45",
    "source": "email_header",
    "raw_date": "2/10/2017 5:40:45 PM",
    "confidence": "high"
  },
  "HOUSE_OVERSIGHT_032461": {
    "date": "2017-02-10",
    "time": "18:37:32",
    "source": "email_header",
    "raw_date": "2/10/2017 6:37:32 PM",
    "confidence": "high"
  },
  "HOUSE_OVERSIGHT_032464": {
    "date": "2017-02-15",
    "time": "11:11:40",
    "source": "email_header",
    "raw_date": "2/15/2017 11:11:40 AM",
    "confidence": "high"
  },
  "HOUSE_OVERSIGHT_032467": {
    "date": "2017-02-15",
    "time": "11:49:48",
    "source": "email_header",
    "raw_date": "2/15/2017 11:49:48 AM",
    "confidence": "high"
  },
  "HOUSE_OVERSIGHT_032471": {
    "date": "2017-02-15",
    "time": "13:16:03",
    "source": "email_header",
    "raw_date": "2/15/2017 1:16:03 PM",
    "confidence": "high"
  },
  "HOUSE_OVERSIGHT_032472": {
    "date": "2017-02-15",
    "time": "13:28:39",
    "source": "email_header",
    "raw_date": "2/15/2017 1:28:39 PM",
    "confidence": "high"
  },
  "HOUSE_OVERSIGHT_032474": {
    "date": "2017-02-15",
    "time": "13:31:07",
    "source": "email_header",
    "raw_date": "2/15/2017 1:31:07 PM",
    "confidence": "high"
  },
  "HOUSE_OVERSIGHT_032475": {
    "date": "2017-02-15",
    "time": null,
    "source": "content_parsed",
    "raw_date": "Wed, Feb 15, 2017",
    "confidence": "low"
  },
  "HOUSE_OVERSIGHT_032476": {
    "date": "2017-02-15",
    "time": "13:53:41",
    "source": "email_header",
    "raw_date": "2/15/2017 1:53:41 PM",
    "confidence": "high"
  },
  "HOUSE_OVERSIGHT_032478": {
    "date": "2017-02-15",
    "time": "13:59:28",
    "source": "email_header",
    "raw_date": "2/15/2017 1:59:28 PM",
    "confidence": "high"
  },
  "HOUSE_OVERSIGHT_032480": {
    "date": "2017-02-15",
    "time": "17:54:14",
    "source": "email_header",
    "raw_date": "2/15/2017 5:54:14 PM",
    "confidence": "high"
  },
  "HOUSE_OVERSIGHT_032484": {
    "date": "2017-02-16",
    "time": "00:07:16",
    "source": "email_header",
    "raw_date": "2/16/2017 12:07:16 AM",
    "confidence": "high"
  },
  "HOUSE_OVERSIGHT_032485": {
    "date": "2017-02-16",
    "time": "01:36:00",
    "source": "email_header",
    "raw_date": "2/16/2017 1:36:00 AM",
    "confidence": "high"
  },
  "HOUSE_OVERSIGHT_032486": {
    "date": "2017-02-17",
    "time": "02:34:42",
    "source": "email_header",
    "raw_date": "2/17/2017 2:34:42 AM",
    "confidence": "high"
  },
  "HOUSE_OVERSIGHT_032491": {
    "date": "2017-02-17",
    "time": "19:00:21",
    "source": "email_header",
    "raw_date": "2/17/2017 7:00:21 PM",
    "confidence": "high"
  },
  "HOUSE_OVERSIGHT_032496": {
    "date": "2017-02-17",
    "time": "20:34:47",
    "source": "email_header",
    "raw_date": "2/17/2017 8:34:47 PM",
    "confidence": "high"
  },
  "HOUSE_OVERSIGHT_032502": {
    "date": "2017-02-19",
    "time": "00:01:21",
    "source": "email_header",
    "raw_date": "2/19/2017 12:01:21 AM",
    "confidence": "high"
  },
  "HOUSE_OVERSIGHT_032503": {
    "date": "2017-02-19",
    "time": "07:54:56",
    "source": "email_header",
    "raw_date": "2/19/2017 7:54:56 AM",
    "confidence": "high"
  },
  "HOUSE_OVERSIGHT_032504": {
    "date": "2017-02-19",
    "time": "21:11:12",
    "source": "email_header",
    "raw_date": "2/19/2017 9:11:12 PM",
    "confidence": "high"
  },
  "HOUSE_OVERSIGHT_032506": {
    "date": "2017-03-03",
    "time": "14:57:50",
    "source": "email_header",
    "raw_date": "3/3/2017 2:57:50 PM",
    "confidence": "high"
  },
  "HOUSE_OVERSIGHT_032507": {
    "date": "2017-03-03",
    "time": "16:26:03",
    "source": "email_header",
    "raw_date": "3/3/2017 4:26:03 PM",
    "confidence": "high"
  },
  "HOUSE_OVERSIGHT_032509": {
    "date": "2017-03-03",
    "time": "16:34:07",
    "source": "email_header",
    "raw_date": "3/3/2017 4:34:07 PM",
    "confidence": "high"
  },
  "HOUSE_OVERSIGHT_032511": {
    "date": "2017-03-05",
    "time": "15:52:39",
    "source": "email_header",
    "raw_date": "3/5/2017 3:52:39 PM",
    "confidence": "high"
  },
  "HOUSE_OVERSIGHT_032512": {
    "date": "2017-03-05",
    "time": "16:21:06",
    "source": "email_header",
    "raw_date": "3/5/2017 4:21:06 PM",
    "confidence": "high"
  },
  "HOUSE_OVERSIGHT_032513": {
    "date": "2017-03-06",
    "time": "05:54:42",
    "source": "email_header",
    "raw_date": "3/6/2017 5:54:42 AM",
    "confidence": "high"
  },
  "HOUSE_OVERSIGHT_032517": {
    "date": "2017-03-09",
    "time": "15:21:50",
    "source": "email_header",
    "raw_date": "3/9/2017 3:21:50 PM",
    "confidence": "high"
  },
  "HOUSE_OVERSIGHT_032518": {
    "date": "2017-03-09",
    "time": null,
    "source": "content_parsed",
    "raw_date": "3/9/2017",
    "confidence": "low"
  },
  "HOUSE_OVERSIGHT_032519": {
    "date": "2017-03-22",
    "time": null,
    "source": "content_parsed",
    "raw_date": "3/22/2017",
    "confidence": "low"
  },
  "HOUSE_OVERSIGHT_032520": {
    "date": "2017-03-22",
    "time": null,
    "source": "content_parsed",
    "raw_date": "3/22/2017",
    "confidence": "low"
  },
  "HOUSE_OVERSIGHT_032522": {
    "date": "2017-03-22",
    "time": "12:27:48",
    "source": "email_header",
    "raw_date": "3/22/2017 12:27:48 PM",
    "confidence": "high"
  },
  "HOUSE_OVERSIGHT_032524": {
    "date": "2017-04-10",
    "time": "09:29:36",
    "source": "email_header",
    "raw_date": "4/10/2017 9:29:36 AM",
    "confidence": "high"
  },
  "HOUSE_OVERSIGHT_032525": {
    "date": "2017-04-16",
    "time": "15:57:41",
    "source": "email_header",
    "raw_date": "4/16/2017 3:57:41 PM",
    "confidence": "high"
  },
  "HOUSE_OVERSIGHT_032526": {
    "date": "2017-04-16",
    "time": "16:12:22",
    "source": "email_header",
    "raw_date": "4/16/2017 4:12:22 PM",
    "confidence": "high"
  },
  "HOUSE_OVERSIGHT_032527": {
    "date": "2017-04-29",
    "time": "18:56:25",
    "source": "email_header",
    "raw_date": "4/29/2017 6:56:25 PM",
    "confidence": "high"
  },
  "HOUSE_OVERSIGHT_032529": {
    "date": "2017-05-06",
    "time": "19:02:25",
    "source": "email_header",
    "raw_date": "5/6/2017 7:02:25 PM",
    "confidence": "high"
  },
  "HOUSE_OVERSIGHT_032530": {
    "date": "2017-05-08",
    "time": "14:43:37",
    "source": "email_header",
    "raw_date": "5/8/2017 2:43:37 PM",
    "confidence": "high"
  },
  "HOUSE_OVERSIGHT_032531": {
    "date": "2017-05-08",
    "time": "15:26:51",
    "source": "email_header",
    "raw_date": "5/8/2017 3:26:51 PM",
    "confidence": "high"
  },
  "HOUSE_OVERSIGHT_032532": {
    "date": "2017-05-08",
    "time": "15:29:13",
    "source": "email_header",
    "raw_date": "5/8/2017 3:29:13 PM",
    "confidence": "high"
  },
  "HOUSE_OVERSIGHT_032534": {
    "date": "2017-05-08",
    "time": "15:30:17",
    "source": "email_header",
    "raw_date": "5/8/2017 3:30:17 PM",
    "confidence": "high"
  },
  "HOUSE_OVERSIGHT_032536": {
    "date": "2017-05-08",
    "time": "15:34:45",
    "source": "email_header",
    "raw_date": "5/8/2017 3:34:45 PM",
    "confidence": "high"
  },
  "HOUSE_OVERSIGHT_032538": {
    "date": "2017-05-08",
    "time": "15:38:08",
    "source": "email_header",
    "raw_date": "5/8/2017 3:38:08 PM",
    "confidence": "high"
  },
  "HOUSE_OVERSIGHT_032541": {
    "date": "2017-05-09",
    "time": "03:39:07",
    "source": "email_header",
    "raw_date": "5/9/2017 3:39:07 AM",
    "confidence": "high"
  },
  "HOUSE_OVERSIGHT_032542": {
    "date": "2017-05-14",
    "time": "19:17:04",
    "source": "email_header",
    "raw_date": "5/14/2017 7:17:04 PM",
    "confidence": "high"
  },
  "HOUSE_OVERSIGHT_032543": {
    "date": "2017-05-21",
    "time": null,
    "source": "content_parsed",
    "raw_date": "5/21/2017",
    "confidence": "low"
  },
  "HOUSE_OVERSIGHT_032544": {
    "date": "2017-05-30",
    "time": "19:57:20",
    "source": "email_header",
    "raw_date": "5/30/2017 7:57:20 PM",
    "confidence": "high"
  },
  "HOUSE_OVERSIGHT_032546": {
    "date": "2017-05-30",
    "time": "23:56:59",
    "source": "email_header",
    "raw_date": "5/30/2017 11:56:59 PM",
    "confidence": "high"
  },
  "HOUSE_OVERSIGHT_032547": {
    "date": "2017-06-13",
    "time": "01:25:21",
    "source": "email_header",
    "raw_date": "6/13/2017 1:25:21 AM",
    "confidence": "high"
  },
  "HOUSE_OVERSIGHT_032550": {
    "date": "2017-07-08",
    "time": "14:55:06",
    "source": "email_header",
    "raw_date": "7/8/2017 2:55:06 PM",
    "confidence": "high"
  },
  "HOUSE_OVERSIGHT_032551": {
    "date": "2017-07-10",
    "time": "07:29:37",
    "source": "email_header",
    "raw_date": "7/10/2017 7:29:37 AM",
    "confidence": "high"
  },
  "HOUSE_OVERSIGHT_032552": {
    "date": "2017-07-21",
    "time": "00:03:20",
    "source": "email_header",
    "raw_date": "7/21/2017 12:03:20 AM",
    "confidence": "high"
  },
  "HOUSE_OVERSIGHT_032553": {
    "date": "2017-07-21",
    "time": "12:06:24",
    "source": "email_header",
    "raw_date": "7/21/2017 12:06:24 PM",
    "confidence": "high"
  },
  "HOUSE_OVERSIGHT_032554": {
    "date": "2017-07-22",
    "time": "17:25:55",
    "source": "email_header",
    "raw_date": "7/22/2017 5:25:55 PM",
    "confidence": "high"
  },
  "HOUSE_OVERSIGHT_032555": {
    "date": "2017-07-22",
    "time": "19:29:28",
    "source": "email_header",
    "raw_date": "7/22/2017 7:29:28 PM",
    "confidence": "high"
  },
  "HOUSE_OVERSIGHT_032556": {
    "date": "2017-07-26",
    "time": "01:51:06",
    "source": "email_header",
    "raw_date": "7/26/2017 1:51:06 AM",
    "confidence": "high"
  },
  "HOUSE_OVERSIGHT_032558": {
    "date": "2017-07-26",
    "time": "15:08:07",
    "source": "email_header",
    "raw_date": "7/26/2017 3:08:07 PM",
    "confidence": "high"
  },
  "HOUSE_OVERSIGHT_032560": {
    "date": "2017-07-31",
    "time": "15:56:48",
    "source": "email_header",
    "raw_date": "7/31/2017 3:56:48 PM",
    "confidence": "high"
  },
  "HOUSE_OVERSIGHT_032562": {
    "date": "2017-08-09",
    "time": "22:37:05",
    "source": "email_header",
    "raw_date": "8/9/2017 10:37:05 PM",
    "confidence": "high"
  },
  "HOUSE_OVERSIGHT_032563": {
    "date": "2017-08-24",
    "time": "05:22:16",
    "source": "email_header",
    "raw_date": "8/24/2017 5:22:16 AM",
    "confidence": "high"
  },
  "HOUSE_OVERSIGHT_032564": {
    "date": "2017-08-24",
    "time": "22:38:21",
    "source": "email_header",
    "raw_date": "8/24/2017 10:38:21 PM",
    "confidence": "high"
  },
  "HOUSE_OVERSIGHT_032565": {
    "date": "2017-08-25",
    "time": "06:56:49",
    "source": "email_header",
    "raw_date": "8/25/2017 6:56:49 AM",
    "confidence": "high"
  },
  "HOUSE_OVERSIGHT_032567": {
    "date": "2017-08-25",
    "time": "10:15:52",
    "source": "email_header",
    "raw_date": "8/25/2017 10:15:52 AM",
    "confidence": "high"
  },
  "HOUSE_OVERSIGHT_032570": {
    "date": "2017-09-03",
    "time": "16:27:45",
    "source": "email_header",
    "raw_date": "9/3/2017 4:27:45 PM",
    "confidence": "high"
  },
  "HOUSE_OVERSIGHT_032571": {
    "date": "2017-09-08",
    "time": "10:24:06",
    "source": "email_header",
    "raw_date": "9/8/2017 10:24:06 AM",
    "confidence": "high"
  },
  "HOUSE_OVERSIGHT_032573": {
    "date": "2017-09-08",
    "time": "10:26:00",
    "source": "email_header",
    "raw_date": "9/8/2017 10:26:00 AM",
    "confidence": "high"
  },
  "HOUSE_OVERSIGHT_032575": {
    "date": "2017-09-08",
    "time": null,
    "source": "content_parsed",
    "raw_date": "Fri, Sep 8, 2017",
    "confidence": "low"
  },
  "HOUSE_OVERSIGHT_032577": {
    "date": "2017-09-08",
    "time": "13:29:56",
    "source": "email_header",
    "raw_date": "9/8/2017 1:29:56 PM",
    "confidence": "high"
  },
  "HOUSE_OVERSIGHT_032579": {
    "date": "2017-09-08",
    "time": "21:48:25",
    "source": "email_header",
    "raw_date": "9/8/2017 9:48:25 PM",
    "confidence": "high"
  },
  "HOUSE_OVERSIGHT_032581": {
    "date": "2017-09-09",
    "time": "02:46:08",
    "source": "email_header",
    "raw_date": "9/9/2017 2:46:08 AM",
    "confidence": "high"
  },
  "HOUSE_OVERSIGHT_032582": {
    "date": "2017-09-09",
    "time": "03:31:28",
    "source": "email_header",
    "raw_date": "9/9/2017 3:31:28 AM",
    "confidence": "high"
  },
  "HOUSE_OVERSIGHT_032585": {
    "date": "2017-09-09",
    "time": "15:40:30",
    "source": "email_header",
    "raw_date": "9/9/2017 3:40:30 PM",
    "confidence": "high"
  },
  "HOUSE_OVERSIGHT_032588": {
    "date": "2017-09-09",
    "time": null,
    "source": "content_parsed",
    "raw_date": "Sat, Sep 9, 2017",
    "confidence": "low"
  },
  "HOUSE_OVERSIGHT_032591": {
    "date": "2017-09-09",
    "time": null,
    "source": "content_parsed",
    "raw_date": "Sat, Sep 9, 2017",
    "confidence": "low"
  },
  "HOUSE_OVERSIGHT_032595": {
    "date": "2017-09-09",
    "time": "16:42:31",
    "source": "email_header",
    "raw_date": "9/9/2017 4:42:31 PM",
    "confidence": "high"
  },
  "HOUSE_OVERSIGHT_032599": {
    "date": "2017-09-09",
    "time": "17:26:47",
    "source": "email_header",
    "raw_date": "9/9/2017 5:26:47 PM",
    "confidence": "high"
  },
  "HOUSE_OVERSIGHT_032604": {
    "date": "2017-09-09",
    "time": "23:39:24",
    "source": "email_header",
    "raw_date": "9/9/2017 11:39:24 PM",
    "confidence": "high"
  },
  "HOUSE_OVERSIGHT_032605": {
    "date": "2017-09-11",
    "time": "18:33:39",
    "source": "email_header",
    "raw_date": "9/11/2017 6:33:39 PM",
    "confidence": "high"
  },
  "HOUSE_OVERSIGHT_032606": {
    "date": "2017-09-11",
    "time": "18:51:05",
    "source": "email_header",
    "raw_date": "9/11/2017 6:51:05 PM",
    "confidence": "high"
  },
  "HOUSE_OVERSIGHT_032607": {
    "date": "2017-09-11",
    "time": null,
    "source": "content_parsed",
    "raw_date": "Mon, Sep 11, 2017",
    "confidence": "low"
  },
  "HOUSE_OVERSIGHT_032609": {
    "date": "2017-09-11",
    "time": null,
    "source": "content_parsed",
    "raw_date": "Mon, Sep 11, 2017",
    "confidence": "low"
  },
  "HOUSE_OVERSIGHT_032611": {
    "date": "2017-09-09",
    "time": null,
    "source": "content_parsed",
    "raw_date": "Sat, Sep 9, 2017",
    "confidence": "low"
  },
  "HOUSE_OVERSIGHT_032616": {
    "date": "2017-09-13",
    "time": null,
    "source": "content_parsed",
    "raw_date": "Wed, Sep 13, 2017",
    "confidence": "low"
  },
  "HOUSE_OVERSIGHT_032622": {
    "date": "2017-09-13",
    "time": "23:59:38",
    "source": "email_header",
    "raw_date": "9/13/2017 11:59:38 PM",
    "confidence": "high"
  },
  "HOUSE_OVERSIGHT_032628": {
    "date": "2017-09-20",
    "time": "21:57:25",
    "source": "email_header",
    "raw_date": "9/20/2017 9:57:25 PM",
    "confidence": "high"
  },
  "HOUSE_OVERSIGHT_032629": {
    "date": "2017-09-20",
    "time": "22:26:34",
    "source": "email_header",
    "raw_date": "9/20/2017 10:26:34 PM",
    "confidence": "high"
  },
  "HOUSE_OVERSIGHT_032631": {
    "date": "2017-09-20",
    "time": null,
    "source": "content_parsed",
    "raw_date": "Wed, Sep 20, 2017",
    "confidence": "low"
  },
  "HOUSE_OVERSIGHT_032633": {
    "date": "2017-09-27",
    "time": "14:47:47",
    "source": "email_header",
    "raw_date": "9/27/2017 2:47:47 PM",
    "confidence": "high"
  },
  "HOUSE_OVERSIGHT_032634": {
    "date": "2017-09-30",
    "time": "17:43:18",
    "source": "email_header",
    "raw_date": "9/30/2017 5:43:18 PM",
    "confidence": "high"
  },
  "HOUSE_OVERSIGHT_032635": {
    "date": "2017-10-15",
    "time": "11:45:57",
    "source": "email_header",
    "raw_date": "10/15/2017 11:45:57 AM",
    "confidence": "high"
  },
  "HOUSE_OVERSIGHT_032636": {
    "date": "2017-10-15",
    "time": "16:11:25",
    "source": "email_header",
    "raw_date": "10/15/2017 4:11:25 PM",
    "confidence": "high"
  },
  "HOUSE_OVERSIGHT_032637": {
    "date": "2017-11-06",
    "time": null,
    "source": "content_parsed",
    "raw_date": "11/6/2017",
    "confidence": "low"
  },
  "HOUSE_OVERSIGHT_032638": {
    "date": "2017-11-06",
    "time": null,
    "source": "metadata",
    "raw_date": "11/06/2017",
    "confidence": "medium"
  },
  "HOUSE_OVERSIGHT_032643": {
    "date": "2017-11-06",
    "time": "21:07:51",
    "source": "email_header",
    "raw_date": "11/6/2017 9:07:51 PM",
    "confidence": "high"
  },
  "HOUSE_OVERSIGHT_032647": {
    "date": "2017-11-16",
    "time": "22:27:22",
    "source": "email_header",
    "raw_date": "11/16/2017 10:27:22 PM",
    "confidence": "high"
  },
  "HOUSE_OVERSIGHT_032648": {
    "date": "2017-11-16",
    "time": "23:59:01",
    "source": "email_header",
    "raw_date": "11/16/2017 11:59:01 PM",
    "confidence": "high"
  },
  "HOUSE_OVERSIGHT_032650": {
    "date": "2017-11-17",
    "time": "11:48:52",
    "source": "email_header",
    "raw_date": "11/17/2017 11:48:52 AM",
    "confidence": "high"
  },
  "HOUSE_OVERSIGHT_032652": {
    "date": "2017-11-17",
    "time": "11:56:42",
    "source": "email_header",
    "raw_date": "11/17/2017 11:56:42 AM",
    "confidence": "high"
  },
  "HOUSE_OVERSIGHT_032654": {
    "date": "2017-11-17",
    "time": "12:17:02",
    "source": "email_header",
    "raw_date": "11/17/2017 12:17:02 PM",
    "confidence": "high"
  },
  "HOUSE_OVERSIGHT_032657": {
    "date": "2017-11-17",
    "time": "18:34:33",
    "source": "email_header",
    "raw_date": "11/17/2017 6:34:33 PM",
    "confidence": "high"
  },
  "HOUSE_OVERSIGHT_032659": {
    "date": "2017-12-02",
    "time": null,
    "source": "content_parsed",
    "raw_date": "12/2/2017",
    "confidence": "low"
  },
  "HOUSE_OVERSIGHT_032660": {
    "date": "2017-12-08",
    "time": null,
    "source": "content_parsed",
    "raw_date": "Fri, Dec 8, 2017",
    "confidence": "low"
  },
  "HOUSE_OVERSIGHT_032663": {
    "date": "2017-12-09",
    "time": "07:00:51",
    "source": "email_header",
    "raw_date": "12/9/2017 7:00:51 AM",
    "confidence": "high"
  },
  "HOUSE_OVERSIGHT_032667": {
    "date": "2017-12-09",
    "time": null,
    "source": "content_parsed",
    "raw_date": "Sat, Dec 9, 2017",
    "confidence": "low"
  },
  "HOUSE_OVERSIGHT_032671": {
    "date": "2017-12-11",
    "time": "15:43:25",
    "source": "email_header",
    "raw_date": "12/11/2017 3:43:25 PM",
    "confidence": "high"
  },
  "HOUSE_OVERSIGHT_032672": {
    "date": "2017-12-22",
    "time": "10:53:41",
    "source": "email_header",
    "raw_date": "12/22/2017 10:53:41 AM",
    "confidence": "high"
  },
  "HOUSE_OVERSIGHT_032676": {
    "date": "2017-12-22",
    "time": "12:03:30",
    "source": "email_header",
    "raw_date": "12/22/2017 12:03:30 PM",
    "confidence": "high"
  },
  "HOUSE_OVERSIGHT_032681": {
    "date": "2017-12-24",
    "time": "14:21:03",
    "source": "email_header",
    "raw_date": "12/24/2017 2:21:03 PM",
    "confidence": "high"
  },
  "HOUSE_OVERSIGHT_032682": {
    "date": "2017-12-25",
    "time": "18:02:01",
    "source": "email_header",
    "raw_date": "12/25/2017 6:02:01 PM",
    "confidence": "high"
  },
  "HOUSE_OVERSIGHT_032687": {
    "date": "2018-01-03",
    "time": "18:08:17",
    "source": "email_header",
    "raw_date": "1/3/2018 6:08:17 PM",
    "confidence": "high"
  },
  "HOUSE_OVERSIGHT_032688": {
    "date": "2018-01-03",
    "time": "18:11:02",
    "source": "email_header",
    "raw_date": "1/3/2018 6:11:02 PM",
    "confidence": "high"
  },
  "HOUSE_OVERSIGHT_032689": {
    "date": "2018-01-03",
    "time": "18:55:08",
    "source": "email_header",
    "raw_date": "1/3/2018 6:55:08 PM",
    "confidence": "high"
  },
  "HOUSE_OVERSIGHT_032690": {
    "date": "2018-01-03",
    "time": "19:01:08",
    "source": "email_header",
    "raw_date": "1/3/2018 7:01:08 PM",
    "confidence": "high"
  },
  "HOUSE_OVERSIGHT_032692": {
    "date": "2018-01-03",
    "time": "19:12:17",
    "source": "email_header",
    "raw_date": "1/3/2018 7:12:17 PM",
    "confidence": "high"
  },
  "HOUSE_OVERSIGHT_032694": {
    "date": "2018-01-03",
    "time": "19:17:38",
    "source": "email_header",
    "raw_date": "1/3/2018 7:17:38 PM",
    "confidence": "high"
  },
  "HOUSE_OVERSIGHT_032697": {
    "date": "2018-01-04",
    "time": "00:24:49",
    "source": "email_header",
    "raw_date": "1/4/2018 12:24:49 AM",
    "confidence": "high"
  },
  "HOUSE_OVERSIGHT_032699": {
    "date": "2018-01-04",
    "time": "13:49:20",
    "source": "email_header",
    "raw_date": "1/4/2018 1:49:20 PM",
    "confidence": "high"
  },
  "HOUSE_OVERSIGHT_032702": {
    "date": "2018-01-04",
    "time": null,
    "source": "content_parsed",
    "raw_date": "1/4/2018",
    "confidence": "low"
  },
  "HOUSE_OVERSIGHT_032703": {
    "date": "2018-01-04",
    "time": "15:37:00",
    "source": "email_header",
    "raw_date": "1/4/2018 3:37:00 PM",
    "confidence": "high"
  },
  "HOUSE_OVERSIGHT_032706": {
    "date": "2018-01-04",
    "time": "15:55:56",
    "source": "email_header",
    "raw_date": "1/4/2018 3:55:56 PM",
    "confidence": "high"
  },
  "HOUSE_OVERSIGHT_032707": {
    "date": "2018-01-04",
    "time": "18:10:55",
    "source": "email_header",
    "raw_date": "1/4/2018 6:10:55 PM",
    "confidence": "high"
  },
  "HOUSE_OVERSIGHT_032708": {
    "date": "2018-01-05",
    "time": "11:04:21",
    "source": "email_header",
    "raw_date": "1/5/2018 11:04:21 AM",
    "confidence": "high"
  },
  "HOUSE_OVERSIGHT_032709": {
    "date": "2018-01-08",
    "time": "00:46:27",
    "source": "email_header",
    "raw_date": "1/8/2018 12:46:27 AM",
    "confidence": "high"
  },
  "HOUSE_OVERSIGHT_032710": {
    "date": "2018-01-08",
    "time": "06:27:13",
    "source": "email_header",
    "raw_date": "1/8/2018 6:27:13 AM",
    "confidence": "high"
  },
  "HOUSE_OVERSIGHT_032711": {
    "date": "2018-01-08",
    "time": "10:57:20",
    "source": "email_header",
    "raw_date": "1/8/2018 10:57:20 AM",
    "confidence": "high"
  },
  "HOUSE_OVERSIGHT_032712": {
    "date": "2018-01-08",
    "time": "17:11:15",
    "source": "email_header",
    "raw_date": "1/8/2018 5:11:15 PM",
    "confidence": "high"
  },
  "HOUSE_OVERSIGHT_032713": {
    "date": null,
    "time": null,
    "source": "unknown",
    "raw_date": null,
    "confidence": "none"
  },
  "HOUSE_OVERSIGHT_032714": {
    "date": "2018-01-10",
    "time": "07:29:10",
    "source": "email_header",
    "raw_date": "1/10/2018 7:29:10 AM",
    "confidence": "high"
  },
  "HOUSE_OVERSIGHT_032716": {
    "date": "2018-01-14",
    "time": null,
    "source": "content_parsed",
    "raw_date": "Sun, Jan 14, 2018",
    "confidence": "low"
  },
  "HOUSE_OVERSIGHT_032719": {
    "date": "2018-01-15",
    "time": "15:05:52",
    "source": "email_header",
    "raw_date": "1/15/2018 3:05:52 PM",
    "confidence": "high"
  },
  "HOUSE_OVERSIGHT_032720": {
    "date": "2018-01-16",
    "time": "19:35:34",
    "source": "email_header",
    "raw_date": "1/16/2018 7:35:34 PM",
    "confidence": "high"
  },
  "HOUSE_OVERSIGHT_032722": {
    "date": "2018-01-16",
    "time": "20:36:01",
    "source": "email_header",
    "raw_date": "1/16/2018 8:36:01 PM",
    "confidence": "high"
  },
  "HOUSE_OVERSIGHT_032724": {
    "date": null,
    "time": null,
    "source": "unknown",
    "raw_date": null,
    "confidence": "none"
  },
  "HOUSE_OVERSIGHT_032725": {
    "date": "2018-01-29",
    "time": "02:39:14",
    "source": "email_header",
    "raw_date": "1/29/2018 2:39:14 AM",
    "confidence": "high"
  },
  "HOUSE_OVERSIGHT_032727": {
    "date": "2018-02-13",
    "time": "14:16:57",
    "source": "email_header",
    "raw_date": "2/13/2018 2:16:57 PM",
    "confidence": "high"
  },
  "HOUSE_OVERSIGHT_032728": {
    "date": "2018-03-02",
    "time": "10:58:05",
    "source": "email_header",
    "raw_date": "3/2/2018 10:58:05 AM",
    "confidence": "high"
  },
  "HOUSE_OVERSIGHT_032729": {
    "date": "2018-03-04",
    "time": "10:29:59",
    "source": "email_header",
    "raw_date": "3/4/2018 10:29:59 AM",
    "confidence": "high"
  },
  "HOUSE_OVERSIGHT_032730": {
    "date": "2018-03-04",
    "time": "14:26:09",
    "source": "email_header",
    "raw_date": "3/4/2018 2:26:09 PM",
    "confidence": "high"
  },
  "HOUSE_OVERSIGHT_032731": {
    "date": "2018-03-07",
    "time": "09:51:44",
    "source": "email_header",
    "raw_date": "3/7/2018 9:51:44 AM",
    "confidence": "high"
  },
  "HOUSE_OVERSIGHT_032732": {
    "date": "2018-03-18",
    "time": "14:00:32",
    "source": "email_header",
    "raw_date": "3/18/2018 2:00:32 PM",
    "confidence": "high"
  },
  "HOUSE_OVERSIGHT_032733": {
    "date": "2018-03-20",
    "time": "18:44:20",
    "source": "email_header",
    "raw_date": "3/20/2018 6:44:20 PM",
    "confidence": "high"
  },
  "HOUSE_OVERSIGHT_032735": {
    "date": "2018-03-22",
    "time": null,
    "source": "metadata",
    "raw_date": "03/22/2018",
    "confidence": "medium"
  },
  "HOUSE_OVERSIGHT_032736": {
    "date": "2018-03-24",
    "time": "12:19:49",
    "source": "email_header",
    "raw_date": "3/24/2018 12:19:49 PM",
    "confidence": "high"
  },
  "HOUSE_OVERSIGHT_032737": {
    "date": "2018-03-24",
    "time": "15:10:06",
    "source": "email_header",
    "raw_date": "3/24/2018 3:10:06 PM",
    "confidence": "high"
  },
  "HOUSE_OVERSIGHT_032739": {
    "date": "2018-03-24",
    "time": "15:19:05",
    "source": "email_header",
    "raw_date": "3/24/2018 3:19:05 PM",
    "confidence": "high"
  },
  "HOUSE_OVERSIGHT_032741": {
    "date": "2018-03-24",
    "time": "15:33:51",
    "source": "email_header",
    "raw_date": "3/24/2018 3:33:51 PM",
    "confidence": "high"
  },
  "HOUSE_OVERSIGHT_032744": {
    "date": "2018-03-24",
    "time": "18:40:48",
    "source": "email_header",
    "raw_date": "3/24/2018 6:40:48 PM",
    "confidence": "high"
  },
  "HOUSE_OVERSIGHT_032745": {
    "date": "2018-03-24",
    "time": "21:14:48",
    "source": "email_header",
    "raw_date": "3/24/2018 9:14:48 PM",
    "confidence": "high"
  },
  "HOUSE_OVERSIGHT_032748": {
    "date": "2018-03-24",
    "time": "21:30:01",
    "source": "email_header",
    "raw_date": "3/24/2018 9:30:01 PM",
    "confidence": "high"
  },
  "HOUSE_OVERSIGHT_032752": {
    "date": "2018-03-25",
    "time": "10:54:31",
    "source": "email_header",
    "raw_date": "3/25/2018 10:54:31 AM",
    "confidence": "high"
  },
  "HOUSE_OVERSIGHT_032756": {
    "date": "2018-03-25",
    "time": "13:50:02",
    "source": "email_header",
    "raw_date": "3/25/2018 1:50:02 PM",
    "confidence": "high"
  },
  "HOUSE_OVERSIGHT_032760": {
    "date": "2018-03-24",
    "time": null,
    "source": "content_parsed",
    "raw_date": "Sat, Mar 24, 2018",
    "confidence": "low"
  },
  "HOUSE_OVERSIGHT_032762": {
    "date": "2018-03-25",
    "time": "17:38:17",
    "source": "email_header",
    "raw_date": "3/25/2018 5:38:17 PM",
    "confidence": "high"
  },
  "HOUSE_OVERSIGHT_032764": {
    "date": "2018-04-10",
    "time": "13:20:04",
    "source": "email_header",
    "raw_date": "4/10/2018 1:20:04 PM",
    "confidence": "high"
  },
  "HOUSE_OVERSIGHT_032765": {
    "date": "2018-04-10",
    "time": "13:53:55",
    "source": "email_header",
    "raw_date": "4/10/2018 1:53:55 PM",
    "confidence": "high"
  },
  "HOUSE_OVERSIGHT_032766": {
    "date": "2018-04-10",
    "time": "14:18:34",
    "source": "email_header",
    "raw_date": "4/10/2018 2:18:34 PM",
    "confidence": "high"
  },
  "HOUSE_OVERSIGHT_032767": {
    "date": "2018-04-10",
    "time": "16:43:07",
    "source": "email_header",
    "raw_date": "4/10/2018 4:43:07 PM",
    "confidence": "high"
  },
  "HOUSE_OVERSIGHT_032768": {
    "date": "2018-04-10",
    "time": "21:20:41",
    "source": "email_header",
    "raw_date": "4/10/2018 9:20:41 PM",
    "confidence": "high"
  },
  "HOUSE_OVERSIGHT_032769": {
    "date": "2018-04-14",
    "time": null,
    "source": "content_parsed",
    "raw_date": "4/14/2018",
    "confidence": "low"
  },
  "HOUSE_OVERSIGHT_032770": {
    "date": "2018-04-15",
    "time": "00:33:37",
    "source": "email_header",
    "raw_date": "4/15/2018 12:33:37 AM",
    "confidence": "high"
  },
  "HOUSE_OVERSIGHT_032771": {
    "date": "2018-04-17",
    "time": "18:31:49",
    "source": "email_header",
    "raw_date": "4/17/2018 6:31:49 PM",
    "confidence": "high"
  },
  "HOUSE_OVERSIGHT_032773": {
    "date": "2018-05-05",
    "time": "22:38:16",
    "source": "email_header",
    "raw_date": "5/5/2018 10:38:16 PM",
    "confidence": "high"
  },
  "HOUSE_OVERSIGHT_032774": {
    "date": "2018-05-19",
    "time": "20:25:18",
    "source": "email_header",
    "raw_date": "5/19/2018 8:25:18 PM",
    "confidence": "high"
  },
  "HOUSE_OVERSIGHT_032775": {
    "date": "2018-06-22",
    "time": "14:42:02",
    "source": "email_header",
    "raw_date": "6/22/2018 2:42:02 PM",
    "confidence": "high"
  },
  "HOUSE_OVERSIGHT_032776": {
    "date": "2018-06-22",
    "time": "14:59:06",
    "source": "email_header",
    "raw_date": "6/22/2018 2:59:06 PM",
    "confidence": "high"
  },
  "HOUSE_OVERSIGHT_032777": {
    "date": "2018-06-22",
    "time": "15:13:33",
    "source": "email_header",
    "raw_date": "6/22/2018 3:13:33 PM",
    "confidence": "high"
  },
  "HOUSE_OVERSIGHT_032778": {
    "date": "2018-06-22",
    "time": "15:17:02",
    "source": "email_header",
    "raw_date": "6/22/2018 3:17:02 PM",
    "confidence": "high"
  },
  "HOUSE_OVERSIGHT_032779": {
    "date": "2018-07-09",
    "time": "19:48:10",
    "source": "email_header",
    "raw_date": "7/9/2018 7:48:10 PM",
    "confidence": "high"
  },
  "HOUSE_OVERSIGHT_032780": {
    "date": "2018-07-15",
    "time": null,
    "source": "content_parsed",
    "raw_date": "Sun, Jul 15, 2018",
    "confidence": "low"
  },
  "HOUSE_OVERSIGHT_032782": {
    "date": "2018-07-17",
    "time": "12:01:00",
    "source": "email_header",
    "raw_date": "7/17/2018 12:01:00 PM",
    "confidence": "high"
  },
  "HOUSE_OVERSIGHT_032785": {
    "date": "2018-07-17",
    "time": null,
    "source": "content_parsed",
    "raw_date": "Tue, Jul 17, 2018",
    "confidence": "low"
  },
  "HOUSE_OVERSIGHT_032788": {
    "date": "2018-07-17",
    "time": null,
    "source": "content_parsed",
    "raw_date": "Tue, Jul 17, 2018",
    "confidence": "low"
  },
  "HOUSE_OVERSIGHT_032792": {
    "date": "2018-07-24",
    "time": "19:57:33",
    "source": "email_header",
    "raw_date": "7/24/2018 7:57:33 PM",
    "confidence": "high"
  },
  "HOUSE_OVERSIGHT_032793": {
    "date": "2018-07-24",
    "time": "20:13:58",
    "source": "email_header",
    "raw_date": "7/24/2018 8:13:58 PM",
    "confidence": "high"
  },
  "HOUSE_OVERSIGHT_032795": {
    "date": "2018-08-21",
    "time": "22:34:55",
    "source": "email_header",
    "raw_date": "8/21/2018 10:34:55 PM",
    "confidence": "high"
  },
  "HOUSE_OVERSIGHT_032796": {
    "date": "2018-08-21",
    "time": "23:32:09",
    "source": "email_header",
    "raw_date": "8/21/2018 11:32:09 PM",
    "confidence": "high"
  },
  "HOUSE_OVERSIGHT_032798": {
    "date": "2018-08-22",
    "time": "15:30:53",
    "source": "email_header",
    "raw_date": "8/22/2018 3:30:53 PM",
    "confidence": "high"
  },
  "HOUSE_OVERSIGHT_032800": {
    "date": "2018-08-22",
    "time": "16:16:57",
    "source": "email_header",
    "raw_date": "8/22/2018 4:16:57 PM",
    "confidence": "high"
  },
  "HOUSE_OVERSIGHT_032801": {
    "date": "2018-08-29",
    "time": "16:19:56",
    "source": "email_header",
    "raw_date": "8/29/2018 4:19:56 PM",
    "confidence": "high"
  },
  "HOUSE_OVERSIGHT_032802": {
    "date": "2018-08-29",
    "time": "16:27:35",
    "source": "email_header",
    "raw_date": "8/29/2018 4:27:35 PM",
    "confidence": "high"
  },
  "HOUSE_OVERSIGHT_032803": {
    "date": "2018-09-04",
    "time": "00:46:09",
    "source": "email_header",
    "raw_date": "9/4/2018 12:46:09 AM",
    "confidence": "high"
  },
  "HOUSE_OVERSIGHT_032804": {
    "date": "2018-09-04",
    "time": "00:50:33",
    "source": "email_header",
    "raw_date": "9/4/2018 12:50:33 AM",
    "confidence": "high"
  },
  "HOUSE_OVERSIGHT_032806": {
    "date": "2018-09-17",
    "time": "18:35:55",
    "source": "email_header",
    "raw_date": "9/17/2018 6:35:55 PM",
    "confidence": "high"
  },
  "HOUSE_OVERSIGHT_032811": {
    "date": "2018-09-19",
    "time": "14:56:08",
    "source": "email_header",
    "raw_date": "9/19/2018 2:56:08 PM",
    "confidence": "high"
  },
  "HOUSE_OVERSIGHT_032812": {
    "date": "2018-09-20",
    "time": "17:43:37",
    "source": "email_header",
    "raw_date": "9/20/2018 5:43:37 PM",
    "confidence": "high"
  },
  "HOUSE_OVERSIGHT_032813": {
    "date": "2018-10-03",
    "time": "01:58:44",
    "source": "email_header",
    "raw_date": "10/3/2018 1:58:44 AM",
    "confidence": "high"
  },
  "HOUSE_OVERSIGHT_032814": {
    "date": "2018-10-03",
    "time": "11:21:41",
    "source": "email_header",
    "raw_date": "10/3/2018 11:21:41 AM",
    "confidence": "high"
  },
  "HOUSE_OVERSIGHT_032816": {
    "date": "2018-10-03",
    "time": "13:02:13",
    "source": "email_header",
    "raw_date": "10/3/2018 1:02:13 PM",
    "confidence": "high"
  },
  "HOUSE_OVERSIGHT_032818": {
    "date": "2018-10-04",
    "time": "15:32:39",
    "source": "email_header",
    "raw_date": "10/4/2018 3:32:39 PM",
    "confidence": "high"
  },
  "HOUSE_OVERSIGHT_032821": {
    "date": "2018-10-05",
    "time": "13:48:46",
    "source": "email_header",
    "raw_date": "10/5/2018 1:48:46 PM",
    "confidence": "high"
  },
  "HOUSE_OVERSIGHT_032825": {
    "date": "2018-10-27",
    "time": "13:40:35",
    "source": "email_header",
    "raw_date": "10/27/2018 1:40:35 PM",
    "confidence": "high"
  },
  "HOUSE_OVERSIGHT_032827": {
    "date": "2018-11-07",
    "time": "00:34:34",
    "source": "email_header",
    "raw_date": "11/7/2018 12:34:34 AM",
    "confidence": "high"
  },
  "HOUSE_OVERSIGHT_032828": {
    "date": "2018-11-08",
    "time": "00:30:56",
    "source": "email_header",
    "raw_date": "11/8/2018 12:30:56 AM",
    "confidence": "high"
  },
  "HOUSE_OVERSIGHT_032829": {
    "date": "2018-12-01",
    "time": "15:57:27",
    "source": "email_header",
    "raw_date": "12/1/2018 3:57:27 PM",
    "confidence": "high"
  },
  "HOUSE_OVERSIGHT_032832": {
    "date": "2018-12-04",
    "time": "13:34:27",
    "source": "email_header",
    "raw_date": "12/4/2018 1:34:27 PM",
    "confidence": "high"
  },
  "HOUSE_OVERSIGHT_032834": {
    "date": "2018-12-20",
    "time": "19:28:53",
    "source": "email_header",
    "raw_date": "12/20/2018 7:28:53 PM",
    "confidence": "high"
  },
  "HOUSE_OVERSIGHT_032835": {
    "date": "2019-03-19",
    "time": "12:56:20",
    "source": "email_header",
    "raw_date": "3/19/2019 12:56:20 PM",
    "confidence": "high"
  },
  "HOUSE_OVERSIGHT_032836": {
    "date": "2019-05-11",
    "time": "19:50:51",
    "source": "email_header",
    "raw_date": "5/11/2019 7:50:51 PM",
    "confidence": "high"
  },
  "HOUSE_OVERSIGHT_032838": {
    "date": "2019-05-14",
    "time": "10:16:30",
    "source": "email_header",
    "raw_date": "5/14/2019 10:16:30 AM",
    "confidence": "high"
  },
  "HOUSE_OVERSIGHT_032839": {
    "date": "2019-06-01",
    "time": "22:53:32",
    "source": "email_header",
    "raw_date": "6/1/2019 10:53:32 PM",
    "confidence": "high"
  },
  "HOUSE_OVERSIGHT_032840": {
    "date": "2019-06-01",
    "time": "22:57:12",
    "source": "email_header",
    "raw_date": "6/1/2019 10:57:12 PM",
    "confidence": "high"
  },
  "HOUSE_OVERSIGHT_032842": {
    "date": "2014-07-02",
    "time": "14:42:24",
    "source": "email_header",
    "raw_date": "7/2/2014 2:42:24 PM",
    "confidence": "high"
  },
  "HOUSE_OVERSIGHT_032845": {
    "date": "2015-08-24",
    "time": "11:16:47",
    "source": "email_header",
    "raw_date": "8/24/2015 11:16:47 AM",
    "confidence": "high"
  },
  "HOUSE_OVERSIGHT_032846": {
    "date": "2016-01-21",
    "time": "01:54:27",
    "source": "email_header",
    "raw_date": "1/21/2016 1:54:27 AM",
    "confidence": "high"
  },
  "HOUSE_OVERSIGHT_032848": {
    "date": "2016-01-21",
    "time": "02:22:20",
    "source": "email_header",
    "raw_date": "1/21/2016 2:22:20 AM",
    "confidence": "high"
  },
  "HOUSE_OVERSIGHT_032850": {
    "date": "2016-02-10",
    "time": "19:07:17",
    "source": "email_header",
    "raw_date": "2/10/2016 7:07:17 PM",
    "confidence": "high"
  },
  "HOUSE_OVERSIGHT_032851": {
    "date": "2016-02-10",
    "time": "19:17:33",
    "source": "email_header",
    "raw_date": "2/10/2016 7:17:33 PM",
    "confidence": "high"
  },
  "HOUSE_OVERSIGHT_032853": {
    "date": "2016-02-19",
    "time": "17:46:24",
    "source": "email_header",
    "raw_date": "2/19/2016 5:46:24 PM",
    "confidence": "high"
  },
  "HOUSE_OVERSIGHT_032854": {
    "date": "2016-02-19",
    "time": "17:47:06",
    "source": "email_header",
    "raw_date": "2/19/2016 5:47:06 PM",
    "confidence": "high"
  },
  "HOUSE_OVERSIGHT_032855": {
    "date": "2016-03-09",
    "time": "17:32:21",
    "source": "email_header",
    "raw_date": "3/9/2016 5:32:21 PM",
    "confidence": "high"
  },
  "HOUSE_OVERSIGHT_032857": {
    "date": "2016-03-16",
    "time": "10:08:48",
    "source": "email_header",
    "raw_date": "3/16/2016 10:08:48 AM",
    "confidence": "high"
  },
  "HOUSE_OVERSIGHT_032858": {
    "date": "2016-03-18",
    "time": "16:18:52",
    "source": "email_header",
    "raw_date": "3/18/2016 4:18:52 PM",
    "confidence": "high"
  },
  "HOUSE_OVERSIGHT_032861": {
    "date": "2016-03-18",
    "time": "16:58:46",
    "source": "email_header",
    "raw_date": "3/18/2016 4:58:46 PM",
    "confidence": "high"
  },
  "HOUSE_OVERSIGHT_032864": {
    "date": "2016-05-10",
    "time": "20:17:34",
    "source": "email_header",
    "raw_date": "5/10/2016 8:17:34 PM",
    "confidence": "high"
  },
  "HOUSE_OVERSIGHT_032865": {
    "date": "2016-05-17",
    "time": "13:56:20",
    "source": "email_header",
    "raw_date": "5/17/2016 1:56:20 PM",
    "confidence": "high"
  },
  "HOUSE_OVERSIGHT_032868": {
    "date": "2016-06-01",
    "time": "15:28:14",
    "source": "email_header",
    "raw_date": "6/1/2016 3:28:14 PM",
    "confidence": "high"
  },
  "HOUSE_OVERSIGHT_032869": {
    "date": "2016-06-01",
    "time": "15:47:12",
    "source": "email_header",
    "raw_date": "6/1/2016 3:47:12 PM",
    "confidence": "high"
  },
  "HOUSE_OVERSIGHT_032871": {
    "date": "2016-06-01",
    "time": "16:00:04",
    "source": "email_header",
    "raw_date": "6/1/2016 4:00:04 PM",
    "confidence": "high"
  },
  "HOUSE_OVERSIGHT_032873": {
    "date": "2016-06-01",
    "time": "16:37:29",
    "source": "email_header",
    "raw_date": "6/1/2016 4:37:29 PM",
    "confidence": "high"
  },
  "HOUSE_OVERSIGHT_032876": {
    "date": "2016-06-22",
    "time": "22:36:05",
    "source": "email_header",
    "raw_date": "6/22/2016 10:36:05 PM",
    "confidence": "high"
  },
  "HOUSE_OVERSIGHT_032877": {
    "date": "2016-06-28",
    "time": "20:44:10",
    "source": "email_header",
    "raw_date": "6/28/2016 8:44:10 PM",
    "confidence": "high"
  },
  "HOUSE_OVERSIGHT_032878": {
    "date": "2016-07-14",
    "time": "12:01:26",
    "source": "email_header",
    "raw_date": "7/14/2016 12:01:26 PM",
    "confidence": "high"
  },
  "HOUSE_OVERSIGHT_032880": {
    "date": "2016-07-15",
    "time": "13:58:56",
    "source": "email_header",
    "raw_date": "7/15/2016 1:58:56 PM",
    "confidence": "high"
  },
  "HOUSE_OVERSIGHT_032882": {
    "date": "2016-09-16",
    "time": "20:02:47",
    "source": "email_header",
    "raw_date": "9/16/2016 8:02:47 PM",
    "confidence": "high"
  },
  "HOUSE_OVERSIGHT_032883": {
    "date": "2016-09-16",
    "time": "20:08:30",
    "source": "email_header",
    "raw_date": "9/16/2016 8:08:30 PM",
    "confidence": "high"
  },
  "HOUSE_OVERSIGHT_032885": {
    "date": "2016-09-16",
    "time": "20:38:51",
    "source": "email_header",
    "raw_date": "9/16/2016 8:38:51 PM",
    "confidence": "high"
  },
  "HOUSE_OVERSIGHT_032888": {
    "date": "2016-09-16",
    "time": "20:52:44",
    "source": "email_header",
    "raw_date": "9/16/2016 8:52:44 PM",
    "confidence": "high"
  },
  "HOUSE_OVERSIGHT_032891": {
    "date": "2016-10-01",
    "time": "03:05:32",
    "source": "email_header",
    "raw_date": "10/1/2016 3:05:32 AM",
    "confidence": "high"
  },
  "HOUSE_OVERSIGHT_032892": {
    "date": "2016-10-09",
    "time": "01:17:28",
    "source": "email_header",
    "raw_date": "10/9/2016 1:17:28 AM",
    "confidence": "high"
  },
  "HOUSE_OVERSIGHT_032894": {
    "date": "2016-10-09",
    "time": "06:16:35",
    "source": "email_header",
    "raw_date": "10/9/2016 6:16:35 AM",
    "confidence": "high"
  },
  "HOUSE_OVERSIGHT_032896": {
    "date": "2016-10-19",
    "time": "15:05:12",
    "source": "email_header",
    "raw_date": "10/19/2016 3:05:12 PM",
    "confidence": "high"
  },
  "HOUSE_OVERSIGHT_032897": {
    "date": "2016-11-04",
    "time": "22:17:45",
    "source": "email_header",
    "raw_date": "11/4/2016 10:17:45 PM",
    "confidence": "high"
  },
  "HOUSE_OVERSIGHT_032899": {
    "date": "2016-11-06",
    "time": "20:32:09",
    "source": "email_header",
    "raw_date": "11/6/2016 8:32:09 PM",
    "confidence": "high"
  },
  "HOUSE_OVERSIGHT_032902": {
    "date": "2016-11-09",
    "time": "04:22:49",
    "source": "email_header",
    "raw_date": "11/9/2016 4:22:49 AM",
    "confidence": "high"
  },
  "HOUSE_OVERSIGHT_032903": {
    "date": "2016-11-10",
    "time": "12:18:00",
    "source": "email_header",
    "raw_date": "11/10/2016 12:18:00 PM",
    "confidence": "high"
  },
  "HOUSE_OVERSIGHT_032904": {
    "date": "2016-11-10",
    "time": "21:58:12",
    "source": "email_header",
    "raw_date": "11/10/2016 9:58:12 PM",
    "confidence": "high"
  },
  "HOUSE_OVERSIGHT_032906": {
    "date": "2016-11-10",
    "time": "22:08:36",
    "source": "email_header",
    "raw_date": "11/10/2016 10:08:36 PM",
    "confidence": "high"
  },
  "HOUSE_OVERSIGHT_032908": {
    "date": "2016-11-10",
    "time": "22:11:04",
    "source": "email_header",
    "raw_date": "11/10/2016 10:11:04 PM",
    "confidence": "high"
  },
  "HOUSE_OVERSIGHT_032910": {
    "date": "2016-11-10",
    "time": "22:14:13",
    "source": "email_header",
    "raw_date": "11/10/2016 10:14:13 PM",
    "confidence": "high"
  },
  "HOUSE_OVERSIGHT_032912": {
    "date": "2016-11-10",
    "time": "22:14:49",
    "source": "email_header",
    "raw_date": "11/10/2016 10:14:49 PM",
    "confidence": "high"
  },
  "HOUSE_OVERSIGHT_032913": {
    "date": "2016-11-10",
    "time": "23:50:21",
    "source": "email_header",
    "raw_date": "11/10/2016 11:50:21 PM",
    "confidence": "high"
  },
  "HOUSE_OVERSIGHT_032914": {
    "date": "2016-11-11",
    "time": "05:19:42",
    "source": "email_header",
    "raw_date": "11/11/2016 5:19:42 AM",
    "confidence": "high"
  },
  "HOUSE_OVERSIGHT_032915": {
    "date": "2016-11-14",
    "time": "14:53:27",
    "source": "email_header",
    "raw_date": "11/14/2016 2:53:27 PM",
    "confidence": "high"
  },
  "HOUSE_OVERSIGHT_032916": {
    "date": "2016-11-14",
    "time": "14:56:18",
    "source": "email_header",
    "raw_date": "11/14/2016 2:56:18 PM",
    "confidence": "high"
  },
  "HOUSE_OVERSIGHT_032918": {
    "date": "2016-11-20",
    "time": "01:48:58",
    "source": "email_header",
    "raw_date": "11/20/2016 1:48:58 AM",
    "confidence": "high"
  },
  "HOUSE_OVERSIGHT_032921": {
    "date": "2016-11-20",
    "time": "05:32:35",
    "source": "email_header",
    "raw_date": "11/20/2016 5:32:35 AM",
    "confidence": "high"
  },
  "HOUSE_OVERSIGHT_032924": {
    "date": "2016-11-20",
    "time": "18:53:17",
    "source": "email_header",
    "raw_date": "11/20/2016 6:53:17 PM",
    "confidence": "high"
  },
  "HOUSE_OVERSIGHT_032927": {
    "date": "2016-11-20",
    "time": "23:00:17",
    "source": "email_header",
    "raw_date": "11/20/2016 11:00:17 PM",
    "confidence": "high"
  },
  "HOUSE_OVERSIGHT_032931": {
    "date": "2016-11-20",
    "time": "23:00:34",
    "source": "email_header",
    "raw_date": "11/20/2016 11:00:34 PM",
    "confidence": "high"
  },
  "HOUSE_OVERSIGHT_032935": {
    "date": "2016-11-25",
    "time": "22:29:32",
    "source": "email_header",
    "raw_date": "11/25/2016 10:29:32 PM",
    "confidence": "high"
  },
  "HOUSE_OVERSIGHT_032936": {
    "date": "2016-11-28",
    "time": "00:22:35",
    "source": "email_header",
    "raw_date": "11/28/2016 12:22:35 AM",
    "confidence": "high"
  },
  "HOUSE_OVERSIGHT_032937": {
    "date": "2016-11-28",
    "time": "20:22:53",
    "source": "email_header",
    "raw_date": "11/28/2016 8:22:53 PM",
    "confidence": "high"
  },
  "HOUSE_OVERSIGHT_032938": {
    "date": "2016-11-29",
    "time": "22:56:40",
    "source": "email_header",
    "raw_date": "11/29/2016 10:56:40 PM",
    "confidence": "high"
  },
  "HOUSE_OVERSIGHT_032939": {
    "date": "2016-12-01",
    "time": "11:55:58",
    "source": "email_header",
    "raw_date": "12/1/2016 11:55:58 AM",
    "confidence": "high"
  },
  "HOUSE_OVERSIGHT_032940": {
    "date": "2016-12-02",
    "time": "11:38:14",
    "source": "email_header",
    "raw_date": "12/2/2016 11:38:14 AM",
    "confidence": "high"
  },
  "HOUSE_OVERSIGHT_032941": {
    "date": "2016-12-07",
    "time": "17:25:20",
    "source": "email_header",
    "raw_date": "12/7/2016 5:25:20 PM",
    "confidence": "high"
  },
  "HOUSE_OVERSIGHT_032942": {
    "date": "2016-12-07",
    "time": "17:30:18",
    "source": "email_header",
    "raw_date": "12/7/2016 5:30:18 PM",
    "confidence": "high"
  },
  "HOUSE_OVERSIGHT_032943": {
    "date": "2016-12-13",
    "time": "13:48:54",
    "source": "email_header",
    "raw_date": "12/13/2016 1:48:54 PM",
    "confidence": "high"
  },
  "HOUSE_OVERSIGHT_032944": {
    "date": "2016-12-15",
    "time": "15:58:59",
    "source": "email_header",
    "raw_date": "12/15/2016 3:58:59 PM",
    "confidence": "high"
  },
  "HOUSE_OVERSIGHT_032946": {
    "date": "2016-12-17",
    "time": "20:30:26",
    "source": "email_header",
    "raw_date": "12/17/2016 8:30:26 PM",
    "confidence": "high"
  },
  "HOUSE_OVERSIGHT_032948": {
    "date": "2016-12-18",
    "time": "15:35:10",
    "source": "email_header",
    "raw_date": "12/18/2016 3:35:10 PM",
    "confidence": "high"
  },
  "HOUSE_OVERSIGHT_032949": {
    "date": "2017-01-06",
    "time": "11:29:46",
    "source": "email_header",
    "raw_date": "1/6/2017 11:29:46 AM",
    "confidence": "high"
  },
  "HOUSE_OVERSIGHT_032951": {
    "date": "2017-01-06",
    "time": null,
    "source": "content_parsed",
    "raw_date": "1/6/2017",
    "confidence": "low"
  },
  "HOUSE_OVERSIGHT_032952": {
    "date": "2017-01-06",
    "time": "14:49:57",
    "source": "email_header",
    "raw_date": "1/6/2017 2:49:57 PM",
    "confidence": "high"
  },
  "HOUSE_OVERSIGHT_032953": {
    "date": "2017-01-08",
    "time": "21:31:02",
    "source": "email_header",
    "raw_date": "1/8/2017 9:31:02 PM",
    "confidence": "high"
  },
  "HOUSE_OVERSIGHT_032955": {
    "date": "2017-01-09",
    "time": "18:56:10",
    "source": "email_header",
    "raw_date": "1/9/2017 6:56:10 PM",
    "confidence": "high"
  },
  "HOUSE_OVERSIGHT_032956": {
    "date": "2017-01-09",
    "time": "18:56:22",
    "source": "email_header",
    "raw_date": "1/9/2017 6:56:22 PM",
    "confidence": "high"
  },
  "HOUSE_OVERSIGHT_032957": {
    "date": "2017-01-12",
    "time": "04:35:42",
    "source": "email_header",
    "raw_date": "1/12/2017 4:35:42 AM",
    "confidence": "high"
  },
  "HOUSE_OVERSIGHT_032958": {
    "date": "2017-01-15",
    "time": "14:28:57",
    "source": "email_header",
    "raw_date": "1/15/2017 2:28:57 PM",
    "confidence": "high"
  },
  "HOUSE_OVERSIGHT_032961": {
    "date": "2017-01-29",
    "time": "09:59:36",
    "source": "email_header",
    "raw_date": "1/29/2017 9:59:36 AM",
    "confidence": "high"
  },
  "HOUSE_OVERSIGHT_032963": {
    "date": "2017-02-08",
    "time": "00:37:31",
    "source": "email_header",
    "raw_date": "2/8/2017 12:37:31 AM",
    "confidence": "high"
  },
  "HOUSE_OVERSIGHT_032964": {
    "date": "2017-02-15",
    "time": "11:37:13",
    "source": "email_header",
    "raw_date": "2/15/2017 11:37:13 AM",
    "confidence": "high"
  },
  "HOUSE_OVERSIGHT_032968": {
    "date": "2017-02-15",
    "time": "11:37:26",
    "source": "email_header",
    "raw_date": "2/15/2017 11:37:26 AM",
    "confidence": "high"
  },
  "HOUSE_OVERSIGHT_032972": {
    "date": "2017-02-15",
    "time": "13:52:46",
    "source": "email_header",
    "raw_date": "2/15/2017 1:52:46 PM",
    "confidence": "high"
  },
  "HOUSE_OVERSIGHT_032974": {
    "date": "2017-02-16",
    "time": "02:03:54",
    "source": "email_header",
    "raw_date": "2/16/2017 2:03:54 AM",
    "confidence": "high"
  },
  "HOUSE_OVERSIGHT_032975": {
    "date": "2017-02-17",
    "time": "20:26:51",
    "source": "email_header",
    "raw_date": "2/17/2017 8:26:51 PM",
    "confidence": "high"
  },
  "HOUSE_OVERSIGHT_032980": {
    "date": "2017-02-19",
    "time": "00:31:38",
    "source": "email_header",
    "raw_date": "2/19/2017 12:31:38 AM",
    "confidence": "high"
  },
  "HOUSE_OVERSIGHT_032982": {
    "date": "2017-02-19",
    "time": "10:13:59",
    "source": "email_header",
    "raw_date": "2/19/2017 10:13:59 AM",
    "confidence": "high"
  },
  "HOUSE_OVERSIGHT_032983": {
    "date": "2017-03-03",
    "time": "16:27:13",
    "source": "email_header",
    "raw_date": "3/3/2017 4:27:13 PM",
    "confidence": "high"
  },
  "HOUSE_OVERSIGHT_032985": {
    "date": "2017-03-03",
    "time": "16:36:56",
    "source": "email_header",
    "raw_date": "3/3/2017 4:36:56 PM",
    "confidence": "high"
  },
  "HOUSE_OVERSIGHT_032988": {
    "date": "2017-03-05",
    "time": "15:53:26",
    "source": "email_header",
    "raw_date": "3/5/2017 3:53:26 PM",
    "confidence": "high"
  },
  "HOUSE_OVERSIGHT_032989": {
    "date": "2017-03-09",
    "time": "15:22:44",
    "source": "email_header",
    "raw_date": "3/9/2017 3:22:44 PM",
    "confidence": "high"
  },
  "HOUSE_OVERSIGHT_032990": {
    "date": "2017-03-09",
    "time": null,
    "source": "content_parsed",
    "raw_date": "Thu, Mar 9, 2017",
    "confidence": "low"
  },
  "HOUSE_OVERSIGHT_032992": {
    "date": "2017-03-22",
    "time": null,
    "source": "content_parsed",
    "raw_date": "Wed, Mar 22, 2017",
    "confidence": "low"
  },
  "HOUSE_OVERSIGHT_032994": {
    "date": "2017-04-10",
    "time": "10:41:00",
    "source": "email_header",
    "raw_date": "4/10/2017 10:41:00 AM",
    "confidence": "high"
  },
  "HOUSE_OVERSIGHT_032995": {
    "date": "2017-04-29",
    "time": "18:57:28",
    "source": "email_header",
    "raw_date": "4/29/2017 6:57:28 PM",
    "confidence": "high"
  },
  "HOUSE_OVERSIGHT_032997": {
    "date": "2017-05-08",
    "time": "15:19:07",
    "source": "email_header",
    "raw_date": "5/8/2017 3:19:07 PM",
    "confidence": "high"
  },
  "HOUSE_OVERSIGHT_032998": {
    "date": "2017-05-10",
    "time": "02:29:16",
    "source": "email_header",
    "raw_date": "5/10/2017 2:29:16 AM",
    "confidence": "high"
  },
  "HOUSE_OVERSIGHT_032999": {
    "date": "2017-05-17",
    "time": "08:07:22",
    "source": "email_header",
    "raw_date": "5/17/2017 8:07:22 AM",
    "confidence": "high"
  },
  "HOUSE_OVERSIGHT_033000": {
    "date": "2017-05-21",
    "time": "15:51:09",
    "source": "email_header",
    "raw_date": "5/21/2017 3:51:09 PM",
    "confidence": "high"
  },
  "HOUSE_OVERSIGHT_033001": {
    "date": "2017-05-22",
    "time": "09:52:07",
    "source": "email_header",
    "raw_date": "5/22/2017 9:52:07 AM",
    "confidence": "high"
  },
  "HOUSE_OVERSIGHT_033003": {
    "date": "2017-05-30",
    "time": "19:53:28",
    "source": "email_header",
    "raw_date": "5/30/2017 7:53:28 PM",
    "confidence": "high"
  },
  "HOUSE_OVERSIGHT_033004": {
    "date": "2017-05-30",
    "time": "19:53:55",
    "source": "email_header",
    "raw_date": "5/30/2017 7:53:55 PM",
    "confidence": "high"
  },
  "HOUSE_OVERSIGHT_033005": {
    "date": "2017-05-30",
    "time": "19:54:10",
    "source": "email_header",
    "raw_date": "5/30/2017 7:54:10 PM",
    "confidence": "high"
  },
  "HOUSE_OVERSIGHT_033007": {
    "date": "2017-06-03",
    "time": "01:32:13",
    "source": "email_header",
    "raw_date": "6/3/2017 1:32:13 AM",
    "confidence": "high"
  },
  "HOUSE_OVERSIGHT_033008": {
    "date": "2017-06-13",
    "time": "01:32:37",
    "source": "email_header",
    "raw_date": "6/13/2017 1:32:37 AM",
    "confidence": "high"
  },
  "HOUSE_OVERSIGHT_033011": {
    "date": "2017-06-17",
    "time": "16:31:26",
    "source": "email_header",
    "raw_date": "6/17/2017 4:31:26 PM",
    "confidence": "high"
  },
  "HOUSE_OVERSIGHT_033012": {
    "date": "2017-07-10",
    "time": "07:40:41",
    "source": "email_header",
    "raw_date": "7/10/2017 7:40:41 AM",
    "confidence": "high"
  },
  "HOUSE_OVERSIGHT_033013": {
    "date": "2017-07-21",
    "time": "01:39:13",
    "source": "email_header",
    "raw_date": "7/21/2017 1:39:13 AM",
    "confidence": "high"
  },
  "HOUSE_OVERSIGHT_033014": {
    "date": "2017-08-24",
    "time": "17:58:38",
    "source": "email_header",
    "raw_date": "8/24/2017 5:58:38 PM",
    "confidence": "high"
  },
  "HOUSE_OVERSIGHT_033015": {
    "date": "2017-08-24",
    "time": "18:01:15",
    "source": "email_header",
    "raw_date": "8/24/2017 6:01:15 PM",
    "confidence": "high"
  },
  "HOUSE_OVERSIGHT_033016": {
    "date": "2017-08-25",
    "time": "12:11:54",
    "source": "email_header",
    "raw_date": "8/25/2017 12:11:54 PM",
    "confidence": "high"
  },
  "HOUSE_OVERSIGHT_033019": {
    "date": "2017-09-03",
    "time": "17:02:27",
    "source": "email_header",
    "raw_date": "9/3/2017 5:02:27 PM",
    "confidence": "high"
  },
  "HOUSE_OVERSIGHT_033020": {
    "date": "2017-09-03",
    "time": "17:25:04",
    "source": "email_header",
    "raw_date": "9/3/2017 5:25:04 PM",
    "confidence": "high"
  },
  "HOUSE_OVERSIGHT_033021": {
    "date": "2017-09-08",
    "time": null,
    "source": "content_parsed",
    "raw_date": "Fri, Sep 8, 2017",
    "confidence": "low"
  },
  "HOUSE_OVERSIGHT_033022": {
    "date": "2017-09-08",
    "time": "08:52:18",
    "source": "email_header",
    "raw_date": "9/8/2017 8:52:18 AM",
    "confidence": "high"
  },
  "HOUSE_OVERSIGHT_033023": {
    "date": "2017-09-09",
    "time": "00:34:28",
    "source": "email_header",
    "raw_date": "9/9/2017 12:34:28 AM",
    "confidence": "high"
  },
  "HOUSE_OVERSIGHT_033025": {
    "date": "2017-09-10",
    "time": "09:01:16",
    "source": "email_header",
    "raw_date": "9/10/2017 9:01:16 AM",
    "confidence": "high"
  },
  "HOUSE_OVERSIGHT_033027": {
    "date": "2017-09-12",
    "time": "05:07:38",
    "source": "email_header",
    "raw_date": "9/12/2017 5:07:38 AM",
    "confidence": "high"
  },
  "HOUSE_OVERSIGHT_033030": {
    "date": "2017-09-12",
    "time": "05:07:53",
    "source": "email_header",
    "raw_date": "9/12/2017 5:07:53 AM",
    "confidence": "high"
  },
  "HOUSE_OVERSIGHT_033033": {
    "date": "2017-09-13",
    "time": "01:29:54",
    "source": "email_header",
    "raw_date": "9/13/2017 1:29:54 AM",
    "confidence": "high"
  },
  "HOUSE_OVERSIGHT_033039": {
    "date": "2017-09-20",
    "time": "22:34:14",
    "source": "email_header",
    "raw_date": "9/20/2017 10:34:14 PM",
    "confidence": "high"
  },
  "HOUSE_OVERSIGHT_033041": {
    "date": "2017-09-20",
    "time": "22:34:58",
    "source": "email_header",
    "raw_date": "9/20/2017 10:34:58 PM",
    "confidence": "high"
  },
  "HOUSE_OVERSIGHT_033043": {
    "date": "2017-09-27",
    "time": "14:56:10",
    "source": "email_header",
    "raw_date": "9/27/2017 2:56:10 PM",
    "confidence": "high"
  },
  "HOUSE_OVERSIGHT_033044": {
    "date": "2017-09-30",
    "time": "21:46:50",
    "source": "email_header",
    "raw_date": "9/30/2017 9:46:50 PM",
    "confidence": "high"
  },
  "HOUSE_OVERSIGHT_033045": {
    "date": "2017-11-16",
    "time": "21:52:54",
    "source": "email_header",
    "raw_date": "11/16/2017 9:52:54 PM",
    "confidence": "high"
  },
  "HOUSE_OVERSIGHT_033047": {
    "date": "2017-11-17",
    "time": "11:58:02",
    "source": "email_header",
    "raw_date": "11/17/2017 11:58:02 AM",
    "confidence": "high"
  },
  "HOUSE_OVERSIGHT_033050": {
    "date": "2017-12-02",
    "time": null,
    "source": "content_parsed",
    "raw_date": "Sat, Dec 2, 2017",
    "confidence": "low"
  },
  "HOUSE_OVERSIGHT_033052": {
    "date": "2017-12-11",
    "time": "15:53:10",
    "source": "email_header",
    "raw_date": "12/11/2017 3:53:10 PM",
    "confidence": "high"
  },
  "HOUSE_OVERSIGHT_033053": {
    "date": "2018-01-03",
    "time": "19:02:31",
    "source": "email_header",
    "raw_date": "1/3/2018 7:02:31 PM",
    "confidence": "high"
  },
  "HOUSE_OVERSIGHT_033055": {
    "date": "2018-01-03",
    "time": "19:03:19",
    "source": "email_header",
    "raw_date": "1/3/2018 7:03:19 PM",
    "confidence": "high"
  },
  "HOUSE_OVERSIGHT_033057": {
    "date": "2018-01-03",
    "time": "19:14:36",
    "source": "email_header",
    "raw_date": "1/3/2018 7:14:36 PM",
    "confidence": "high"
  },
  "HOUSE_OVERSIGHT_033059": {
    "date": "2018-01-04",
    "time": "15:46:44",
    "source": "email_header",
    "raw_date": "1/4/2018 3:46:44 PM",
    "confidence": "high"
  },
  "HOUSE_OVERSIGHT_033062": {
    "date": "2018-01-04",
    "time": "18:17:52",
    "source": "email_header",
    "raw_date": "1/4/2018 6:17:52 PM",
    "confidence": "high"
  },
  "HOUSE_OVERSIGHT_033063": {
    "date": "2018-01-05",
    "time": "11:17:30",
    "source": "email_header",
    "raw_date": "1/5/2018 11:17:30 AM",
    "confidence": "high"
  },
  "HOUSE_OVERSIGHT_033064": {
    "date": "2018-01-08",
    "time": "11:02:22",
    "source": "email_header",
    "raw_date": "1/8/2018 11:02:22 AM",
    "confidence": "high"
  },
  "HOUSE_OVERSIGHT_033066": {
    "date": "2018-01-08",
    "time": "11:27:44",
    "source": "email_header",
    "raw_date": "1/8/2018 11:27:44 AM",
    "confidence": "high"
  },
  "HOUSE_OVERSIGHT_033068": {
    "date": "2018-01-15",
    "time": "02:57:30",
    "source": "email_header",
    "raw_date": "1/15/2018 2:57:30 AM",
    "confidence": "high"
  },
  "HOUSE_OVERSIGHT_033071": {
    "date": "2018-01-15",
    "time": "15:17:18",
    "source": "email_header",
    "raw_date": "1/15/2018 3:17:18 PM",
    "confidence": "high"
  },
  "HOUSE_OVERSIGHT_033073": {
    "date": "2018-02-13",
    "time": "14:19:01",
    "source": "email_header",
    "raw_date": "2/13/2018 2:19:01 PM",
    "confidence": "high"
  },
  "HOUSE_OVERSIGHT_033074": {
    "date": "2018-03-04",
    "time": "11:45:02",
    "source": "email_header",
    "raw_date": "3/4/2018 11:45:02 AM",
    "confidence": "high"
  },
  "HOUSE_OVERSIGHT_033075": {
    "date": "2018-03-04",
    "time": "14:35:53",
    "source": "email_header",
    "raw_date": "3/4/2018 2:35:53 PM",
    "confidence": "high"
  },
  "HOUSE_OVERSIGHT_033076": {
    "date": "2018-03-07",
    "time": "11:49:41",
    "source": "email_header",
    "raw_date": "3/7/2018 11:49:41 AM",
    "confidence": "high"
  },
  "HOUSE_OVERSIGHT_033077": {
    "date": "2018-03-08",
    "time": "00:13:48",
    "source": "email_header",
    "raw_date": "3/8/2018 12:13:48 AM",
    "confidence": "high"
  },
  "HOUSE_OVERSIGHT_033078": {
    "date": "2018-03-24",
    "time": "12:26:50",
    "source": "email_header",
    "raw_date": "3/24/2018 12:26:50 PM",
    "confidence": "high"
  },
  "HOUSE_OVERSIGHT_033079": {
    "date": "2018-03-24",
    "time": "12:59:19",
    "source": "email_header",
    "raw_date": "3/24/2018 12:59:19 PM",
    "confidence": "high"
  },
  "HOUSE_OVERSIGHT_033081": {
    "date": "2018-03-24",
    "time": "13:15:12",
    "source": "email_header",
    "raw_date": "3/24/2018 1:15:12 PM",
    "confidence": "high"
  },
  "HOUSE_OVERSIGHT_033082": {
    "date": "2018-03-24",
    "time": "13:16:30",
    "source": "email_header",
    "raw_date": "3/24/2018 1:16:30 PM",
    "confidence": "high"
  },
  "HOUSE_OVERSIGHT_033084": {
    "date": "2018-03-24",
    "time": "16:15:12",
    "source": "email_header",
    "raw_date": "3/24/2018 4:15:12 PM",
    "confidence": "high"
  },
  "HOUSE_OVERSIGHT_033087": {
    "date": "2018-04-10",
    "time": "14:36:47",
    "source": "email_header",
    "raw_date": "4/10/2018 2:36:47 PM",
    "confidence": "high"
  },
  "HOUSE_OVERSIGHT_033088": {
    "date": "2018-04-10",
    "time": "21:26:01",
    "source": "email_header",
    "raw_date": "4/10/2018 9:26:01 PM",
    "confidence": "high"
  },
  "HOUSE_OVERSIGHT_033090": {
    "date": "2018-04-18",
    "time": "16:53:58",
    "source": "email_header",
    "raw_date": "4/18/2018 4:53:58 PM",
    "confidence": "high"
  },
  "HOUSE_OVERSIGHT_033091": {
    "date": "2018-04-22",
    "time": "19:28:13",
    "source": "email_header",
    "raw_date": "4/22/2018 7:28:13 PM",
    "confidence": "high"
  },
  "HOUSE_OVERSIGHT_033092": {
    "date": "2018-05-09",
    "time": "10:33:34",
    "source": "email_header",
    "raw_date": "5/9/2018 10:33:34 AM",
    "confidence": "high"
  },
  "HOUSE_OVERSIGHT_033094": {
    "date": "2018-06-06",
    "time": "22:29:46",
    "source": "email_header",
    "raw_date": "6/6/2018 10:29:46 PM",
    "confidence": "high"
  },
  "HOUSE_OVERSIGHT_033095": {
    "date": "2018-06-22",
    "time": "13:58:37",
    "source": "email_header",
    "raw_date": "6/22/2018 1:58:37 PM",
    "confidence": "high"
  },
  "HOUSE_OVERSIGHT_033096": {
    "date": "2018-06-24",
    "time": "13:59:24",
    "source": "email_header",
    "raw_date": "6/24/2018 1:59:24 PM",
    "confidence": "high"
  },
  "HOUSE_OVERSIGHT_033097": {
    "date": "2018-07-13",
    "time": "11:11:16",
    "source": "email_header",
    "raw_date": "7/13/2018 11:11:16 AM",
    "confidence": "high"
  },
  "HOUSE_OVERSIGHT_033098": {
    "date": "2018-07-17",
    "time": "00:42:20",
    "source": "email_header",
    "raw_date": "7/17/2018 12:42:20 AM",
    "confidence": "high"
  },
  "HOUSE_OVERSIGHT_033100": {
    "date": "2018-07-17",
    "time": "12:13:00",
    "source": "email_header",
    "raw_date": "7/17/2018 12:13:00 PM",
    "confidence": "high"
  },
  "HOUSE_OVERSIGHT_033103": {
    "date": "2018-07-18",
    "time": "14:58:35",
    "source": "email_header",
    "raw_date": "7/18/2018 2:58:35 PM",
    "confidence": "high"
  },
  "HOUSE_OVERSIGHT_033107": {
    "date": "2018-08-21",
    "time": "22:36:45",
    "source": "email_header",
    "raw_date": "8/21/2018 10:36:45 PM",
    "confidence": "high"
  },
  "HOUSE_OVERSIGHT_033108": {
    "date": "2018-08-22",
    "time": "15:35:51",
    "source": "email_header",
    "raw_date": "8/22/2018 3:35:51 PM",
    "confidence": "high"
  },
  "HOUSE_OVERSIGHT_033110": {
    "date": "2018-08-22",
    "time": "16:26:31",
    "source": "email_header",
    "raw_date": "8/22/2018 4:26:31 PM",
    "confidence": "high"
  },
  "HOUSE_OVERSIGHT_033111": {
    "date": "2018-08-29",
    "time": "16:27:12",
    "source": "email_header",
    "raw_date": "8/29/2018 4:27:12 PM",
    "confidence": "high"
  },
  "HOUSE_OVERSIGHT_033112": {
    "date": "2018-09-04",
    "time": "01:40:13",
    "source": "email_header",
    "raw_date": "9/4/2018 1:40:13 AM",
    "confidence": "high"
  },
  "HOUSE_OVERSIGHT_033114": {
    "date": "2018-09-07",
    "time": "15:17:10",
    "source": "email_header",
    "raw_date": "9/7/2018 3:17:10 PM",
    "confidence": "high"
  },
  "HOUSE_OVERSIGHT_033115": {
    "date": "2018-09-17",
    "time": "19:12:25",
    "source": "email_header",
    "raw_date": "9/17/2018 7:12:25 PM",
    "confidence": "high"
  },
  "HOUSE_OVERSIGHT_033120": {
    "date": "2018-09-20",
    "time": "10:01:48",
    "source": "email_header",
    "raw_date": "9/20/2018 10:01:48 AM",
    "confidence": "high"
  },
  "HOUSE_OVERSIGHT_033122": {
    "date": "2018-09-26",
    "time": "17:14:42",
    "source": "email_header",
    "raw_date": "9/26/2018 5:14:42 PM",
    "confidence": "high"
  },
  "HOUSE_OVERSIGHT_033124": {
    "date": "2018-10-03",
    "time": "09:59:22",
    "source": "email_header",
    "raw_date": "10/3/2018 9:59:22 AM",
    "confidence": "high"
  },
  "HOUSE_OVERSIGHT_033125": {
    "date": "2018-10-03",
    "time": "11:29:06",
    "source": "email_header",
    "raw_date": "10/3/2018 11:29:06 AM",
    "confidence": "high"
  },
  "HOUSE_OVERSIGHT_033127": {
    "date": "2018-10-05",
    "time": "13:46:57",
    "source": "email_header",
    "raw_date": "10/5/2018 1:46:57 PM",
    "confidence": "high"
  },
  "HOUSE_OVERSIGHT_033129": {
    "date": "2018-10-05",
    "time": "13:49:48",
    "source": "email_header",
    "raw_date": "10/5/2018 1:49:48 PM",
    "confidence": "high"
  },
  "HOUSE_OVERSIGHT_033133": {
    "date": "2018-10-05",
    "time": "13:51:39",
    "source": "email_header",
    "raw_date": "10/5/2018 1:51:39 PM",
    "confidence": "high"
  },
  "HOUSE_OVERSIGHT_033137": {
    "date": "2018-11-07",
    "time": "11:05:27",
    "source": "email_header",
    "raw_date": "11/7/2018 11:05:27 AM",
    "confidence": "high"
  },
  "HOUSE_OVERSIGHT_033138": {
    "date": "2018-11-16",
    "time": "11:52:51",
    "source": "email_header",
    "raw_date": "11/16/2018 11:52:51 AM",
    "confidence": "high"
  },
  "HOUSE_OVERSIGHT_033139": {
    "date": "2018-12-20",
    "time": "12:09:41",
    "source": "email_header",
    "raw_date": "12/20/2018 12:09:41 PM",
    "confidence": "high"
  },
  "HOUSE_OVERSIGHT_033140": {
    "date": "2018-12-20",
    "time": "19:30:07",
    "source": "email_header",
    "raw_date": "12/20/2018 7:30:07 PM",
    "confidence": "high"
  },
  "HOUSE_OVERSIGHT_033142": {
    "date": "2019-02-09",
    "time": "22:00:59",
    "source": "email_header",
    "raw_date": "2/9/2019 10:00:59 PM",
    "confidence": "high"
  },
  "HOUSE_OVERSIGHT_033144": {
    "date": "2019-05-13",
    "time": "20:36:29",
    "source": "email_header",
    "raw_date": "5/13/2019 8:36:29 PM",
    "confidence": "high"
  },
  "HOUSE_OVERSIGHT_033145": {
    "date": "2019-05-19",
    "time": "22:39:32",
    "source": "email_header",
    "raw_date": "5/19/2019 10:39:32 PM",
    "confidence": "high"
  },
  "HOUSE_OVERSIGHT_033146": {
    "date": "2019-05-20",
    "time": "21:26:52",
    "source": "email_header",
    "raw_date": "5/20/2019 9:26:52 PM",
    "confidence": "high"
  },
  "HOUSE_OVERSIGHT_033147": {
    "date": "2019-05-29",
    "time": "23:59:25",
    "source": "email_header",
    "raw_date": "5/29/2019 11:59:25 PM",
    "confidence": "high"
  },
  "HOUSE_OVERSIGHT_033148": {
    "date": "2019-05-30",
    "time": "12:32:45",
    "source": "email_header",
    "raw_date": "5/30/2019 12:32:45 PM",
    "confidence": "high"
  },
  "HOUSE_OVERSIGHT_033149": {
    "date": "2019-05-31",
    "time": "09:33:59",
    "source": "email_header",
    "raw_date": "5/31/2019 9:33:59 AM",
    "confidence": "high"
  },
  "HOUSE_OVERSIGHT_033150": {
    "date": "2019-06-01",
    "time": "22:45:53",
    "source": "email_header",
    "raw_date": "6/1/2019 10:45:53 PM",
    "confidence": "high"
  },
  "HOUSE_OVERSIGHT_033151": {
    "date": "2019-06-01",
    "time": "22:59:01",
    "source": "email_header",
    "raw_date": "6/1/2019 10:59:01 PM",
    "confidence": "high"
  },
  "HOUSE_OVERSIGHT_033152": {
    "date": "2019-06-08",
    "time": "23:53:57",
    "source": "email_header",
    "raw_date": "6/8/2019 11:53:57 PM",
    "confidence": "high"
  },
  "HOUSE_OVERSIGHT_033153": {
    "date": "2011-04-11",
    "time": "14:33:58",
    "source": "email_header",
    "raw_date": "4/11/2011 2:33:58 PM",
    "confidence": "high"
  },
  "HOUSE_OVERSIGHT_033154": {
    "date": "2011-04-26",
    "time": "16:34:41",
    "source": "email_header",
    "raw_date": "4/26/2011 4:34:41 PM",
    "confidence": "high"
  },
  "HOUSE_OVERSIGHT_033155": {
    "date": "2011-04-26",
    "time": "19:28:33",
    "source": "email_header",
    "raw_date": "4/26/2011 7:28:33 PM",
    "confidence": "high"
  },
  "HOUSE_OVERSIGHT_033156": {
    "date": "2011-05-27",
    "time": "16:34:44",
    "source": "email_header",
    "raw_date": "5/27/2011 4:34:44 PM",
    "confidence": "high"
  },
  "HOUSE_OVERSIGHT_033157": {
    "date": "2014-01-21",
    "time": "22:51:27",
    "source": "email_header",
    "raw_date": "1/21/2014 10:51:27 PM",
    "confidence": "high"
  },
  "HOUSE_OVERSIGHT_033162": {
    "date": "2012-04-19",
    "time": null,
    "source": "content_parsed",
    "raw_date": "4/19/2012",
    "confidence": "low"
  },
  "HOUSE_OVERSIGHT_033163": {
    "date": "2015-03-24",
    "time": null,
    "source": "content_parsed",
    "raw_date": "3/24/2015",
    "confidence": "low"
  },
  "HOUSE_OVERSIGHT_033164": {
    "date": "2015-03-24",
    "time": "20:00:21",
    "source": "email_header",
    "raw_date": "3/24/2015 8:00:21 PM",
    "confidence": "high"
  },
  "HOUSE_OVERSIGHT_033166": {
    "date": "2016-09-20",
    "time": "13:05:00",
    "source": "email_header",
    "raw_date": "9/20/2016 1:05:00 PM",
    "confidence": "high"
  },
  "HOUSE_OVERSIGHT_033167": {
    "date": "2016-09-21",
    "time": "12:01:29",
    "source": "email_header",
    "raw_date": "9/21/2016 12:01:29 PM",
    "confidence": "high"
  },
  "HOUSE_OVERSIGHT_033168": {
    "date": "2016-09-26",
    "time": null,
    "source": "content_parsed",
    "raw_date": "9/26/2016",
    "confidence": "low"
  },
  "HOUSE_OVERSIGHT_033169": {
    "date": "2016-09-26",
    "time": null,
    "source": "content_parsed",
    "raw_date": "9/26/2016",
    "confidence": "low"
  },
  "HOUSE_OVERSIGHT_033170": {
    "date": "2016-09-27",
    "time": "00:32:41",
    "source": "email_header",
    "raw_date": "9/27/2016 12:32:41 AM",
    "confidence": "high"
  },
  "HOUSE_OVERSIGHT_033171": {
    "date": "2016-09-27",
    "time": "21:46:03",
    "source": "email_header",
    "raw_date": "9/27/2016 9:46:03 PM",
    "confidence": "high"
  },
  "HOUSE_OVERSIGHT_033173": {
    "date": "2016-10-03",
    "time": "23:10:56",
    "source": "email_header",
    "raw_date": "10/3/2016 11:10:56 PM",
    "confidence": "high"
  },
  "HOUSE_OVERSIGHT_033174": {
    "date": "2016-10-08",
    "time": "15:45:09",
    "source": "email_header",
    "raw_date": "10/8/2016 3:45:09 PM",
    "confidence": "high"
  },
  "HOUSE_OVERSIGHT_033175": {
    "date": "2016-10-13",
    "time": "13:39:13",
    "source": "email_header",
    "raw_date": "10/13/2016 1:39:13 PM",
    "confidence": "high"
  },
  "HOUSE_OVERSIGHT_033176": {
    "date": "2016-10-13",
    "time": "22:36:57",
    "source": "email_header",
    "raw_date": "10/13/2016 10:36:57 PM",
    "confidence": "high"
  },
  "HOUSE_OVERSIGHT_033177": {
    "date": "2016-10-13",
    "time": null,
    "source": "metadata",
    "raw_date": "10/13/2016",
    "confidence": "medium"
  },
  "HOUSE_OVERSIGHT_033178": {
    "date": "2016-10-19",
    "time": "18:25:58",
    "source": "email_header",
    "raw_date": "10/19/2016 6:25:58 PM",
    "confidence": "high"
  },
  "HOUSE_OVERSIGHT_033179": {
    "date": "2016-10-29",
    "time": "12:21:03",
    "source": "email_header",
    "raw_date": "10/29/2016 12:21:03 PM",
    "confidence": "high"
  },
  "HOUSE_OVERSIGHT_033180": {
    "date": "2016-11-02",
    "time": null,
    "source": "content_parsed",
    "raw_date": "11/2/2016",
    "confidence": "low"
  },
  "HOUSE_OVERSIGHT_033181": {
    "date": null,
    "time": null,
    "source": "unknown",
    "raw_date": null,
    "confidence": "none"
  },
  "HOUSE_OVERSIGHT_033183": {
    "date": "2016-11-04",
    "time": "23:43:01",
    "source": "email_header",
    "raw_date": "11/4/2016 11:43:01 PM",
    "confidence": "high"
  },
  "HOUSE_OVERSIGHT_033184": {
    "date": "2016-11-06",
    "time": "20:36:05",
    "source": "email_header",
    "raw_date": "11/6/2016 8:36:05 PM",
    "confidence": "high"
  },
  "HOUSE_OVERSIGHT_033187": {
    "date": "2016-11-09",
    "time": "13:46:11",
    "source": "email_header",
    "raw_date": "11/9/2016 1:46:11 PM",
    "confidence": "high"
  },
  "HOUSE_OVERSIGHT_033188": {
    "date": "2016-11-10",
    "time": "20:32:13",
    "source": "email_header",
    "raw_date": "11/10/2016 8:32:13 PM",
    "confidence": "high"
  },
  "HOUSE_OVERSIGHT_033189": {
    "date": "2016-11-10",
    "time": "22:55:01",
    "source": "email_header",
    "raw_date": "11/10/2016 10:55:01 PM",
    "confidence": "high"
  },
  "HOUSE_OVERSIGHT_033191": {
    "date": "2016-11-11",
    "time": "17:57:27",
    "source": "email_header",
    "raw_date": "11/11/2016 5:57:27 PM",
    "confidence": "high"
  },
  "HOUSE_OVERSIGHT_033192": {
    "date": "2016-11-14",
    "time": "15:04:29",
    "source": "email_header",
    "raw_date": "11/14/2016 3:04:29 PM",
    "confidence": "high"
  },
  "HOUSE_OVERSIGHT_033193": {
    "date": "2016-11-15",
    "time": "09:31:51",
    "source": "email_header",
    "raw_date": "11/15/2016 9:31:51 AM",
    "confidence": "high"
  },
  "HOUSE_OVERSIGHT_033194": {
    "date": "2016-11-16",
    "time": "10:33:03",
    "source": "email_header",
    "raw_date": "11/16/2016 10:33:03 AM",
    "confidence": "high"
  },
  "HOUSE_OVERSIGHT_033195": {
    "date": "2016-11-18",
    "time": "20:37:36",
    "source": "email_header",
    "raw_date": "11/18/2016 8:37:36 PM",
    "confidence": "high"
  },
  "HOUSE_OVERSIGHT_033196": {
    "date": "2016-11-21",
    "time": null,
    "source": "content_parsed",
    "raw_date": "11/21/2016",
    "confidence": "low"
  },
  "HOUSE_OVERSIGHT_033197": {
    "date": "2016-11-22",
    "time": "13:49:24",
    "source": "email_header",
    "raw_date": "11/22/2016 1:49:24 PM",
    "confidence": "high"
  },
  "HOUSE_OVERSIGHT_033198": {
    "date": "2016-11-22",
    "time": "17:35:05",
    "source": "email_header",
    "raw_date": "11/22/2016 5:35:05 PM",
    "confidence": "high"
  },
  "HOUSE_OVERSIGHT_033199": {
    "date": "2016-11-26",
    "time": "03:37:10",
    "source": "email_header",
    "raw_date": "11/26/2016 3:37:10 AM",
    "confidence": "high"
  },
  "HOUSE_OVERSIGHT_033200": {
    "date": "2016-12-01",
    "time": "03:46:53",
    "source": "email_header",
    "raw_date": "12/1/2016 3:46:53 AM",
    "confidence": "high"
  },
  "HOUSE_OVERSIGHT_033201": {
    "date": "2016-12-05",
    "time": null,
    "source": "content_parsed",
    "raw_date": "12/5/2016",
    "confidence": "low"
  },
  "HOUSE_OVERSIGHT_033202": {
    "date": "2016-12-06",
    "time": "22:57:20",
    "source": "email_header",
    "raw_date": "12/6/2016 10:57:20 PM",
    "confidence": "high"
  },
  "HOUSE_OVERSIGHT_033203": {
    "date": "2016-12-07",
    "time": "17:31:19",
    "source": "email_header",
    "raw_date": "12/7/2016 5:31:19 PM",
    "confidence": "high"
  },
  "HOUSE_OVERSIGHT_033204": {
    "date": "2016-12-08",
    "time": "19:43:45",
    "source": "email_header",
    "raw_date": "12/8/2016 7:43:45 PM",
    "confidence": "high"
  },
  "HOUSE_OVERSIGHT_033205": {
    "date": "2016-12-08",
    "time": "20:51:06",
    "source": "email_header",
    "raw_date": "12/8/2016 8:51:06 PM",
    "confidence": "high"
  },
  "HOUSE_OVERSIGHT_033206": {
    "date": "2016-12-14",
    "time": "02:34:21",
    "source": "email_header",
    "raw_date": "12/14/2016 2:34:21 AM",
    "confidence": "high"
  },
  "HOUSE_OVERSIGHT_033207": {
    "date": "2016-12-15",
    "time": "08:37:33",
    "source": "email_header",
    "raw_date": "12/15/2016 8:37:33 AM",
    "confidence": "high"
  },
  "HOUSE_OVERSIGHT_033208": {
    "date": "2016-12-16",
    "time": "15:09:19",
    "source": "email_header",
    "raw_date": "12/16/2016 3:09:19 PM",
    "confidence": "high"
  },
  "HOUSE_OVERSIGHT_033209": {
    "date": "2016-12-20",
    "time": "22:33:15",
    "source": "email_header",
    "raw_date": "12/20/2016 10:33:15 PM",
    "confidence": "high"
  },
  "HOUSE_OVERSIGHT_033210": {
    "date": "2017-01-03",
    "time": "14:07:16",
    "source": "email_header",
    "raw_date": "1/3/2017 2:07:16 PM",
    "confidence": "high"
  },
  "HOUSE_OVERSIGHT_033212": {
    "date": "2017-01-06",
    "time": null,
    "source": "content_parsed",
    "raw_date": "1/6/2017",
    "confidence": "low"
  },
  "HOUSE_OVERSIGHT_033213": {
    "date": "2017-01-11",
    "time": "23:38:08",
    "source": "email_header",
    "raw_date": "1/11/2017 11:38:08 PM",
    "confidence": "high"
  },
  "HOUSE_OVERSIGHT_033214": {
    "date": "2017-01-12",
    "time": "22:35:55",
    "source": "email_header",
    "raw_date": "1/12/2017 10:35:55 PM",
    "confidence": "high"
  },
  "HOUSE_OVERSIGHT_033215": {
    "date": "2017-01-14",
    "time": "13:13:48",
    "source": "email_header",
    "raw_date": "1/14/2017 1:13:48 PM",
    "confidence": "high"
  },
  "HOUSE_OVERSIGHT_033216": {
    "date": "2017-01-20",
    "time": "15:25:48",
    "source": "email_header",
    "raw_date": "1/20/2017 3:25:48 PM",
    "confidence": "high"
  },
  "HOUSE_OVERSIGHT_033217": {
    "date": "2017-01-29",
    "time": "13:44:28",
    "source": "email_header",
    "raw_date": "1/29/2017 1:44:28 PM",
    "confidence": "high"
  },
  "HOUSE_OVERSIGHT_033218": {
    "date": "2017-02-01",
    "time": "01:24:27",
    "source": "email_header",
    "raw_date": "2/1/2017 1:24:27 AM",
    "confidence": "high"
  },
  "HOUSE_OVERSIGHT_033220": {
    "date": "2017-01-27",
    "time": null,
    "source": "metadata",
    "raw_date": "01/27/2017",
    "confidence": "medium"
  },
  "HOUSE_OVERSIGHT_033222": {
    "date": "2017-02-01",
    "time": "17:02:59",
    "source": "email_header",
    "raw_date": "2/1/2017 5:02:59 PM",
    "confidence": "high"
  },
  "HOUSE_OVERSIGHT_033224": {
    "date": "2017-02-03",
    "time": "15:43:10",
    "source": "email_header",
    "raw_date": "2/3/2017 3:43:10 PM",
    "confidence": "high"
  },
  "HOUSE_OVERSIGHT_033225": {
    "date": "2017-02-12",
    "time": "00:25:16",
    "source": "email_header",
    "raw_date": "2/12/2017 12:25:16 AM",
    "confidence": "high"
  },
  "HOUSE_OVERSIGHT_033226": {
    "date": "2017-02-15",
    "time": "15:48:18",
    "source": "email_header",
    "raw_date": "2/15/2017 3:48:18 PM",
    "confidence": "high"
  },
  "HOUSE_OVERSIGHT_033227": {
    "date": "2017-03-13",
    "time": "13:36:48",
    "source": "email_header",
    "raw_date": "3/13/2017 1:36:48 PM",
    "confidence": "high"
  },
  "HOUSE_OVERSIGHT_033228": {
    "date": "2017-03-14",
    "time": "12:31:06",
    "source": "email_header",
    "raw_date": "3/14/2017 12:31:06 PM",
    "confidence": "high"
  },
  "HOUSE_OVERSIGHT_033229": {
    "date": "2017-03-16",
    "time": "08:35:54",
    "source": "email_header",
    "raw_date": "3/16/2017 8:35:54 AM",
    "confidence": "high"
  },
  "HOUSE_OVERSIGHT_033230": {
    "date": "2017-03-30",
    "time": null,
    "source": "content_parsed",
    "raw_date": "3/30/2017",
    "confidence": "low"
  },
  "HOUSE_OVERSIGHT_033231": {
    "date": "2017-03-30",
    "time": null,
    "source": "metadata",
    "raw_date": "03/30/2017",
    "confidence": "medium"
  },
  "HOUSE_OVERSIGHT_033232": {
    "date": "2017-04-16",
    "time": "12:24:32",
    "source": "email_header",
    "raw_date": "4/16/2017 12:24:32 PM",
    "confidence": "high"
  },
  "HOUSE_OVERSIGHT_033233": {
    "date": "2017-04-16",
    "time": "15:04:37",
    "source": "email_header",
    "raw_date": "4/16/2017 3:04:37 PM",
    "confidence": "high"
  },
  "HOUSE_OVERSIGHT_033234": {
    "date": "2017-04-24",
    "time": "08:32:33",
    "source": "email_header",
    "raw_date": "4/24/2017 8:32:33 AM",
    "confidence": "high"
  },
  "HOUSE_OVERSIGHT_033235": {
    "date": "2017-05-09",
    "time": "21:22:35",
    "source": "email_header",
    "raw_date": "5/9/2017 9:22:35 PM",
    "confidence": "high"
  },
  "HOUSE_OVERSIGHT_033236": {
    "date": null,
    "time": null,
    "source": "unknown",
    "raw_date": null,
    "confidence": "none"
  },
  "HOUSE_OVERSIGHT_033238": {
    "date": "2017-05-25",
    "time": "13:02:58",
    "source": "email_header",
    "raw_date": "5/25/2017 1:02:58 PM",
    "confidence": "high"
  },
  "HOUSE_OVERSIGHT_033239": {
    "date": "2017-05-30",
    "time": "12:51:12",
    "source": "email_header",
    "raw_date": "5/30/2017 12:51:12 PM",
    "confidence": "high"
  },
  "HOUSE_OVERSIGHT_033240": {
    "date": "2017-05-30",
    "time": "19:51:52",
    "source": "email_header",
    "raw_date": "5/30/2017 7:51:52 PM",
    "confidence": "high"
  },
  "HOUSE_OVERSIGHT_033241": {
    "date": "2017-06-03",
    "time": "18:36:57",
    "source": "email_header",
    "raw_date": "6/3/2017 6:36:57 PM",
    "confidence": "high"
  },
  "HOUSE_OVERSIGHT_033242": {
    "date": "2017-06-13",
    "time": "23:38:59",
    "source": "email_header",
    "raw_date": "6/13/2017 11:38:59 PM",
    "confidence": "high"
  },
  "HOUSE_OVERSIGHT_033243": {
    "date": "2017-07-30",
    "time": "15:11:00",
    "source": "email_header",
    "raw_date": "7/30/2017 3:11:00 PM",
    "confidence": "high"
  },
  "HOUSE_OVERSIGHT_033244": {
    "date": "2017-08-07",
    "time": "19:51:25",
    "source": "email_header",
    "raw_date": "8/7/2017 7:51:25 PM",
    "confidence": "high"
  },
  "HOUSE_OVERSIGHT_033245": {
    "date": "2017-08-10",
    "time": "18:35:55",
    "source": "email_header",
    "raw_date": "8/10/2017 6:35:55 PM",
    "confidence": "high"
  },
  "HOUSE_OVERSIGHT_033246": {
    "date": "2017-09-06",
    "time": "05:08:21",
    "source": "email_header",
    "raw_date": "9/6/2017 5:08:21 AM",
    "confidence": "high"
  },
  "HOUSE_OVERSIGHT_033247": {
    "date": "2017-09-06",
    "time": "09:18:52",
    "source": "email_header",
    "raw_date": "9/6/2017 9:18:52 AM",
    "confidence": "high"
  },
  "HOUSE_OVERSIGHT_033249": {
    "date": "2017-09-06",
    "time": "17:19:43",
    "source": "email_header",
    "raw_date": "9/6/2017 5:19:43 PM",
    "confidence": "high"
  },
  "HOUSE_OVERSIGHT_033251": {
    "date": "2017-09-16",
    "time": "19:57:47",
    "source": "email_header",
    "raw_date": "9/16/2017 7:57:47 PM",
    "confidence": "high"
  },
  "HOUSE_OVERSIGHT_033252": {
    "date": "2017-09-25",
    "time": null,
    "source": "content_parsed",
    "raw_date": "9/25/2017",
    "confidence": "low"
  },
  "HOUSE_OVERSIGHT_033253": {
    "date": "2017-09-15",
    "time": null,
    "source": "metadata",
    "raw_date": "09/15/2017",
    "confidence": "medium"
  },
  "HOUSE_OVERSIGHT_033255": {
    "date": "2017-09-28",
    "time": "20:27:09",
    "source": "email_header",
    "raw_date": "9/28/2017 8:27:09 PM",
    "confidence": "high"
  },
  "HOUSE_OVERSIGHT_033256": {
    "date": "2017-10-04",
    "time": null,
    "source": "content_parsed",
    "raw_date": "10/4/2017",
    "confidence": "low"
  },
  "HOUSE_OVERSIGHT_033257": {
    "date": "2017-10-16",
    "time": "17:12:25",
    "source": "email_header",
    "raw_date": "10/16/2017 5:12:25 PM",
    "confidence": "high"
  },
  "HOUSE_OVERSIGHT_033259": {
    "date": "2017-11-17",
    "time": "02:32:27",
    "source": "email_header",
    "raw_date": "11/17/2017 2:32:27 AM",
    "confidence": "high"
  },
  "HOUSE_OVERSIGHT_033260": {
    "date": "2017-11-30",
    "time": "10:28:42",
    "source": "email_header",
    "raw_date": "11/30/2017 10:28:42 AM",
    "confidence": "high"
  },
  "HOUSE_OVERSIGHT_033261": {
    "date": "2017-12-01",
    "time": "16:34:09",
    "source": "email_header",
    "raw_date": "12/1/2017 4:34:09 PM",
    "confidence": "high"
  },
  "HOUSE_OVERSIGHT_033262": {
    "date": "2017-12-05",
    "time": "12:02:43",
    "source": "email_header",
    "raw_date": "12/5/2017 12:02:43 PM",
    "confidence": "high"
  },
  "HOUSE_OVERSIGHT_033263": {
    "date": "2017-12-07",
    "time": "18:13:54",
    "source": "email_header",
    "raw_date": "12/7/2017 6:13:54 PM",
    "confidence": "high"
  },
  "HOUSE_OVERSIGHT_033264": {
    "date": "2018-01-03",
    "time": "18:00:32",
    "source": "email_header",
    "raw_date": "1/3/2018 6:00:32 PM",
    "confidence": "high"
  },
  "HOUSE_OVERSIGHT_033265": {
    "date": "2018-01-05",
    "time": "16:38:00",
    "source": "email_header",
    "raw_date": "1/5/2018 4:38:00 PM",
    "confidence": "high"
  },
  "HOUSE_OVERSIGHT_033266": {
    "date": "2018-01-05",
    "time": "17:03:27",
    "source": "email_header",
    "raw_date": "1/5/2018 5:03:27 PM",
    "confidence": "high"
  },
  "HOUSE_OVERSIGHT_033267": {
    "date": "2018-01-08",
    "time": null,
    "source": "content_parsed",
    "raw_date": "1/8/2018",
    "confidence": "low"
  },
  "HOUSE_OVERSIGHT_033268": {
    "date": "2018-01-09",
    "time": "01:04:53",
    "source": "email_header",
    "raw_date": "1/9/2018 1:04:53 AM",
    "confidence": "high"
  },
  "HOUSE_OVERSIGHT_033269": {
    "date": "2018-01-17",
    "time": "19:08:41",
    "source": "email_header",
    "raw_date": "1/17/2018 7:08:41 PM",
    "confidence": "high"
  },
  "HOUSE_OVERSIGHT_033270": {
    "date": "2018-01-25",
    "time": "19:43:30",
    "source": "email_header",
    "raw_date": "1/25/2018 7:43:30 PM",
    "confidence": "high"
  },
  "HOUSE_OVERSIGHT_033271": {
    "date": "2018-01-30",
    "time": "02:30:10",
    "source": "email_header",
    "raw_date": "1/30/2018 2:30:10 AM",
    "confidence": "high"
  },
  "HOUSE_OVERSIGHT_033272": {
    "date": "2018-01-30",
    "time": "16:57:53",
    "source": "email_header",
    "raw_date": "1/30/2018 4:57:53 PM",
    "confidence": "high"
  },
  "HOUSE_OVERSIGHT_033273": {
    "date": "2018-02-16",
    "time": "12:56:55",
    "source": "email_header",
    "raw_date": "2/16/2018 12:56:55 PM",
    "confidence": "high"
  },
  "HOUSE_OVERSIGHT_033274": {
    "date": "2018-02-16",
    "time": "14:19:27",
    "source": "email_header",
    "raw_date": "2/16/2018 2:19:27 PM",
    "confidence": "high"
  },
  "HOUSE_OVERSIGHT_033275": {
    "date": "2018-02-27",
    "time": "18:50:45",
    "source": "email_header",
    "raw_date": "2/27/2018 6:50:45 PM",
    "confidence": "high"
  },
  "HOUSE_OVERSIGHT_033276": {
    "date": "2018-03-14",
    "time": "16:59:21",
    "source": "email_header",
    "raw_date": "3/14/2018 4:59:21 PM",
    "confidence": "high"
  },
  "HOUSE_OVERSIGHT_033277": {
    "date": "2018-03-30",
    "time": "17:50:50",
    "source": "email_header",
    "raw_date": "3/30/2018 5:50:50 PM",
    "confidence": "high"
  },
  "HOUSE_OVERSIGHT_033278": {
    "date": "2018-04-06",
    "time": "21:20:51",
    "source": "email_header",
    "raw_date": "4/6/2018 9:20:51 PM",
    "confidence": "high"
  },
  "HOUSE_OVERSIGHT_033279": {
    "date": "2018-04-12",
    "time": "00:36:12",
    "source": "email_header",
    "raw_date": "4/12/2018 12:36:12 AM",
    "confidence": "high"
  },
  "HOUSE_OVERSIGHT_033280": {
    "date": "2018-04-14",
    "time": "21:40:46",
    "source": "email_header",
    "raw_date": "4/14/2018 9:40:46 PM",
    "confidence": "high"
  },
  "HOUSE_OVERSIGHT_033281": {
    "date": "2015-08-19",
    "time": "17:48:50",
    "source": "email_header",
    "raw_date": "8/19/2015 5:48:50 PM",
    "confidence": "high"
  },
  "HOUSE_OVERSIGHT_033282": {
    "date": "2015-08-24",
    "time": "11:32:13",
    "source": "email_header",
    "raw_date": "8/24/2015 11:32:13 AM",
    "confidence": "high"
  },
  "HOUSE_OVERSIGHT_033283": {
    "date": "2016-01-04",
    "time": "21:05:31",
    "source": "email_header",
    "raw_date": "1/4/2016 9:05:31 PM",
    "confidence": "high"
  },
  "HOUSE_OVERSIGHT_033284": {
    "date": "2016-02-10",
    "time": null,
    "source": "content_parsed",
    "raw_date": "2016-02-10",
    "confidence": "low"
  },
  "HOUSE_OVERSIGHT_033285": {
    "date": "2016-02-29",
    "time": "16:35:11",
    "source": "email_header",
    "raw_date": "2/29/2016 4:35:11 PM",
    "confidence": "high"
  },
  "HOUSE_OVERSIGHT_033286": {
    "date": "2016-03-04",
    "time": "14:21:38",
    "source": "email_header",
    "raw_date": "3/4/2016 2:21:38 PM",
    "confidence": "high"
  },
  "HOUSE_OVERSIGHT_033287": {
    "date": "2016-03-07",
    "time": "22:05:34",
    "source": "email_header",
    "raw_date": "3/7/2016 10:05:34 PM",
    "confidence": "high"
  },
  "HOUSE_OVERSIGHT_033288": {
    "date": "2016-04-25",
    "time": "17:03:12",
    "source": "email_header",
    "raw_date": "4/25/2016 5:03:12 PM",
    "confidence": "high"
  },
  "HOUSE_OVERSIGHT_033289": {
    "date": "2016-04-27",
    "time": "19:49:46",
    "source": "email_header",
    "raw_date": "4/27/2016 7:49:46 PM",
    "confidence": "high"
  },
  "HOUSE_OVERSIGHT_033291": {
    "date": "2016-04-29",
    "time": "16:41:30",
    "source": "email_header",
    "raw_date": "4/29/2016 4:41:30 PM",
    "confidence": "high"
  },
  "HOUSE_OVERSIGHT_033292": {
    "date": "2016-05-04",
    "time": "16:21:38",
    "source": "email_header",
    "raw_date": "5/4/2016 4:21:38 PM",
    "confidence": "high"
  },
  "HOUSE_OVERSIGHT_033293": {
    "date": "2016-05-06",
    "time": "19:52:09",
    "source": "email_header",
    "raw_date": "5/6/2016 7:52:09 PM",
    "confidence": "high"
  },
  "HOUSE_OVERSIGHT_033295": {
    "date": "2016-05-13",
    "time": "00:31:13",
    "source": "email_header",
    "raw_date": "5/13/2016 12:31:13 AM",
    "confidence": "high"
  },
  "HOUSE_OVERSIGHT_033296": {
    "date": "2016-06-01",
    "time": "11:29:02",
    "source": "email_header",
    "raw_date": "6/1/2016 11:29:02 AM",
    "confidence": "high"
  },
  "HOUSE_OVERSIGHT_033297": {
    "date": "2016-06-02",
    "time": "21:25:10",
    "source": "email_header",
    "raw_date": "6/2/2016 9:25:10 PM",
    "confidence": "high"
  },
  "HOUSE_OVERSIGHT_033298": {
    "date": "2016-06-22",
    "time": "16:15:25",
    "source": "email_header",
    "raw_date": "6/22/2016 4:15:25 PM",
    "confidence": "high"
  },
  "HOUSE_OVERSIGHT_033299": {
    "date": "2016-06-26",
    "time": "21:55:27",
    "source": "email_header",
    "raw_date": "6/26/2016 9:55:27 PM",
    "confidence": "high"
  },
  "HOUSE_OVERSIGHT_033300": {
    "date": "2016-06-27",
    "time": "02:03:17",
    "source": "email_header",
    "raw_date": "6/27/2016 2:03:17 AM",
    "confidence": "high"
  },
  "HOUSE_OVERSIGHT_033301": {
    "date": "2016-06-27",
    "time": "15:20:09",
    "source": "email_header",
    "raw_date": "6/27/2016 3:20:09 PM",
    "confidence": "high"
  },
  "HOUSE_OVERSIGHT_033304": {
    "date": "2016-07-06",
    "time": "20:12:44",
    "source": "email_header",
    "raw_date": "7/6/2016 8:12:44 PM",
    "confidence": "high"
  },
  "HOUSE_OVERSIGHT_033305": {
    "date": "2016-07-14",
    "time": "17:13:01",
    "source": "email_header",
    "raw_date": "7/14/2016 5:13:01 PM",
    "confidence": "high"
  },
  "HOUSE_OVERSIGHT_033306": {
    "date": "2016-07-21",
    "time": "12:00:41",
    "source": "email_header",
    "raw_date": "7/21/2016 12:00:41 PM",
    "confidence": "high"
  },
  "HOUSE_OVERSIGHT_033307": {
    "date": "2016-07-25",
    "time": "16:28:09",
    "source": "email_header",
    "raw_date": "7/25/2016 4:28:09 PM",
    "confidence": "high"
  },
  "HOUSE_OVERSIGHT_033308": {
    "date": "2016-08-09",
    "time": "08:14:10",
    "source": "email_header",
    "raw_date": "8/9/2016 8:14:10 AM",
    "confidence": "high"
  },
  "HOUSE_OVERSIGHT_033309": {
    "date": "2016-08-18",
    "time": "14:09:42",
    "source": "email_header",
    "raw_date": "8/18/2016 2:09:42 PM",
    "confidence": "high"
  },
  "HOUSE_OVERSIGHT_033310": {
    "date": "2016-09-13",
    "time": "17:36:29",
    "source": "email_header",
    "raw_date": "9/13/2016 5:36:29 PM",
    "confidence": "high"
  },
  "HOUSE_OVERSIGHT_033311": {
    "date": "2016-09-14",
    "time": null,
    "source": "content_parsed",
    "raw_date": "9/14/2016",
    "confidence": "low"
  },
  "HOUSE_OVERSIGHT_033312": {
    "date": "2018-04-20",
    "time": "17:52:34",
    "source": "email_header",
    "raw_date": "4/20/2018 5:52:34 PM",
    "confidence": "high"
  },
  "HOUSE_OVERSIGHT_033313": {
    "date": "2018-06-22",
    "time": "13:12:21",
    "source": "email_header",
    "raw_date": "6/22/2018 1:12:21 PM",
    "confidence": "high"
  },
  "HOUSE_OVERSIGHT_033314": {
    "date": "2018-06-28",
    "time": "00:27:50",
    "source": "email_header",
    "raw_date": "6/28/2018 12:27:50 AM",
    "confidence": "high"
  },
  "HOUSE_OVERSIGHT_033315": {
    "date": "2018-07-17",
    "time": "00:29:07",
    "source": "email_header",
    "raw_date": "7/17/2018 12:29:07 AM",
    "confidence": "high"
  },
  "HOUSE_OVERSIGHT_033316": {
    "date": "2018-09-18",
    "time": null,
    "source": "content_parsed",
    "raw_date": "9/18/2018",
    "confidence": "low"
  },
  "HOUSE_OVERSIGHT_033323": {
    "date": "2018-10-17",
    "time": null,
    "source": "metadata",
    "raw_date": "10/17/2018",
    "confidence": "medium"
  },
  "HOUSE_OVERSIGHT_033326": {
    "date": "2018-10-24",
    "time": "22:27:45",
    "source": "email_header",
    "raw_date": "10/24/2018 10:27:45 PM",
    "confidence": "high"
  },
  "HOUSE_OVERSIGHT_033327": {
    "date": "2018-11-08",
    "time": "20:46:41",
    "source": "email_header",
    "raw_date": "11/8/2018 8:46:41 PM",
    "confidence": "high"
  },
  "HOUSE_OVERSIGHT_033328": {
    "date": "2018-11-21",
    "time": null,
    "source": "content_parsed",
    "raw_date": "11/21/2018",
    "confidence": "low"
  },
  "HOUSE_OVERSIGHT_033329": {
    "date": "2018-11-21",
    "time": "22:29:49",
    "source": "email_header",
    "raw_date": "11/21/2018 10:29:49 PM",
    "confidence": "high"
  },
  "HOUSE_OVERSIGHT_033332": {
    "date": "2018-11-28",
    "time": "21:56:58",
    "source": "email_header",
    "raw_date": "11/28/2018 9:56:58 PM",
    "confidence": "high"
  },
  "HOUSE_OVERSIGHT_033333": {
    "date": "2018-11-29",
    "time": "22:02:09",
    "source": "email_header",
    "raw_date": "11/29/2018 10:02:09 PM",
    "confidence": "high"
  },
  "HOUSE_OVERSIGHT_033334": {
    "date": "2018-12-14",
    "time": "08:38:47",
    "source": "email_header",
    "raw_date": "12/14/2018 8:38:47 AM",
    "confidence": "high"
  },
  "HOUSE_OVERSIGHT_033335": {
    "date": "2018-12-14",
    "time": "11:21:04",
    "source": "email_header",
    "raw_date": "12/14/2018 11:21:04 AM",
    "confidence": "high"
  },
  "HOUSE_OVERSIGHT_033336": {
    "date": "2018-12-14",
    "time": "18:42:54",
    "source": "email_header",
    "raw_date": "12/14/2018 6:42:54 PM",
    "confidence": "high"
  },
  "HOUSE_OVERSIGHT_033337": {
    "date": "2018-12-20",
    "time": "17:58:37",
    "source": "email_header",
    "raw_date": "12/20/2018 5:58:37 PM",
    "confidence": "high"
  },
  "HOUSE_OVERSIGHT_033338": {
    "date": null,
    "time": null,
    "source": "unknown",
    "raw_date": null,
    "confidence": "none"
  },
  "HOUSE_OVERSIGHT_033339": {
    "date": "2019-01-10",
    "time": "11:08:57",
    "source": "email_header",
    "raw_date": "1/10/2019 11:08:57 AM",
    "confidence": "high"
  },
  "HOUSE_OVERSIGHT_033340": {
    "date": "2019-01-18",
    "time": "15:13:37",
    "source": "email_header",
    "raw_date": "1/18/2019 3:13:37 PM",
    "confidence": "high"
  },
  "HOUSE_OVERSIGHT_033341": {
    "date": "2019-02-01",
    "time": "20:12:28",
    "source": "email_header",
    "raw_date": "2/1/2019 8:12:28 PM",
    "confidence": "high"
  },
  "HOUSE_OVERSIGHT_033342": {
    "date": "2019-02-03",
    "time": "21:53:52",
    "source": "email_header",
    "raw_date": "2/3/2019 9:53:52 PM",
    "confidence": "high"
  },
  "HOUSE_OVERSIGHT_033343": {
    "date": "2019-02-13",
    "time": "18:07:04",
    "source": "email_header",
    "raw_date": "2/13/2019 6:07:04 PM",
    "confidence": "high"
  },
  "HOUSE_OVERSIGHT_033344": {
    "date": "2019-03-18",
    "time": "01:50:32",
    "source": "email_header",
    "raw_date": "3/18/2019 1:50:32 AM",
    "confidence": "high"
  },
  "HOUSE_OVERSIGHT_033345": {
    "date": "2019-03-24",
    "time": null,
    "source": "content_parsed",
    "raw_date": "3/24/2019",
    "confidence": "low"
  },
  "HOUSE_OVERSIGHT_033352": {
    "date": "2019-04-28",
    "time": "09:09:20",
    "source": "email_header",
    "raw_date": "4/28/2019 9:09:20 AM",
    "confidence": "high"
  },
  "HOUSE_OVERSIGHT_033353": {
    "date": "2019-04-29",
    "time": "21:59:45",
    "source": "email_header",
    "raw_date": "4/29/2019 9:59:45 PM",
    "confidence": "high"
  },
  "HOUSE_OVERSIGHT_033354": {
    "date": "2019-05-07",
    "time": "23:53:10",
    "source": "email_header",
    "raw_date": "5/7/2019 11:53:10 PM",
    "confidence": "high"
  },
  "HOUSE_OVERSIGHT_033355": {
    "date": "2019-05-08",
    "time": "00:36:13",
    "source": "email_header",
    "raw_date": "5/8/2019 12:36:13 AM",
    "confidence": "high"
  },
  "HOUSE_OVERSIGHT_033356": {
    "date": "2019-05-09",
    "time": "09:28:17",
    "source": "email_header",
    "raw_date": "5/9/2019 9:28:17 AM",
    "confidence": "high"
  },
  "HOUSE_OVERSIGHT_033357": {
    "date": "2019-05-09",
    "time": "23:24:30",
    "source": "email_header",
    "raw_date": "5/9/2019 11:24:30 PM",
    "confidence": "high"
  },
  "HOUSE_OVERSIGHT_033358": {
    "date": "2019-05-19",
    "time": "10:21:24",
    "source": "email_header",
    "raw_date": "5/19/2019 10:21:24 AM",
    "confidence": "high"
  },
  "HOUSE_OVERSIGHT_033359": {
    "date": "2019-05-22",
    "time": "17:02:24",
    "source": "email_header",
    "raw_date": "5/22/2019 5:02:24 PM",
    "confidence": "high"
  },
  "HOUSE_OVERSIGHT_033360": {
    "date": "2019-05-28",
    "time": "20:51:55",
    "source": "email_header",
    "raw_date": "5/28/2019 8:51:55 PM",
    "confidence": "high"
  },
  "HOUSE_OVERSIGHT_033361": {
    "date": "2019-05-29",
    "time": "16:57:42",
    "source": "email_header",
    "raw_date": "5/29/2019 4:57:42 PM",
    "confidence": "high"
  },
  "HOUSE_OVERSIGHT_033362": {
    "date": "2019-05-30",
    "time": "15:19:40",
    "source": "email_header",
    "raw_date": "5/30/2019 3:19:40 PM",
    "confidence": "high"
  },
  "HOUSE_OVERSIGHT_033365": {
    "date": "2019-05-29",
    "time": null,
    "source": "content_parsed",
    "raw_date": "5/29/2019",
    "confidence": "low"
  },
  "HOUSE_OVERSIGHT_033368": {
    "date": "2019-06-07",
    "time": "16:21:40",
    "source": "email_header",
    "raw_date": "6/7/2019 4:21:40 PM",
    "confidence": "high"
  },
  "HOUSE_OVERSIGHT_033369": {
    "date": "2019-06-13",
    "time": "14:49:13",
    "source": "email_header",
    "raw_date": "6/13/2019 2:49:13 PM",
    "confidence": "high"
  },
  "HOUSE_OVERSIGHT_033370": {
    "date": "2013-11-12",
    "time": "21:07:32",
    "source": "email_header",
    "raw_date": "11/12/2013 9:07:32 PM",
    "confidence": "high"
  },
  "HOUSE_OVERSIGHT_033371": {
    "date": "2018-04-26",
    "time": "19:34:48",
    "source": "email_header",
    "raw_date": "4/26/2018 7:34:48 PM",
    "confidence": "high"
  },
  "HOUSE_OVERSIGHT_033372": {
    "date": "2018-04-26",
    "time": "19:55:58",
    "source": "email_header",
    "raw_date": "4/26/2018 7:55:58 PM",
    "confidence": "high"
  },
  "HOUSE_OVERSIGHT_033374": {
    "date": "2018-05-03",
    "time": "06:30:55",
    "source": "email_header",
    "raw_date": "5/3/2018 6:30:55 AM",
    "confidence": "high"
  },
  "HOUSE_OVERSIGHT_033375": {
    "date": "2018-05-04",
    "time": "04:37:03",
    "source": "email_header",
    "raw_date": "5/4/2018 4:37:03 AM",
    "confidence": "high"
  },
  "HOUSE_OVERSIGHT_033377": {
    "date": "2018-05-04",
    "time": "04:40:15",
    "source": "email_header",
    "raw_date": "5/4/2018 4:40:15 AM",
    "confidence": "high"
  },
  "HOUSE_OVERSIGHT_033379": {
    "date": "2018-05-28",
    "time": null,
    "source": "metadata",
    "raw_date": "05/28/2018",
    "confidence": "medium"
  },
  "HOUSE_OVERSIGHT_033383": {
    "date": "2011-02-10",
    "time": "15:02:14",
    "source": "email_header",
    "raw_date": "2/10/2011 3:02:14 PM",
    "confidence": "high"
  },
  "HOUSE_OVERSIGHT_033384": {
    "date": "2011-03-25",
    "time": "15:00:02",
    "source": "email_header",
    "raw_date": "3/25/2011 3:00:02 PM",
    "confidence": "high"
  },
  "HOUSE_OVERSIGHT_033386": {
    "date": "2011-06-27",
    "time": "16:17:37",
    "source": "email_header",
    "raw_date": "6/27/2011 4:17:37 PM",
    "confidence": "high"
  },
  "HOUSE_OVERSIGHT_033388": {
    "date": "2017-04-16",
    "time": "15:12:17",
    "source": "email_header",
    "raw_date": "4/16/2017 3:12:17 PM",
    "confidence": "high"
  },
  "HOUSE_OVERSIGHT_033389": {
    "date": "2018-01-09",
    "time": "01:22:51",
    "source": "email_header",
    "raw_date": "1/9/2018 1:22:51 AM",
    "confidence": "high"
  },
  "HOUSE_OVERSIGHT_033390": {
    "date": "2018-05-11",
    "time": "20:31:29",
    "source": "email_header",
    "raw_date": "5/11/2018 8:31:29 PM",
    "confidence": "high"
  },
  "HOUSE_OVERSIGHT_033391": {
    "date": "2018-11-20",
    "time": "18:44:25",
    "source": "email_header",
    "raw_date": "11/20/2018 6:44:25 PM",
    "confidence": "high"
  },
  "HOUSE_OVERSIGHT_033393": {
    "date": "2018-11-21",
    "time": "19:07:56",
    "source": "email_header",
    "raw_date": "11/21/2018 7:07:56 PM",
    "confidence": "high"
  },
  "HOUSE_OVERSIGHT_033395": {
    "date": "2018-12-04",
    "time": "15:41:44",
    "source": "email_header",
    "raw_date": "12/4/2018 3:41:44 PM",
    "confidence": "high"
  },
  "HOUSE_OVERSIGHT_033398": {
    "date": "2018-12-15",
    "time": "16:21:21",
    "source": "email_header",
    "raw_date": "12/15/2018 4:21:21 PM",
    "confidence": "high"
  },
  "HOUSE_OVERSIGHT_033399": {
    "date": "2018-12-18",
    "time": "12:57:26",
    "source": "email_header",
    "raw_date": "12/18/2018 12:57:26 PM",
    "confidence": "high"
  },
  "HOUSE_OVERSIGHT_033400": {
    "date": "2018-12-22",
    "time": "00:13:56",
    "source": "email_header",
    "raw_date": "12/22/2018 12:13:56 AM",
    "confidence": "high"
  },
  "HOUSE_OVERSIGHT_033401": {
    "date": "2019-02-19",
    "time": "20:24:07",
    "source": "email_header",
    "raw_date": "2/19/2019 8:24:07 PM",
    "confidence": "high"
  },
  "HOUSE_OVERSIGHT_033402": {
    "date": "2019-02-21",
    "time": "13:51:38",
    "source": "email_header",
    "raw_date": "2/21/2019 1:51:38 PM",
    "confidence": "high"
  },
  "HOUSE_OVERSIGHT_033403": {
    "date": "2019-02-21",
    "time": "14:46:12",
    "source": "email_header",
    "raw_date": "2/21/2019 2:46:12 PM",
    "confidence": "high"
  },
  "HOUSE_OVERSIGHT_033405": {
    "date": "2019-03-17",
    "time": "22:18:39",
    "source": "email_header",
    "raw_date": "3/17/2019 10:18:39 PM",
    "confidence": "high"
  },
  "HOUSE_OVERSIGHT_033410": {
    "date": "2019-04-13",
    "time": "22:44:40",
    "source": "email_header",
    "raw_date": "4/13/2019 10:44:40 PM",
    "confidence": "high"
  },
  "HOUSE_OVERSIGHT_033411": {
    "date": "2019-04-21",
    "time": "13:22:00",
    "source": "email_header",
    "raw_date": "4/21/2019 1:22:00 PM",
    "confidence": "high"
  },
  "HOUSE_OVERSIGHT_033412": {
    "date": "2018-10-12",
    "time": "19:46:11",
    "source": "email_header",
    "raw_date": "10/12/2018 7:46:11 PM",
    "confidence": "high"
  },
  "HOUSE_OVERSIGHT_033414": {
    "date": "2018-10-30",
    "time": "11:00:04",
    "source": "email_header",
    "raw_date": "10/30/2018 11:00:04 AM",
    "confidence": "high"
  },
  "HOUSE_OVERSIGHT_033416": {
    "date": "2018-10-30",
    "time": "13:06:54",
    "source": "email_header",
    "raw_date": "10/30/2018 1:06:54 PM",
    "confidence": "high"
  },
  "HOUSE_OVERSIGHT_033418": {
    "date": "2018-11-20",
    "time": "18:36:39",
    "source": "email_header",
    "raw_date": "11/20/2018 6:36:39 PM",
    "confidence": "high"
  },
  "HOUSE_OVERSIGHT_033419": {
    "date": "2018-11-29",
    "time": "03:57:47",
    "source": "email_header",
    "raw_date": "11/29/2018 3:57:47 AM",
    "confidence": "high"
  },
  "HOUSE_OVERSIGHT_033420": {
    "date": "2018-12-04",
    "time": "15:20:07",
    "source": "email_header",
    "raw_date": "12/4/2018 3:20:07 PM",
    "confidence": "high"
  },
  "HOUSE_OVERSIGHT_033422": {
    "date": "2018-12-14",
    "time": "14:59:21",
    "source": "email_header",
    "raw_date": "12/14/2018 2:59:21 PM",
    "confidence": "high"
  },
  "HOUSE_OVERSIGHT_033423": {
    "date": "2018-12-14",
    "time": "15:12:21",
    "source": "email_header",
    "raw_date": "12/14/2018 3:12:21 PM",
    "confidence": "high"
  },
  "HOUSE_OVERSIGHT_033424": {
    "date": "2018-12-18",
    "time": "03:21:16",
    "source": "email_header",
    "raw_date": "12/18/2018 3:21:16 AM",
    "confidence": "high"
  },
  "HOUSE_OVERSIGHT_033425": {
    "date": "2018-12-22",
    "time": "00:03:25",
    "source": "email_header",
    "raw_date": "12/22/2018 12:03:25 AM",
    "confidence": "high"
  },
  "HOUSE_OVERSIGHT_033426": {
    "date": "2018-12-22",
    "time": "12:52:50",
    "source": "email_header",
    "raw_date": "12/22/2018 12:52:50 PM",
    "confidence": "high"
  },
  "HOUSE_OVERSIGHT_033428": {
    "date": "2019-02-05",
    "time": "17:44:43",
    "source": "email_header",
    "raw_date": "2/5/2019 5:44:43 PM",
    "confidence": "high"
  },
  "HOUSE_OVERSIGHT_033429": {
    "date": "2019-02-19",
    "time": "20:25:24",
    "source": "email_header",
    "raw_date": "2/19/2019 8:25:24 PM",
    "confidence": "high"
  },
  "HOUSE_OVERSIGHT_033430": {
    "date": "2019-02-21",
    "time": "13:51:10",
    "source": "email_header",
    "raw_date": "2/21/2019 1:51:10 PM",
    "confidence": "high"
  },
  "HOUSE_OVERSIGHT_033431": {
    "date": "2019-02-21",
    "time": "13:54:02",
    "source": "email_header",
    "raw_date": "2/21/2019 1:54:02 PM",
    "confidence": "high"
  },
  "HOUSE_OVERSIGHT_033432": {
    "date": null,
    "time": null,
    "source": "unknown",
    "raw_date": null,
    "confidence": "none"
  },
  "HOUSE_OVERSIGHT_033433": {
    "date": null,
    "time": null,
    "source": "unknown",
    "raw_date": null,
    "confidence": "none"
  },
  "HOUSE_OVERSIGHT_033434": {
    "date": null,
    "time": null,
    "source": "unknown",
    "raw_date": null,
    "confidence": "none"
  },
  "HOUSE_OVERSIGHT_033435": {
    "date": "2019-03-17",
    "time": "13:45:22",
    "source": "email_header",
    "raw_date": "3/17/2019 1:45:22 PM",
    "confidence": "high"
  },
  "HOUSE_OVERSIGHT_033437": {
    "date": "2019-03-17",
    "time": "15:48:09",
    "source": "email_header",
    "raw_date": "3/17/2019 3:48:09 PM",
    "confidence": "high"
  },
  "HOUSE_OVERSIGHT_033440": {
    "date": "2019-03-17",
    "time": "16:24:05",
    "source": "email_header",
    "raw_date": "3/17/2019 4:24:05 PM",
    "confidence": "high"
  },
  "HOUSE_OVERSIGHT_033444": {
    "date": "2019-03-17",
    "time": "18:16:22",
    "source": "email_header",
    "raw_date": "3/17/2019 6:16:22 PM",
    "confidence": "high"
  },
  "HOUSE_OVERSIGHT_033448": {
    "date": "2019-03-17",
    "time": "20:35:34",
    "source": "email_header",
    "raw_date": "3/17/2019 8:35:34 PM",
    "confidence": "high"
  },
  "HOUSE_OVERSIGHT_033453": {
    "date": "2019-04-13",
    "time": "22:40:00",
    "source": "email_header",
    "raw_date": "4/13/2019 10:40:00 PM",
    "confidence": "high"
  },
  "HOUSE_OVERSIGHT_033454": {
    "date": "2019-04-18",
    "time": "14:21:05",
    "source": "email_header",
    "raw_date": "4/18/2019 2:21:05 PM",
    "confidence": "high"
  },
  "HOUSE_OVERSIGHT_033455": {
    "date": "2019-04-21",
    "time": "13:21:37",
    "source": "email_header",
    "raw_date": "4/21/2019 1:21:37 PM",
    "confidence": "high"
  },
  "HOUSE_OVERSIGHT_033456": {
    "date": "2010-01-06",
    "time": "01:03:04",
    "source": "email_header",
    "raw_date": "1/6/2010 1:03:04 AM",
    "confidence": "high"
  },
  "HOUSE_OVERSIGHT_033458": {
    "date": "2010-01-06",
    "time": "10:38:22",
    "source": "email_header",
    "raw_date": "1/6/2010 10:38:22 AM",
    "confidence": "high"
  },
  "HOUSE_OVERSIGHT_033460": {
    "date": "2010-01-07",
    "time": "22:54:22",
    "source": "email_header",
    "raw_date": "1/7/2010 10:54:22 PM",
    "confidence": "high"
  },
  "HOUSE_OVERSIGHT_033463": {
    "date": "2011-06-27",
    "time": null,
    "source": "content_parsed",
    "raw_date": "Mon, Jun 27, 2011",
    "confidence": "low"
  },
  "HOUSE_OVERSIGHT_033466": {
    "date": "2012-01-12",
    "time": "15:22:33",
    "source": "email_header",
